Sheet: Table1
A1: CAP_duefrom | B1: INT_duefrom | C1: 2012-02-22T00:00:00.000 | F1: Dis | G1: TICKETID | H1: BRANCHID | I1: TKTNO | J1: CONDATE | K1: EXPRDATE | L1: PERIOD | M1: TOTINT | N1: TOTCAP | O1: STSID | P1: MINDAYS | Q1: SLABNO | R1: NODAYSFROM | S1: NODAYSTO | T1: RATE | U1: (SELECT intamount FROM tbldailyinterest t where tktid= `tblticket`.ticketid and lastupuserid=998)
A2: 60000 | B2: 9000.61 | C2: =IF(DAYS360(RC[7],R1C3)+2>365,365,DAYS360(RC[7],R1C3)+2) -> 365 | D2: =ROUND(RC[-3]*RC[16]/36500,2) -> 24.66 | E2: =RC[-1]*RC[-2] -> 9000.9 | F2: =RC[-1]-RC[-4] -> 0.28999999999905413 | G2: 132 | H2: 4 | I2: AP2PW10000014 | J2: 2010-12-24 12:28:48 | K2: 2011-12-24 12:28:48 | L2: 12 | M2: 8876.7099999999991 | N2: 60000 | O2: 4 | P2: 30 | Q2: 1 | R2: 1 | S2: 365 | T2: 15 | U2: 369.61 | V2: =RC[-1]+RC[-16] -> 369.89999999999907
A3: 35000 | B3: 5249.05 | C3: =IF(DAYS360(RC[7],R1C3)+2>365,365,DAYS360(RC[7],R1C3)+2) -> 365 | D3: =ROUND(RC[-3]*RC[16]/36500,2) -> 14.38 | E3: =RC[-1]*RC[-2] -> 5248.7000000000007 | F3: =RC[-1]-RC[-4] -> -0.3499999999994543 | G3: 217 | H3: 4 | I3: AP2PW11000060 | J3: 2011-01-12 12:28:48 | K3: 2012-01-12 12:28:48 | L3: 12 | M3: 5178.08 | N3: 35000 | O3: 4 | P3: 30 | Q3: 1 | R3: 1 | S3: 365 | T3: 15 | U3: 216.05 | V3: =RC[-1]+RC[-16] -> 215.70000000000056
A4: 24000 | B4: 3599.2 | C4: =IF(DAYS360(RC[7],R1C3)+2>365,365,DAYS360(RC[7],R1C3)+2) -> 365 | D4: =ROUND(RC[-3]*RC[16]/36500,2) -> 9.86 | E4: =RC[-1]*RC[-2] -> 3598.8999999999996 | F4: =RC[-1]-RC[-4] -> -0.3000000000001819 | G4: 219 | H4: 4 | I4: AP2PW11000062 | J4: 2011-01-13 12:28:48 | K4: 2012-01-13 12:28:48 | L4: 12 | M4: 3550.68 | N4: 24000 | O4: 4 | P4: 30 | Q4: 1 | R4: 1 | S4: 365 | T4: 15 | U4: 148.20 | V4: =RC[-1]+RC[-16] -> 147.89999999999981
A5: 20000 | B5: 3000.23 | C5: =IF(DAYS360(RC[7],R1C3)+2>365,365,DAYS360(RC[7],R1C3)+2) -> 365 | D5: =ROUND(RC[-3]*RC[16]/36500,2) -> 8.2200000000000006 | E5: =RC[-1]*RC[-2] -> 3000.3 | F5: =RC[-1]-RC[-4] -> 7.0000000000163709E-2 | G5: 229 | H5: 4 | I5: AP2PW11000071 | J5: 2011-01-21 12:28:48 | K5: 2012-01-21 12:28:48 | L5: 12 | M5: 2958.9 | N5: 20000 | O5: 4 | P5: 30 | Q5: 1 | R5: 1 | S5: 365 | T5: 15 | U5: 123.23 | V5: =RC[-1]+RC[-16] -> 123.30000000000017
A6: 46000 | B6: 6747.5 | C6: =IF(DAYS360(RC[7],R1C3)+2>365,365,DAYS360(RC[7],R1C3)+2) -> 351 | D6: =ROUND(RC[-3]*RC[16]/36500,2) -> 18.899999999999999 | E6: =RC[-1]*RC[-2] -> 6633.9 | F6: =RC[-1]-RC[-4] -> -113.60000000000036 | G6: 294 | H6: 4 | I6: AP2PW11000081 | J6: 2011-03-03 12:28:48 | K6: 2012-03-03 12:28:48 | L6: 12 | M6: 6805.48 | N6: 46000 | O6: 1 | P6: 30 | Q6: 1 | R6: 1 | S6: 365 | T6: 15 | U6: 321.50 | V6: =RC[-1]+RC[-16] -> 207.89999999999964
A7: 10000 | B7: 1462.45 | C7: =IF(DAYS360(RC[7],R1C3)+2>365,365,DAYS360(RC[7],R1C3)+2) -> 351 | D7: =ROUND(RC[-3]*RC[16]/36500,2) -> 4.1100000000000003 | E7: =RC[-1]*RC[-2] -> 1442.6100000000001 | F7: =RC[-1]-RC[-4] -> -19.839999999999918 | G7: 295 | H7: 4 | I7: AP2PW11000082 | J7: 2011-03-03 12:28:48 | K7: 2012-03-03 12:28:48 | L7: 12 | M7: 1479.45 | N7: 10000 | O7: 1 | P7: 61 | Q7: 1 | R7: 1 | S7: 365 | T7: 15 | U7: 192.46 | V7: =RC[-1]+RC[-16] -> 172.62000000000009
A8: 92000 | B8: 12779.72 | C8: =IF(DAYS360(RC[7],R1C3)+2>365,365,DAYS360(RC[7],R1C3)+2) -> 332 | D8: =ROUND(RC[-3]*RC[16]/36500,2) -> 37.81 | E8: =RC[-1]*RC[-2] -> 12552.92 | F8: =RC[-1]-RC[-4] -> -226.79999999999927 | G8: 339 | H8: 4 | I8: AP2PW11000089 | J8: 2011-03-22 12:28:48 | K8: 2012-03-22 12:28:48 | L8: 12 | M8: 13610.96 | N8: 92000 | O8: 1 | P8: 30 | Q8: 1 | R8: 1 | S8: 365 | T8: 15 | U8: 1172.05 | V8: =RC[-1]+RC[-16] -> 945.25000000000068
A9: 70000 | B9: 9551.52 | C9: =IF(DAYS360(RC[7],R1C3)+2>365,365,DAYS360(RC[7],R1C3)+2) -> 326 | D9: =ROUND(RC[-3]*RC[16]/36500,2) -> 28.77 | E9: =RC[-1]*RC[-2] -> 9379.02 | F9: =RC[-1]-RC[-4] -> -172.5 | G9: 353 | H9: 4 | I9: AP2PW11000094 | J9: 2011-03-28 12:28:48 | K9: 2012-03-28 12:28:48 | L9: 12 | M9: 10356.16 | N9: 70000 | O9: 1 | P9: 30 | Q9: 1 | R9: 1 | S9: 365 | T9: 15 | U9: 891.75 | V9: =RC[-1]+RC[-16] -> 719.25
A10: 8000 | B10: 1088.95 | C10: =IF(DAYS360(RC[7],R1C3)+2>365,365,DAYS360(RC[7],R1C3)+2) -> 326 | D10: =ROUND(RC[-3]*RC[16]/36500,2) -> 3.29 | E10: =RC[-1]*RC[-2] -> 1072.54 | F10: =RC[-1]-RC[-4] -> -16.410000000000082 | G10: 355 | H10: 4 | I10: AP2PW11000096 | J10: 2011-03-28 12:28:48 | K10: 2012-03-28 12:28:48 | L10: 12 | M10: 1183.56 | N10: 8000 | O10: 1 | P10: 76 | Q10: 1 | R10: 1 | S10: 365 | T10: 15 | U10: 250.00 | V10: =RC[-1]+RC[-16] -> 233.58999999999992
A11: 10000 | B11: 1347.37 | C11: =IF(DAYS360(RC[7],R1C3)+2>365,365,DAYS360(RC[7],R1C3)+2) -> 324 | D11: =ROUND(RC[-3]*RC[16]/36500,2) -> 4.1100000000000003 | E11: =RC[-1]*RC[-2] -> 1331.64 | F11: =RC[-1]-RC[-4] -> -15.729999999999791 | G11: 371 | H11: 4 | I11: AP2PW11000099 | J11: 2011-03-31 12:28:48 | K11: 2012-03-31 12:28:48 | L11: 12 | M11: 1479.45 | N11: 10000 | O11: 1 | P11: 61 | Q11: 1 | R11: 1 | S11: 365 | T11: 15 | U11: 250.00 | V11: =RC[-1]+RC[-16] -> 234.27000000000021
A12: 40000 | B12: 5392.27 | C12: =IF(DAYS360(RC[7],R1C3)+2>365,365,DAYS360(RC[7],R1C3)+2) -> 323 | D12: =ROUND(RC[-3]*RC[16]/36500,2) -> 16.440000000000001 | E12: =RC[-1]*RC[-2] -> 5310.1200000000008 | F12: =RC[-1]-RC[-4] -> -82.149999999999636 | G12: 378 | H12: 4 | I12: AP2PW11000101 | J12: 2011-04-01 00:00:00 | K12: 2012-04-01 00:00:00 | L12: 12 | M12: 5917.81 | N12: 40000 | O12: 1 | P12: 30 | Q12: 1 | R12: 1 | S12: 365 | T12: 15 | U12: 493.15 | V12: =RC[-1]+RC[-16] -> 411.00000000000034
A13: 61000 | B13: 8072.49 | C13: =IF(DAYS360(RC[7],R1C3)+2>365,365,DAYS360(RC[7],R1C3)+2) -> 317 | D13: =ROUND(RC[-3]*RC[16]/36500,2) -> 25.07 | E13: =RC[-1]*RC[-2] -> 7947.1900000000005 | F13: =RC[-1]-RC[-4] -> -125.29999999999927 | G13: 385 | H13: 4 | I13: AP2PW11000106 | J13: 2011-04-07 00:00:00 | K13: 2012-04-07 00:00:00 | L13: 12 | M13: 9024.66 | N13: 61000 | O13: 1 | P13: 30 | Q13: 1 | R13: 1 | S13: 365 | T13: 15 | U13: 752.05 | V13: =RC[-1]+RC[-16] -> 626.75000000000068
A14: 94000 | B14: 12400.23 | C14: =IF(DAYS360(RC[7],R1C3)+2>365,365,DAYS360(RC[7],R1C3)+2) -> 316 | D14: =ROUND(RC[-3]*RC[16]/36500,2) -> 38.630000000000003 | E14: =RC[-1]*RC[-2] -> 12207.08 | F14: =RC[-1]-RC[-4] -> -193.14999999999964 | G14: 391 | H14: 4 | I14: AP2PW11000108 | J14: 2011-04-08 00:00:00 | K14: 2012-04-08 00:00:00 | L14: 12 | M14: 13906.85 | N14: 94000 | O14: 1 | P14: 30 | Q14: 1 | R14: 1 | S14: 365 | T14: 15 | U14: 1158.90 | V14: =RC[-1]+RC[-16] -> 965.75000000000045
A15: 5000 | B15: 639.5 | C15: =IF(DAYS360(RC[7],R1C3)+2>365,365,DAYS360(RC[7],R1C3)+2) -> 306 | D15: =ROUND(RC[-3]*RC[16]/36500,2) -> 2.0499999999999998 | E15: =RC[-1]*RC[-2] -> 627.29999999999995 | F15: =RC[-1]-RC[-4] -> -12.200000000000045 | G15: 410 | H15: 4 | I15: AP2PW11000117 | J15: 2011-04-18 00:00:00 | K15: 2012-04-18 00:00:00 | L15: 12 | M15: 739.73 | N15: 5000 | O15: 1 | P15: 121 | Q15: 1 | R15: 1 | S15: 365 | T15: 15 | U15: 250.00 | V15: =RC[-1]+RC[-16] -> 237.79999999999995
A16: 47000 | B16: 5969.73 | C16: =IF(DAYS360(RC[7],R1C3)+2>365,365,DAYS360(RC[7],R1C3)+2) -> 304 | D16: =ROUND(RC[-3]*RC[16]/36500,2) -> 19.32 | E16: =RC[-1]*RC[-2] -> 5873.28 | F16: =RC[-1]-RC[-4] -> -96.449999999999818 | G16: 419 | H16: 4 | I16: AP2PW11000118 | J16: 2011-04-20 00:00:00 | K16: 2012-04-20 00:00:00 | L16: 12 | M16: 6953.42 | N16: 47000 | O16: 1 | P16: 30 | Q16: 1 | R16: 1 | S16: 365 | T16: 15 | U16: 579.45 | V16: =RC[-1]+RC[-16] -> 483.00000000000023
A17: 86000 | B17: 10743.43 | C17: =IF(DAYS360(RC[7],R1C3)+2>365,365,DAYS360(RC[7],R1C3)+2) -> 299 | D17: =ROUND(RC[-3]*RC[16]/36500,2) -> 35.340000000000003 | E17: =RC[-1]*RC[-2] -> 10566.660000000002 | F17: =RC[-1]-RC[-4] -> -176.76999999999862 | G17: 431 | H17: 4 | I17: AP2PW11000120 | J17: 2011-04-25 00:00:00 | K17: 2012-04-25 00:00:00 | L17: 12 | M17: 12723.29 | N17: 86000 | O17: 1 | P17: 30 | Q17: 1 | R17: 1 | S17: 365 | T17: 15 | U17: 1060.27 | V17: =RC[-1]+RC[-16] -> 883.50000000000136
A18: 7800 | B18: 978.67 | C18: =IF(DAYS360(RC[7],R1C3)+2>365,365,DAYS360(RC[7],R1C3)+2) -> 299 | D18: =ROUND(RC[-3]*RC[16]/36500,2) -> 3.21 | E18: =RC[-1]*RC[-2] -> 959.79 | F18: =RC[-1]-RC[-4] -> -18.879999999999995 | G18: 432 | H18: 4 | I18: AP2PW11000121 | J18: 2011-04-25 00:00:00 | K18: 2012-04-25 00:00:00 | L18: 12 | M18: 1153.97 | N18: 7800 | O18: 1 | P18: 77 | Q18: 1 | R18: 1 | S18: 365 | T18: 15 | U18: 250.00 | V18: =RC[-1]+RC[-16] -> 231.12
A19: 126000 | B19: 14923.49 | C19: =IF(DAYS360(RC[7],R1C3)+2>365,365,DAYS360(RC[7],R1C3)+2) -> 258 | D19: =ROUND(RC[-3]*RC[16]/36500,2) -> 56.96 | E19: =RC[-1]*RC[-2] -> 14695.68 | F19: =RC[-1]-RC[-4] -> -227.80999999999949 | G19: 497 | H19: 4 | I19: AP2PW11000144 | J19: 2011-06-06 00:00:00 | K19: 2012-06-06 00:00:00 | L19: 12 | M19: 20505.21 | N19: 126000 | O19: 1 | P19: 30 | Q19: 1 | R19: 1 | S19: 365 | T19: 16.5 | U19: 1708.77 | V19: =RC[-1]+RC[-16] -> 1480.9600000000005
A20: 7000 | B20: 815.64 | C20: =IF(DAYS360(RC[7],R1C3)+2>365,365,DAYS360(RC[7],R1C3)+2) -> 254 | D20: =ROUND(RC[-3]*RC[16]/36500,2) -> 3.16 | E20: =RC[-1]*RC[-2] -> 802.64 | F20: =RC[-1]-RC[-4] -> -13 | G20: 503 | H20: 4 | I20: AP2PW11000147 | J20: 2011-06-10 00:00:00 | K20: 2012-06-10 00:00:00 | L20: 12 | M20: 1139.18 | N20: 7000 | O20: 1 | P20: 79 | Q20: 1 | R20: 1 | S20: 365 | T20: 16.5 | U20: 250.00 | V20: =RC[-1]+RC[-16] -> 237
A21: 24500 | B21: 3068.39 | C21: =IF(DAYS360(RC[7],R1C3)+2>365,365,DAYS360(RC[7],R1C3)+2) -> 250 | D21: =ROUND(RC[-3]*RC[16]/36500,2) -> 12.08 | E21: =RC[-1]*RC[-2] -> 3020 | F21: =RC[-1]-RC[-4] -> -48.389999999999873 | G21: 506 | H21: 4 | I21: AP2PW11000150 | J21: 2011-06-14 00:00:00 | K21: 2012-06-14 00:00:00 | L21: 12 | M21: 4349.59 | N21: 24500 | O21: 1 | P21: 30 | Q21: 1 | R21: 1 | S21: 365 | T21: 18 | U21: 362.47 | V21: =RC[-1]+RC[-16] -> 314.08000000000015
A22: 16500 | B22: 2048.94 | C22: =IF(DAYS360(RC[7],R1C3)+2>365,365,DAYS360(RC[7],R1C3)+2) -> 247 | D22: =ROUND(RC[-3]*RC[16]/36500,2) -> 8.14 | E22: =RC[-1]*RC[-2] -> 2010.5800000000002 | F22: =RC[-1]-RC[-4] -> -38.3599999999999 | G22: 512 | H22: 4 | I22: AP2PW11000154 | J22: 2011-06-17 00:00:00 | K22: 2012-06-17 00:00:00 | L22: 12 | M22: 2929.32 | N22: 16500 | O22: 1 | P22: 30 | Q22: 1 | R22: 1 | S22: 365 | T22: 18 | U22: 250.00 | V22: =RC[-1]+RC[-16] -> 211.6400000000001
A23: 12500 | B23: 1531.28 | C23: =IF(DAYS360(RC[7],R1C3)+2>365,365,DAYS360(RC[7],R1C3)+2) -> 244 | D23: =ROUND(RC[-3]*RC[16]/36500,2) -> 6.16 | E23: =RC[-1]*RC[-2] -> 1503.04 | F23: =RC[-1]-RC[-4] -> -28.240000000000009 | G23: 524 | H23: 4 | I23: AP2PW11000157 | J23: 2011-06-20 00:00:00 | K23: 2012-06-20 00:00:00 | L23: 12 | M23: 2219.1799999999998 | N23: 12500 | O23: 1 | P23: 40 | Q23: 1 | R23: 1 | S23: 365 | T23: 18 | U23: 250.00 | V23: =RC[-1]+RC[-16] -> 221.76
A24: 26000 | B24: 3128.14 | C24: =IF(DAYS360(RC[7],R1C3)+2>365,365,DAYS360(RC[7],R1C3)+2) -> 240 | D24: =ROUND(RC[-3]*RC[16]/36500,2) -> 12.82 | E24: =RC[-1]*RC[-2] -> 3076.8 | F24: =RC[-1]-RC[-4] -> -51.339999999999691 | G24: 533 | H24: 4 | I24: AP2PW11000158 | J24: 2011-06-24 00:00:00 | K24: 2012-06-24 00:00:00 | L24: 12 | M24: 4615.8900000000003 | N24: 26000 | O24: 1 | P24: 30 | Q24: 1 | R24: 1 | S24: 365 | T24: 18 | U24: 384.66 | V24: =RC[-1]+RC[-16] -> 333.32000000000033
A25: 20000 | B25: 2346.77 | C25: =IF(DAYS360(RC[7],R1C3)+2>365,365,DAYS360(RC[7],R1C3)+2) -> 234 | D25: =ROUND(RC[-3]*RC[16]/36500,2) -> 9.86 | E25: =RC[-1]*RC[-2] -> 2307.2399999999998 | F25: =RC[-1]-RC[-4] -> -39.5300000000002 | G25: 540 | H25: 4 | I25: AP2PW11000159 | J25: 2011-06-30 00:00:00 | K25: 2012-06-30 00:00:00 | L25: 12 | M25: 3550.68 | N25: 20000 | O25: 1 | P25: 30 | Q25: 1 | R25: 1 | S25: 365 | T25: 18 | U25: 295.89 | V25: =RC[-1]+RC[-16] -> 256.35999999999979
A26: 7000 | B26: 757.15 | C26: =IF(DAYS360(RC[7],R1C3)+2>365,365,DAYS360(RC[7],R1C3)+2) -> 215 | D26: =ROUND(RC[-3]*RC[16]/36500,2) -> 3.45 | E26: =RC[-1]*RC[-2] -> 741.75 | F26: =RC[-1]-RC[-4] -> -15.399999999999977 | G26: 555 | H26: 4 | I26: AP2PW11000163 | J26: 2011-07-19 00:00:00 | K26: 2012-07-19 00:00:00 | L26: 12 | M26: 1242.74 | N26: 7000 | O26: 1 | P26: 72 | Q26: 1 | R26: 1 | S26: 365 | T26: 18 | U26: 250.00 | V26: =RC[-1]+RC[-16] -> 234.60000000000002
A27: 49000 | B27: 5291.17 | C27: =IF(DAYS360(RC[7],R1C3)+2>365,365,DAYS360(RC[7],R1C3)+2) -> 215 | D27: =ROUND(RC[-3]*RC[16]/36500,2) -> 24.16 | E27: =RC[-1]*RC[-2] -> 5194.3999999999996 | F27: =RC[-1]-RC[-4] -> -96.770000000000437 | G27: 556 | H27: 4 | I27: AP2PW11000164 | J27: 2011-07-19 00:00:00 | K27: 2012-07-19 00:00:00 | L27: 12 | M27: 8699.18 | N27: 49000 | O27: 1 | P27: 30 | Q27: 1 | R27: 1 | S27: 365 | T27: 18 | U27: 724.93 | V27: =RC[-1]+RC[-16] -> 628.15999999999951
A28: 5500 | B28: 588.75 | C28: =IF(DAYS360(RC[7],R1C3)+2>365,365,DAYS360(RC[7],R1C3)+2) -> 213 | D28: =ROUND(RC[-3]*RC[16]/36500,2) -> 2.71 | E28: =RC[-1]*RC[-2] -> 577.23 | F28: =RC[-1]-RC[-4] -> -11.519999999999982 | G28: 557 | H28: 4 | I28: AP2PW11000165 | J28: 2011-07-21 00:00:00 | K28: 2012-07-21 00:00:00 | L28: 12 | M28: 976.44 | N28: 5500 | O28: 1 | P28: 92 | Q28: 1 | R28: 1 | S28: 365 | T28: 18 | U28: 250.00 | V28: =RC[-1]+RC[-16] -> 238.48000000000002
A29: 33500 | B29: 3568.34 | C29: =IF(DAYS360(RC[7],R1C3)+2>365,365,DAYS360(RC[7],R1C3)+2) -> 212 | D29: =ROUND(RC[-3]*RC[16]/36500,2) -> 16.52 | E29: =RC[-1]*RC[-2] -> 3502.24 | F29: =RC[-1]-RC[-4] -> -66.100000000000364 | G29: 566 | H29: 4 | I29: AP2PW11000173 | J29: 2011-07-22 00:00:00 | K29: 2012-07-22 00:00:00 | L29: 12 | M29: 5947.4 | N29: 33500 | O29: 1 | P29: 30 | Q29: 1 | R29: 1 | S29: 365 | T29: 18 | U29: 495.62 | V29: =RC[-1]+RC[-16] -> 429.51999999999964
A30: 40000 | B30: 4143.18 | C30: =IF(DAYS360(RC[7],R1C3)+2>365,365,DAYS360(RC[7],R1C3)+2) -> 206 | D30: =ROUND(RC[-3]*RC[16]/36500,2) -> 19.73 | E30: =RC[-1]*RC[-2] -> 4064.38 | F30: =RC[-1]-RC[-4] -> -78.800000000000182 | G30: 575 | H30: 4 | I30: AP2PW11000177 | J30: 2011-07-28 00:00:00 | K30: 2012-07-28 00:00:00 | L30: 12 | M30: 7101.37 | N30: 40000 | O30: 1 | P30: 30 | Q30: 1 | R30: 1 | S30: 365 | T30: 18 | U30: 591.78 | V30: =RC[-1]+RC[-16] -> 512.97999999999979
A31: 47000 | B31: 4728.66 | C31: =IF(DAYS360(RC[7],R1C3)+2>365,365,DAYS360(RC[7],R1C3)+2) -> 201 | D31: =ROUND(RC[-3]*RC[16]/36500,2) -> 23.18 | E31: =RC[-1]*RC[-2] -> 4659.18 | F31: =RC[-1]-RC[-4] -> -69.479999999999563 | G31: 586 | H31: 4 | I31: AP2PW11000180 | J31: 2011-08-03 00:00:00 | K31: 2012-08-03 00:00:00 | L31: 12 | M31: 8344.11 | N31: 47000 | O31: 1 | P31: 30 | Q31: 1 | R31: 1 | S31: 365 | T31: 18 | U31: 695.34 | V31: =RC[-1]+RC[-16] -> 625.86000000000047
A32: 36000 | B32: 3479.1 | C32: =IF(DAYS360(RC[7],R1C3)+2>365,365,DAYS360(RC[7],R1C3)+2) -> 193 | D32: =ROUND(RC[-3]*RC[16]/36500,2) -> 17.75 | E32: =RC[-1]*RC[-2] -> 3425.75 | F32: =RC[-1]-RC[-4] -> -53.349999999999909 | G32: 621 | H32: 4 | I32: AP2PW11000190 | J32: 2011-08-11 00:00:00 | K32: 2012-08-11 00:00:00 | L32: 12 | M32: 6391.23 | N32: 36000 | O32: 1 | P32: 30 | Q32: 1 | R32: 1 | S32: 365 | T32: 18 | U32: 532.60 | V32: =RC[-1]+RC[-16] -> 479.25000000000011
A33: 202000 | B33: 18927.689999999999 | C33: =IF(DAYS360(RC[7],R1C3)+2>365,365,DAYS360(RC[7],R1C3)+2) -> 187 | D33: =ROUND(RC[-3]*RC[16]/36500,2) -> 99.62 | E33: =RC[-1]*RC[-2] -> 18628.940000000002 | F33: =RC[-1]-RC[-4] -> -298.74999999999636 | G33: 657 | H33: 4 | I33: AP2PW11000196 | J33: 2011-08-17 00:00:00 | K33: 2012-08-17 00:00:00 | L33: 12 | M33: 35861.919999999998 | N33: 202000 | O33: 1 | P33: 30 | Q33: 1 | R33: 1 | S33: 365 | T33: 18 | U33: 2988.49 | V33: =RC[-1]+RC[-16] -> 2689.7400000000034
A34: 26500 | B34: 2483.25 | C34: =IF(DAYS360(RC[7],R1C3)+2>365,365,DAYS360(RC[7],R1C3)+2) -> 187 | D34: =ROUND(RC[-3]*RC[16]/36500,2) -> 13.07 | E34: =RC[-1]*RC[-2] -> 2444.09 | F34: =RC[-1]-RC[-4] -> -39.159999999999854 | G34: 658 | H34: 4 | I34: AP2PW11000197 | J34: 2011-08-17 00:00:00 | K34: 2012-08-17 00:00:00 | L34: 12 | M34: 4704.66 | N34: 26500 | O34: 1 | P34: 30 | Q34: 1 | R34: 1 | S34: 365 | T34: 18 | U34: 392.05 | V34: =RC[-1]+RC[-16] -> 352.89000000000016
A35: 35000 | B35: 3262.15 | C35: =IF(DAYS360(RC[7],R1C3)+2>365,365,DAYS360(RC[7],R1C3)+2) -> 186 | D35: =ROUND(RC[-3]*RC[16]/36500,2) -> 17.260000000000002 | E35: =RC[-1]*RC[-2] -> 3210.36 | F35: =RC[-1]-RC[-4] -> -51.789999999999964 | G35: 669 | H35: 4 | I35: AP2PW11000198 | J35: 2011-08-18 00:00:00 | K35: 2012-08-18 00:00:00 | L35: 12 | M35: 6213.7 | N35: 35000 | O35: 1 | P35: 30 | Q35: 1 | R35: 1 | S35: 365 | T35: 18 | U35: 517.81 | V35: =RC[-1]+RC[-16] -> 466.02
A36: 215000 | B36: 19933.560000000001 | C36: =IF(DAYS360(RC[7],R1C3)+2>365,365,DAYS360(RC[7],R1C3)+2) -> 185 | D36: =ROUND(RC[-3]*RC[16]/36500,2) -> 106.03 | E36: =RC[-1]*RC[-2] -> 19615.55 | F36: =RC[-1]-RC[-4] -> -318.01000000000204 | G36: 672 | H36: 4 | I36: AP2PW11000199 | J36: 2011-08-19 00:00:00 | K36: 2012-08-19 00:00:00 | L36: 12 | M36: 38169.86 | N36: 215000 | O36: 1 | P36: 30 | Q36: 1 | R36: 1 | S36: 365 | T36: 18 | U36: 3180.82 | V36: =RC[-1]+RC[-16] -> 2862.8099999999981
A37: 82700 | B37: 7462.85 | C37: =IF(DAYS360(RC[7],R1C3)+2>365,365,DAYS360(RC[7],R1C3)+2) -> 180 | D37: =ROUND(RC[-3]*RC[16]/36500,2) -> 40.78 | E37: =RC[-1]*RC[-2] -> 7340.4000000000005 | F37: =RC[-1]-RC[-4] -> -122.44999999999982 | G37: 703 | H37: 4 | I37: AP2PW11000203 | J37: 2011-08-24 00:00:00 | K37: 2012-08-24 00:00:00 | L37: 12 | M37: 14682.08 | N37: 82700 | O37: 1 | P37: 30 | Q37: 1 | R37: 1 | S37: 365 | T37: 18 | U37: 1223.51 | V37: =RC[-1]+RC[-16] -> 1101.0600000000002
A38: 74000 | B38: 6677.76 | C38: =IF(DAYS360(RC[7],R1C3)+2>365,365,DAYS360(RC[7],R1C3)+2) -> 180 | D38: =ROUND(RC[-3]*RC[16]/36500,2) -> 36.49 | E38: =RC[-1]*RC[-2] -> 6568.2000000000007 | F38: =RC[-1]-RC[-4] -> -109.55999999999949 | G38: 704 | H38: 4 | I38: AP2PW11000204 | J38: 2011-08-24 00:00:00 | K38: 2012-08-24 00:00:00 | L38: 12 | M38: 13137.53 | N38: 74000 | O38: 1 | P38: 30 | Q38: 1 | R38: 1 | S38: 365 | T38: 18 | U38: 1094.79 | V38: =RC[-1]+RC[-16] -> 985.23000000000047
A39: 13800 | B39: 1237.45 | C39: =IF(DAYS360(RC[7],R1C3)+2>365,365,DAYS360(RC[7],R1C3)+2) -> 178 | D39: =ROUND(RC[-3]*RC[16]/36500,2) -> 6.81 | E39: =RC[-1]*RC[-2] -> 1212.1799999999998 | F39: =RC[-1]-RC[-4] -> -25.270000000000209 | G39: 720 | H39: 4 | I39: AP2PW11000206 | J39: 2011-08-26 00:00:00 | K39: 2012-08-26 00:00:00 | L39: 12 | M39: 2449.9699999999998 | N39: 13800 | O39: 1 | P39: 36 | Q39: 1 | R39: 1 | S39: 365 | T39: 18 | U39: 250.00 | V39: =RC[-1]+RC[-16] -> 224.72999999999979
A40: 39700 | B40: 3348.12 | C40: =IF(DAYS360(RC[7],R1C3)+2>365,365,DAYS360(RC[7],R1C3)+2) -> 169 | D40: =ROUND(RC[-3]*RC[16]/36500,2) -> 19.579999999999998 | E40: =RC[-1]*RC[-2] -> 3309.0199999999995 | F40: =RC[-1]-RC[-4] -> -39.100000000000364 | G40: 744 | H40: 4 | I40: AP2PW11000212 | J40: 2011-09-05 00:00:00 | K40: 2012-09-05 00:00:00 | L40: 12 | M40: 7048.11 | N40: 39700 | O40: 1 | P40: 30 | Q40: 1 | R40: 1 | S40: 365 | T40: 18 | U40: 587.34 | V40: =RC[-1]+RC[-16] -> 548.23999999999967
A41: 9000 | B41: 760.6 | C41: =IF(DAYS360(RC[7],R1C3)+2>365,365,DAYS360(RC[7],R1C3)+2) -> 169 | D41: =ROUND(RC[-3]*RC[16]/36500,2) -> 4.4400000000000004 | E41: =RC[-1]*RC[-2] -> 750.36 | F41: =RC[-1]-RC[-4] -> -10.240000000000009 | G41: 745 | H41: 4 | I41: AP2PW11000213 | J41: 2011-09-05 00:00:00 | K41: 2012-09-05 00:00:00 | L41: 12 | M41: 1597.81 | N41: 9000 | O41: 1 | P41: 56 | Q41: 1 | R41: 1 | S41: 365 | T41: 18 | U41: 250.00 | V41: =RC[-1]+RC[-16] -> 239.76
A42: 100000 | B42: 8384.25 | C42: =IF(DAYS360(RC[7],R1C3)+2>365,365,DAYS360(RC[7],R1C3)+2) -> 168 | D42: =ROUND(RC[-3]*RC[16]/36500,2) -> 49.32 | E42: =RC[-1]*RC[-2] -> 8285.76 | F42: =RC[-1]-RC[-4] -> -98.489999999999782 | G42: 750 | H42: 4 | I42: AP2PW11000214 | J42: 2011-09-06 00:00:00 | K42: 2012-09-06 00:00:00 | L42: 12 | M42: 17753.419999999998 | N42: 100000 | O42: 1 | P42: 30 | Q42: 1 | R42: 1 | S42: 365 | T42: 18 | U42: 1479.45 | V42: =RC[-1]+RC[-16] -> 1380.9600000000003
A43: 40000 | B43: 3353.98 | C43: =IF(DAYS360(RC[7],R1C3)+2>365,365,DAYS360(RC[7],R1C3)+2) -> 168 | D43: =ROUND(RC[-3]*RC[16]/36500,2) -> 19.73 | E43: =RC[-1]*RC[-2] -> 3314.64 | F43: =RC[-1]-RC[-4] -> -39.340000000000146 | G43: 751 | H43: 4 | I43: AP2PW11000215 | J43: 2011-09-06 00:00:00 | K43: 2012-09-06 00:00:00 | L43: 12 | M43: 7101.37 | N43: 40000 | O43: 1 | P43: 30 | Q43: 1 | R43: 1 | S43: 365 | T43: 18 | U43: 591.78 | V43: =RC[-1]+RC[-16] -> 552.43999999999983
A44: 50000 | B44: 4019.51 | C44: =IF(DAYS360(RC[7],R1C3)+2>365,365,DAYS360(RC[7],R1C3)+2) -> 161 | D44: =ROUND(RC[-3]*RC[16]/36500,2) -> 24.66 | E44: =RC[-1]*RC[-2] -> 3970.26 | F44: =RC[-1]-RC[-4] -> -49.25 | G44: 781 | H44: 4 | I44: AP2PW11000219 | J44: 2011-09-13 00:00:00 | K44: 2012-09-13 00:00:00 | L44: 12 | M44: 8876.7099999999991 | N44: 50000 | O44: 1 | P44: 30 | Q44: 1 | R44: 1 | S44: 365 | T44: 18 | U44: 739.73 | V44: =RC[-1]+RC[-16] -> 690.48
A45: 27000 | B45: 2171.0100000000002 | C45: =IF(DAYS360(RC[7],R1C3)+2>365,365,DAYS360(RC[7],R1C3)+2) -> 161 | D45: =ROUND(RC[-3]*RC[16]/36500,2) -> 13.32 | E45: =RC[-1]*RC[-2] -> 2144.52 | F45: =RC[-1]-RC[-4] -> -26.490000000000236 | G45: 782 | H45: 4 | I45: AP2PW11000220 | J45: 2011-09-13 00:00:00 | K45: 2012-09-13 00:00:00 | L45: 12 | M45: 4793.42 | N45: 27000 | O45: 1 | P45: 30 | Q45: 1 | R45: 1 | S45: 365 | T45: 18 | U45: 399.45 | V45: =RC[-1]+RC[-16] -> 372.95999999999975
A46: 45300 | B46: 3641.41 | C46: =IF(DAYS360(RC[7],R1C3)+2>365,365,DAYS360(RC[7],R1C3)+2) -> 161 | D46: =ROUND(RC[-3]*RC[16]/36500,2) -> 22.34 | E46: =RC[-1]*RC[-2] -> 3596.74 | F46: =RC[-1]-RC[-4] -> -44.670000000000073 | G46: 783 | H46: 4 | I46: AP2PW11000221 | J46: 2011-09-13 00:00:00 | K46: 2012-09-13 00:00:00 | L46: 12 | M46: 8042.3 | N46: 45300 | O46: 1 | P46: 30 | Q46: 1 | R46: 1 | S46: 365 | T46: 18 | U46: 670.19 | V46: =RC[-1]+RC[-16] -> 625.52
A47: 9000 | B47: 720.64 | C47: =IF(DAYS360(RC[7],R1C3)+2>365,365,DAYS360(RC[7],R1C3)+2) -> 160 | D47: =ROUND(RC[-3]*RC[16]/36500,2) -> 4.4400000000000004 | E47: =RC[-1]*RC[-2] -> 710.40000000000009 | F47: =RC[-1]-RC[-4] -> -10.239999999999895 | G47: 789 | H47: 4 | I47: AP2PW11000222 | J47: 2011-09-14 00:00:00 | K47: 2012-09-14 00:00:00 | L47: 12 | M47: 1597.81 | N47: 9000 | O47: 1 | P47: 56 | Q47: 1 | R47: 1 | S47: 365 | T47: 18 | U47: 250 | V47: =RC[-1]+RC[-16] -> 239.7600000000001
A48: 11500 | B48: 919.06 | C48: =IF(DAYS360(RC[7],R1C3)+2>365,365,DAYS360(RC[7],R1C3)+2) -> 160 | D48: =ROUND(RC[-3]*RC[16]/36500,2) -> 5.67 | E48: =RC[-1]*RC[-2] -> 907.2 | F48: =RC[-1]-RC[-4] -> -11.8599999999999 | G48: 790 | H48: 4 | I48: AP2PW11000223 | J48: 2011-09-14 00:00:00 | K48: 2012-09-14 00:00:00 | L48: 12 | M48: 2041.64 | N48: 11500 | O48: 1 | P48: 44 | Q48: 1 | R48: 1 | S48: 365 | T48: 18 | U48: 250 | V48: =RC[-1]+RC[-16] -> 238.1400000000001
A49: 6000 | B49: 872.44 | C49: =IF(DAYS360(RC[7],R1C3)+2>365,365,DAYS360(RC[7],R1C3)+2) -> 347 | D49: =ROUND(RC[-3]*RC[16]/36500,2) -> 2.4700000000000002 | E49: =RC[-1]*RC[-2] -> 857.09 | F49: =RC[-1]-RC[-4] -> -15.350000000000023 | G49: 307 | H49: 5 | I49: AW3PW11000023 | J49: 2011-03-07 12:28:48 | K49: 2012-03-07 12:28:48 | L49: 12 | M49: 887.67 | N49: 6000 | O49: 1 | P49: 101 | Q49: 1 | R49: 1 | S49: 365 | T49: 15 | U49: 227.77 | V49: =RC[-1]+RC[-16] -> 212.42
A50: 7000 | B50: 949.84 | C50: =IF(DAYS360(RC[7],R1C3)+2>365,365,DAYS360(RC[7],R1C3)+2) -> 324 | D50: =ROUND(RC[-3]*RC[16]/36500,2) -> 2.88 | E50: =RC[-1]*RC[-2] -> 933.12 | F50: =RC[-1]-RC[-4] -> -16.720000000000027 | G50: 367 | H50: 5 | I50: AW3PW11000033 | J50: 2011-03-30 12:28:48 | K50: 2012-03-30 12:28:48 | L50: 12 | M50: 1035.6199999999999 | N50: 7000 | O50: 1 | P50: 87 | Q50: 1 | R50: 1 | S50: 365 | T50: 15 | U50: 250.00 | V50: =RC[-1]+RC[-16] -> 233.27999999999997
A51: 25500 | B51: 3447.9 | C51: =IF(DAYS360(RC[7],R1C3)+2>365,365,DAYS360(RC[7],R1C3)+2) -> 324 | D51: =ROUND(RC[-3]*RC[16]/36500,2) -> 10.48 | E51: =RC[-1]*RC[-2] -> 3395.52 | F51: =RC[-1]-RC[-4] -> -52.380000000000109 | G51: 373 | H51: 5 | I51: AW3PW11000035 | J51: 2011-03-31 12:28:48 | K51: 2012-03-31 12:28:48 | L51: 12 | M51: 3772.6 | N51: 25500 | O51: 1 | P51: 30 | Q51: 1 | R51: 1 | S51: 365 | T51: 15 | U51: 314.38 | V51: =RC[-1]+RC[-16] -> 261.99999999999989
A52: 10000 | B52: 1306.27 | C52: =IF(DAYS360(RC[7],R1C3)+2>365,365,DAYS360(RC[7],R1C3)+2) -> 312 | D52: =ROUND(RC[-3]*RC[16]/36500,2) -> 4.1100000000000003 | E52: =RC[-1]*RC[-2] -> 1282.3200000000002 | F52: =RC[-1]-RC[-4] -> -23.949999999999818 | G52: 406 | H52: 5 | I52: AW3PW11000039 | J52: 2011-04-12 12:28:48 | K52: 2012-04-12 12:28:48 | L52: 12 | M52: 1479.45 | N52: 10000 | O52: 1 | P52: 60 | Q52: 1 | R52: 1 | S52: 365 | T52: 15 | U52: 250.00 | V52: =RC[-1]+RC[-16] -> 226.05000000000018
A53: 5000 | B53: 602.6 | C53: =IF(DAYS360(RC[7],R1C3)+2>365,365,DAYS360(RC[7],R1C3)+2) -> 288 | D53: =ROUND(RC[-3]*RC[16]/36500,2) -> 2.0499999999999998 | E53: =RC[-1]*RC[-2] -> 590.4 | F53: =RC[-1]-RC[-4] -> -12.200000000000045 | G53: 466 | H53: 5 | I53: AW3PW11000045 | J53: 2011-05-06 12:28:48 | K53: 2012-05-06 12:28:48 | L53: 12 | M53: 739.73 | N53: 5000 | O53: 1 | P53: 121 | Q53: 1 | R53: 1 | S53: 365 | T53: 15 | U53: 250.00 | V53: =RC[-1]+RC[-16] -> 237.79999999999995
A54: 6000 | B54: 744.32 | C54: =IF(DAYS360(RC[7],R1C3)+2>365,365,DAYS360(RC[7],R1C3)+2) -> 247 | D54: =ROUND(RC[-3]*RC[16]/36500,2) -> 2.96 | E54: =RC[-1]*RC[-2] -> 731.12 | F54: =RC[-1]-RC[-4] -> -13.200000000000045 | G54: 517 | H54: 5 | I54: AW3PW11000052 | J54: 2011-06-17 12:28:48 | K54: 2012-06-17 12:28:48 | L54: 12 | M54: 1065.21 | N54: 6000 | O54: 1 | P54: 84 | Q54: 1 | R54: 1 | S54: 365 | T54: 18 | U54: 250.00 | V54: =RC[-1]+RC[-16] -> 236.79999999999995
A55: 37000 | B55: 4270.3999999999996 | C55: =IF(DAYS360(RC[7],R1C3)+2>365,365,DAYS360(RC[7],R1C3)+2) -> 230 | D55: =ROUND(RC[-3]*RC[16]/36500,2) -> 18.25 | E55: =RC[-1]*RC[-2] -> 4197.5 | F55: =RC[-1]-RC[-4] -> -72.899999999999636 | G55: 543 | H55: 5 | I55: AW3PW11000059 | J55: 2011-07-04 12:28:48 | K55: 2012-07-04 12:28:48 | L55: 12 | M55: 6568.77 | N55: 37000 | O55: 1 | P55: 30 | Q55: 1 | R55: 1 | S55: 365 | T55: 18 | U55: 547.40 | V55: =RC[-1]+RC[-16] -> 474.50000000000034
A56: 33000 | B56: 3693.41 | C56: =IF(DAYS360(RC[7],R1C3)+2>365,365,DAYS360(RC[7],R1C3)+2) -> 223 | D56: =ROUND(RC[-3]*RC[16]/36500,2) -> 16.27 | E56: =RC[-1]*RC[-2] -> 3628.21 | F56: =RC[-1]-RC[-4] -> -65.199999999999818 | G56: 551 | H56: 5 | I56: AW3PW11000062 | J56: 2011-07-11 12:28:48 | K56: 2012-07-11 12:28:48 | L56: 12 | M56: 5858.63 | N56: 33000 | O56: 1 | P56: 30 | Q56: 1 | R56: 1 | S56: 365 | T56: 18 | U56: 488.22 | V56: =RC[-1]+RC[-16] -> 423.02000000000021
A57: 6000 | B57: 667.36 | C57: =IF(DAYS360(RC[7],R1C3)+2>365,365,DAYS360(RC[7],R1C3)+2) -> 222 | D57: =ROUND(RC[-3]*RC[16]/36500,2) -> 2.96 | E57: =RC[-1]*RC[-2] -> 657.12 | F57: =RC[-1]-RC[-4] -> -10.240000000000009 | G57: 553 | H57: 5 | I57: AW3PW11000063 | J57: 2011-07-12 12:28:48 | K57: 2012-07-12 12:28:48 | L57: 12 | M57: 1065.21 | N57: 6000 | O57: 1 | P57: 84 | Q57: 1 | R57: 1 | S57: 365 | T57: 18 | U57: 250.00 | V57: =RC[-1]+RC[-16] -> 239.76
A58: 33000 | B58: 3335.47 | C58: =IF(DAYS360(RC[7],R1C3)+2>365,365,DAYS360(RC[7],R1C3)+2) -> 202 | D58: =ROUND(RC[-3]*RC[16]/36500,2) -> 16.27 | E58: =RC[-1]*RC[-2] -> 3286.54 | F58: =RC[-1]-RC[-4] -> -48.929999999999836 | G58: 580 | H58: 5 | I58: AW3PW11000065 | J58: 2011-08-02 12:28:48 | K58: 2012-08-02 12:28:48 | L58: 12 | M58: 5858.63 | N58: 33000 | O58: 1 | P58: 30 | Q58: 1 | R58: 1 | S58: 365 | T58: 18 | U58: 488.22 | V58: =RC[-1]+RC[-16] -> 439.29000000000019
A59: 130000 | B59: 13014.32 | C59: =IF(DAYS360(RC[7],R1C3)+2>365,365,DAYS360(RC[7],R1C3)+2) -> 200 | D59: =ROUND(RC[-3]*RC[16]/36500,2) -> 64.11 | E59: =RC[-1]*RC[-2] -> 12822 | F59: =RC[-1]-RC[-4] -> -192.31999999999971 | G59: 588 | H59: 5 | I59: AW3PW11000066 | J59: 2011-08-04 12:28:48 | K59: 2012-08-04 12:28:48 | L59: 12 | M59: 23079.45 | N59: 130000 | O59: 1 | P59: 30 | Q59: 1 | R59: 1 | S59: 365 | T59: 18 | U59: 1923.29 | V59: =RC[-1]+RC[-16] -> 1730.9700000000003
A60: 34000 | B60: 3135.9 | C60: =IF(DAYS360(RC[7],R1C3)+2>365,365,DAYS360(RC[7],R1C3)+2) -> 185 | D60: =ROUND(RC[-3]*RC[16]/36500,2) -> 16.77 | E60: =RC[-1]*RC[-2] -> 3102.45 | F60: =RC[-1]-RC[-4] -> -33.450000000000273 | G60: 671 | H60: 5 | I60: AW3PW11000079 | J60: 2011-08-19 12:28:48 | K60: 2012-08-19 12:28:48 | L60: 12 | M60: 6036.16 | N60: 34000 | O60: 1 | P60: 30 | Q60: 1 | R60: 1 | S60: 365 | T60: 18 | U60: 503.01 | V60: =RC[-1]+RC[-16] -> 469.55999999999972
A61: 33000 | B61: 2993.8 | C61: =IF(DAYS360(RC[7],R1C3)+2>365,365,DAYS360(RC[7],R1C3)+2) -> 182 | D61: =ROUND(RC[-3]*RC[16]/36500,2) -> 16.27 | E61: =RC[-1]*RC[-2] -> 2961.14 | F61: =RC[-1]-RC[-4] -> -32.660000000000309 | G61: 688 | H61: 5 | I61: AW3PW11000084 | J61: 2011-08-22 12:28:48 | K61: 2012-08-22 12:28:48 | L61: 12 | M61: 5858.63 | N61: 33000 | O61: 1 | P61: 30 | Q61: 1 | R61: 1 | S61: 365 | T61: 18 | U61: 488.22 | V61: =RC[-1]+RC[-16] -> 455.55999999999972
A62: 47000 | B62: 4195.5200000000004 | C62: =IF(DAYS360(RC[7],R1C3)+2>365,365,DAYS360(RC[7],R1C3)+2) -> 179 | D62: =ROUND(RC[-3]*RC[16]/36500,2) -> 23.18 | E62: =RC[-1]*RC[-2] -> 4149.22 | F62: =RC[-1]-RC[-4] -> -46.300000000000182 | G62: 713 | H62: 5 | I62: AW3PW11000086 | J62: 2011-08-25 12:28:48 | K62: 2012-08-25 12:28:48 | L62: 12 | M62: 8344.11 | N62: 47000 | O62: 1 | P62: 30 | Q62: 1 | R62: 1 | S62: 365 | T62: 18 | U62: 695.34 | V62: =RC[-1]+RC[-16] -> 649.03999999999985
A63: 39300 | B63: 3488.42 | C63: =IF(DAYS360(RC[7],R1C3)+2>365,365,DAYS360(RC[7],R1C3)+2) -> 178 | D63: =ROUND(RC[-3]*RC[16]/36500,2) -> 19.38 | E63: =RC[-1]*RC[-2] -> 3449.64 | F63: =RC[-1]-RC[-4] -> -38.7800000000002 | G63: 718 | H63: 5 | I63: AW3PW11000087 | J63: 2011-08-26 12:28:48 | K63: 2012-08-26 12:28:48 | L63: 12 | M63: 6977.1 | N63: 39300 | O63: 1 | P63: 30 | Q63: 1 | R63: 1 | S63: 365 | T63: 18 | U63: 581.42 | V63: =RC[-1]+RC[-16] -> 542.63999999999976
A64: 93750 | B64: 8044.11 | C64: =IF(DAYS360(RC[7],R1C3)+2>365,365,DAYS360(RC[7],R1C3)+2) -> 173 | D64: =ROUND(RC[-3]*RC[16]/36500,2) -> 46.23 | E64: =RC[-1]*RC[-2] -> 7997.7899999999991 | F64: =RC[-1]-RC[-4] -> -46.320000000000618 | G64: 729 | H64: 5 | I64: AW3PW11000089 | J64: 2011-09-01 12:28:48 | K64: 2012-09-01 12:28:48 | L64: 12 | M64: 16643.84 | N64: 93750 | O64: 1 | P64: 30 | Q64: 1 | R64: 1 | S64: 365 | T64: 18 | U64: 1386.99 | V64: =RC[-1]+RC[-16] -> 1340.6699999999994
A65: 36000 | B65: 3088.6 | C65: =IF(DAYS360(RC[7],R1C3)+2>365,365,DAYS360(RC[7],R1C3)+2) -> 173 | D65: =ROUND(RC[-3]*RC[16]/36500,2) -> 17.75 | E65: =RC[-1]*RC[-2] -> 3070.75 | F65: =RC[-1]-RC[-4] -> -17.849999999999909 | G65: 735 | H65: 5 | I65: AW3PW11000090 | J65: 2011-09-01 12:28:48 | K65: 2012-09-01 12:28:48 | L65: 12 | M65: 6391.23 | N65: 36000 | O65: 1 | P65: 30 | Q65: 1 | R65: 1 | S65: 365 | T65: 18 | U65: 532.60 | V65: =RC[-1]+RC[-16] -> 514.75000000000011
A66: 33000 | B66: 2831.1 | C66: =IF(DAYS360(RC[7],R1C3)+2>365,365,DAYS360(RC[7],R1C3)+2) -> 173 | D66: =ROUND(RC[-3]*RC[16]/36500,2) -> 16.27 | E66: =RC[-1]*RC[-2] -> 2814.71 | F66: =RC[-1]-RC[-4] -> -16.389999999999873 | G66: 736 | H66: 5 | I66: AW3PW11000091 | J66: 2011-09-01 12:28:48 | K66: 2012-09-01 12:28:48 | L66: 12 | M66: 5858.63 | N66: 33000 | O66: 1 | P66: 30 | Q66: 1 | R66: 1 | S66: 365 | T66: 18 | U66: 488.22 | V66: =RC[-1]+RC[-16] -> 471.83000000000015
A67: 35000 | B67: 2985.99 | C67: =IF(DAYS360(RC[7],R1C3)+2>365,365,DAYS360(RC[7],R1C3)+2) -> 172 | D67: =ROUND(RC[-3]*RC[16]/36500,2) -> 17.260000000000002 | E67: =RC[-1]*RC[-2] -> 2968.7200000000003 | F67: =RC[-1]-RC[-4] -> -17.269999999999527 | G67: 737 | H67: 5 | I67: AW3PW11000092 | J67: 2011-09-02 12:28:48 | K67: 2012-09-02 12:28:48 | L67: 12 | M67: 6213.7 | N67: 35000 | O67: 1 | P67: 30 | Q67: 1 | R67: 1 | S67: 365 | T67: 18 | U67: 517.81 | V67: =RC[-1]+RC[-16] -> 500.54000000000042
A68: 35000 | B68: 2985.99 | C68: =IF(DAYS360(RC[7],R1C3)+2>365,365,DAYS360(RC[7],R1C3)+2) -> 172 | D68: =ROUND(RC[-3]*RC[16]/36500,2) -> 17.260000000000002 | E68: =RC[-1]*RC[-2] -> 2968.7200000000003 | F68: =RC[-1]-RC[-4] -> -17.269999999999527 | G68: 738 | H68: 5 | I68: AW3PW11000093 | J68: 2011-09-02 12:28:48 | K68: 2012-09-02 12:28:48 | L68: 12 | M68: 6213.7 | N68: 35000 | O68: 1 | P68: 30 | Q68: 1 | R68: 1 | S68: 365 | T68: 18 | U68: 517.81 | V68: =RC[-1]+RC[-16] -> 500.54000000000042
A69: 76000 | B69: 6334.1 | C69: =IF(DAYS360(RC[7],R1C3)+2>365,365,DAYS360(RC[7],R1C3)+2) -> 168 | D69: =ROUND(RC[-3]*RC[16]/36500,2) -> 37.479999999999997 | E69: =RC[-1]*RC[-2] -> 6296.6399999999994 | F69: =RC[-1]-RC[-4] -> -37.460000000000946 | G69: 746 | H69: 5 | I69: AW3PW11000094 | J69: 2011-09-06 12:28:48 | K69: 2012-09-06 12:28:48 | L69: 12 | M69: 13492.6 | N69: 76000 | O69: 1 | P69: 30 | Q69: 1 | R69: 1 | S69: 365 | T69: 18 | U69: 1124.38 | V69: =RC[-1]+RC[-16] -> 1086.9199999999992
A70: 48000 | B70: 4000.27 | C70: =IF(DAYS360(RC[7],R1C3)+2>365,365,DAYS360(RC[7],R1C3)+2) -> 168 | D70: =ROUND(RC[-3]*RC[16]/36500,2) -> 23.67 | E70: =RC[-1]*RC[-2] -> 3976.5600000000004 | F70: =RC[-1]-RC[-4] -> -23.709999999999582 | G70: 747 | H70: 5 | I70: AW3PW11000095 | J70: 2011-09-06 12:28:48 | K70: 2012-09-06 12:28:48 | L70: 12 | M70: 8521.64 | N70: 48000 | O70: 1 | P70: 30 | Q70: 1 | R70: 1 | S70: 365 | T70: 18 | U70: 710.14 | V70: =RC[-1]+RC[-16] -> 686.4300000000004
A71: 45000 | B71: 3750.16 | C71: =IF(DAYS360(RC[7],R1C3)+2>365,365,DAYS360(RC[7],R1C3)+2) -> 168 | D71: =ROUND(RC[-3]*RC[16]/36500,2) -> 22.19 | E71: =RC[-1]*RC[-2] -> 3727.92 | F71: =RC[-1]-RC[-4] -> -22.239999999999782 | G71: 748 | H71: 5 | I71: AW3PW11000096 | J71: 2011-09-06 12:28:48 | K71: 2012-09-06 12:28:48 | L71: 12 | M71: 7989.04 | N71: 45000 | O71: 1 | P71: 30 | Q71: 1 | R71: 1 | S71: 365 | T71: 18 | U71: 665.75 | V71: =RC[-1]+RC[-16] -> 643.51000000000022
A72: 37000 | B72: 3065.9 | C72: =IF(DAYS360(RC[7],R1C3)+2>365,365,DAYS360(RC[7],R1C3)+2) -> 167 | D72: =ROUND(RC[-3]*RC[16]/36500,2) -> 18.25 | E72: =RC[-1]*RC[-2] -> 3047.75 | F72: =RC[-1]-RC[-4] -> -18.150000000000091 | G72: 755 | H72: 5 | I72: AW3PW11000097 | J72: 2011-09-07 12:28:48 | K72: 2012-09-07 12:28:48 | L72: 12 | M72: 6568.77 | N72: 37000 | O72: 1 | P72: 30 | Q72: 1 | R72: 1 | S72: 365 | T72: 18 | U72: 547.40 | V72: =RC[-1]+RC[-16] -> 529.24999999999989
A73: 50000 | B73: 4142.8100000000004 | C73: =IF(DAYS360(RC[7],R1C3)+2>365,365,DAYS360(RC[7],R1C3)+2) -> 167 | D73: =ROUND(RC[-3]*RC[16]/36500,2) -> 24.66 | E73: =RC[-1]*RC[-2] -> 4118.22 | F73: =RC[-1]-RC[-4] -> -24.590000000000146 | G73: 760 | H73: 5 | I73: AW3PW11000098 | J73: 2011-09-07 12:28:48 | K73: 2012-09-07 12:28:48 | L73: 12 | M73: 8876.7099999999991 | N73: 50000 | O73: 1 | P73: 30 | Q73: 1 | R73: 1 | S73: 365 | T73: 18 | U73: 739.73 | V73: =RC[-1]+RC[-16] -> 715.13999999999987
A74: 18500 | B74: 1486.66 | C74: =IF(DAYS360(RC[7],R1C3)+2>365,365,DAYS360(RC[7],R1C3)+2) -> 162 | D74: =ROUND(RC[-3]*RC[16]/36500,2) -> 9.1199999999999992 | E74: =RC[-1]*RC[-2] -> 1477.4399999999998 | F74: =RC[-1]-RC[-4] -> -9.2200000000002547 | G74: 774 | H74: 5 | I74: AW3PW11000102 | J74: 2011-09-12 12:28:48 | K74: 2012-09-12 12:28:48 | L74: 12 | M74: 3284.38 | N74: 18500 | O74: 1 | P74: 30 | Q74: 1 | R74: 1 | S74: 365 | T74: 18 | U74: 273.70 | V74: =RC[-1]+RC[-16] -> 264.47999999999973
A75: 35000 | B75: 2813.39 | C75: =IF(DAYS360(RC[7],R1C3)+2>365,365,DAYS360(RC[7],R1C3)+2) -> 162 | D75: =ROUND(RC[-3]*RC[16]/36500,2) -> 17.260000000000002 | E75: =RC[-1]*RC[-2] -> 2796.1200000000003 | F75: =RC[-1]-RC[-4] -> -17.269999999999527 | G75: 775 | H75: 5 | I75: AW3PW11000103 | J75: 2011-09-12 12:28:48 | K75: 2012-09-12 12:28:48 | L75: 12 | M75: 6213.7 | N75: 35000 | O75: 1 | P75: 30 | Q75: 1 | R75: 1 | S75: 365 | T75: 18 | U75: 517.81 | V75: =RC[-1]+RC[-16] -> 500.54000000000042
A76: 30000 | B76: 2898.98 | C76: =IF(DAYS360(RC[7],R1C3)+2>365,365,DAYS360(RC[7],R1C3)+2) -> 193 | D76: =ROUND(RC[-3]*RC[16]/36500,2) -> 14.79 | E76: =RC[-1]*RC[-2] -> 2854.47 | F76: =RC[-1]-RC[-4] -> -44.510000000000218 | G76: 627 | H76: 7 | I76: EP5PW11000006 | J76: 2011-08-11 12:28:48 | K76: 2012-08-11 12:28:48 | L76: 12 | M76: 5326.03 | N76: 30000 | O76: 1 | P76: 30 | Q76: 1 | R76: 1 | S76: 365 | T76: 18 | U76: 443.84 | V76: =RC[-1]+RC[-16] -> 399.32999999999976
A77: 80000 | B77: 7495.56 | C77: =IF(DAYS360(RC[7],R1C3)+2>365,365,DAYS360(RC[7],R1C3)+2) -> 188 | D77: =ROUND(RC[-3]*RC[16]/36500,2) -> 39.450000000000003 | E77: =RC[-1]*RC[-2] -> 7416.6 | F77: =RC[-1]-RC[-4] -> -78.960000000000036 | G77: 649 | H77: 7 | I77: EP5PW11000010 | J77: 2011-08-16 12:28:48 | K77: 2012-08-16 12:28:48 | L77: 12 | M77: 14202.74 | N77: 80000 | O77: 1 | P77: 30 | Q77: 1 | R77: 1 | S77: 365 | T77: 18 | U77: 1183.56 | V77: =RC[-1]+RC[-16] -> 1104.5999999999999
A78: 18500 | B78: 1650.82 | C78: =IF(DAYS360(RC[7],R1C3)+2>365,365,DAYS360(RC[7],R1C3)+2) -> 179 | D78: =ROUND(RC[-3]*RC[16]/36500,2) -> 9.1199999999999992 | E78: =RC[-1]*RC[-2] -> 1632.4799999999998 | F78: =RC[-1]-RC[-4] -> -18.340000000000146 | G78: 711 | H78: 7 | I78: EP5PW11000015 | J78: 2011-08-25 12:28:48 | K78: 2012-08-25 12:28:48 | L78: 12 | M78: 3284.38 | N78: 18500 | O78: 1 | P78: 30 | Q78: 1 | R78: 1 | S78: 365 | T78: 18 | U78: 273.70 | V78: =RC[-1]+RC[-16] -> 255.35999999999984
A79: 120000 | B79: 10060.540000000001 | C79: =IF(DAYS360(RC[7],R1C3)+2>365,365,DAYS360(RC[7],R1C3)+2) -> 169 | D79: =ROUND(RC[-3]*RC[16]/36500,2) -> 59.18 | E79: =RC[-1]*RC[-2] -> 10001.42 | F79: =RC[-1]-RC[-4] -> -59.1200000000008 | G79: 742 | H79: 7 | I79: EP5PW11000018 | J79: 2011-09-05 12:28:48 | K79: 2012-09-05 12:28:48 | L79: 12 | M79: 21304.11 | N79: 120000 | O79: 1 | P79: 30 | Q79: 1 | R79: 1 | S79: 365 | T79: 18 | U79: 1775.34 | V79: =RC[-1]+RC[-16] -> 1716.2199999999991
A80: 11500 | B80: 1726.14 | C80: =IF(DAYS360(RC[7],R1C3)+2>365,365,DAYS360(RC[7],R1C3)+2) -> 365 | D80: =ROUND(RC[-3]*RC[16]/36500,2) -> 4.7300000000000004 | E80: =RC[-1]*RC[-2] -> 1726.45 | F80: =RC[-1]-RC[-4] -> 0.30999999999994543 | G80: 111 | H80: 6 | I80: KA4PW11000007 | J80: 2011-01-12 12:28:48 | K80: 2012-01-12 12:28:48 | L80: 12 | M80: 1701.37 | N80: 11500 | O80: 4 | P80: 53 | Q80: 1 | R80: 1 | S80: 365 | T80: 15 | U80: 70.64 | V80: =RC[-1]+RC[-16] -> 70.949999999999946
A81: 78000 | B81: 11698.72 | C81: =IF(DAYS360(RC[7],R1C3)+2>365,365,DAYS360(RC[7],R1C3)+2) -> 365 | D81: =ROUND(RC[-3]*RC[16]/36500,2) -> 32.049999999999997 | E81: =RC[-1]*RC[-2] -> 11698.249999999998 | F81: =RC[-1]-RC[-4] -> -0.47000000000116415 | G81: 112 | H81: 6 | I81: KA4PW11000008 | J81: 2011-01-12 12:28:48 | K81: 2012-01-12 12:28:48 | L81: 12 | M81: 11539.73 | N81: 78000 | O81: 4 | P81: 30 | Q81: 1 | R81: 1 | S81: 365 | T81: 15 | U81: 481.22 | V81: =RC[-1]+RC[-16] -> 480.74999999999886
A82: 93000 | B82: 13950.22 | C82: =IF(DAYS360(RC[7],R1C3)+2>365,365,DAYS360(RC[7],R1C3)+2) -> 365 | D82: =ROUND(RC[-3]*RC[16]/36500,2) -> 38.22 | E82: =RC[-1]*RC[-2] -> 13950.3 | F82: =RC[-1]-RC[-4] -> 7.999999999992724E-2 | G82: 225 | H82: 6 | I82: KA4PW11000014 | J82: 2011-01-18 12:28:48 | K82: 2012-01-18 12:28:48 | L82: 12 | M82: 13758.9 | N82: 93000 | O82: 4 | P82: 30 | Q82: 1 | R82: 1 | S82: 365 | T82: 15 | U82: 573.22 | V82: =RC[-1]+RC[-16] -> 573.29999999999995
A83: 41000 | B83: 6150.19 | C83: =IF(DAYS360(RC[7],R1C3)+2>365,365,DAYS360(RC[7],R1C3)+2) -> 365 | D83: =ROUND(RC[-3]*RC[16]/36500,2) -> 16.850000000000001 | E83: =RC[-1]*RC[-2] -> 6150.2500000000009 | F83: =RC[-1]-RC[-4] -> 6.0000000001309672E-2 | G83: 266 | H83: 6 | I83: KA4PW11000017 | J83: 2011-01-20 12:28:48 | K83: 2012-01-20 12:28:48 | L83: 12 | M83: 6065.75 | N83: 41000 | O83: 4 | P83: 30 | Q83: 1 | R83: 1 | S83: 365 | T83: 15 | U83: 252.69 | V83: =RC[-1]+RC[-16] -> 252.75000000000131
A84: 27500 | B84: 4124.62 | C84: =IF(DAYS360(RC[7],R1C3)+2>365,365,DAYS360(RC[7],R1C3)+2) -> 365 | D84: =ROUND(RC[-3]*RC[16]/36500,2) -> 11.3 | E84: =RC[-1]*RC[-2] -> 4124.5 | F84: =RC[-1]-RC[-4] -> -0.11999999999989086 | G84: 267 | H84: 6 | I84: KA4PW11000018 | J84: 2011-01-20 12:28:48 | K84: 2012-01-20 12:28:48 | L84: 12 | M84: 4068.49 | N84: 27500 | O84: 4 | P84: 30 | Q84: 1 | R84: 1 | S84: 365 | T84: 15 | U84: 169.62 | V84: =RC[-1]+RC[-16] -> 169.50000000000011
A85: 59000 | B85: 8850.9500000000007 | C85: =IF(DAYS360(RC[7],R1C3)+2>365,365,DAYS360(RC[7],R1C3)+2) -> 365 | D85: =ROUND(RC[-3]*RC[16]/36500,2) -> 24.25 | E85: =RC[-1]*RC[-2] -> 8851.25 | F85: =RC[-1]-RC[-4] -> 0.2999999999992724 | G85: 276 | H85: 6 | I85: KA4PW11000022 | J85: 2011-01-24 12:28:48 | K85: 2012-01-24 12:28:48 | L85: 12 | M85: 8728.77 | N85: 59000 | O85: 4 | P85: 30 | Q85: 1 | R85: 1 | S85: 365 | T85: 15 | U85: 363.45 | V85: =RC[-1]+RC[-16] -> 363.74999999999926
A86: 51000 | B86: 7650.32 | C86: =IF(DAYS360(RC[7],R1C3)+2>365,365,DAYS360(RC[7],R1C3)+2) -> 365 | D86: =ROUND(RC[-3]*RC[16]/36500,2) -> 20.96 | E86: =RC[-1]*RC[-2] -> 7650.4000000000005 | F86: =RC[-1]-RC[-4] -> 8.0000000000836735E-2 | G86: 282 | H86: 6 | I86: KA4PW11000026 | J86: 2011-02-11 12:28:48 | K86: 2012-02-11 12:28:48 | L86: 12 | M86: 7545.21 | N86: 51000 | O86: 4 | P86: 30 | Q86: 1 | R86: 1 | S86: 365 | T86: 15 | U86: 314.32 | V86: =RC[-1]+RC[-16] -> 314.40000000000083
A87: 38000 | B87: 5607.4 | C87: =IF(DAYS360(RC[7],R1C3)+2>365,365,DAYS360(RC[7],R1C3)+2) -> 353 | D87: =ROUND(RC[-3]*RC[16]/36500,2) -> 15.62 | E87: =RC[-1]*RC[-2] -> 5513.86 | F87: =RC[-1]-RC[-4] -> -93.539999999999964 | G87: 287 | H87: 6 | I87: KA4PW11000031 | J87: 2011-03-01 12:28:48 | K87: 2012-03-01 12:28:48 | L87: 12 | M87: 5621.92 | N87: 38000 | O87: 1 | P87: 30 | Q87: 1 | R87: 1 | S87: 365 | T87: 15 | U87: 234.12 | V87: =RC[-1]+RC[-16] -> 140.58000000000004
A88: 40000 | B88: 5869 | C88: =IF(DAYS360(RC[7],R1C3)+2>365,365,DAYS360(RC[7],R1C3)+2) -> 351 | D88: =ROUND(RC[-3]*RC[16]/36500,2) -> 16.440000000000001 | E88: =RC[-1]*RC[-2] -> 5770.4400000000005 | F88: =RC[-1]-RC[-4] -> -98.559999999999491 | G88: 289 | H88: 6 | I88: KA4PW11000033 | J88: 2011-03-03 12:28:48 | K88: 2012-03-03 12:28:48 | L88: 12 | M88: 5917.81 | N88: 40000 | O88: 1 | P88: 30 | Q88: 1 | R88: 1 | S88: 365 | T88: 15 | U88: 246.52 | V88: =RC[-1]+RC[-16] -> 147.96000000000052
A89: 40000 | B89: 5869 | C89: =IF(DAYS360(RC[7],R1C3)+2>365,365,DAYS360(RC[7],R1C3)+2) -> 351 | D89: =ROUND(RC[-3]*RC[16]/36500,2) -> 16.440000000000001 | E89: =RC[-1]*RC[-2] -> 5770.4400000000005 | F89: =RC[-1]-RC[-4] -> -98.559999999999491 | G89: 290 | H89: 6 | I89: KA4PW11000034 | J89: 2011-03-03 12:28:48 | K89: 2012-03-03 12:28:48 | L89: 12 | M89: 5917.81 | N89: 40000 | O89: 1 | P89: 30 | Q89: 1 | R89: 1 | S89: 365 | T89: 15 | U89: 246.52 | V89: =RC[-1]+RC[-16] -> 147.96000000000052
A90: 55000 | B90: 7910.12 | C90: =IF(DAYS360(RC[7],R1C3)+2>365,365,DAYS360(RC[7],R1C3)+2) -> 344 | D90: =ROUND(RC[-3]*RC[16]/36500,2) -> 22.6 | E90: =RC[-1]*RC[-2] -> 7774.4000000000005 | F90: =RC[-1]-RC[-4] -> -135.71999999999935 | G90: 315 | H90: 6 | I90: KA4PW11000038 | J90: 2011-03-10 12:28:48 | K90: 2012-03-10 12:28:48 | L90: 12 | M90: 8136.99 | N90: 55000 | O90: 1 | P90: 30 | Q90: 1 | R90: 1 | S90: 365 | T90: 15 | U90: 339.12 | V90: =RC[-1]+RC[-16] -> 203.40000000000066
A91: 7500 | B91: 1066.2 | C91: =IF(DAYS360(RC[7],R1C3)+2>365,365,DAYS360(RC[7],R1C3)+2) -> 340 | D91: =ROUND(RC[-3]*RC[16]/36500,2) -> 3.08 | E91: =RC[-1]*RC[-2] -> 1047.2 | F91: =RC[-1]-RC[-4] -> -19 | G91: 320 | H91: 6 | I91: KA4PW11000040 | J91: 2011-03-14 12:28:48 | K91: 2012-03-14 12:28:48 | L91: 12 | M91: 1109.5899999999999 | N91: 7500 | O91: 1 | P91: 81 | Q91: 1 | R91: 1 | S91: 365 | T91: 15 | U91: 240.76 | V91: =RC[-1]+RC[-16] -> 221.76
A92: 7800 | B92: 1039.6600000000001 | C92: =IF(DAYS360(RC[7],R1C3)+2>365,365,DAYS360(RC[7],R1C3)+2) -> 318 | D92: =ROUND(RC[-3]*RC[16]/36500,2) -> 3.21 | E92: =RC[-1]*RC[-2] -> 1020.78 | F92: =RC[-1]-RC[-4] -> -18.880000000000109 | G92: 397 | H92: 6 | I92: KA4PW11000056 | J92: 2011-04-06 12:28:48 | K92: 2012-04-06 12:28:48 | L92: 12 | M92: 1153.97 | N92: 7800 | O92: 1 | P92: 77 | Q92: 1 | R92: 1 | S92: 365 | T92: 15 | U92: 250.00 | V92: =RC[-1]+RC[-16] -> 231.11999999999989
A93: 39000 | B93: 5177.6099999999997 | C93: =IF(DAYS360(RC[7],R1C3)+2>365,365,DAYS360(RC[7],R1C3)+2) -> 318 | D93: =ROUND(RC[-3]*RC[16]/36500,2) -> 16.03 | E93: =RC[-1]*RC[-2] -> 5097.54 | F93: =RC[-1]-RC[-4] -> -80.069999999999709 | G93: 398 | H93: 6 | I93: KA4PW11000057 | J93: 2011-04-06 12:28:48 | K93: 2012-04-06 12:28:48 | L93: 12 | M93: 5769.86 | N93: 39000 | O93: 1 | P93: 30 | Q93: 1 | R93: 1 | S93: 365 | T93: 15 | U93: 480.82 | V93: =RC[-1]+RC[-16] -> 400.75000000000028
A94: 13000 | B94: 1718.5 | C94: =IF(DAYS360(RC[7],R1C3)+2>365,365,DAYS360(RC[7],R1C3)+2) -> 316 | D94: =ROUND(RC[-3]*RC[16]/36500,2) -> 5.34 | E94: =RC[-1]*RC[-2] -> 1687.44 | F94: =RC[-1]-RC[-4] -> -31.059999999999945 | G94: 400 | H94: 6 | I94: KA4PW11000058 | J94: 2011-04-08 12:28:48 | K94: 2012-04-08 12:28:48 | L94: 12 | M94: 1923.29 | N94: 13000 | O94: 1 | P94: 46 | Q94: 1 | R94: 1 | S94: 365 | T94: 15 | U94: 250.00 | V94: =RC[-1]+RC[-16] -> 218.94000000000005
A95: 47000 | B95: 6124.29 | C95: =IF(DAYS360(RC[7],R1C3)+2>365,365,DAYS360(RC[7],R1C3)+2) -> 312 | D95: =ROUND(RC[-3]*RC[16]/36500,2) -> 19.32 | E95: =RC[-1]*RC[-2] -> 6027.84 | F95: =RC[-1]-RC[-4] -> -96.449999999999818 | G95: 408 | H95: 6 | I95: KA4PW11000060 | J95: 2011-04-12 12:28:48 | K95: 2012-04-12 12:28:48 | L95: 12 | M95: 6953.42 | N95: 47000 | O95: 1 | P95: 30 | Q95: 1 | R95: 1 | S95: 365 | T95: 15 | U95: 579.45 | V95: =RC[-1]+RC[-16] -> 483.00000000000023
A96: 15750 | B96: 1971.02 | C96: =IF(DAYS360(RC[7],R1C3)+2>365,365,DAYS360(RC[7],R1C3)+2) -> 299 | D96: =ROUND(RC[-3]*RC[16]/36500,2) -> 6.47 | E96: =RC[-1]*RC[-2] -> 1934.53 | F96: =RC[-1]-RC[-4] -> -36.490000000000009 | G96: 426 | H96: 6 | I96: KA4PW11000064 | J96: 2011-04-25 12:28:48 | K96: 2012-04-25 12:28:48 | L96: 12 | M96: 2330.14 | N96: 15750 | O96: 1 | P96: 38 | Q96: 1 | R96: 1 | S96: 365 | T96: 15 | U96: 250.00 | V96: =RC[-1]+RC[-16] -> 213.51
A97: 45000 | B97: 5417.66 | C97: =IF(DAYS360(RC[7],R1C3)+2>365,365,DAYS360(RC[7],R1C3)+2) -> 288 | D97: =ROUND(RC[-3]*RC[16]/36500,2) -> 18.489999999999998 | E97: =RC[-1]*RC[-2] -> 5325.12 | F97: =RC[-1]-RC[-4] -> -92.539999999999964 | G97: 465 | H97: 6 | I97: KA4PW11000072 | J97: 2011-05-06 12:28:48 | K97: 2012-05-06 12:28:48 | L97: 12 | M97: 6657.53 | N97: 45000 | O97: 1 | P97: 30 | Q97: 1 | R97: 1 | S97: 365 | T97: 15 | U97: 554.79 | V97: =RC[-1]+RC[-16] -> 462.25
A98: 53000 | B98: 6272.66 | C98: =IF(DAYS360(RC[7],R1C3)+2>365,365,DAYS360(RC[7],R1C3)+2) -> 283 | D98: =ROUND(RC[-3]*RC[16]/36500,2) -> 21.78 | E98: =RC[-1]*RC[-2] -> 6163.7400000000007 | F98: =RC[-1]-RC[-4] -> -108.91999999999916 | G98: 472 | H98: 6 | I98: KA4PW11000073 | J98: 2011-05-11 12:28:48 | K98: 2012-05-11 12:28:48 | L98: 12 | M98: 7841.1 | N98: 53000 | O98: 1 | P98: 30 | Q98: 1 | R98: 1 | S98: 365 | T98: 15 | U98: 653.42 | V98: =RC[-1]+RC[-16] -> 544.5000000000008
A99: 16000 | B99: 1962.13 | C99: =IF(DAYS360(RC[7],R1C3)+2>365,365,DAYS360(RC[7],R1C3)+2) -> 244 | D99: =ROUND(RC[-3]*RC[16]/36500,2) -> 7.89 | E99: =RC[-1]*RC[-2] -> 1925.1599999999999 | F99: =RC[-1]-RC[-4] -> -36.970000000000255 | G99: 522 | H99: 6 | I99: KA4PW11000077 | J99: 2011-06-20 12:28:48 | K99: 2012-06-20 12:28:48 | L99: 12 | M99: 2840.55 | N99: 16000 | O99: 1 | P99: 31 | Q99: 1 | R99: 1 | S99: 365 | T99: 18 | U99: 250.00 | V99: =RC[-1]+RC[-16] -> 213.02999999999975
A100: 8750 | B100: 1070.8 | C100: =IF(DAYS360(RC[7],R1C3)+2>365,365,DAYS360(RC[7],R1C3)+2) -> 243 | D100: =ROUND(RC[-3]*RC[16]/36500,2) -> 4.32 | E100: =RC[-1]*RC[-2] -> 1049.76 | F100: =RC[-1]-RC[-4] -> -21.039999999999964 | G100: 525 | H100: 6 | I100: KA4PW11000079 | J100: 2011-06-21 12:28:48 | K100: 2012-06-21 12:28:48 | L100: 12 | M100: 1553.42 | N100: 8750 | O100: 1 | P100: 57 | Q100: 1 | R100: 1 | S100: 365 | T100: 18 | U100: 250.00 | V100: =RC[-1]+RC[-16] -> 228.96000000000004
A101: 27000 | B101: 3263.25 | C101: =IF(DAYS360(RC[7],R1C3)+2>365,365,DAYS360(RC[7],R1C3)+2) -> 241 | D101: =ROUND(RC[-3]*RC[16]/36500,2) -> 13.32 | E101: =RC[-1]*RC[-2] -> 3210.12 | F101: =RC[-1]-RC[-4] -> -53.130000000000109 | G101: 531 | H101: 6 | I101: KA4PW11000081 | J101: 2011-06-23 12:28:48 | K101: 2012-06-23 12:28:48 | L101: 12 | M101: 4793.42 | N101: 27000 | O101: 1 | P101: 30 | Q101: 1 | R101: 1 | S101: 365 | T101: 18 | U101: 399.45 | V101: =RC[-1]+RC[-16] -> 346.31999999999988
A102: 48000 | B102: 4947.07 | C102: =IF(DAYS360(RC[7],R1C3)+2>365,365,DAYS360(RC[7],R1C3)+2) -> 205 | D102: =ROUND(RC[-3]*RC[16]/36500,2) -> 23.67 | E102: =RC[-1]*RC[-2] -> 4852.3500000000004 | F102: =RC[-1]-RC[-4] -> -94.719999999999345 | G102: 578 | H102: 6 | I102: KA4PW11000085 | J102: 2011-07-29 12:28:48 | K102: 2012-07-29 12:28:48 | L102: 12 | M102: 8521.64 | N102: 48000 | O102: 1 | P102: 30 | Q102: 1 | R102: 1 | S102: 365 | T102: 18 | U102: 710.14 | V102: =RC[-1]+RC[-16] -> 615.42000000000064
A103: 30000 | B103: 2943.35 | C103: =IF(DAYS360(RC[7],R1C3)+2>365,365,DAYS360(RC[7],R1C3)+2) -> 196 | D103: =ROUND(RC[-3]*RC[16]/36500,2) -> 14.79 | E103: =RC[-1]*RC[-2] -> 2898.8399999999997 | F103: =RC[-1]-RC[-4] -> -44.510000000000218 | G103: 602 | H103: 6 | I103: KA4PW11000087 | J103: 2011-08-08 12:28:48 | K103: 2012-08-08 12:28:48 | L103: 12 | M103: 5326.03 | N103: 30000 | O103: 1 | P103: 30 | Q103: 1 | R103: 1 | S103: 365 | T103: 18 | U103: 443.84 | V103: =RC[-1]+RC[-16] -> 399.32999999999976
A104: 180000 | B104: 17665.14 | C104: =IF(DAYS360(RC[7],R1C3)+2>365,365,DAYS360(RC[7],R1C3)+2) -> 196 | D104: =ROUND(RC[-3]*RC[16]/36500,2) -> 88.77 | E104: =RC[-1]*RC[-2] -> 17398.919999999998 | F104: =RC[-1]-RC[-4] -> -266.22000000000116 | G104: 607 | H104: 6 | I104: KA4PW11000089 | J104: 2011-08-08 12:28:48 | K104: 2012-08-08 12:28:48 | L104: 12 | M104: 31956.16 | N104: 180000 | O104: 1 | P104: 30 | Q104: 1 | R104: 1 | S104: 365 | T104: 18 | U104: 2663.01 | V104: =RC[-1]+RC[-16] -> 2396.7899999999991
A105: 36000 | B105: 3514.6 | C105: =IF(DAYS360(RC[7],R1C3)+2>365,365,DAYS360(RC[7],R1C3)+2) -> 195 | D105: =ROUND(RC[-3]*RC[16]/36500,2) -> 17.75 | E105: =RC[-1]*RC[-2] -> 3461.25 | F105: =RC[-1]-RC[-4] -> -53.349999999999909 | G105: 612 | H105: 6 | I105: KA4PW11000090 | J105: 2011-08-09 12:28:48 | K105: 2012-08-09 12:28:48 | L105: 12 | M105: 6391.23 | N105: 36000 | O105: 1 | P105: 30 | Q105: 1 | R105: 1 | S105: 365 | T105: 18 | U105: 532.60 | V105: =RC[-1]+RC[-16] -> 479.25000000000011
A106: 8500 | B106: 798.89 | C106: =IF(DAYS360(RC[7],R1C3)+2>365,365,DAYS360(RC[7],R1C3)+2) -> 188 | D106: =ROUND(RC[-3]*RC[16]/36500,2) -> 4.1900000000000004 | E106: =RC[-1]*RC[-2] -> 787.72 | F106: =RC[-1]-RC[-4] -> -11.169999999999959 | G106: 652 | H106: 6 | I106: KA4PW11000096 | J106: 2011-08-16 12:28:48 | K106: 2012-08-16 12:28:48 | L106: 12 | M106: 1509.04 | N106: 8500 | O106: 1 | P106: 59 | Q106: 1 | R106: 1 | S106: 365 | T106: 18 | U106: 250.00 | V106: =RC[-1]+RC[-16] -> 238.83000000000004
A107: 17000 | B107: 1525.27 | C107: =IF(DAYS360(RC[7],R1C3)+2>365,365,DAYS360(RC[7],R1C3)+2) -> 180 | D107: =ROUND(RC[-3]*RC[16]/36500,2) -> 8.3800000000000008 | E107: =RC[-1]*RC[-2] -> 1508.4 | F107: =RC[-1]-RC[-4] -> -16.869999999999891 | G107: 699 | H107: 6 | I107: KA4PW11000108 | J107: 2011-08-24 12:28:48 | K107: 2012-08-24 12:28:48 | L107: 12 | M107: 3018.08 | N107: 17000 | O107: 1 | P107: 30 | Q107: 1 | R107: 1 | S107: 365 | T107: 18 | U107: 251.51 | V107: =RC[-1]+RC[-16] -> 234.6400000000001
A108: 77700 | B108: 6897.53 | C108: =IF(DAYS360(RC[7],R1C3)+2>365,365,DAYS360(RC[7],R1C3)+2) -> 178 | D108: =ROUND(RC[-3]*RC[16]/36500,2) -> 38.32 | E108: =RC[-1]*RC[-2] -> 6820.96 | F108: =RC[-1]-RC[-4] -> -76.569999999999709 | G108: 716 | H108: 6 | I108: KA4PW11000113 | J108: 2011-08-26 12:28:48 | K108: 2012-08-26 12:28:48 | L108: 12 | M108: 13794.41 | N108: 77700 | O108: 1 | P108: 30 | Q108: 1 | R108: 1 | S108: 365 | T108: 18 | U108: 1149.53 | V108: =RC[-1]+RC[-16] -> 1072.9600000000003
A109: 36500 | B109: 3132 | C109: =IF(DAYS360(RC[7],R1C3)+2>365,365,DAYS360(RC[7],R1C3)+2) -> 173 | D109: =ROUND(RC[-3]*RC[16]/36500,2) -> 18 | E109: =RC[-1]*RC[-2] -> 3114 | F109: =RC[-1]-RC[-4] -> -18 | G109: 732 | H109: 6 | I109: KA4PW11000117 | J109: 2011-09-01 12:28:48 | K109: 2012-09-01 12:28:48 | L109: 12 | M109: 6480 | N109: 36500 | O109: 1 | P109: 30 | Q109: 1 | R109: 1 | S109: 365 | T109: 18 | U109: 540.00 | V109: =RC[-1]+RC[-16] -> 522
A110: 135000 | B110: 11185.3 | C110: =IF(DAYS360(RC[7],R1C3)+2>365,365,DAYS360(RC[7],R1C3)+2) -> 167 | D110: =ROUND(RC[-3]*RC[16]/36500,2) -> 66.58 | E110: =RC[-1]*RC[-2] -> 11118.86 | F110: =RC[-1]-RC[-4] -> -66.43999999999869 | G110: 754 | H110: 6 | I110: KA4PW11000121 | J110: 2011-09-07 12:28:48 | K110: 2012-09-07 12:28:48 | L110: 12 | M110: 23967.119999999999 | N110: 135000 | O110: 1 | P110: 30 | Q110: 1 | R110: 1 | S110: 365 | T110: 18 | U110: 1997.26 | V110: =RC[-1]+RC[-16] -> 1930.8200000000013
A111: 39000 | B111: 3230.73 | C111: =IF(DAYS360(RC[7],R1C3)+2>365,365,DAYS360(RC[7],R1C3)+2) -> 167 | D111: =ROUND(RC[-3]*RC[16]/36500,2) -> 19.23 | E111: =RC[-1]*RC[-2] -> 3211.41 | F111: =RC[-1]-RC[-4] -> -19.320000000000164 | G111: 761 | H111: 6 | I111: KA4PW11000124 | J111: 2011-09-07 12:28:48 | K111: 2012-09-07 12:28:48 | L111: 12 | M111: 6923.84 | N111: 39000 | O111: 1 | P111: 30 | Q111: 1 | R111: 1 | S111: 365 | T111: 18 | U111: 576.99 | V111: =RC[-1]+RC[-16] -> 557.66999999999985
A112: 90000 | B112: 7411.57 | C112: =IF(DAYS360(RC[7],R1C3)+2>365,365,DAYS360(RC[7],R1C3)+2) -> 166 | D112: =ROUND(RC[-3]*RC[16]/36500,2) -> 44.38 | E112: =RC[-1]*RC[-2] -> 7367.0800000000008 | F112: =RC[-1]-RC[-4] -> -44.489999999998872 | G112: 764 | H112: 6 | I112: KA4PW11000126 | J112: 2011-09-08 12:28:48 | K112: 2012-09-08 12:28:48 | L112: 12 | M112: 15978.08 | N112: 90000 | O112: 1 | P112: 30 | Q112: 1 | R112: 1 | S112: 365 | T112: 18 | U112: 1331.51 | V112: =RC[-1]+RC[-16] -> 1287.0200000000011
A113: 9250 | B113: 747.04 | C113: =IF(DAYS360(RC[7],R1C3)+2>365,365,DAYS360(RC[7],R1C3)+2) -> 162 | D113: =ROUND(RC[-3]*RC[16]/36500,2) -> 4.5599999999999996 | E113: =RC[-1]*RC[-2] -> 738.71999999999991 | F113: =RC[-1]-RC[-4] -> -8.32000000000005 | G113: 776 | H113: 6 | I113: KA4PW11000130 | J113: 2011-09-12 12:28:48 | K113: 2012-09-12 12:28:48 | L113: 12 | M113: 1642.19 | N113: 9250 | O113: 1 | P113: 54 | Q113: 1 | R113: 1 | S113: 365 | T113: 18 | U113: 250.00 | V113: =RC[-1]+RC[-16] -> 241.67999999999995
A114: 36500 | B114: 2898 | C114: =IF(DAYS360(RC[7],R1C3)+2>365,365,DAYS360(RC[7],R1C3)+2) -> 160 | D114: =ROUND(RC[-3]*RC[16]/36500,2) -> 18 | E114: =RC[-1]*RC[-2] -> 2880 | F114: =RC[-1]-RC[-4] -> -18 | G114: 787 | H114: 6 | I114: KA4PW11000134 | J114: 2011-09-14 12:28:48 | K114: 2012-09-14 12:28:48 | L114: 12 | M114: 6480 | N114: 36500 | O114: 1 | P114: 30 | Q114: 1 | R114: 1 | S114: 365 | T114: 18 | U114: 540 | V114: =RC[-1]+RC[-16] -> 522
A115: 10000 | B115: 999.36 | C115: =IF(DAYS360(RC[7],R1C3)+2>365,365,DAYS360(RC[7],R1C3)+2) -> 200 | D115: =ROUND(RC[-3]*RC[16]/36500,2) -> 4.93 | E115: =RC[-1]*RC[-2] -> 986 | F115: =RC[-1]-RC[-4] -> -13.360000000000014 | G115: 595 | H115: 9 | I115: MB7PW11000006 | J115: 2011-08-04 12:28:48 | K115: 2012-08-04 12:28:48 | L115: 12 | M115: 1775.34 | N115: 10000 | O115: 1 | P115: 50 | Q115: 1 | R115: 1 | S115: 365 | T115: 18 | U115: 250.00 | V115: =RC[-1]+RC[-16] -> 236.64
A116: 32000 | B116: 3203.36 | C116: =IF(DAYS360(RC[7],R1C3)+2>365,365,DAYS360(RC[7],R1C3)+2) -> 200 | D116: =ROUND(RC[-3]*RC[16]/36500,2) -> 15.78 | E116: =RC[-1]*RC[-2] -> 3156 | F116: =RC[-1]-RC[-4] -> -47.360000000000127 | G116: 596 | H116: 9 | I116: MB7PW11000007 | J116: 2011-08-04 12:28:48 | K116: 2012-08-04 12:28:48 | L116: 12 | M116: 5681.1 | N116: 32000 | O116: 1 | P116: 30 | Q116: 1 | R116: 1 | S116: 365 | T116: 18 | U116: 473.42 | V116: =RC[-1]+RC[-16] -> 426.05999999999989
A117: 20000 | B117: 2001.67 | C117: =IF(DAYS360(RC[7],R1C3)+2>365,365,DAYS360(RC[7],R1C3)+2) -> 200 | D117: =ROUND(RC[-3]*RC[16]/36500,2) -> 9.86 | E117: =RC[-1]*RC[-2] -> 1972 | F117: =RC[-1]-RC[-4] -> -29.670000000000073 | G117: 597 | H117: 9 | I117: MB7PW11000008 | J117: 2011-08-04 12:28:48 | K117: 2012-08-04 12:28:48 | L117: 12 | M117: 3550.68 | N117: 20000 | O117: 1 | P117: 30 | Q117: 1 | R117: 1 | S117: 365 | T117: 18 | U117: 295.89 | V117: =RC[-1]+RC[-16] -> 266.21999999999991
A118: 40000 | B118: 3590.74 | C118: =IF(DAYS360(RC[7],R1C3)+2>365,365,DAYS360(RC[7],R1C3)+2) -> 180 | D118: =ROUND(RC[-3]*RC[16]/36500,2) -> 19.73 | E118: =RC[-1]*RC[-2] -> 3551.4 | F118: =RC[-1]-RC[-4] -> -39.339999999999691 | G118: 694 | H118: 9 | I118: MB7PW11000015 | J118: 2011-08-24 12:28:48 | K118: 2012-08-24 12:28:48 | L118: 12 | M118: 7101.37 | N118: 40000 | O118: 1 | P118: 30 | Q118: 1 | R118: 1 | S118: 365 | T118: 18 | U118: 591.78 | V118: =RC[-1]+RC[-16] -> 552.44000000000028
A119: 25000 | B119: 2244.02 | C119: =IF(DAYS360(RC[7],R1C3)+2>365,365,DAYS360(RC[7],R1C3)+2) -> 180 | D119: =ROUND(RC[-3]*RC[16]/36500,2) -> 12.33 | E119: =RC[-1]*RC[-2] -> 2219.4 | F119: =RC[-1]-RC[-4] -> -24.619999999999891 | G119: 695 | H119: 9 | I119: MB7PW11000016 | J119: 2011-08-24 12:28:48 | K119: 2012-08-24 12:28:48 | L119: 12 | M119: 4438.3599999999997 | N119: 25000 | O119: 1 | P119: 30 | Q119: 1 | R119: 1 | S119: 365 | T119: 18 | U119: 369.86 | V119: =RC[-1]+RC[-16] -> 345.24000000000012
A120: 110000 | B120: 9819.15 | C120: =IF(DAYS360(RC[7],R1C3)+2>365,365,DAYS360(RC[7],R1C3)+2) -> 179 | D120: =ROUND(RC[-3]*RC[16]/36500,2) -> 54.25 | E120: =RC[-1]*RC[-2] -> 9710.75 | F120: =RC[-1]-RC[-4] -> -108.39999999999964 | G120: 705 | H120: 8 | I120: MG6PW11000006 | J120: 2011-08-25 12:28:48 | K120: 2012-08-25 12:28:48 | L120: 12 | M120: 19528.77 | N120: 110000 | O120: 1 | P120: 30 | Q120: 1 | R120: 1 | S120: 365 | T120: 18 | U120: 1627.40 | V120: =RC[-1]+RC[-16] -> 1519.0000000000005
A121: 230000 | B121: 20529.16 | C121: =IF(DAYS360(RC[7],R1C3)+2>365,365,DAYS360(RC[7],R1C3)+2) -> 179 | D121: =ROUND(RC[-3]*RC[16]/36500,2) -> 113.42 | E121: =RC[-1]*RC[-2] -> 20302.18 | F121: =RC[-1]-RC[-4] -> -226.97999999999956 | G121: 708 | H121: 8 | I121: MG6PW11000007 | J121: 2011-08-25 12:28:48 | K121: 2012-08-25 12:28:48 | L121: 12 | M121: 40832.879999999997 | N121: 230000 | O121: 1 | P121: 30 | Q121: 1 | R121: 1 | S121: 365 | T121: 18 | U121: 3402.74 | V121: =RC[-1]+RC[-16] -> 3175.76
A122: 92000 | B122: 8211.9699999999993 | C122: =IF(DAYS360(RC[7],R1C3)+2>365,365,DAYS360(RC[7],R1C3)+2) -> 179 | D122: =ROUND(RC[-3]*RC[16]/36500,2) -> 45.37 | E122: =RC[-1]*RC[-2] -> 8121.23 | F122: =RC[-1]-RC[-4] -> -90.739999999999782 | G122: 709 | H122: 8 | I122: MG6PW11000008 | J122: 2011-08-25 12:28:48 | K122: 2012-08-25 12:28:48 | L122: 12 | M122: 16333.15 | N122: 92000 | O122: 1 | P122: 30 | Q122: 1 | R122: 1 | S122: 365 | T122: 18 | U122: 1361.10 | V122: =RC[-1]+RC[-16] -> 1270.3600000000001
A123: 419000 | B123: 34300.58 | C123: =IF(DAYS360(RC[7],R1C3)+2>365,365,DAYS360(RC[7],R1C3)+2) -> 165 | D123: =ROUND(RC[-3]*RC[16]/36500,2) -> 206.63 | E123: =RC[-1]*RC[-2] -> 34093.949999999997 | F123: =RC[-1]-RC[-4] -> -206.63000000000466 | G123: 773 | H123: 8 | I123: MG6PW11000011 | J123: 2011-09-09 12:28:48 | K123: 2012-09-09 12:28:48 | L123: 12 | M123: 74386.850000000006 | N123: 419000 | O123: 1 | P123: 30 | Q123: 1 | R123: 1 | S123: 365 | T123: 18 | U123: 6198.90 | V123: =RC[-1]+RC[-16] -> 5992.269999999995
A124: 33000 | B124: 2619.59 | C124: =IF(DAYS360(RC[7],R1C3)+2>365,365,DAYS360(RC[7],R1C3)+2) -> 160 | D124: =ROUND(RC[-3]*RC[16]/36500,2) -> 16.27 | E124: =RC[-1]*RC[-2] -> 2603.1999999999998 | F124: =RC[-1]-RC[-4] -> -16.390000000000327 | G124: 785 | H124: 8 | I124: MG6PW11000012 | J124: 2011-09-14 12:28:48 | K124: 2012-09-14 12:28:48 | L124: 12 | M124: 5858.63 | N124: 33000 | O124: 1 | P124: 30 | Q124: 1 | R124: 1 | S124: 365 | T124: 18 | U124: 488.22 | V124: =RC[-1]+RC[-16] -> 471.8299999999997
A125: 9800 | B125: 1470.73 | C125: =IF(DAYS360(RC[7],R1C3)+2>365,365,DAYS360(RC[7],R1C3)+2) -> 365 | D125: =ROUND(RC[-3]*RC[16]/36500,2) -> 4.03 | E125: =RC[-1]*RC[-2] -> 1470.95 | F125: =RC[-1]-RC[-4] -> 0.22000000000002728 | G125: 137 | H125: 3 | I125: TR1PW11000048 | J125: 2011-01-07 12:28:48 | K125: 2012-01-07 12:28:48 | L125: 12 | M125: 1449.86 | N125: 9800 | O125: 4 | P125: 64 | Q125: 1 | R125: 1 | S125: 365 | T125: 15 | U125: 60.23 | V125: =RC[-1]+RC[-16] -> 60.450000000000024
A126: 12000 | B126: 1799.56 | C126: =IF(DAYS360(RC[7],R1C3)+2>365,365,DAYS360(RC[7],R1C3)+2) -> 365 | D126: =ROUND(RC[-3]*RC[16]/36500,2) -> 4.93 | E126: =RC[-1]*RC[-2] -> 1799.4499999999998 | F126: =RC[-1]-RC[-4] -> -0.11000000000012733 | G126: 197 | H126: 3 | I126: TR1PW11000067 | J126: 2011-01-17 12:28:48 | K126: 2012-01-17 12:28:48 | L126: 12 | M126: 1775.34 | N126: 12000 | O126: 4 | P126: 52 | Q126: 1 | R126: 1 | S126: 365 | T126: 15 | U126: 74.06 | V126: =RC[-1]+RC[-16] -> 73.949999999999875
A127: 39000 | B127: 5722.58 | C127: =IF(DAYS360(RC[7],R1C3)+2>365,365,DAYS360(RC[7],R1C3)+2) -> 351 | D127: =ROUND(RC[-3]*RC[16]/36500,2) -> 16.03 | E127: =RC[-1]*RC[-2] -> 5626.5300000000007 | F127: =RC[-1]-RC[-4] -> -96.049999999999272 | G127: 297 | H127: 3 | I127: TR1PW11000112 | J127: 2011-03-03 12:28:48 | K127: 2012-03-03 12:28:48 | L127: 12 | M127: 5769.86 | N127: 39000 | O127: 1 | P127: 30 | Q127: 1 | R127: 1 | S127: 365 | T127: 15 | U127: 240.32 | V127: =RC[-1]+RC[-16] -> 144.27000000000072
A128: 23000 | B128: 3373.75 | C128: =IF(DAYS360(RC[7],R1C3)+2>365,365,DAYS360(RC[7],R1C3)+2) -> 351 | D128: =ROUND(RC[-3]*RC[16]/36500,2) -> 9.4499999999999993 | E128: =RC[-1]*RC[-2] -> 3316.95 | F128: =RC[-1]-RC[-4] -> -56.800000000000182 | G128: 298 | H128: 3 | I128: TR1PW11000113 | J128: 2011-03-03 12:28:48 | K128: 2012-03-03 12:28:48 | L128: 12 | M128: 3402.74 | N128: 23000 | O128: 1 | P128: 30 | Q128: 1 | R128: 1 | S128: 365 | T128: 15 | U128: 141.85 | V128: =RC[-1]+RC[-16] -> 85.049999999999812
A129: 75000 | B129: 10447.56 | C129: =IF(DAYS360(RC[7],R1C3)+2>365,365,DAYS360(RC[7],R1C3)+2) -> 333 | D129: =ROUND(RC[-3]*RC[16]/36500,2) -> 30.82 | E129: =RC[-1]*RC[-2] -> 10263.06 | F129: =RC[-1]-RC[-4] -> -184.5 | G129: 333 | H129: 3 | I129: TR1PW11000123 | J129: 2011-03-21 12:28:48 | K129: 2012-03-21 12:28:48 | L129: 12 | M129: 11095.89 | N129: 75000 | O129: 1 | P129: 30 | Q129: 1 | R129: 1 | S129: 365 | T129: 15 | U129: 338.60 | V129: =RC[-1]+RC[-16] -> 154.10000000000002
A130: 31500 | B130: 4299.22 | C130: =IF(DAYS360(RC[7],R1C3)+2>365,365,DAYS360(RC[7],R1C3)+2) -> 326 | D130: =ROUND(RC[-3]*RC[16]/36500,2) -> 12.95 | E130: =RC[-1]*RC[-2] -> 4221.7 | F130: =RC[-1]-RC[-4] -> -77.520000000000437 | G130: 349 | H130: 3 | I130: TR1PW11000132 | J130: 2011-03-28 12:28:48 | K130: 2012-03-28 12:28:48 | L130: 12 | M130: 4660.2700000000004 | N130: 31500 | O130: 1 | P130: 30 | Q130: 1 | R130: 1 | S130: 365 | T130: 15 | U130: 375.37 | V130: =RC[-1]+RC[-16] -> 297.84999999999957
A131: 230000 | B131: 31097.1 | C131: =IF(DAYS360(RC[7],R1C3)+2>365,365,DAYS360(RC[7],R1C3)+2) -> 324 | D131: =ROUND(RC[-3]*RC[16]/36500,2) -> 94.52 | E131: =RC[-1]*RC[-2] -> 30624.48 | F131: =RC[-1]-RC[-4] -> -472.61999999999898 | G131: 364 | H131: 3 | I131: TR1PW11000136 | J131: 2011-03-30 12:28:48 | K131: 2012-03-30 12:28:48 | L131: 12 | M131: 34027.4 | N131: 230000 | O131: 1 | P131: 30 | Q131: 1 | R131: 1 | S131: 365 | T131: 15 | U131: 1228.78 | V131: =RC[-1]+RC[-16] -> 756.16000000000099
A132: 5000 | B132: 668.2 | C132: =IF(DAYS360(RC[7],R1C3)+2>365,365,DAYS360(RC[7],R1C3)+2) -> 320 | D132: =ROUND(RC[-3]*RC[16]/36500,2) -> 2.0499999999999998 | E132: =RC[-1]*RC[-2] -> 656 | F132: =RC[-1]-RC[-4] -> -12.200000000000045 | G132: 387 | H132: 3 | I132: TR1PW11000138 | J132: 2011-04-04 00:00:00 | K132: 2012-04-04 00:00:00 | L132: 12 | M132: 739.73 | N132: 5000 | O132: 1 | P132: 121 | Q132: 1 | R132: 1 | S132: 365 | T132: 15 | U132: 250.00 | V132: =RC[-1]+RC[-16] -> 237.79999999999995
A133: 5000 | B133: 635.4 | C133: =IF(DAYS360(RC[7],R1C3)+2>365,365,DAYS360(RC[7],R1C3)+2) -> 304 | D133: =ROUND(RC[-3]*RC[16]/36500,2) -> 2.0499999999999998 | E133: =RC[-1]*RC[-2] -> 623.19999999999993 | F133: =RC[-1]-RC[-4] -> -12.200000000000045 | G133: 417 | H133: 3 | I133: TR1PW11000147 | J133: 2011-04-20 00:00:00 | K133: 2012-04-20 00:00:00 | L133: 12 | M133: 739.73 | N133: 5000 | O133: 1 | P133: 121 | Q133: 1 | R133: 1 | S133: 365 | T133: 15 | U133: 250.00 | V133: =RC[-1]+RC[-16] -> 237.79999999999995
A134: 15000 | B134: 1876.24 | C134: =IF(DAYS360(RC[7],R1C3)+2>365,365,DAYS360(RC[7],R1C3)+2) -> 299 | D134: =ROUND(RC[-3]*RC[16]/36500,2) -> 6.16 | E134: =RC[-1]*RC[-2] -> 1841.8400000000001 | F134: =RC[-1]-RC[-4] -> -34.399999999999864 | G134: 425 | H134: 3 | I134: TR1PW11000150 | J134: 2011-04-25 00:00:00 | K134: 2012-04-25 00:00:00 | L134: 12 | M134: 2219.1799999999998 | N134: 15000 | O134: 1 | P134: 40 | Q134: 1 | R134: 1 | S134: 365 | T134: 15 | U134: 250.00 | V134: =RC[-1]+RC[-16] -> 215.60000000000014
A135: 10000 | B135: 1219.96 | C135: =IF(DAYS360(RC[7],R1C3)+2>365,365,DAYS360(RC[7],R1C3)+2) -> 291 | D135: =ROUND(RC[-3]*RC[16]/36500,2) -> 4.1100000000000003 | E135: =RC[-1]*RC[-2] -> 1196.01 | F135: =RC[-1]-RC[-4] -> -23.950000000000045 | G135: 452 | H135: 3 | I135: TR1PW11000160 | J135: 2011-05-03 00:00:00 | K135: 2012-05-03 00:00:00 | L135: 12 | M135: 1479.45 | N135: 10000 | O135: 1 | P135: 60 | Q135: 1 | R135: 1 | S135: 365 | T135: 15 | U135: 250.00 | V135: =RC[-1]+RC[-16] -> 226.04999999999995
A136: 50000 | B136: 6062.19 | C136: =IF(DAYS360(RC[7],R1C3)+2>365,365,DAYS360(RC[7],R1C3)+2) -> 290 | D136: =ROUND(RC[-3]*RC[16]/36500,2) -> 20.55 | E136: =RC[-1]*RC[-2] -> 5959.5 | F136: =RC[-1]-RC[-4] -> -102.6899999999996 | G136: 460 | H136: 3 | I136: TR1PW11000161 | J136: 2011-05-04 00:00:00 | K136: 2012-05-04 00:00:00 | L136: 12 | M136: 7397.26 | N136: 50000 | O136: 1 | P136: 30 | Q136: 1 | R136: 1 | S136: 365 | T136: 15 | U136: 616.44 | V136: =RC[-1]+RC[-16] -> 513.75000000000045
A137: 27500 | B137: 3310.94 | C137: =IF(DAYS360(RC[7],R1C3)+2>365,365,DAYS360(RC[7],R1C3)+2) -> 288 | D137: =ROUND(RC[-3]*RC[16]/36500,2) -> 11.3 | E137: =RC[-1]*RC[-2] -> 3254.4 | F137: =RC[-1]-RC[-4] -> -56.539999999999964 | G137: 469 | H137: 3 | I137: TR1PW11000164 | J137: 2011-05-06 00:00:00 | K137: 2012-05-06 00:00:00 | L137: 12 | M137: 4068.49 | N137: 27500 | O137: 1 | P137: 30 | Q137: 1 | R137: 1 | S137: 365 | T137: 15 | U137: 339.04 | V137: =RC[-1]+RC[-16] -> 282.50000000000006
A138: 9000 | B138: 1075.0999999999999 | C138: =IF(DAYS360(RC[7],R1C3)+2>365,365,DAYS360(RC[7],R1C3)+2) -> 285 | D138: =ROUND(RC[-3]*RC[16]/36500,2) -> 3.7 | E138: =RC[-1]*RC[-2] -> 1054.5 | F138: =RC[-1]-RC[-4] -> -20.599999999999909 | G138: 470 | H138: 3 | I138: TR1PW11000165 | J138: 2011-05-09 00:00:00 | K138: 2012-05-09 00:00:00 | L138: 12 | M138: 1331.51 | N138: 9000 | O138: 1 | P138: 67 | Q138: 1 | R138: 1 | S138: 365 | T138: 15 | U138: 250.00 | V138: =RC[-1]+RC[-16] -> 229.40000000000009
A139: 14000 | B139: 1819.84 | C139: =IF(DAYS360(RC[7],R1C3)+2>365,365,DAYS360(RC[7],R1C3)+2) -> 282 | D139: =ROUND(RC[-3]*RC[16]/36500,2) -> 6.33 | E139: =RC[-1]*RC[-2] -> 1785.06 | F139: =RC[-1]-RC[-4] -> -34.779999999999973 | G139: 475 | H139: 3 | I139: TR1PW11000166 | J139: 2011-05-12 00:00:00 | K139: 2012-05-12 00:00:00 | L139: 12 | M139: 2278.36 | N139: 14000 | O139: 1 | P139: 39 | Q139: 1 | R139: 1 | S139: 365 | T139: 16.5 | U139: 250.00 | V139: =RC[-1]+RC[-16] -> 215.22000000000003
A140: 9000 | B140: 1165.75 | C140: =IF(DAYS360(RC[7],R1C3)+2>365,365,DAYS360(RC[7],R1C3)+2) -> 281 | D140: =ROUND(RC[-3]*RC[16]/36500,2) -> 4.07 | E140: =RC[-1]*RC[-2] -> 1143.67 | F140: =RC[-1]-RC[-4] -> -22.079999999999927 | G140: 477 | H140: 3 | I140: TR1PW11000168 | J140: 2011-05-13 00:00:00 | K140: 2012-05-13 00:00:00 | L140: 12 | M140: 1464.66 | N140: 9000 | O140: 1 | P140: 61 | Q140: 1 | R140: 1 | S140: 365 | T140: 16.5 | U140: 250.00 | V140: =RC[-1]+RC[-16] -> 227.92000000000007
A141: 5000 | B141: 647.76 | C141: =IF(DAYS360(RC[7],R1C3)+2>365,365,DAYS360(RC[7],R1C3)+2) -> 281 | D141: =ROUND(RC[-3]*RC[16]/36500,2) -> 2.2599999999999998 | E141: =RC[-1]*RC[-2] -> 635.05999999999995 | F141: =RC[-1]-RC[-4] -> -12.700000000000045 | G141: 478 | H141: 3 | I141: TR1PW11000169 | J141: 2011-05-13 00:00:00 | K141: 2012-05-13 00:00:00 | L141: 12 | M141: 813.7 | N141: 5000 | O141: 1 | P141: 110 | Q141: 1 | R141: 1 | S141: 365 | T141: 16.5 | U141: 250.00 | V141: =RC[-1]+RC[-16] -> 237.29999999999995
A142: 19500 | B142: 2495.91 | C142: =IF(DAYS360(RC[7],R1C3)+2>365,365,DAYS360(RC[7],R1C3)+2) -> 278 | D142: =ROUND(RC[-3]*RC[16]/36500,2) -> 8.82 | E142: =RC[-1]*RC[-2] -> 2451.96 | F142: =RC[-1]-RC[-4] -> -43.949999999999818 | G142: 481 | H142: 3 | I142: TR1PW11000170 | J142: 2011-05-16 00:00:00 | K142: 2012-05-16 00:00:00 | L142: 12 | M142: 3173.42 | N142: 19500 | O142: 1 | P142: 30 | Q142: 1 | R142: 1 | S142: 365 | T142: 16.5 | U142: 264.45 | V142: =RC[-1]+RC[-16] -> 220.50000000000017
A143: 15500 | B143: 1988.48 | C143: =IF(DAYS360(RC[7],R1C3)+2>365,365,DAYS360(RC[7],R1C3)+2) -> 278 | D143: =ROUND(RC[-3]*RC[16]/36500,2) -> 7.01 | E143: =RC[-1]*RC[-2] -> 1948.78 | F143: =RC[-1]-RC[-4] -> -39.700000000000045 | G143: 484 | H143: 3 | I143: TR1PW11000172 | J143: 2011-05-16 00:00:00 | K143: 2012-05-16 00:00:00 | L143: 12 | M143: 2522.4699999999998 | N143: 15500 | O143: 1 | P143: 35 | Q143: 1 | R143: 1 | S143: 365 | T143: 16.5 | U143: 250.00 | V143: =RC[-1]+RC[-16] -> 210.29999999999995
A144: 10000 | B144: 1212.76 | C144: =IF(DAYS360(RC[7],R1C3)+2>365,365,DAYS360(RC[7],R1C3)+2) -> 264 | D144: =ROUND(RC[-3]*RC[16]/36500,2) -> 4.5199999999999996 | E144: =RC[-1]*RC[-2] -> 1193.28 | F144: =RC[-1]-RC[-4] -> -19.480000000000018 | G144: 493 | H144: 3 | I144: TR1PW11000175 | J144: 2011-05-31 00:00:00 | K144: 2012-05-31 00:00:00 | L144: 12 | M144: 1627.4 | N144: 10000 | O144: 1 | P144: 55 | Q144: 1 | R144: 1 | S144: 365 | T144: 16.5 | U144: 250.00 | V144: =RC[-1]+RC[-16] -> 230.51999999999998
A145: 60000 | B145: 7268.26 | C145: =IF(DAYS360(RC[7],R1C3)+2>365,365,DAYS360(RC[7],R1C3)+2) -> 264 | D145: =ROUND(RC[-3]*RC[16]/36500,2) -> 27.12 | E145: =RC[-1]*RC[-2] -> 7159.68 | F145: =RC[-1]-RC[-4] -> -108.57999999999993 | G145: 494 | H145: 3 | I145: TR1PW11000176 | J145: 2011-05-31 00:00:00 | K145: 2012-05-31 00:00:00 | L145: 12 | M145: 9764.3799999999992 | N145: 60000 | O145: 1 | P145: 30 | Q145: 1 | R145: 1 | S145: 365 | T145: 16.5 | U145: 813.70 | V145: =RC[-1]+RC[-16] -> 705.12000000000012
A146: 9000 | B146: 1059.93 | C146: =IF(DAYS360(RC[7],R1C3)+2>365,365,DAYS360(RC[7],R1C3)+2) -> 256 | D146: =ROUND(RC[-3]*RC[16]/36500,2) -> 4.07 | E146: =RC[-1]*RC[-2] -> 1041.92 | F146: =RC[-1]-RC[-4] -> -18.009999999999991 | G146: 500 | H146: 3 | I146: TR1PW11000180 | J146: 2011-06-08 00:00:00 | K146: 2012-06-08 00:00:00 | L146: 12 | M146: 1464.66 | N146: 9000 | O146: 1 | P146: 61 | Q146: 1 | R146: 1 | S146: 365 | T146: 16.5 | U146: 250.00 | V146: =RC[-1]+RC[-16] -> 231.99
A147: 121000 | B147: 13843.48 | C147: =IF(DAYS360(RC[7],R1C3)+2>365,365,DAYS360(RC[7],R1C3)+2) -> 228 | D147: =ROUND(RC[-3]*RC[16]/36500,2) -> 59.67 | E147: =RC[-1]*RC[-2] -> 13604.76 | F147: =RC[-1]-RC[-4] -> -238.71999999999935 | G147: 548 | H147: 3 | I147: TR1PW11000193 | J147: 2011-07-06 00:00:00 | K147: 2012-07-06 00:00:00 | L147: 12 | M147: 21481.64 | N147: 121000 | O147: 1 | P147: 30 | Q147: 1 | R147: 1 | S147: 365 | T147: 18 | U147: 1790.14 | V147: =RC[-1]+RC[-16] -> 1551.4200000000008
A148: 150000 | B148: 15681.72 | C148: =IF(DAYS360(RC[7],R1C3)+2>365,365,DAYS360(RC[7],R1C3)+2) -> 208 | D148: =ROUND(RC[-3]*RC[16]/36500,2) -> 73.97 | E148: =RC[-1]*RC[-2] -> 15385.76 | F148: =RC[-1]-RC[-4] -> -295.95999999999913 | G148: 569 | H148: 3 | I148: TR1PW11000196 | J148: 2011-07-26 00:00:00 | K148: 2012-07-26 00:00:00 | L148: 12 | M148: 26630.14 | N148: 150000 | O148: 1 | P148: 30 | Q148: 1 | R148: 1 | S148: 365 | T148: 18 | U148: 2219.18 | V148: =RC[-1]+RC[-16] -> 1923.2200000000007
A149: 52000 | B149: 5205.04 | C149: =IF(DAYS360(RC[7],R1C3)+2>365,365,DAYS360(RC[7],R1C3)+2) -> 200 | D149: =ROUND(RC[-3]*RC[16]/36500,2) -> 25.64 | E149: =RC[-1]*RC[-2] -> 5128 | F149: =RC[-1]-RC[-4] -> -77.039999999999964 | G149: 587 | H149: 3 | I149: TR1PW11000204 | J149: 2011-08-04 00:00:00 | K149: 2012-08-04 00:00:00 | L149: 12 | M149: 9231.7800000000007 | N149: 52000 | O149: 1 | P149: 30 | Q149: 1 | R149: 1 | S149: 365 | T149: 18 | U149: 769.32 | V149: =RC[-1]+RC[-16] -> 692.28000000000009
A150: 15000 | B150: 1456.2 | C150: =IF(DAYS360(RC[7],R1C3)+2>365,365,DAYS360(RC[7],R1C3)+2) -> 193 | D150: =ROUND(RC[-3]*RC[16]/36500,2) -> 7.4 | E150: =RC[-1]*RC[-2] -> 1428.2 | F150: =RC[-1]-RC[-4] -> -28 | G150: 617 | H150: 3 | I150: TR1PW11000206 | J150: 2011-08-11 00:00:00 | K150: 2012-08-11 00:00:00 | L150: 12 | M150: 2663.01 | N150: 15000 | O150: 1 | P150: 33 | Q150: 1 | R150: 1 | S150: 365 | T150: 18 | U150: 250.00 | V150: =RC[-1]+RC[-16] -> 222
A151: 105000 | B151: 9786.44 | C151: =IF(DAYS360(RC[7],R1C3)+2>365,365,DAYS360(RC[7],R1C3)+2) -> 186 | D151: =ROUND(RC[-3]*RC[16]/36500,2) -> 51.78 | E151: =RC[-1]*RC[-2] -> 9631.08 | F151: =RC[-1]-RC[-4] -> -155.36000000000058 | G151: 667 | H151: 3 | I151: TR1PW11000212 | J151: 2011-08-18 00:00:00 | K151: 2012-08-18 00:00:00 | L151: 12 | M151: 18641.099999999999 | N151: 105000 | O151: 1 | P151: 30 | Q151: 1 | R151: 1 | S151: 365 | T151: 18 | U151: 1553.42 | V151: =RC[-1]+RC[-16] -> 1398.0599999999995
A152: 100000 | B152: 9124.0499999999993 | C152: =IF(DAYS360(RC[7],R1C3)+2>365,365,DAYS360(RC[7],R1C3)+2) -> 182 | D152: =ROUND(RC[-3]*RC[16]/36500,2) -> 49.32 | E152: =RC[-1]*RC[-2] -> 8976.24 | F152: =RC[-1]-RC[-4] -> -147.80999999999949 | G152: 683 | H152: 3 | I152: TR1PW11000213 | J152: 2011-08-22 00:00:00 | K152: 2012-08-22 00:00:00 | L152: 12 | M152: 17753.419999999998 | N152: 100000 | O152: 1 | P152: 30 | Q152: 1 | R152: 1 | S152: 365 | T152: 18 | U152: 1479.45 | V152: =RC[-1]+RC[-16] -> 1331.6400000000006
A153: 125000 | B153: 11403.52 | C153: =IF(DAYS360(RC[7],R1C3)+2>365,365,DAYS360(RC[7],R1C3)+2) -> 182 | D153: =ROUND(RC[-3]*RC[16]/36500,2) -> 61.64 | E153: =RC[-1]*RC[-2] -> 11218.48 | F153: =RC[-1]-RC[-4] -> -185.04000000000087 | G153: 684 | H153: 3 | I153: TR1PW11000214 | J153: 2011-08-22 00:00:00 | K153: 2012-08-22 00:00:00 | L153: 12 | M153: 22191.78 | N153: 125000 | O153: 1 | P153: 30 | Q153: 1 | R153: 1 | S153: 365 | T153: 18 | U153: 1849.32 | V153: =RC[-1]+RC[-16] -> 1664.2799999999991
A154: 19500 | B154: 1779.59 | C154: =IF(DAYS360(RC[7],R1C3)+2>365,365,DAYS360(RC[7],R1C3)+2) -> 182 | D154: =ROUND(RC[-3]*RC[16]/36500,2) -> 9.6199999999999992 | E154: =RC[-1]*RC[-2] -> 1750.84 | F154: =RC[-1]-RC[-4] -> -28.75 | G154: 685 | H154: 3 | I154: TR1PW11000215 | J154: 2011-08-22 00:00:00 | K154: 2012-08-22 00:00:00 | L154: 12 | M154: 3461.92 | N154: 19500 | O154: 1 | P154: 30 | Q154: 1 | R154: 1 | S154: 365 | T154: 18 | U154: 288.49 | V154: =RC[-1]+RC[-16] -> 259.74
A155: 106000 | B155: 9304.18 | C155: =IF(DAYS360(RC[7],R1C3)+2>365,365,DAYS360(RC[7],R1C3)+2) -> 175 | D155: =ROUND(RC[-3]*RC[16]/36500,2) -> 52.27 | E155: =RC[-1]*RC[-2] -> 9147.25 | F155: =RC[-1]-RC[-4] -> -156.93000000000029 | G155: 722 | H155: 3 | I155: TR1PW11000220 | J155: 2011-08-29 00:00:00 | K155: 2012-08-29 00:00:00 | L155: 12 | M155: 18818.63 | N155: 106000 | O155: 1 | P155: 30 | Q155: 1 | R155: 1 | S155: 365 | T155: 18 | U155: 1568.22 | V155: =RC[-1]+RC[-16] -> 1411.2899999999997
A156: 36500 | B156: 3060 | C156: =IF(DAYS360(RC[7],R1C3)+2>365,365,DAYS360(RC[7],R1C3)+2) -> 168 | D156: =ROUND(RC[-3]*RC[16]/36500,2) -> 18 | E156: =RC[-1]*RC[-2] -> 3024 | F156: =RC[-1]-RC[-4] -> -36 | G156: 749 | H156: 3 | I156: TR1PW11000221 | J156: 2011-09-06 00:00:00 | K156: 2012-09-06 00:00:00 | L156: 12 | M156: 6480 | N156: 36500 | O156: 1 | P156: 30 | Q156: 1 | R156: 1 | S156: 365 | T156: 18 | U156: 540.00 | V156: =RC[-1]+RC[-16] -> 504
C157: =IF(DAYS360(RC[7],R1C3)+2>365,365,DAYS360(RC[7],R1C3)+2) -> 365 | D157: =ROUND(RC[-3]*RC[16]/36500,2) -> 0 | E157: =RC[-1]*RC[-2] -> 0 | F157: =RC[-1]-RC[-4] -> 0
C158: =IF(DAYS360(RC[7],R1C3)+2>365,365,DAYS360(RC[7],R1C3)+2) -> 365 | D158: =ROUND(RC[-3]*RC[16]/36500,2) -> 0 | E158: =RC[-1]*RC[-2] -> 0 | F158: =RC[-1]-RC[-4] -> 0
C159: =IF(DAYS360(RC[7],R1C3)+2>365,365,DAYS360(RC[7],R1C3)+2) -> 365 | D159: =ROUND(RC[-3]*RC[16]/36500,2) -> 0 | E159: =RC[-1]*RC[-2] -> 0 | F159: =RC[-1]-RC[-4] -> 0
C160: =IF(DAYS360(RC[7],R1C3)+2>365,365,DAYS360(RC[7],R1C3)+2) -> 365 | D160: =ROUND(RC[-3]*RC[16]/36500,2) -> 0 | E160: =RC[-1]*RC[-2] -> 0 | F160: =RC[-1]-RC[-4] -> 0
C161: =IF(DAYS360(RC[7],R1C3)+2>365,365,DAYS360(RC[7],R1C3)+2) -> 365 | D161: =ROUND(RC[-3]*RC[16]/36500,2) -> 0 | E161: =RC[-1]*RC[-2] -> 0 | F161: =RC[-1]-RC[-4] -> 0
C162: =IF(DAYS360(RC[7],R1C3)+2>365,365,DAYS360(RC[7],R1C3)+2) -> 365 | D162: =ROUND(RC[-3]*RC[16]/36500,2) -> 0 | E162: =RC[-1]*RC[-2] -> 0 | F162: =RC[-1]-RC[-4] -> 0
C163: =IF(DAYS360(RC[7],R1C3)+2>365,365,DAYS360(RC[7],R1C3)+2) -> 365 | D163: =ROUND(RC[-3]*RC[16]/36500,2) -> 0 | E163: =RC[-1]*RC[-2] -> 0 | F163: =RC[-1]-RC[-4] -> 0
C164: =IF(DAYS360(RC[7],R1C3)+2>365,365,DAYS360(RC[7],R1C3)+2) -> 365 | D164: =ROUND(RC[-3]*RC[16]/36500,2) -> 0 | E164: =RC[-1]*RC[-2] -> 0 | F164: =RC[-1]-RC[-4] -> 0
C165: =IF(DAYS360(RC[7],R1C3)+2>365,365,DAYS360(RC[7],R1C3)+2) -> 365 | D165: =ROUND(RC[-3]*RC[16]/36500,2) -> 0 | E165: =RC[-1]*RC[-2] -> 0 | F165: =RC[-1]-RC[-4] -> 0
C166: =IF(DAYS360(RC[7],R1C3)+2>365,365,DAYS360(RC[7],R1C3)+2) -> 365 | D166: =ROUND(RC[-3]*RC[16]/36500,2) -> 0 | E166: =RC[-1]*RC[-2] -> 0 | F166: =RC[-1]-RC[-4] -> 0
C167: =IF(DAYS360(RC[7],R1C3)+2>365,365,DAYS360(RC[7],R1C3)+2) -> 365 | D167: =ROUND(RC[-3]*RC[16]/36500,2) -> 0 | E167: =RC[-1]*RC[-2] -> 0 | F167: =RC[-1]-RC[-4] -> 0
C168: =IF(DAYS360(RC[7],R1C3)+2>365,365,DAYS360(RC[7],R1C3)+2) -> 365 | D168: =ROUND(RC[-3]*RC[16]/36500,2) -> 0 | E168: =RC[-1]*RC[-2] -> 0 | F168: =RC[-1]-RC[-4] -> 0
C169: =IF(DAYS360(RC[7],R1C3)+2>365,365,DAYS360(RC[7],R1C3)+2) -> 365 | D169: =ROUND(RC[-3]*RC[16]/36500,2) -> 0 | E169: =RC[-1]*RC[-2] -> 0 | F169: =RC[-1]-RC[-4] -> 0
C170: =IF(DAYS360(RC[7],R1C3)+2>365,365,DAYS360(RC[7],R1C3)+2) -> 365 | D170: =ROUND(RC[-3]*RC[16]/36500,2) -> 0 | E170: =RC[-1]*RC[-2] -> 0 | F170: =RC[-1]-RC[-4] -> 0
C171: =IF(DAYS360(RC[7],R1C3)+2>365,365,DAYS360(RC[7],R1C3)+2) -> 365 | D171: =ROUND(RC[-3]*RC[16]/36500,2) -> 0 | E171: =RC[-1]*RC[-2] -> 0 | F171: =RC[-1]-RC[-4] -> 0
C172: =IF(DAYS360(RC[7],R1C3)+2>365,365,DAYS360(RC[7],R1C3)+2) -> 365 | D172: =ROUND(RC[-3]*RC[16]/36500,2) -> 0 | E172: =RC[-1]*RC[-2] -> 0 | F172: =RC[-1]-RC[-4] -> 0
C173: =IF(DAYS360(RC[7],R1C3)+2>365,365,DAYS360(RC[7],R1C3)+2) -> 365 | D173: =ROUND(RC[-3]*RC[16]/36500,2) -> 0 | E173: =RC[-1]*RC[-2] -> 0 | F173: =RC[-1]-RC[-4] -> 0
C174: =IF(DAYS360(RC[7],R1C3)+2>365,365,DAYS360(RC[7],R1C3)+2) -> 365 | D174: =ROUND(RC[-3]*RC[16]/36500,2) -> 0 | E174: =RC[-1]*RC[-2] -> 0 | F174: =RC[-1]-RC[-4] -> 0
C175: =IF(DAYS360(RC[7],R1C3)+2>365,365,DAYS360(RC[7],R1C3)+2) -> 365 | D175: =ROUND(RC[-3]*RC[16]/36500,2) -> 0 | E175: =RC[-1]*RC[-2] -> 0 | F175: =RC[-1]-RC[-4] -> 0
C176: =IF(DAYS360(RC[7],R1C3)+2>365,365,DAYS360(RC[7],R1C3)+2) -> 365 | D176: =ROUND(RC[-3]*RC[16]/36500,2) -> 0 | E176: =RC[-1]*RC[-2] -> 0 | F176: =RC[-1]-RC[-4] -> 0
C177: =IF(DAYS360(RC[7],R1C3)+2>365,365,DAYS360(RC[7],R1C3)+2) -> 365 | D177: =ROUND(RC[-3]*RC[16]/36500,2) -> 0 | E177: =RC[-1]*RC[-2] -> 0 | F177: =RC[-1]-RC[-4] -> 0
C178: =IF(DAYS360(RC[7],R1C3)+2>365,365,DAYS360(RC[7],R1C3)+2) -> 365 | D178: =ROUND(RC[-3]*RC[16]/36500,2) -> 0 | E178: =RC[-1]*RC[-2] -> 0 | F178: =RC[-1]-RC[-4] -> 0
C179: =IF(DAYS360(RC[7],R1C3)+2>365,365,DAYS360(RC[7],R1C3)+2) -> 365 | D179: =ROUND(RC[-3]*RC[16]/36500,2) -> 0 | E179: =RC[-1]*RC[-2] -> 0 | F179: =RC[-1]-RC[-4] -> 0
C180: =IF(DAYS360(RC[7],R1C3)+2>365,365,DAYS360(RC[7],R1C3)+2) -> 365 | D180: =ROUND(RC[-3]*RC[16]/36500,2) -> 0 | E180: =RC[-1]*RC[-2] -> 0 | F180: =RC[-1]-RC[-4] -> 0
C181: =IF(DAYS360(RC[7],R1C3)+2>365,365,DAYS360(RC[7],R1C3)+2) -> 365 | D181: =ROUND(RC[-3]*RC[16]/36500,2) -> 0 | E181: =RC[-1]*RC[-2] -> 0 | F181: =RC[-1]-RC[-4] -> 0
C182: =IF(DAYS360(RC[7],R1C3)+2>365,365,DAYS360(RC[7],R1C3)+2) -> 365 | D182: =ROUND(RC[-3]*RC[16]/36500,2) -> 0 | E182: =RC[-1]*RC[-2] -> 0 | F182: =RC[-1]-RC[-4] -> 0
C183: =IF(DAYS360(RC[7],R1C3)+2>365,365,DAYS360(RC[7],R1C3)+2) -> 365 | D183: =ROUND(RC[-3]*RC[16]/36500,2) -> 0 | E183: =RC[-1]*RC[-2] -> 0 | F183: =RC[-1]-RC[-4] -> 0
C184: =IF(DAYS360(RC[7],R1C3)+2>365,365,DAYS360(RC[7],R1C3)+2) -> 365 | D184: =ROUND(RC[-3]*RC[16]/36500,2) -> 0 | E184: =RC[-1]*RC[-2] -> 0 | F184: =RC[-1]-RC[-4] -> 0
C185: =IF(DAYS360(RC[7],R1C3)+2>365,365,DAYS360(RC[7],R1C3)+2) -> 365 | D185: =ROUND(RC[-3]*RC[16]/36500,2) -> 0 | E185: =RC[-1]*RC[-2] -> 0 | F185: =RC[-1]-RC[-4] -> 0
C186: =IF(DAYS360(RC[7],R1C3)+2>365,365,DAYS360(RC[7],R1C3)+2) -> 365 | D186: =ROUND(RC[-3]*RC[16]/36500,2) -> 0 | E186: =RC[-1]*RC[-2] -> 0 | F186: =RC[-1]-RC[-4] -> 0
C187: =IF(DAYS360(RC[7],R1C3)+2>365,365,DAYS360(RC[7],R1C3)+2) -> 365 | D187: =ROUND(RC[-3]*RC[16]/36500,2) -> 0 | E187: =RC[-1]*RC[-2] -> 0 | F187: =RC[-1]-RC[-4] -> 0
C188: =IF(DAYS360(RC[7],R1C3)+2>365,365,DAYS360(RC[7],R1C3)+2) -> 365 | D188: =ROUND(RC[-3]*RC[16]/36500,2) -> 0 | E188: =RC[-1]*RC[-2] -> 0 | F188: =RC[-1]-RC[-4] -> 0
C189: =IF(DAYS360(RC[7],R1C3)+2>365,365,DAYS360(RC[7],R1C3)+2) -> 365 | D189: =ROUND(RC[-3]*RC[16]/36500,2) -> 0 | E189: =RC[-1]*RC[-2] -> 0 | F189: =RC[-1]-RC[-4] -> 0
C190: =IF(DAYS360(RC[7],R1C3)+2>365,365,DAYS360(RC[7],R1C3)+2) -> 365 | D190: =ROUND(RC[-3]*RC[16]/36500,2) -> 0 | E190: =RC[-1]*RC[-2] -> 0 | F190: =RC[-1]-RC[-4] -> 0
C191: =IF(DAYS360(RC[7],R1C3)+2>365,365,DAYS360(RC[7],R1C3)+2) -> 365 | D191: =ROUND(RC[-3]*RC[16]/36500,2) -> 0 | E191: =RC[-1]*RC[-2] -> 0 | F191: =RC[-1]-RC[-4] -> 0
C192: =IF(DAYS360(RC[7],R1C3)+2>365,365,DAYS360(RC[7],R1C3)+2) -> 365 | D192: =ROUND(RC[-3]*RC[16]/36500,2) -> 0 | E192: =RC[-1]*RC[-2] -> 0 | F192: =RC[-1]-RC[-4] -> 0
C193: =IF(DAYS360(RC[7],R1C3)+2>365,365,DAYS360(RC[7],R1C3)+2) -> 365 | D193: =ROUND(RC[-3]*RC[16]/36500,2) -> 0 | E193: =RC[-1]*RC[-2] -> 0 | F193: =RC[-1]-RC[-4] -> 0
C194: =IF(DAYS360(RC[7],R1C3)+2>365,365,DAYS360(RC[7],R1C3)+2) -> 365 | D194: =ROUND(RC[-3]*RC[16]/36500,2) -> 0 | E194: =RC[-1]*RC[-2] -> 0 | F194: =RC[-1]-RC[-4] -> 0
C195: =IF(DAYS360(RC[7],R1C3)+2>365,365,DAYS360(RC[7],R1C3)+2) -> 365 | D195: =ROUND(RC[-3]*RC[16]/36500,2) -> 0 | E195: =RC[-1]*RC[-2] -> 0 | F195: =RC[-1]-RC[-4] -> 0
C196: =IF(DAYS360(RC[7],R1C3)+2>365,365,DAYS360(RC[7],R1C3)+2) -> 365 | D196: =ROUND(RC[-3]*RC[16]/36500,2) -> 0 | E196: =RC[-1]*RC[-2] -> 0 | F196: =RC[-1]-RC[-4] -> 0
C197: =IF(DAYS360(RC[7],R1C3)+2>365,365,DAYS360(RC[7],R1C3)+2) -> 365 | D197: =ROUND(RC[-3]*RC[16]/36500,2) -> 0 | E197: =RC[-1]*RC[-2] -> 0 | F197: =RC[-1]-RC[-4] -> 0
C198: =IF(DAYS360(RC[7],R1C3)+2>365,365,DAYS360(RC[7],R1C3)+2) -> 365 | D198: =ROUND(RC[-3]*RC[16]/36500,2) -> 0 | E198: =RC[-1]*RC[-2] -> 0 | F198: =RC[-1]-RC[-4] -> 0
C199: =IF(DAYS360(RC[7],R1C3)+2>365,365,DAYS360(RC[7],R1C3)+2) -> 365 | D199: =ROUND(RC[-3]*RC[16]/36500,2) -> 0 | E199: =RC[-1]*RC[-2] -> 0 | F199: =RC[-1]-RC[-4] -> 0
C200: =IF(DAYS360(RC[7],R1C3)+2>365,365,DAYS360(RC[7],R1C3)+2) -> 365 | D200: =ROUND(RC[-3]*RC[16]/36500,2) -> 0 | E200: =RC[-1]*RC[-2] -> 0 | F200: =RC[-1]-RC[-4] -> 0
C201: =IF(DAYS360(RC[7],R1C3)+2>365,365,DAYS360(RC[7],R1C3)+2) -> 365 | D201: =ROUND(RC[-3]*RC[16]/36500,2) -> 0 | E201: =RC[-1]*RC[-2] -> 0 | F201: =RC[-1]-RC[-4] -> 0
C202: =IF(DAYS360(RC[7],R1C3)+2>365,365,DAYS360(RC[7],R1C3)+2) -> 365 | D202: =ROUND(RC[-3]*RC[16]/36500,2) -> 0 | E202: =RC[-1]*RC[-2] -> 0 | F202: =RC[-1]-RC[-4] -> 0
C203: =IF(DAYS360(RC[7],R1C3)+2>365,365,DAYS360(RC[7],R1C3)+2) -> 365 | D203: =ROUND(RC[-3]*RC[16]/36500,2) -> 0 | E203: =RC[-1]*RC[-2] -> 0 | F203: =RC[-1]-RC[-4] -> 0
C204: =IF(DAYS360(RC[7],R1C3)+2>365,365,DAYS360(RC[7],R1C3)+2) -> 365 | D204: =ROUND(RC[-3]*RC[16]/36500,2) -> 0 | E204: =RC[-1]*RC[-2] -> 0 | F204: =RC[-1]-RC[-4] -> 0
C205: =IF(DAYS360(RC[7],R1C3)+2>365,365,DAYS360(RC[7],R1C3)+2) -> 365 | D205: =ROUND(RC[-3]*RC[16]/36500,2) -> 0 | E205: =RC[-1]*RC[-2] -> 0 | F205: =RC[-1]-RC[-4] -> 0
C206: =IF(DAYS360(RC[7],R1C3)+2>365,365,DAYS360(RC[7],R1C3)+2) -> 365 | D206: =ROUND(RC[-3]*RC[16]/36500,2) -> 0 | E206: =RC[-1]*RC[-2] -> 0 | F206: =RC[-1]-RC[-4] -> 0
C207: =IF(DAYS360(RC[7],R1C3)+2>365,365,DAYS360(RC[7],R1C3)+2) -> 365 | D207: =ROUND(RC[-3]*RC[16]/36500,2) -> 0 | E207: =RC[-1]*RC[-2] -> 0 | F207: =RC[-1]-RC[-4] -> 0
C208: =IF(DAYS360(RC[7],R1C3)+2>365,365,DAYS360(RC[7],R1C3)+2) -> 365 | D208: =ROUND(RC[-3]*RC[16]/36500,2) -> 0 | E208: =RC[-1]*RC[-2] -> 0 | F208: =RC[-1]-RC[-4] -> 0
C209: =IF(DAYS360(RC[7],R1C3)+2>365,365,DAYS360(RC[7],R1C3)+2) -> 365 | D209: =ROUND(RC[-3]*RC[16]/36500,2) -> 0 | E209: =RC[-1]*RC[-2] -> 0 | F209: =RC[-1]-RC[-4] -> 0
C210: =IF(DAYS360(RC[7],R1C3)+2>365,365,DAYS360(RC[7],R1C3)+2) -> 365 | D210: =ROUND(RC[-3]*RC[16]/36500,2) -> 0 | E210: =RC[-1]*RC[-2] -> 0 | F210: =RC[-1]-RC[-4] -> 0
C211: =IF(DAYS360(RC[7],R1C3)+2>365,365,DAYS360(RC[7],R1C3)+2) -> 365 | D211: =ROUND(RC[-3]*RC[16]/36500,2) -> 0 | E211: =RC[-1]*RC[-2] -> 0 | F211: =RC[-1]-RC[-4] -> 0
C212: =IF(DAYS360(RC[7],R1C3)+2>365,365,DAYS360(RC[7],R1C3)+2) -> 365 | D212: =ROUND(RC[-3]*RC[16]/36500,2) -> 0 | E212: =RC[-1]*RC[-2] -> 0 | F212: =RC[-1]-RC[-4] -> 0
C213: =IF(DAYS360(RC[7],R1C3)+2>365,365,DAYS360(RC[7],R1C3)+2) -> 365 | D213: =ROUND(RC[-3]*RC[16]/36500,2) -> 0 | E213: =RC[-1]*RC[-2] -> 0 | F213: =RC[-1]-RC[-4] -> 0
C214: =IF(DAYS360(RC[7],R1C3)+2>365,365,DAYS360(RC[7],R1C3)+2) -> 365 | D214: =ROUND(RC[-3]*RC[16]/36500,2) -> 0 | E214: =RC[-1]*RC[-2] -> 0 | F214: =RC[-1]-RC[-4] -> 0
C215: =IF(DAYS360(RC[7],R1C3)+2>365,365,DAYS360(RC[7],R1C3)+2) -> 365 | D215: =ROUND(RC[-3]*RC[16]/36500,2) -> 0 | E215: =RC[-1]*RC[-2] -> 0 | F215: =RC[-1]-RC[-4] -> 0
C216: =IF(DAYS360(RC[7],R1C3)+2>365,365,DAYS360(RC[7],R1C3)+2) -> 365 | D216: =ROUND(RC[-3]*RC[16]/36500,2) -> 0 | E216: =RC[-1]*RC[-2] -> 0 | F216: =RC[-1]-RC[-4] -> 0
C217: =IF(DAYS360(RC[7],R1C3)+2>365,365,DAYS360(RC[7],R1C3)+2) -> 365 | D217: =ROUND(RC[-3]*RC[16]/36500,2) -> 0 | E217: =RC[-1]*RC[-2] -> 0 | F217: =RC[-1]-RC[-4] -> 0
C218: =IF(DAYS360(RC[7],R1C3)+2>365,365,DAYS360(RC[7],R1C3)+2) -> 365 | D218: =ROUND(RC[-3]*RC[16]/36500,2) -> 0 | E218: =RC[-1]*RC[-2] -> 0 | F218: =RC[-1]-RC[-4] -> 0
C219: =IF(DAYS360(RC[7],R1C3)+2>365,365,DAYS360(RC[7],R1C3)+2) -> 365 | D219: =ROUND(RC[-3]*RC[16]/36500,2) -> 0 | E219: =RC[-1]*RC[-2] -> 0 | F219: =RC[-1]-RC[-4] -> 0
C220: =IF(DAYS360(RC[7],R1C3)+2>365,365,DAYS360(RC[7],R1C3)+2) -> 365 | D220: =ROUND(RC[-3]*RC[16]/36500,2) -> 0 | E220: =RC[-1]*RC[-2] -> 0 | F220: =RC[-1]-RC[-4] -> 0
C221: =IF(DAYS360(RC[7],R1C3)+2>365,365,DAYS360(RC[7],R1C3)+2) -> 365 | D221: =ROUND(RC[-3]*RC[16]/36500,2) -> 0 | E221: =RC[-1]*RC[-2] -> 0 | F221: =RC[-1]-RC[-4] -> 0
C222: =IF(DAYS360(RC[7],R1C3)+2>365,365,DAYS360(RC[7],R1C3)+2) -> 365 | D222: =ROUND(RC[-3]*RC[16]/36500,2) -> 0 | E222: =RC[-1]*RC[-2] -> 0 | F222: =RC[-1]-RC[-4] -> 0
C223: =IF(DAYS360(RC[7],R1C3)+2>365,365,DAYS360(RC[7],R1C3)+2) -> 365 | D223: =ROUND(RC[-3]*RC[16]/36500,2) -> 0 | E223: =RC[-1]*RC[-2] -> 0 | F223: =RC[-1]-RC[-4] -> 0
C224: =IF(DAYS360(RC[7],R1C3)+2>365,365,DAYS360(RC[7],R1C3)+2) -> 365 | D224: =ROUND(RC[-3]*RC[16]/36500,2) -> 0 | E224: =RC[-1]*RC[-2] -> 0 | F224: =RC[-1]-RC[-4] -> 0
C225: =IF(DAYS360(RC[7],R1C3)+2>365,365,DAYS360(RC[7],R1C3)+2) -> 365 | D225: =ROUND(RC[-3]*RC[16]/36500,2) -> 0 | E225: =RC[-1]*RC[-2] -> 0 | F225: =RC[-1]-RC[-4] -> 0
C226: =IF(DAYS360(RC[7],R1C3)+2>365,365,DAYS360(RC[7],R1C3)+2) -> 365 | D226: =ROUND(RC[-3]*RC[16]/36500,2) -> 0 | E226: =RC[-1]*RC[-2] -> 0 | F226: =RC[-1]-RC[-4] -> 0
C227: =IF(DAYS360(RC[7],R1C3)+2>365,365,DAYS360(RC[7],R1C3)+2) -> 365 | D227: =ROUND(RC[-3]*RC[16]/36500,2) -> 0 | E227: =RC[-1]*RC[-2] -> 0 | F227: =RC[-1]-RC[-4] -> 0
C228: =IF(DAYS360(RC[7],R1C3)+2>365,365,DAYS360(RC[7],R1C3)+2) -> 365 | D228: =ROUND(RC[-3]*RC[16]/36500,2) -> 0 | E228: =RC[-1]*RC[-2] -> 0 | F228: =RC[-1]-RC[-4] -> 0
C229: =IF(DAYS360(RC[7],R1C3)+2>365,365,DAYS360(RC[7],R1C3)+2) -> 365 | D229: =ROUND(RC[-3]*RC[16]/36500,2) -> 0 | E229: =RC[-1]*RC[-2] -> 0 | F229: =RC[-1]-RC[-4] -> 0
C230: =IF(DAYS360(RC[7],R1C3)+2>365,365,DAYS360(RC[7],R1C3)+2) -> 365 | D230: =ROUND(RC[-3]*RC[16]/36500,2) -> 0 | E230: =RC[-1]*RC[-2] -> 0 | F230: =RC[-1]-RC[-4] -> 0
C231: =IF(DAYS360(RC[7],R1C3)+2>365,365,DAYS360(RC[7],R1C3)+2) -> 365 | D231: =ROUND(RC[-3]*RC[16]/36500,2) -> 0 | E231: =RC[-1]*RC[-2] -> 0 | F231: =RC[-1]-RC[-4] -> 0
C232: =IF(DAYS360(RC[7],R1C3)+2>365,365,DAYS360(RC[7],R1C3)+2) -> 365 | D232: =ROUND(RC[-3]*RC[16]/36500,2) -> 0 | E232: =RC[-1]*RC[-2] -> 0 | F232: =RC[-1]-RC[-4] -> 0
C233: =IF(DAYS360(RC[7],R1C3)+2>365,365,DAYS360(RC[7],R1C3)+2) -> 365 | D233: =ROUND(RC[-3]*RC[16]/36500,2) -> 0 | E233: =RC[-1]*RC[-2] -> 0 | F233: =RC[-1]-RC[-4] -> 0
C234: =IF(DAYS360(RC[7],R1C3)+2>365,365,DAYS360(RC[7],R1C3)+2) -> 365 | D234: =ROUND(RC[-3]*RC[16]/36500,2) -> 0 | E234: =RC[-1]*RC[-2] -> 0 | F234: =RC[-1]-RC[-4] -> 0
C235: =IF(DAYS360(RC[7],R1C3)+2>365,365,DAYS360(RC[7],R1C3)+2) -> 365 | D235: =ROUND(RC[-3]*RC[16]/36500,2) -> 0 | E235: =RC[-1]*RC[-2] -> 0 | F235: =RC[-1]-RC[-4] -> 0
C236: =IF(DAYS360(RC[7],R1C3)+2>365,365,DAYS360(RC[7],R1C3)+2) -> 365 | D236: =ROUND(RC[-3]*RC[16]/36500,2) -> 0 | E236: =RC[-1]*RC[-2] -> 0 | F236: =RC[-1]-RC[-4] -> 0
C237: =IF(DAYS360(RC[7],R1C3)+2>365,365,DAYS360(RC[7],R1C3)+2) -> 365 | D237: =ROUND(RC[-3]*RC[16]/36500,2) -> 0 | E237: =RC[-1]*RC[-2] -> 0 | F237: =RC[-1]-RC[-4] -> 0
C238: =IF(DAYS360(RC[7],R1C3)+2>365,365,DAYS360(RC[7],R1C3)+2) -> 365 | D238: =ROUND(RC[-3]*RC[16]/36500,2) -> 0 | E238: =RC[-1]*RC[-2] -> 0 | F238: =RC[-1]-RC[-4] -> 0
C239: =IF(DAYS360(RC[7],R1C3)+2>365,365,DAYS360(RC[7],R1C3)+2) -> 365 | D239: =ROUND(RC[-3]*RC[16]/36500,2) -> 0 | E239: =RC[-1]*RC[-2] -> 0 | F239: =RC[-1]-RC[-4] -> 0
C240: =IF(DAYS360(RC[7],R1C3)+2>365,365,DAYS360(RC[7],R1C3)+2) -> 365 | D240: =ROUND(RC[-3]*RC[16]/36500,2) -> 0 | E240: =RC[-1]*RC[-2] -> 0 | F240: =RC[-1]-RC[-4] -> 0
C241: =IF(DAYS360(RC[7],R1C3)+2>365,365,DAYS360(RC[7],R1C3)+2) -> 365 | D241: =ROUND(RC[-3]*RC[16]/36500,2) -> 0 | E241: =RC[-1]*RC[-2] -> 0 | F241: =RC[-1]-RC[-4] -> 0
C242: =IF(DAYS360(RC[7],R1C3)+2>365,365,DAYS360(RC[7],R1C3)+2) -> 365 | D242: =ROUND(RC[-3]*RC[16]/36500,2) -> 0 | E242: =RC[-1]*RC[-2] -> 0 | F242: =RC[-1]-RC[-4] -> 0
C243: =IF(DAYS360(RC[7],R1C3)+2>365,365,DAYS360(RC[7],R1C3)+2) -> 365 | D243: =ROUND(RC[-3]*RC[16]/36500,2) -> 0 | E243: =RC[-1]*RC[-2] -> 0 | F243: =RC[-1]-RC[-4] -> 0
C244: =IF(DAYS360(RC[7],R1C3)+2>365,365,DAYS360(RC[7],R1C3)+2) -> 365 | D244: =ROUND(RC[-3]*RC[16]/36500,2) -> 0 | E244: =RC[-1]*RC[-2] -> 0 | F244: =RC[-1]-RC[-4] -> 0
C245: =IF(DAYS360(RC[7],R1C3)+2>365,365,DAYS360(RC[7],R1C3)+2) -> 365 | D245: =ROUND(RC[-3]*RC[16]/36500,2) -> 0 | E245: =RC[-1]*RC[-2] -> 0 | F245: =RC[-1]-RC[-4] -> 0
C246: =IF(DAYS360(RC[7],R1C3)+2>365,365,DAYS360(RC[7],R1C3)+2) -> 365 | D246: =ROUND(RC[-3]*RC[16]/36500,2) -> 0 | E246: =RC[-1]*RC[-2] -> 0 | F246: =RC[-1]-RC[-4] -> 0
C247: =IF(DAYS360(RC[7],R1C3)+2>365,365,DAYS360(RC[7],R1C3)+2) -> 365 | D247: =ROUND(RC[-3]*RC[16]/36500,2) -> 0 | E247: =RC[-1]*RC[-2] -> 0 | F247: =RC[-1]-RC[-4] -> 0
C248: =IF(DAYS360(RC[7],R1C3)+2>365,365,DAYS360(RC[7],R1C3)+2) -> 365 | D248: =ROUND(RC[-3]*RC[16]/36500,2) -> 0 | E248: =RC[-1]*RC[-2] -> 0 | F248: =RC[-1]-RC[-4] -> 0
C249: =IF(DAYS360(RC[7],R1C3)+2>365,365,DAYS360(RC[7],R1C3)+2) -> 365 | D249: =ROUND(RC[-3]*RC[16]/36500,2) -> 0 | E249: =RC[-1]*RC[-2] -> 0 | F249: =RC[-1]-RC[-4] -> 0
C250: =IF(DAYS360(RC[7],R1C3)+2>365,365,DAYS360(RC[7],R1C3)+2) -> 365 | D250: =ROUND(RC[-3]*RC[16]/36500,2) -> 0 | E250: =RC[-1]*RC[-2] -> 0 | F250: =RC[-1]-RC[-4] -> 0
C251: =IF(DAYS360(RC[7],R1C3)+2>365,365,DAYS360(RC[7],R1C3)+2) -> 365 | D251: =ROUND(RC[-3]*RC[16]/36500,2) -> 0 | E251: =RC[-1]*RC[-2] -> 0 | F251: =RC[-1]-RC[-4] -> 0
C252: =IF(DAYS360(RC[7],R1C3)+2>365,365,DAYS360(RC[7],R1C3)+2) -> 365 | D252: =ROUND(RC[-3]*RC[16]/36500,2) -> 0 | E252: =RC[-1]*RC[-2] -> 0 | F252: =RC[-1]-RC[-4] -> 0
C253: =IF(DAYS360(RC[7],R1C3)+2>365,365,DAYS360(RC[7],R1C3)+2) -> 365 | D253: =ROUND(RC[-3]*RC[16]/36500,2) -> 0 | E253: =RC[-1]*RC[-2] -> 0 | F253: =RC[-1]-RC[-4] -> 0
C254: =IF(DAYS360(RC[7],R1C3)+2>365,365,DAYS360(RC[7],R1C3)+2) -> 365 | D254: =ROUND(RC[-3]*RC[16]/36500,2) -> 0 | E254: =RC[-1]*RC[-2] -> 0 | F254: =RC[-1]-RC[-4] -> 0
C255: =IF(DAYS360(RC[7],R1C3)+2>365,365,DAYS360(RC[7],R1C3)+2) -> 365 | D255: =ROUND(RC[-3]*RC[16]/36500,2) -> 0 | E255: =RC[-1]*RC[-2] -> 0 | F255: =RC[-1]-RC[-4] -> 0
C256: =IF(DAYS360(RC[7],R1C3)+2>365,365,DAYS360(RC[7],R1C3)+2) -> 365 | D256: =ROUND(RC[-3]*RC[16]/36500,2) -> 0 | E256: =RC[-1]*RC[-2] -> 0 | F256: =RC[-1]-RC[-4] -> 0
C257: =IF(DAYS360(RC[7],R1C3)+2>365,365,DAYS360(RC[7],R1C3)+2) -> 365 | D257: =ROUND(RC[-3]*RC[16]/36500,2) -> 0 | E257: =RC[-1]*RC[-2] -> 0 | F257: =RC[-1]-RC[-4] -> 0
C258: =IF(DAYS360(RC[7],R1C3)+2>365,365,DAYS360(RC[7],R1C3)+2) -> 365 | D258: =ROUND(RC[-3]*RC[16]/36500,2) -> 0 | E258: =RC[-1]*RC[-2] -> 0 | F258: =RC[-1]-RC[-4] -> 0
C259: =IF(DAYS360(RC[7],R1C3)+2>365,365,DAYS360(RC[7],R1C3)+2) -> 365 | D259: =ROUND(RC[-3]*RC[16]/36500,2) -> 0 | E259: =RC[-1]*RC[-2] -> 0 | F259: =RC[-1]-RC[-4] -> 0
C260: =IF(DAYS360(RC[7],R1C3)+2>365,365,DAYS360(RC[7],R1C3)+2) -> 365 | D260: =ROUND(RC[-3]*RC[16]/36500,2) -> 0 | E260: =RC[-1]*RC[-2] -> 0 | F260: =RC[-1]-RC[-4] -> 0
C261: =IF(DAYS360(RC[7],R1C3)+2>365,365,DAYS360(RC[7],R1C3)+2) -> 365 | D261: =ROUND(RC[-3]*RC[16]/36500,2) -> 0 | E261: =RC[-1]*RC[-2] -> 0 | F261: =RC[-1]-RC[-4] -> 0
C262: =IF(DAYS360(RC[7],R1C3)+2>365,365,DAYS360(RC[7],R1C3)+2) -> 365 | D262: =ROUND(RC[-3]*RC[16]/36500,2) -> 0 | E262: =RC[-1]*RC[-2] -> 0 | F262: =RC[-1]-RC[-4] -> 0
C263: =IF(DAYS360(RC[7],R1C3)+2>365,365,DAYS360(RC[7],R1C3)+2) -> 365 | D263: =ROUND(RC[-3]*RC[16]/36500,2) -> 0 | E263: =RC[-1]*RC[-2] -> 0 | F263: =RC[-1]-RC[-4] -> 0
C264: =IF(DAYS360(RC[7],R1C3)+2>365,365,DAYS360(RC[7],R1C3)+2) -> 365 | D264: =ROUND(RC[-3]*RC[16]/36500,2) -> 0 | E264: =RC[-1]*RC[-2] -> 0 | F264: =RC[-1]-RC[-4] -> 0
C265: =IF(DAYS360(RC[7],R1C3)+2>365,365,DAYS360(RC[7],R1C3)+2) -> 365 | D265: =ROUND(RC[-3]*RC[16]/36500,2) -> 0 | E265: =RC[-1]*RC[-2] -> 0 | F265: =RC[-1]-RC[-4] -> 0
C266: =IF(DAYS360(RC[7],R1C3)+2>365,365,DAYS360(RC[7],R1C3)+2) -> 365 | D266: =ROUND(RC[-3]*RC[16]/36500,2) -> 0 | E266: =RC[-1]*RC[-2] -> 0 | F266: =RC[-1]-RC[-4] -> 0
C267: =IF(DAYS360(RC[7],R1C3)+2>365,365,DAYS360(RC[7],R1C3)+2) -> 365 | D267: =ROUND(RC[-3]*RC[16]/36500,2) -> 0 | E267: =RC[-1]*RC[-2] -> 0 | F267: =RC[-1]-RC[-4] -> 0
C268: =IF(DAYS360(RC[7],R1C3)+2>365,365,DAYS360(RC[7],R1C3)+2) -> 365 | D268: =ROUND(RC[-3]*RC[16]/36500,2) -> 0 | E268: =RC[-1]*RC[-2] -> 0 | F268: =RC[-1]-RC[-4] -> 0
C269: =IF(DAYS360(RC[7],R1C3)+2>365,365,DAYS360(RC[7],R1C3)+2) -> 365 | D269: =ROUND(RC[-3]*RC[16]/36500,2) -> 0 | E269: =RC[-1]*RC[-2] -> 0 | F269: =RC[-1]-RC[-4] -> 0
C270: =IF(DAYS360(RC[7],R1C3)+2>365,365,DAYS360(RC[7],R1C3)+2) -> 365 | D270: =ROUND(RC[-3]*RC[16]/36500,2) -> 0 | E270: =RC[-1]*RC[-2] -> 0 | F270: =RC[-1]-RC[-4] -> 0
C271: =IF(DAYS360(RC[7],R1C3)+2>365,365,DAYS360(RC[7],R1C3)+2) -> 365 | D271: =ROUND(RC[-3]*RC[16]/36500,2) -> 0 | E271: =RC[-1]*RC[-2] -> 0 | F271: =RC[-1]-RC[-4] -> 0
C272: =IF(DAYS360(RC[7],R1C3)+2>365,365,DAYS360(RC[7],R1C3)+2) -> 365 | D272: =ROUND(RC[-3]*RC[16]/36500,2) -> 0 | E272: =RC[-1]*RC[-2] -> 0 | F272: =RC[-1]-RC[-4] -> 0
C273: =IF(DAYS360(RC[7],R1C3)+2>365,365,DAYS360(RC[7],R1C3)+2) -> 365 | D273: =ROUND(RC[-3]*RC[16]/36500,2) -> 0 | E273: =RC[-1]*RC[-2] -> 0 | F273: =RC[-1]-RC[-4] -> 0
C274: =IF(DAYS360(RC[7],R1C3)+2>365,365,DAYS360(RC[7],R1C3)+2) -> 365 | D274: =ROUND(RC[-3]*RC[16]/36500,2) -> 0 | E274: =RC[-1]*RC[-2] -> 0 | F274: =RC[-1]-RC[-4] -> 0
C275: =IF(DAYS360(RC[7],R1C3)+2>365,365,DAYS360(RC[7],R1C3)+2) -> 365 | D275: =ROUND(RC[-3]*RC[16]/36500,2) -> 0 | E275: =RC[-1]*RC[-2] -> 0 | F275: =RC[-1]-RC[-4] -> 0
C276: =IF(DAYS360(RC[7],R1C3)+2>365,365,DAYS360(RC[7],R1C3)+2) -> 365 | D276: =ROUND(RC[-3]*RC[16]/36500,2) -> 0 | E276: =RC[-1]*RC[-2] -> 0 | F276: =RC[-1]-RC[-4] -> 0
C277: =IF(DAYS360(RC[7],R1C3)+2>365,365,DAYS360(RC[7],R1C3)+2) -> 365 | D277: =ROUND(RC[-3]*RC[16]/36500,2) -> 0 | E277: =RC[-1]*RC[-2] -> 0 | F277: =RC[-1]-RC[-4] -> 0
C278: =IF(DAYS360(RC[7],R1C3)+2>365,365,DAYS360(RC[7],R1C3)+2) -> 365 | D278: =ROUND(RC[-3]*RC[16]/36500,2) -> 0 | E278: =RC[-1]*RC[-2] -> 0 | F278: =RC[-1]-RC[-4] -> 0
C279: =IF(DAYS360(RC[7],R1C3)+2>365,365,DAYS360(RC[7],R1C3)+2) -> 365 | D279: =ROUND(RC[-3]*RC[16]/36500,2) -> 0 | E279: =RC[-1]*RC[-2] -> 0 | F279: =RC[-1]-RC[-4] -> 0
C280: =IF(DAYS360(RC[7],R1C3)+2>365,365,DAYS360(RC[7],R1C3)+2) -> 365 | D280: =ROUND(RC[-3]*RC[16]/36500,2) -> 0 | E280: =RC[-1]*RC[-2] -> 0 | F280: =RC[-1]-RC[-4] -> 0
C281: =IF(DAYS360(RC[7],R1C3)+2>365,365,DAYS360(RC[7],R1C3)+2) -> 365 | D281: =ROUND(RC[-3]*RC[16]/36500,2) -> 0 | E281: =RC[-1]*RC[-2] -> 0 | F281: =RC[-1]-RC[-4] -> 0
C282: =IF(DAYS360(RC[7],R1C3)+2>365,365,DAYS360(RC[7],R1C3)+2) -> 365 | D282: =ROUND(RC[-3]*RC[16]/36500,2) -> 0 | E282: =RC[-1]*RC[-2] -> 0 | F282: =RC[-1]-RC[-4] -> 0
C283: =IF(DAYS360(RC[7],R1C3)+2>365,365,DAYS360(RC[7],R1C3)+2) -> 365 | D283: =ROUND(RC[-3]*RC[16]/36500,2) -> 0 | E283: =RC[-1]*RC[-2] -> 0 | F283: =RC[-1]-RC[-4] -> 0
C284: =IF(DAYS360(RC[7],R1C3)+2>365,365,DAYS360(RC[7],R1C3)+2) -> 365 | D284: =ROUND(RC[-3]*RC[16]/36500,2) -> 0 | E284: =RC[-1]*RC[-2] -> 0 | F284: =RC[-1]-RC[-4] -> 0
C285: =IF(DAYS360(RC[7],R1C3)+2>365,365,DAYS360(RC[7],R1C3)+2) -> 365 | D285: =ROUND(RC[-3]*RC[16]/36500,2) -> 0 | E285: =RC[-1]*RC[-2] -> 0 | F285: =RC[-1]-RC[-4] -> 0
C286: =IF(DAYS360(RC[7],R1C3)+2>365,365,DAYS360(RC[7],R1C3)+2) -> 365 | D286: =ROUND(RC[-3]*RC[16]/36500,2) -> 0 | E286: =RC[-1]*RC[-2] -> 0 | F286: =RC[-1]-RC[-4] -> 0
C287: =IF(DAYS360(RC[7],R1C3)+2>365,365,DAYS360(RC[7],R1C3)+2) -> 365 | D287: =ROUND(RC[-3]*RC[16]/36500,2) -> 0 | E287: =RC[-1]*RC[-2] -> 0 | F287: =RC[-1]-RC[-4] -> 0
C288: =IF(DAYS360(RC[7],R1C3)+2>365,365,DAYS360(RC[7],R1C3)+2) -> 365 | D288: =ROUND(RC[-3]*RC[16]/36500,2) -> 0 | E288: =RC[-1]*RC[-2] -> 0 | F288: =RC[-1]-RC[-4] -> 0
C289: =IF(DAYS360(RC[7],R1C3)+2>365,365,DAYS360(RC[7],R1C3)+2) -> 365 | D289: =ROUND(RC[-3]*RC[16]/36500,2) -> 0 | E289: =RC[-1]*RC[-2] -> 0 | F289: =RC[-1]-RC[-4] -> 0
C290: =IF(DAYS360(RC[7],R1C3)+2>365,365,DAYS360(RC[7],R1C3)+2) -> 365 | D290: =ROUND(RC[-3]*RC[16]/36500,2) -> 0 | E290: =RC[-1]*RC[-2] -> 0 | F290: =RC[-1]-RC[-4] -> 0
C291: =IF(DAYS360(RC[7],R1C3)+2>365,365,DAYS360(RC[7],R1C3)+2) -> 365 | D291: =ROUND(RC[-3]*RC[16]/36500,2) -> 0 | E291: =RC[-1]*RC[-2] -> 0 | F291: =RC[-1]-RC[-4] -> 0
C292: =IF(DAYS360(RC[7],R1C3)+2>365,365,DAYS360(RC[7],R1C3)+2) -> 365 | D292: =ROUND(RC[-3]*RC[16]/36500,2) -> 0 | E292: =RC[-1]*RC[-2] -> 0 | F292: =RC[-1]-RC[-4] -> 0
C293: =IF(DAYS360(RC[7],R1C3)+2>365,365,DAYS360(RC[7],R1C3)+2) -> 365 | D293: =ROUND(RC[-3]*RC[16]/36500,2) -> 0 | E293: =RC[-1]*RC[-2] -> 0 | F293: =RC[-1]-RC[-4] -> 0
C294: =IF(DAYS360(RC[7],R1C3)+2>365,365,DAYS360(RC[7],R1C3)+2) -> 365 | D294: =ROUND(RC[-3]*RC[16]/36500,2) -> 0 | E294: =RC[-1]*RC[-2] -> 0 | F294: =RC[-1]-RC[-4] -> 0
C295: =IF(DAYS360(RC[7],R1C3)+2>365,365,DAYS360(RC[7],R1C3)+2) -> 365 | D295: =ROUND(RC[-3]*RC[16]/36500,2) -> 0 | E295: =RC[-1]*RC[-2] -> 0 | F295: =RC[-1]-RC[-4] -> 0
C296: =IF(DAYS360(RC[7],R1C3)+2>365,365,DAYS360(RC[7],R1C3)+2) -> 365 | D296: =ROUND(RC[-3]*RC[16]/36500,2) -> 0 | E296: =RC[-1]*RC[-2] -> 0 | F296: =RC[-1]-RC[-4] -> 0
C297: =IF(DAYS360(RC[7],R1C3)+2>365,365,DAYS360(RC[7],R1C3)+2) -> 365 | D297: =ROUND(RC[-3]*RC[16]/36500,2) -> 0 | E297: =RC[-1]*RC[-2] -> 0 | F297: =RC[-1]-RC[-4] -> 0
C298: =IF(DAYS360(RC[7],R1C3)+2>365,365,DAYS360(RC[7],R1C3)+2) -> 365 | D298: =ROUND(RC[-3]*RC[16]/36500,2) -> 0 | E298: =RC[-1]*RC[-2] -> 0 | F298: =RC[-1]-RC[-4] -> 0
C299: =IF(DAYS360(RC[7],R1C3)+2>365,365,DAYS360(RC[7],R1C3)+2) -> 365 | D299: =ROUND(RC[-3]*RC[16]/36500,2) -> 0 | E299: =RC[-1]*RC[-2] -> 0 | F299: =RC[-1]-RC[-4] -> 0
C300: =IF(DAYS360(RC[7],R1C3)+2>365,365,DAYS360(RC[7],R1C3)+2) -> 365 | D300: =ROUND(RC[-3]*RC[16]/36500,2) -> 0 | E300: =RC[-1]*RC[-2] -> 0 | F300: =RC[-1]-RC[-4] -> 0
C301: =IF(DAYS360(RC[7],R1C3)+2>365,365,DAYS360(RC[7],R1C3)+2) -> 365 | D301: =ROUND(RC[-3]*RC[16]/36500,2) -> 0 | E301: =RC[-1]*RC[-2] -> 0 | F301: =RC[-1]-RC[-4] -> 0
C302: =IF(DAYS360(RC[7],R1C3)+2>365,365,DAYS360(RC[7],R1C3)+2) -> 365 | D302: =ROUND(RC[-3]*RC[16]/36500,2) -> 0 | E302: =RC[-1]*RC[-2] -> 0 | F302: =RC[-1]-RC[-4] -> 0
C303: =IF(DAYS360(RC[7],R1C3)+2>365,365,DAYS360(RC[7],R1C3)+2) -> 365 | D303: =ROUND(RC[-3]*RC[16]/36500,2) -> 0 | E303: =RC[-1]*RC[-2] -> 0 | F303: =RC[-1]-RC[-4] -> 0
C304: =IF(DAYS360(RC[7],R1C3)+2>365,365,DAYS360(RC[7],R1C3)+2) -> 365 | D304: =ROUND(RC[-3]*RC[16]/36500,2) -> 0 | E304: =RC[-1]*RC[-2] -> 0 | F304: =RC[-1]-RC[-4] -> 0
C305: =IF(DAYS360(RC[7],R1C3)+2>365,365,DAYS360(RC[7],R1C3)+2) -> 365 | D305: =ROUND(RC[-3]*RC[16]/36500,2) -> 0 | E305: =RC[-1]*RC[-2] -> 0 | F305: =RC[-1]-RC[-4] -> 0
C306: =IF(DAYS360(RC[7],R1C3)+2>365,365,DAYS360(RC[7],R1C3)+2) -> 365 | D306: =ROUND(RC[-3]*RC[16]/36500,2) -> 0 | E306: =RC[-1]*RC[-2] -> 0 | F306: =RC[-1]-RC[-4] -> 0
C307: =IF(DAYS360(RC[7],R1C3)+2>365,365,DAYS360(RC[7],R1C3)+2) -> 365 | D307: =ROUND(RC[-3]*RC[16]/36500,2) -> 0 | E307: =RC[-1]*RC[-2] -> 0 | F307: =RC[-1]-RC[-4] -> 0
C308: =IF(DAYS360(RC[7],R1C3)+2>365,365,DAYS360(RC[7],R1C3)+2) -> 365 | D308: =ROUND(RC[-3]*RC[16]/36500,2) -> 0 | E308: =RC[-1]*RC[-2] -> 0 | F308: =RC[-1]-RC[-4] -> 0
C309: =IF(DAYS360(RC[7],R1C3)+2>365,365,DAYS360(RC[7],R1C3)+2) -> 365 | D309: =ROUND(RC[-3]*RC[16]/36500,2) -> 0 | E309: =RC[-1]*RC[-2] -> 0 | F309: =RC[-1]-RC[-4] -> 0
C310: =IF(DAYS360(RC[7],R1C3)+2>365,365,DAYS360(RC[7],R1C3)+2) -> 365 | D310: =ROUND(RC[-3]*RC[16]/36500,2) -> 0 | E310: =RC[-1]*RC[-2] -> 0 | F310: =RC[-1]-RC[-4] -> 0
C311: =IF(DAYS360(RC[7],R1C3)+2>365,365,DAYS360(RC[7],R1C3)+2) -> 365 | D311: =ROUND(RC[-3]*RC[16]/36500,2) -> 0 | E311: =RC[-1]*RC[-2] -> 0 | F311: =RC[-1]-RC[-4] -> 0
C312: =IF(DAYS360(RC[7],R1C3)+2>365,365,DAYS360(RC[7],R1C3)+2) -> 365 | D312: =ROUND(RC[-3]*RC[16]/36500,2) -> 0 | E312: =RC[-1]*RC[-2] -> 0 | F312: =RC[-1]-RC[-4] -> 0
C313: =IF(DAYS360(RC[7],R1C3)+2>365,365,DAYS360(RC[7],R1C3)+2) -> 365 | D313: =ROUND(RC[-3]*RC[16]/36500,2) -> 0 | E313: =RC[-1]*RC[-2] -> 0 | F313: =RC[-1]-RC[-4] -> 0
C314: =IF(DAYS360(RC[7],R1C3)+2>365,365,DAYS360(RC[7],R1C3)+2) -> 365 | D314: =ROUND(RC[-3]*RC[16]/36500,2) -> 0 | E314: =RC[-1]*RC[-2] -> 0 | F314: =RC[-1]-RC[-4] -> 0
C315: =IF(DAYS360(RC[7],R1C3)+2>365,365,DAYS360(RC[7],R1C3)+2) -> 365 | D315: =ROUND(RC[-3]*RC[16]/36500,2) -> 0 | E315: =RC[-1]*RC[-2] -> 0 | F315: =RC[-1]-RC[-4] -> 0
C316: =IF(DAYS360(RC[7],R1C3)+2>365,365,DAYS360(RC[7],R1C3)+2) -> 365 | D316: =ROUND(RC[-3]*RC[16]/36500,2) -> 0 | E316: =RC[-1]*RC[-2] -> 0 | F316: =RC[-1]-RC[-4] -> 0
C317: =IF(DAYS360(RC[7],R1C3)+2>365,365,DAYS360(RC[7],R1C3)+2) -> 365 | D317: =ROUND(RC[-3]*RC[16]/36500,2) -> 0 | E317: =RC[-1]*RC[-2] -> 0 | F317: =RC[-1]-RC[-4] -> 0
C318: =IF(DAYS360(RC[7],R1C3)+2>365,365,DAYS360(RC[7],R1C3)+2) -> 365 | D318: =ROUND(RC[-3]*RC[16]/36500,2) -> 0 | E318: =RC[-1]*RC[-2] -> 0 | F318: =RC[-1]-RC[-4] -> 0
C319: =IF(DAYS360(RC[7],R1C3)+2>365,365,DAYS360(RC[7],R1C3)+2) -> 365 | D319: =ROUND(RC[-3]*RC[16]/36500,2) -> 0 | E319: =RC[-1]*RC[-2] -> 0 | F319: =RC[-1]-RC[-4] -> 0
C320: =IF(DAYS360(RC[7],R1C3)+2>365,365,DAYS360(RC[7],R1C3)+2) -> 365 | D320: =ROUND(RC[-3]*RC[16]/36500,2) -> 0 | E320: =RC[-1]*RC[-2] -> 0 | F320: =RC[-1]-RC[-4] -> 0
C321: =IF(DAYS360(RC[7],R1C3)+2>365,365,DAYS360(RC[7],R1C3)+2) -> 365 | D321: =ROUND(RC[-3]*RC[16]/36500,2) -> 0 | E321: =RC[-1]*RC[-2] -> 0 | F321: =RC[-1]-RC[-4] -> 0
C322: =IF(DAYS360(RC[7],R1C3)+2>365,365,DAYS360(RC[7],R1C3)+2) -> 365 | D322: =ROUND(RC[-3]*RC[16]/36500,2) -> 0 | E322: =RC[-1]*RC[-2] -> 0 | F322: =RC[-1]-RC[-4] -> 0
C323: =IF(DAYS360(RC[7],R1C3)+2>365,365,DAYS360(RC[7],R1C3)+2) -> 365 | D323: =ROUND(RC[-3]*RC[16]/36500,2) -> 0 | E323: =RC[-1]*RC[-2] -> 0 | F323: =RC[-1]-RC[-4] -> 0
C324: =IF(DAYS360(RC[7],R1C3)+2>365,365,DAYS360(RC[7],R1C3)+2) -> 365 | D324: =ROUND(RC[-3]*RC[16]/36500,2) -> 0 | E324: =RC[-1]*RC[-2] -> 0 | F324: =RC[-1]-RC[-4] -> 0
C325: =IF(DAYS360(RC[7],R1C3)+2>365,365,DAYS360(RC[7],R1C3)+2) -> 365 | D325: =ROUND(RC[-3]*RC[16]/36500,2) -> 0 | E325: =RC[-1]*RC[-2] -> 0 | F325: =RC[-1]-RC[-4] -> 0
C326: =IF(DAYS360(RC[7],R1C3)+2>365,365,DAYS360(RC[7],R1C3)+2) -> 365 | D326: =ROUND(RC[-3]*RC[16]/36500,2) -> 0 | E326: =RC[-1]*RC[-2] -> 0 | F326: =RC[-1]-RC[-4] -> 0
C327: =IF(DAYS360(RC[7],R1C3)+2>365,365,DAYS360(RC[7],R1C3)+2) -> 365 | D327: =ROUND(RC[-3]*RC[16]/36500,2) -> 0 | E327: =RC[-1]*RC[-2] -> 0 | F327: =RC[-1]-RC[-4] -> 0
C328: =IF(DAYS360(RC[7],R1C3)+2>365,365,DAYS360(RC[7],R1C3)+2) -> 365 | D328: =ROUND(RC[-3]*RC[16]/36500,2) -> 0 | E328: =RC[-1]*RC[-2] -> 0 | F328: =RC[-1]-RC[-4] -> 0
C329: =IF(DAYS360(RC[7],R1C3)+2>365,365,DAYS360(RC[7],R1C3)+2) -> 365 | D329: =ROUND(RC[-3]*RC[16]/36500,2) -> 0 | E329: =RC[-1]*RC[-2] -> 0 | F329: =RC[-1]-RC[-4] -> 0
C330: =IF(DAYS360(RC[7],R1C3)+2>365,365,DAYS360(RC[7],R1C3)+2) -> 365 | D330: =ROUND(RC[-3]*RC[16]/36500,2) -> 0 | E330: =RC[-1]*RC[-2] -> 0 | F330: =RC[-1]-RC[-4] -> 0
C331: =IF(DAYS360(RC[7],R1C3)+2>365,365,DAYS360(RC[7],R1C3)+2) -> 365 | D331: =ROUND(RC[-3]*RC[16]/36500,2) -> 0 | E331: =RC[-1]*RC[-2] -> 0 | F331: =RC[-1]-RC[-4] -> 0
C332: =IF(DAYS360(RC[7],R1C3)+2>365,365,DAYS360(RC[7],R1C3)+2) -> 365 | D332: =ROUND(RC[-3]*RC[16]/36500,2) -> 0 | E332: =RC[-1]*RC[-2] -> 0 | F332: =RC[-1]-RC[-4] -> 0
C333: =IF(DAYS360(RC[7],R1C3)+2>365,365,DAYS360(RC[7],R1C3)+2) -> 365 | D333: =ROUND(RC[-3]*RC[16]/36500,2) -> 0 | E333: =RC[-1]*RC[-2] -> 0 | F333: =RC[-1]-RC[-4] -> 0
C334: =IF(DAYS360(RC[7],R1C3)+2>365,365,DAYS360(RC[7],R1C3)+2) -> 365 | D334: =ROUND(RC[-3]*RC[16]/36500,2) -> 0 | E334: =RC[-1]*RC[-2] -> 0 | F334: =RC[-1]-RC[-4] -> 0
C335: =IF(DAYS360(RC[7],R1C3)+2>365,365,DAYS360(RC[7],R1C3)+2) -> 365 | D335: =ROUND(RC[-3]*RC[16]/36500,2) -> 0 | E335: =RC[-1]*RC[-2] -> 0 | F335: =RC[-1]-RC[-4] -> 0
C336: =IF(DAYS360(RC[7],R1C3)+2>365,365,DAYS360(RC[7],R1C3)+2) -> 365 | D336: =ROUND(RC[-3]*RC[16]/36500,2) -> 0 | E336: =RC[-1]*RC[-2] -> 0 | F336: =RC[-1]-RC[-4] -> 0
C337: =IF(DAYS360(RC[7],R1C3)+2>365,365,DAYS360(RC[7],R1C3)+2) -> 365 | D337: =ROUND(RC[-3]*RC[16]/36500,2) -> 0 | E337: =RC[-1]*RC[-2] -> 0 | F337: =RC[-1]-RC[-4] -> 0
C338: =IF(DAYS360(RC[7],R1C3)+2>365,365,DAYS360(RC[7],R1C3)+2) -> 365 | D338: =ROUND(RC[-3]*RC[16]/36500,2) -> 0 | E338: =RC[-1]*RC[-2] -> 0 | F338: =RC[-1]-RC[-4] -> 0
C339: =IF(DAYS360(RC[7],R1C3)+2>365,365,DAYS360(RC[7],R1C3)+2) -> 365 | D339: =ROUND(RC[-3]*RC[16]/36500,2) -> 0 | E339: =RC[-1]*RC[-2] -> 0 | F339: =RC[-1]-RC[-4] -> 0
C340: =IF(DAYS360(RC[7],R1C3)+2>365,365,DAYS360(RC[7],R1C3)+2) -> 365 | D340: =ROUND(RC[-3]*RC[16]/36500,2) -> 0 | E340: =RC[-1]*RC[-2] -> 0 | F340: =RC[-1]-RC[-4] -> 0
C341: =IF(DAYS360(RC[7],R1C3)+2>365,365,DAYS360(RC[7],R1C3)+2) -> 365 | D341: =ROUND(RC[-3]*RC[16]/36500,2) -> 0 | E341: =RC[-1]*RC[-2] -> 0 | F341: =RC[-1]-RC[-4] -> 0
C342: =IF(DAYS360(RC[7],R1C3)+2>365,365,DAYS360(RC[7],R1C3)+2) -> 365 | D342: =ROUND(RC[-3]*RC[16]/36500,2) -> 0 | E342: =RC[-1]*RC[-2] -> 0 | F342: =RC[-1]-RC[-4] -> 0
C343: =IF(DAYS360(RC[7],R1C3)+2>365,365,DAYS360(RC[7],R1C3)+2) -> 365 | D343: =ROUND(RC[-3]*RC[16]/36500,2) -> 0 | E343: =RC[-1]*RC[-2] -> 0 | F343: =RC[-1]-RC[-4] -> 0
C344: =IF(DAYS360(RC[7],R1C3)+2>365,365,DAYS360(RC[7],R1C3)+2) -> 365 | D344: =ROUND(RC[-3]*RC[16]/36500,2) -> 0 | E344: =RC[-1]*RC[-2] -> 0 | F344: =RC[-1]-RC[-4] -> 0
C345: =IF(DAYS360(RC[7],R1C3)+2>365,365,DAYS360(RC[7],R1C3)+2) -> 365 | D345: =ROUND(RC[-3]*RC[16]/36500,2) -> 0 | E345: =RC[-1]*RC[-2] -> 0 | F345: =RC[-1]-RC[-4] -> 0
C346: =IF(DAYS360(RC[7],R1C3)+2>365,365,DAYS360(RC[7],R1C3)+2) -> 365 | D346: =ROUND(RC[-3]*RC[16]/36500,2) -> 0 | E346: =RC[-1]*RC[-2] -> 0 | F346: =RC[-1]-RC[-4] -> 0
C347: =IF(DAYS360(RC[7],R1C3)+2>365,365,DAYS360(RC[7],R1C3)+2) -> 365 | D347: =ROUND(RC[-3]*RC[16]/36500,2) -> 0 | E347: =RC[-1]*RC[-2] -> 0 | F347: =RC[-1]-RC[-4] -> 0
C348: =IF(DAYS360(RC[7],R1C3)+2>365,365,DAYS360(RC[7],R1C3)+2) -> 365 | D348: =ROUND(RC[-3]*RC[16]/36500,2) -> 0 | E348: =RC[-1]*RC[-2] -> 0 | F348: =RC[-1]-RC[-4] -> 0
C349: =IF(DAYS360(RC[7],R1C3)+2>365,365,DAYS360(RC[7],R1C3)+2) -> 365 | D349: =ROUND(RC[-3]*RC[16]/36500,2) -> 0 | E349: =RC[-1]*RC[-2] -> 0 | F349: =RC[-1]-RC[-4] -> 0
C350: =IF(DAYS360(RC[7],R1C3)+2>365,365,DAYS360(RC[7],R1C3)+2) -> 365 | D350: =ROUND(RC[-3]*RC[16]/36500,2) -> 0 | E350: =RC[-1]*RC[-2] -> 0 | F350: =RC[-1]-RC[-4] -> 0
C351: =IF(DAYS360(RC[7],R1C3)+2>365,365,DAYS360(RC[7],R1C3)+2) -> 365 | D351: =ROUND(RC[-3]*RC[16]/36500,2) -> 0 | E351: =RC[-1]*RC[-2] -> 0 | F351: =RC[-1]-RC[-4] -> 0
C352: =IF(DAYS360(RC[7],R1C3)+2>365,365,DAYS360(RC[7],R1C3)+2) -> 365 | D352: =ROUND(RC[-3]*RC[16]/36500,2) -> 0 | E352: =RC[-1]*RC[-2] -> 0 | F352: =RC[-1]-RC[-4] -> 0
C353: =IF(DAYS360(RC[7],R1C3)+2>365,365,DAYS360(RC[7],R1C3)+2) -> 365 | D353: =ROUND(RC[-3]*RC[16]/36500,2) -> 0 | E353: =RC[-1]*RC[-2] -> 0 | F353: =RC[-1]-RC[-4] -> 0
C354: =IF(DAYS360(RC[7],R1C3)+2>365,365,DAYS360(RC[7],R1C3)+2) -> 365 | D354: =ROUND(RC[-3]*RC[16]/36500,2) -> 0 | E354: =RC[-1]*RC[-2] -> 0 | F354: =RC[-1]-RC[-4] -> 0
C355: =IF(DAYS360(RC[7],R1C3)+2>365,365,DAYS360(RC[7],R1C3)+2) -> 365 | D355: =ROUND(RC[-3]*RC[16]/36500,2) -> 0 | E355: =RC[-1]*RC[-2] -> 0 | F355: =RC[-1]-RC[-4] -> 0
C356: =IF(DAYS360(RC[7],R1C3)+2>365,365,DAYS360(RC[7],R1C3)+2) -> 365 | D356: =ROUND(RC[-3]*RC[16]/36500,2) -> 0 | E356: =RC[-1]*RC[-2] -> 0 | F356: =RC[-1]-RC[-4] -> 0
C357: =IF(DAYS360(RC[7],R1C3)+2>365,365,DAYS360(RC[7],R1C3)+2) -> 365 | D357: =ROUND(RC[-3]*RC[16]/36500,2) -> 0 | E357: =RC[-1]*RC[-2] -> 0 | F357: =RC[-1]-RC[-4] -> 0