Sheet: Table1
C1: 2012-02-22T00:00:00.000
A2: CAP_duefrom | B2: INT_duefrom | H2: TICKETID | I2: BRANCHID | J2: TKTNO | K2: CONDATE | L2: EXPRDATE | M2: PERIOD | N2: TOTINT | O2: TOTCAP | P2: STSID | Q2: MINDAYS | R2: SLABNO | S2: NODAYSFROM | T2: NODAYSTO | U2: RATE
A3: 60000 | B3: 9000.61 | C3: =IF(DAYS360(RC[8],R1C3)+2>365,365,DAYS360(RC[8],R1C3)+2) -> 365 | D3: =ROUND(RC[-3]*RC[17]/36500,2) -> 24.66 | E3: =RC[-1]*RC[-2] -> 9000.9 | F3: =RC[-1]-RC[-4] -> 0.28999999999905413 | H3: 132 | I3: 4 | J3: AP2PW10000014 | K3: 2010-12-24 12:28:48 | L3: 2011-12-24 12:28:48 | M3: 12 | N3: 8876.7099999999991 | O3: 60000 | P3: 4 | Q3: 30 | R3: 1 | S3: 1 | T3: 365 | U3: 15
A4: 35000 | B4: 5249.05 | C4: =IF(DAYS360(RC[8],R1C3)+2>365,365,DAYS360(RC[8],R1C3)+2) -> 365 | D4: =ROUND(RC[-3]*RC[17]/36500,2) -> 14.38 | E4: =RC[-1]*RC[-2] -> 5248.7000000000007 | F4: =RC[-1]-RC[-4] -> -0.3499999999994543 | H4: 217 | I4: 4 | J4: AP2PW11000060 | K4: 2011-01-12 12:28:48 | L4: 2012-01-12 12:28:48 | M4: 12 | N4: 5178.08 | O4: 35000 | P4: 4 | Q4: 30 | R4: 1 | S4: 1 | T4: 365 | U4: 15
A5: 24000 | B5: 3599.2 | C5: =IF(DAYS360(RC[8],R1C3)+2>365,365,DAYS360(RC[8],R1C3)+2) -> 365 | D5: =ROUND(RC[-3]*RC[17]/36500,2) -> 9.86 | E5: =RC[-1]*RC[-2] -> 3598.8999999999996 | F5: =RC[-1]-RC[-4] -> -0.3000000000001819 | H5: 219 | I5: 4 | J5: AP2PW11000062 | K5: 2011-01-13 12:28:48 | L5: 2012-01-13 12:28:48 | M5: 12 | N5: 3550.68 | O5: 24000 | P5: 4 | Q5: 30 | R5: 1 | S5: 1 | T5: 365 | U5: 15
A6: 20000 | B6: 3000.23 | C6: =IF(DAYS360(RC[8],R1C3)+2>365,365,DAYS360(RC[8],R1C3)+2) -> 365 | D6: =ROUND(RC[-3]*RC[17]/36500,2) -> 8.2200000000000006 | E6: =RC[-1]*RC[-2] -> 3000.3 | F6: =RC[-1]-RC[-4] -> 7.0000000000163709E-2 | H6: 229 | I6: 4 | J6: AP2PW11000071 | K6: 2011-01-21 12:28:48 | L6: 2012-01-21 12:28:48 | M6: 12 | N6: 2958.9 | O6: 20000 | P6: 4 | Q6: 30 | R6: 1 | S6: 1 | T6: 365 | U6: 15
A7: 46000 | B7: 6747.5 | C7: =IF(DAYS360(RC[8],R1C3)+2>365,365,DAYS360(RC[8],R1C3)+2) -> 351 | D7: =ROUND(RC[-3]*RC[17]/36500,2) -> 18.899999999999999 | E7: =RC[-1]*RC[-2] -> 6633.9 | F7: =RC[-1]-RC[-4] -> -113.60000000000036 | H7: 294 | I7: 4 | J7: AP2PW11000081 | K7: 2011-03-03 12:28:48 | L7: 2012-03-03 12:28:48 | M7: 12 | N7: 6805.48 | O7: 46000 | P7: 1 | Q7: 30 | R7: 1 | S7: 1 | T7: 365 | U7: 15
A8: 10000 | B8: 1462.45 | C8: =IF(DAYS360(RC[8],R1C3)+2>365,365,DAYS360(RC[8],R1C3)+2) -> 351 | D8: =ROUND(RC[-3]*RC[17]/36500,2) -> 4.1100000000000003 | E8: =RC[-1]*RC[-2] -> 1442.6100000000001 | F8: =RC[-1]-RC[-4] -> -19.839999999999918 | H8: 295 | I8: 4 | J8: AP2PW11000082 | K8: 2011-03-03 12:28:48 | L8: 2012-03-03 12:28:48 | M8: 12 | N8: 1479.45 | O8: 10000 | P8: 1 | Q8: 61 | R8: 1 | S8: 1 | T8: 365 | U8: 15
A9: 92000 | B9: 12779.72 | C9: =IF(DAYS360(RC[8],R1C3)+2>365,365,DAYS360(RC[8],R1C3)+2) -> 332 | D9: =ROUND(RC[-3]*RC[17]/36500,2) -> 37.81 | E9: =RC[-1]*RC[-2] -> 12552.92 | F9: =RC[-1]-RC[-4] -> -226.79999999999927 | H9: 339 | I9: 4 | J9: AP2PW11000089 | K9: 2011-03-22 12:28:48 | L9: 2012-03-22 12:28:48 | M9: 12 | N9: 13610.96 | O9: 92000 | P9: 1 | Q9: 30 | R9: 1 | S9: 1 | T9: 365 | U9: 15
A10: 70000 | B10: 9551.52 | C10: =IF(DAYS360(RC[8],R1C3)+2>365,365,DAYS360(RC[8],R1C3)+2) -> 326 | D10: =ROUND(RC[-3]*RC[17]/36500,2) -> 28.77 | E10: =RC[-1]*RC[-2] -> 9379.02 | F10: =RC[-1]-RC[-4] -> -172.5 | H10: 353 | I10: 4 | J10: AP2PW11000094 | K10: 2011-03-28 12:28:48 | L10: 2012-03-28 12:28:48 | M10: 12 | N10: 10356.16 | O10: 70000 | P10: 1 | Q10: 30 | R10: 1 | S10: 1 | T10: 365 | U10: 15
A11: 8000 | B11: 1088.95 | C11: =IF(DAYS360(RC[8],R1C3)+2>365,365,DAYS360(RC[8],R1C3)+2) -> 326 | D11: =ROUND(RC[-3]*RC[17]/36500,2) -> 3.29 | E11: =RC[-1]*RC[-2] -> 1072.54 | F11: =RC[-1]-RC[-4] -> -16.410000000000082 | H11: 355 | I11: 4 | J11: AP2PW11000096 | K11: 2011-03-28 12:28:48 | L11: 2012-03-28 12:28:48 | M11: 12 | N11: 1183.56 | O11: 8000 | P11: 1 | Q11: 76 | R11: 1 | S11: 1 | T11: 365 | U11: 15
A12: 10000 | B12: 1347.37 | C12: =IF(DAYS360(RC[8],R1C3)+2>365,365,DAYS360(RC[8],R1C3)+2) -> 324 | D12: =ROUND(RC[-3]*RC[17]/36500,2) -> 4.1100000000000003 | E12: =RC[-1]*RC[-2] -> 1331.64 | F12: =RC[-1]-RC[-4] -> -15.729999999999791 | H12: 371 | I12: 4 | J12: AP2PW11000099 | K12: 2011-03-31 12:28:48 | L12: 2012-03-31 12:28:48 | M12: 12 | N12: 1479.45 | O12: 10000 | P12: 1 | Q12: 61 | R12: 1 | S12: 1 | T12: 365 | U12: 15
A13: 40000 | B13: 5392.27 | C13: =IF(DAYS360(RC[8],R1C3)+2>365,365,DAYS360(RC[8],R1C3)+2) -> 323 | D13: =ROUND(RC[-3]*RC[17]/36500,2) -> 16.440000000000001 | E13: =RC[-1]*RC[-2] -> 5310.1200000000008 | F13: =RC[-1]-RC[-4] -> -82.149999999999636 | H13: 378 | I13: 4 | J13: AP2PW11000101 | K13: 2011-04-01 00:00:00 | L13: 2012-04-01 00:00:00 | M13: 12 | N13: 5917.81 | O13: 40000 | P13: 1 | Q13: 30 | R13: 1 | S13: 1 | T13: 365 | U13: 15
A14: 61000 | B14: 8072.49 | C14: =IF(DAYS360(RC[8],R1C3)+2>365,365,DAYS360(RC[8],R1C3)+2) -> 317 | D14: =ROUND(RC[-3]*RC[17]/36500,2) -> 25.07 | E14: =RC[-1]*RC[-2] -> 7947.1900000000005 | F14: =RC[-1]-RC[-4] -> -125.29999999999927 | H14: 385 | I14: 4 | J14: AP2PW11000106 | K14: 2011-04-07 00:00:00 | L14: 2012-04-07 00:00:00 | M14: 12 | N14: 9024.66 | O14: 61000 | P14: 1 | Q14: 30 | R14: 1 | S14: 1 | T14: 365 | U14: 15
A15: 94000 | B15: 12400.23 | C15: =IF(DAYS360(RC[8],R1C3)+2>365,365,DAYS360(RC[8],R1C3)+2) -> 316 | D15: =ROUND(RC[-3]*RC[17]/36500,2) -> 38.630000000000003 | E15: =RC[-1]*RC[-2] -> 12207.08 | F15: =RC[-1]-RC[-4] -> -193.14999999999964 | H15: 391 | I15: 4 | J15: AP2PW11000108 | K15: 2011-04-08 00:00:00 | L15: 2012-04-08 00:00:00 | M15: 12 | N15: 13906.85 | O15: 94000 | P15: 1 | Q15: 30 | R15: 1 | S15: 1 | T15: 365 | U15: 15
A16: 5000 | B16: 639.5 | C16: =IF(DAYS360(RC[8],R1C3)+2>365,365,DAYS360(RC[8],R1C3)+2) -> 306 | D16: =ROUND(RC[-3]*RC[17]/36500,2) -> 2.0499999999999998 | E16: =RC[-1]*RC[-2] -> 627.29999999999995 | F16: =RC[-1]-RC[-4] -> -12.200000000000045 | H16: 410 | I16: 4 | J16: AP2PW11000117 | K16: 2011-04-18 00:00:00 | L16: 2012-04-18 00:00:00 | M16: 12 | N16: 739.73 | O16: 5000 | P16: 1 | Q16: 121 | R16: 1 | S16: 1 | T16: 365 | U16: 15
A17: 47000 | B17: 5969.73 | C17: =IF(DAYS360(RC[8],R1C3)+2>365,365,DAYS360(RC[8],R1C3)+2) -> 304 | D17: =ROUND(RC[-3]*RC[17]/36500,2) -> 19.32 | E17: =RC[-1]*RC[-2] -> 5873.28 | F17: =RC[-1]-RC[-4] -> -96.449999999999818 | H17: 419 | I17: 4 | J17: AP2PW11000118 | K17: 2011-04-20 00:00:00 | L17: 2012-04-20 00:00:00 | M17: 12 | N17: 6953.42 | O17: 47000 | P17: 1 | Q17: 30 | R17: 1 | S17: 1 | T17: 365 | U17: 15
A18: 86000 | B18: 10743.43 | C18: =IF(DAYS360(RC[8],R1C3)+2>365,365,DAYS360(RC[8],R1C3)+2) -> 299 | D18: =ROUND(RC[-3]*RC[17]/36500,2) -> 35.340000000000003 | E18: =RC[-1]*RC[-2] -> 10566.660000000002 | F18: =RC[-1]-RC[-4] -> -176.76999999999862 | H18: 431 | I18: 4 | J18: AP2PW11000120 | K18: 2011-04-25 00:00:00 | L18: 2012-04-25 00:00:00 | M18: 12 | N18: 12723.29 | O18: 86000 | P18: 1 | Q18: 30 | R18: 1 | S18: 1 | T18: 365 | U18: 15
A19: 7800 | B19: 978.67 | C19: =IF(DAYS360(RC[8],R1C3)+2>365,365,DAYS360(RC[8],R1C3)+2) -> 299 | D19: =ROUND(RC[-3]*RC[17]/36500,2) -> 3.21 | E19: =RC[-1]*RC[-2] -> 959.79 | F19: =RC[-1]-RC[-4] -> -18.879999999999995 | H19: 432 | I19: 4 | J19: AP2PW11000121 | K19: 2011-04-25 00:00:00 | L19: 2012-04-25 00:00:00 | M19: 12 | N19: 1153.97 | O19: 7800 | P19: 1 | Q19: 77 | R19: 1 | S19: 1 | T19: 365 | U19: 15
A20: 126000 | B20: 14923.49 | C20: =IF(DAYS360(RC[8],R1C3)+2>365,365,DAYS360(RC[8],R1C3)+2) -> 258 | D20: =ROUND(RC[-3]*RC[17]/36500,2) -> 56.96 | E20: =RC[-1]*RC[-2] -> 14695.68 | F20: =RC[-1]-RC[-4] -> -227.80999999999949 | H20: 497 | I20: 4 | J20: AP2PW11000144 | K20: 2011-06-06 00:00:00 | L20: 2012-06-06 00:00:00 | M20: 12 | N20: 20505.21 | O20: 126000 | P20: 1 | Q20: 30 | R20: 1 | S20: 1 | T20: 365 | U20: 16.5
A21: 7000 | B21: 815.64 | C21: =IF(DAYS360(RC[8],R1C3)+2>365,365,DAYS360(RC[8],R1C3)+2) -> 254 | D21: =ROUND(RC[-3]*RC[17]/36500,2) -> 3.16 | E21: =RC[-1]*RC[-2] -> 802.64 | F21: =RC[-1]-RC[-4] -> -13 | H21: 503 | I21: 4 | J21: AP2PW11000147 | K21: 2011-06-10 00:00:00 | L21: 2012-06-10 00:00:00 | M21: 12 | N21: 1139.18 | O21: 7000 | P21: 1 | Q21: 79 | R21: 1 | S21: 1 | T21: 365 | U21: 16.5
A22: 24500 | B22: 3068.39 | C22: =IF(DAYS360(RC[8],R1C3)+2>365,365,DAYS360(RC[8],R1C3)+2) -> 250 | D22: =ROUND(RC[-3]*RC[17]/36500,2) -> 12.08 | E22: =RC[-1]*RC[-2] -> 3020 | F22: =RC[-1]-RC[-4] -> -48.389999999999873 | H22: 506 | I22: 4 | J22: AP2PW11000150 | K22: 2011-06-14 00:00:00 | L22: 2012-06-14 00:00:00 | M22: 12 | N22: 4349.59 | O22: 24500 | P22: 1 | Q22: 30 | R22: 1 | S22: 1 | T22: 365 | U22: 18
A23: 16500 | B23: 2048.94 | C23: =IF(DAYS360(RC[8],R1C3)+2>365,365,DAYS360(RC[8],R1C3)+2) -> 247 | D23: =ROUND(RC[-3]*RC[17]/36500,2) -> 8.14 | E23: =RC[-1]*RC[-2] -> 2010.5800000000002 | F23: =RC[-1]-RC[-4] -> -38.3599999999999 | H23: 512 | I23: 4 | J23: AP2PW11000154 | K23: 2011-06-17 00:00:00 | L23: 2012-06-17 00:00:00 | M23: 12 | N23: 2929.32 | O23: 16500 | P23: 1 | Q23: 30 | R23: 1 | S23: 1 | T23: 365 | U23: 18
A24: 12500 | B24: 1531.28 | C24: =IF(DAYS360(RC[8],R1C3)+2>365,365,DAYS360(RC[8],R1C3)+2) -> 244 | D24: =ROUND(RC[-3]*RC[17]/36500,2) -> 6.16 | E24: =RC[-1]*RC[-2] -> 1503.04 | F24: =RC[-1]-RC[-4] -> -28.240000000000009 | H24: 524 | I24: 4 | J24: AP2PW11000157 | K24: 2011-06-20 00:00:00 | L24: 2012-06-20 00:00:00 | M24: 12 | N24: 2219.1799999999998 | O24: 12500 | P24: 1 | Q24: 40 | R24: 1 | S24: 1 | T24: 365 | U24: 18
A25: 26000 | B25: 3128.14 | C25: =IF(DAYS360(RC[8],R1C3)+2>365,365,DAYS360(RC[8],R1C3)+2) -> 240 | D25: =ROUND(RC[-3]*RC[17]/36500,2) -> 12.82 | E25: =RC[-1]*RC[-2] -> 3076.8 | F25: =RC[-1]-RC[-4] -> -51.339999999999691 | H25: 533 | I25: 4 | J25: AP2PW11000158 | K25: 2011-06-24 00:00:00 | L25: 2012-06-24 00:00:00 | M25: 12 | N25: 4615.8900000000003 | O25: 26000 | P25: 1 | Q25: 30 | R25: 1 | S25: 1 | T25: 365 | U25: 18
A26: 20000 | B26: 2346.77 | C26: =IF(DAYS360(RC[8],R1C3)+2>365,365,DAYS360(RC[8],R1C3)+2) -> 234 | D26: =ROUND(RC[-3]*RC[17]/36500,2) -> 9.86 | E26: =RC[-1]*RC[-2] -> 2307.2399999999998 | F26: =RC[-1]-RC[-4] -> -39.5300000000002 | H26: 540 | I26: 4 | J26: AP2PW11000159 | K26: 2011-06-30 00:00:00 | L26: 2012-06-30 00:00:00 | M26: 12 | N26: 3550.68 | O26: 20000 | P26: 1 | Q26: 30 | R26: 1 | S26: 1 | T26: 365 | U26: 18
A27: 7000 | B27: 757.15 | C27: =IF(DAYS360(RC[8],R1C3)+2>365,365,DAYS360(RC[8],R1C3)+2) -> 215 | D27: =ROUND(RC[-3]*RC[17]/36500,2) -> 3.45 | E27: =RC[-1]*RC[-2] -> 741.75 | F27: =RC[-1]-RC[-4] -> -15.399999999999977 | H27: 555 | I27: 4 | J27: AP2PW11000163 | K27: 2011-07-19 00:00:00 | L27: 2012-07-19 00:00:00 | M27: 12 | N27: 1242.74 | O27: 7000 | P27: 1 | Q27: 72 | R27: 1 | S27: 1 | T27: 365 | U27: 18
A28: 49000 | B28: 5291.17 | C28: =IF(DAYS360(RC[8],R1C3)+2>365,365,DAYS360(RC[8],R1C3)+2) -> 215 | D28: =ROUND(RC[-3]*RC[17]/36500,2) -> 24.16 | E28: =RC[-1]*RC[-2] -> 5194.3999999999996 | F28: =RC[-1]-RC[-4] -> -96.770000000000437 | H28: 556 | I28: 4 | J28: AP2PW11000164 | K28: 2011-07-19 00:00:00 | L28: 2012-07-19 00:00:00 | M28: 12 | N28: 8699.18 | O28: 49000 | P28: 1 | Q28: 30 | R28: 1 | S28: 1 | T28: 365 | U28: 18
A29: 5500 | B29: 588.75 | C29: =IF(DAYS360(RC[8],R1C3)+2>365,365,DAYS360(RC[8],R1C3)+2) -> 213 | D29: =ROUND(RC[-3]*RC[17]/36500,2) -> 2.71 | E29: =RC[-1]*RC[-2] -> 577.23 | F29: =RC[-1]-RC[-4] -> -11.519999999999982 | H29: 557 | I29: 4 | J29: AP2PW11000165 | K29: 2011-07-21 00:00:00 | L29: 2012-07-21 00:00:00 | M29: 12 | N29: 976.44 | O29: 5500 | P29: 1 | Q29: 92 | R29: 1 | S29: 1 | T29: 365 | U29: 18
A30: 33500 | B30: 3568.34 | C30: =IF(DAYS360(RC[8],R1C3)+2>365,365,DAYS360(RC[8],R1C3)+2) -> 212 | D30: =ROUND(RC[-3]*RC[17]/36500,2) -> 16.52 | E30: =RC[-1]*RC[-2] -> 3502.24 | F30: =RC[-1]-RC[-4] -> -66.100000000000364 | H30: 566 | I30: 4 | J30: AP2PW11000173 | K30: 2011-07-22 00:00:00 | L30: 2012-07-22 00:00:00 | M30: 12 | N30: 5947.4 | O30: 33500 | P30: 1 | Q30: 30 | R30: 1 | S30: 1 | T30: 365 | U30: 18
A31: 40000 | B31: 4143.18 | C31: =IF(DAYS360(RC[8],R1C3)+2>365,365,DAYS360(RC[8],R1C3)+2) -> 206 | D31: =ROUND(RC[-3]*RC[17]/36500,2) -> 19.73 | E31: =RC[-1]*RC[-2] -> 4064.38 | F31: =RC[-1]-RC[-4] -> -78.800000000000182 | H31: 575 | I31: 4 | J31: AP2PW11000177 | K31: 2011-07-28 00:00:00 | L31: 2012-07-28 00:00:00 | M31: 12 | N31: 7101.37 | O31: 40000 | P31: 1 | Q31: 30 | R31: 1 | S31: 1 | T31: 365 | U31: 18
A32: 47000 | B32: 4728.66 | C32: =IF(DAYS360(RC[8],R1C3)+2>365,365,DAYS360(RC[8],R1C3)+2) -> 201 | D32: =ROUND(RC[-3]*RC[17]/36500,2) -> 23.18 | E32: =RC[-1]*RC[-2] -> 4659.18 | F32: =RC[-1]-RC[-4] -> -69.479999999999563 | H32: 586 | I32: 4 | J32: AP2PW11000180 | K32: 2011-08-03 00:00:00 | L32: 2012-08-03 00:00:00 | M32: 12 | N32: 8344.11 | O32: 47000 | P32: 1 | Q32: 30 | R32: 1 | S32: 1 | T32: 365 | U32: 18
A33: 36000 | B33: 3479.1 | C33: =IF(DAYS360(RC[8],R1C3)+2>365,365,DAYS360(RC[8],R1C3)+2) -> 193 | D33: =ROUND(RC[-3]*RC[17]/36500,2) -> 17.75 | E33: =RC[-1]*RC[-2] -> 3425.75 | F33: =RC[-1]-RC[-4] -> -53.349999999999909 | H33: 621 | I33: 4 | J33: AP2PW11000190 | K33: 2011-08-11 00:00:00 | L33: 2012-08-11 00:00:00 | M33: 12 | N33: 6391.23 | O33: 36000 | P33: 1 | Q33: 30 | R33: 1 | S33: 1 | T33: 365 | U33: 18
A34: 202000 | B34: 18927.689999999999 | C34: =IF(DAYS360(RC[8],R1C3)+2>365,365,DAYS360(RC[8],R1C3)+2) -> 187 | D34: =ROUND(RC[-3]*RC[17]/36500,2) -> 99.62 | E34: =RC[-1]*RC[-2] -> 18628.940000000002 | F34: =RC[-1]-RC[-4] -> -298.74999999999636 | H34: 657 | I34: 4 | J34: AP2PW11000196 | K34: 2011-08-17 00:00:00 | L34: 2012-08-17 00:00:00 | M34: 12 | N34: 35861.919999999998 | O34: 202000 | P34: 1 | Q34: 30 | R34: 1 | S34: 1 | T34: 365 | U34: 18
A35: 26500 | B35: 2483.25 | C35: =IF(DAYS360(RC[8],R1C3)+2>365,365,DAYS360(RC[8],R1C3)+2) -> 187 | D35: =ROUND(RC[-3]*RC[17]/36500,2) -> 13.07 | E35: =RC[-1]*RC[-2] -> 2444.09 | F35: =RC[-1]-RC[-4] -> -39.159999999999854 | H35: 658 | I35: 4 | J35: AP2PW11000197 | K35: 2011-08-17 00:00:00 | L35: 2012-08-17 00:00:00 | M35: 12 | N35: 4704.66 | O35: 26500 | P35: 1 | Q35: 30 | R35: 1 | S35: 1 | T35: 365 | U35: 18
A36: 35000 | B36: 3262.15 | C36: =IF(DAYS360(RC[8],R1C3)+2>365,365,DAYS360(RC[8],R1C3)+2) -> 186 | D36: =ROUND(RC[-3]*RC[17]/36500,2) -> 17.260000000000002 | E36: =RC[-1]*RC[-2] -> 3210.36 | F36: =RC[-1]-RC[-4] -> -51.789999999999964 | H36: 669 | I36: 4 | J36: AP2PW11000198 | K36: 2011-08-18 00:00:00 | L36: 2012-08-18 00:00:00 | M36: 12 | N36: 6213.7 | O36: 35000 | P36: 1 | Q36: 30 | R36: 1 | S36: 1 | T36: 365 | U36: 18
A37: 215000 | B37: 19933.560000000001 | C37: =IF(DAYS360(RC[8],R1C3)+2>365,365,DAYS360(RC[8],R1C3)+2) -> 185 | D37: =ROUND(RC[-3]*RC[17]/36500,2) -> 106.03 | E37: =RC[-1]*RC[-2] -> 19615.55 | F37: =RC[-1]-RC[-4] -> -318.01000000000204 | H37: 672 | I37: 4 | J37: AP2PW11000199 | K37: 2011-08-19 00:00:00 | L37: 2012-08-19 00:00:00 | M37: 12 | N37: 38169.86 | O37: 215000 | P37: 1 | Q37: 30 | R37: 1 | S37: 1 | T37: 365 | U37: 18
A38: 82700 | B38: 7462.85 | C38: =IF(DAYS360(RC[8],R1C3)+2>365,365,DAYS360(RC[8],R1C3)+2) -> 180 | D38: =ROUND(RC[-3]*RC[17]/36500,2) -> 40.78 | E38: =RC[-1]*RC[-2] -> 7340.4000000000005 | F38: =RC[-1]-RC[-4] -> -122.44999999999982 | H38: 703 | I38: 4 | J38: AP2PW11000203 | K38: 2011-08-24 00:00:00 | L38: 2012-08-24 00:00:00 | M38: 12 | N38: 14682.08 | O38: 82700 | P38: 1 | Q38: 30 | R38: 1 | S38: 1 | T38: 365 | U38: 18
A39: 74000 | B39: 6677.76 | C39: =IF(DAYS360(RC[8],R1C3)+2>365,365,DAYS360(RC[8],R1C3)+2) -> 180 | D39: =ROUND(RC[-3]*RC[17]/36500,2) -> 36.49 | E39: =RC[-1]*RC[-2] -> 6568.2000000000007 | F39: =RC[-1]-RC[-4] -> -109.55999999999949 | H39: 704 | I39: 4 | J39: AP2PW11000204 | K39: 2011-08-24 00:00:00 | L39: 2012-08-24 00:00:00 | M39: 12 | N39: 13137.53 | O39: 74000 | P39: 1 | Q39: 30 | R39: 1 | S39: 1 | T39: 365 | U39: 18
A40: 13800 | B40: 1237.45 | C40: =IF(DAYS360(RC[8],R1C3)+2>365,365,DAYS360(RC[8],R1C3)+2) -> 178 | D40: =ROUND(RC[-3]*RC[17]/36500,2) -> 6.81 | E40: =RC[-1]*RC[-2] -> 1212.1799999999998 | F40: =RC[-1]-RC[-4] -> -25.270000000000209 | H40: 720 | I40: 4 | J40: AP2PW11000206 | K40: 2011-08-26 00:00:00 | L40: 2012-08-26 00:00:00 | M40: 12 | N40: 2449.9699999999998 | O40: 13800 | P40: 1 | Q40: 36 | R40: 1 | S40: 1 | T40: 365 | U40: 18
A41: 39700 | B41: 3348.12 | C41: =IF(DAYS360(RC[8],R1C3)+2>365,365,DAYS360(RC[8],R1C3)+2) -> 169 | D41: =ROUND(RC[-3]*RC[17]/36500,2) -> 19.579999999999998 | E41: =RC[-1]*RC[-2] -> 3309.0199999999995 | F41: =RC[-1]-RC[-4] -> -39.100000000000364 | H41: 744 | I41: 4 | J41: AP2PW11000212 | K41: 2011-09-05 00:00:00 | L41: 2012-09-05 00:00:00 | M41: 12 | N41: 7048.11 | O41: 39700 | P41: 1 | Q41: 30 | R41: 1 | S41: 1 | T41: 365 | U41: 18
A42: 9000 | B42: 760.6 | C42: =IF(DAYS360(RC[8],R1C3)+2>365,365,DAYS360(RC[8],R1C3)+2) -> 169 | D42: =ROUND(RC[-3]*RC[17]/36500,2) -> 4.4400000000000004 | E42: =RC[-1]*RC[-2] -> 750.36 | F42: =RC[-1]-RC[-4] -> -10.240000000000009 | H42: 745 | I42: 4 | J42: AP2PW11000213 | K42: 2011-09-05 00:00:00 | L42: 2012-09-05 00:00:00 | M42: 12 | N42: 1597.81 | O42: 9000 | P42: 1 | Q42: 56 | R42: 1 | S42: 1 | T42: 365 | U42: 18
A43: 100000 | B43: 8384.25 | C43: =IF(DAYS360(RC[8],R1C3)+2>365,365,DAYS360(RC[8],R1C3)+2) -> 168 | D43: =ROUND(RC[-3]*RC[17]/36500,2) -> 49.32 | E43: =RC[-1]*RC[-2] -> 8285.76 | F43: =RC[-1]-RC[-4] -> -98.489999999999782 | H43: 750 | I43: 4 | J43: AP2PW11000214 | K43: 2011-09-06 00:00:00 | L43: 2012-09-06 00:00:00 | M43: 12 | N43: 17753.419999999998 | O43: 100000 | P43: 1 | Q43: 30 | R43: 1 | S43: 1 | T43: 365 | U43: 18
A44: 40000 | B44: 3353.98 | C44: =IF(DAYS360(RC[8],R1C3)+2>365,365,DAYS360(RC[8],R1C3)+2) -> 168 | D44: =ROUND(RC[-3]*RC[17]/36500,2) -> 19.73 | E44: =RC[-1]*RC[-2] -> 3314.64 | F44: =RC[-1]-RC[-4] -> -39.340000000000146 | H44: 751 | I44: 4 | J44: AP2PW11000215 | K44: 2011-09-06 00:00:00 | L44: 2012-09-06 00:00:00 | M44: 12 | N44: 7101.37 | O44: 40000 | P44: 1 | Q44: 30 | R44: 1 | S44: 1 | T44: 365 | U44: 18
A45: 50000 | B45: 4019.51 | C45: =IF(DAYS360(RC[8],R1C3)+2>365,365,DAYS360(RC[8],R1C3)+2) -> 161 | D45: =ROUND(RC[-3]*RC[17]/36500,2) -> 24.66 | E45: =RC[-1]*RC[-2] -> 3970.26 | F45: =RC[-1]-RC[-4] -> -49.25 | H45: 781 | I45: 4 | J45: AP2PW11000219 | K45: 2011-09-13 00:00:00 | L45: 2012-09-13 00:00:00 | M45: 12 | N45: 8876.7099999999991 | O45: 50000 | P45: 1 | Q45: 30 | R45: 1 | S45: 1 | T45: 365 | U45: 18
A46: 27000 | B46: 2171.0100000000002 | C46: =IF(DAYS360(RC[8],R1C3)+2>365,365,DAYS360(RC[8],R1C3)+2) -> 161 | D46: =ROUND(RC[-3]*RC[17]/36500,2) -> 13.32 | E46: =RC[-1]*RC[-2] -> 2144.52 | F46: =RC[-1]-RC[-4] -> -26.490000000000236 | H46: 782 | I46: 4 | J46: AP2PW11000220 | K46: 2011-09-13 00:00:00 | L46: 2012-09-13 00:00:00 | M46: 12 | N46: 4793.42 | O46: 27000 | P46: 1 | Q46: 30 | R46: 1 | S46: 1 | T46: 365 | U46: 18
A47: 45300 | B47: 3641.41 | C47: =IF(DAYS360(RC[8],R1C3)+2>365,365,DAYS360(RC[8],R1C3)+2) -> 161 | D47: =ROUND(RC[-3]*RC[17]/36500,2) -> 22.34 | E47: =RC[-1]*RC[-2] -> 3596.74 | F47: =RC[-1]-RC[-4] -> -44.670000000000073 | H47: 783 | I47: 4 | J47: AP2PW11000221 | K47: 2011-09-13 00:00:00 | L47: 2012-09-13 00:00:00 | M47: 12 | N47: 8042.3 | O47: 45300 | P47: 1 | Q47: 30 | R47: 1 | S47: 1 | T47: 365 | U47: 18
A48: 9000 | B48: 720.64 | C48: =IF(DAYS360(RC[8],R1C3)+2>365,365,DAYS360(RC[8],R1C3)+2) -> 160 | D48: =ROUND(RC[-3]*RC[17]/36500,2) -> 4.4400000000000004 | E48: =RC[-1]*RC[-2] -> 710.40000000000009 | F48: =RC[-1]-RC[-4] -> -10.239999999999895 | H48: 789 | I48: 4 | J48: AP2PW11000222 | K48: 2011-09-14 00:00:00 | L48: 2012-09-14 00:00:00 | M48: 12 | N48: 1597.81 | O48: 9000 | P48: 1 | Q48: 56 | R48: 1 | S48: 1 | T48: 365 | U48: 18
A49: 11500 | B49: 919.06 | C49: =IF(DAYS360(RC[8],R1C3)+2>365,365,DAYS360(RC[8],R1C3)+2) -> 160 | D49: =ROUND(RC[-3]*RC[17]/36500,2) -> 5.67 | E49: =RC[-1]*RC[-2] -> 907.2 | F49: =RC[-1]-RC[-4] -> -11.8599999999999 | H49: 790 | I49: 4 | J49: AP2PW11000223 | K49: 2011-09-14 00:00:00 | L49: 2012-09-14 00:00:00 | M49: 12 | N49: 2041.64 | O49: 11500 | P49: 1 | Q49: 44 | R49: 1 | S49: 1 | T49: 365 | U49: 18
A50: 9000 | B50: 680.68 | C50: =IF(DAYS360(RC[8],R1C3)+2>365,365,DAYS360(RC[8],R1C3)+2) -> 151 | D50: =ROUND(RC[-3]*RC[17]/36500,2) -> 4.4400000000000004 | E50: =RC[-1]*RC[-2] -> 670.44 | F50: =RC[-1]-RC[-4] -> -10.239999999999895 | H50: 818 | I50: 4 | J50: AP2PW11000227 | K50: 2011-09-23 00:00:00 | L50: 2012-09-23 00:00:00 | M50: 12 | N50: 1597.81 | O50: 9000 | P50: 1 | Q50: 56 | R50: 1 | S50: 1 | T50: 365 | U50: 18
A51: 15000 | B51: 1138 | C51: =IF(DAYS360(RC[8],R1C3)+2>365,365,DAYS360(RC[8],R1C3)+2) -> 151 | D51: =ROUND(RC[-3]*RC[17]/36500,2) -> 7.4 | E51: =RC[-1]*RC[-2] -> 1117.4000000000001 | F51: =RC[-1]-RC[-4] -> -20.599999999999909 | H51: 819 | I51: 4 | J51: AP2PW11000228 | K51: 2011-09-23 00:00:00 | L51: 2012-09-23 00:00:00 | M51: 12 | N51: 2663.01 | O51: 15000 | P51: 1 | Q51: 33 | R51: 1 | S51: 1 | T51: 365 | U51: 18
A52: 15000 | B52: 1115.8 | C52: =IF(DAYS360(RC[8],R1C3)+2>365,365,DAYS360(RC[8],R1C3)+2) -> 148 | D52: =ROUND(RC[-3]*RC[17]/36500,2) -> 7.4 | E52: =RC[-1]*RC[-2] -> 1095.2 | F52: =RC[-1]-RC[-4] -> -20.599999999999909 | H52: 826 | I52: 4 | J52: AP2PW11000230 | K52: 2011-09-26 00:00:00 | L52: 2012-09-26 00:00:00 | M52: 12 | N52: 2663.01 | O52: 15000 | P52: 1 | Q52: 33 | R52: 1 | S52: 1 | T52: 365 | U52: 18
A53: 205000 | B53: 14457.18 | C53: =IF(DAYS360(RC[8],R1C3)+2>365,365,DAYS360(RC[8],R1C3)+2) -> 141 | D53: =ROUND(RC[-3]*RC[17]/36500,2) -> 101.1 | E53: =RC[-1]*RC[-2] -> 14255.099999999999 | F53: =RC[-1]-RC[-4] -> -202.08000000000175 | H53: 837 | I53: 4 | J53: AP2PW11000233 | K53: 2011-10-03 00:00:00 | L53: 2012-10-03 00:00:00 | M53: 12 | N53: 36394.519999999997 | O53: 205000 | P53: 1 | Q53: 30 | R53: 1 | S53: 1 | T53: 365 | U53: 18
A54: 21000 | B54: 1642.95 | C54: =IF(DAYS360(RC[8],R1C3)+2>365,365,DAYS360(RC[8],R1C3)+2) -> 134 | D54: =ROUND(RC[-3]*RC[17]/36500,2) -> 12.08 | E54: =RC[-1]*RC[-2] -> 1618.72 | F54: =RC[-1]-RC[-4] -> -24.230000000000018 | H54: 850 | I54: 4 | J54: AP2PW11000237 | K54: 2011-10-10 00:00:00 | L54: 2012-10-10 00:00:00 | M54: 12 | N54: 4349.59 | O54: 21000 | P54: 1 | Q54: 30 | R54: 1 | S54: 1 | T54: 365 | U54: 21
A55: 100000 | B55: 7824.21 | C55: =IF(DAYS360(RC[8],R1C3)+2>365,365,DAYS360(RC[8],R1C3)+2) -> 134 | D55: =ROUND(RC[-3]*RC[17]/36500,2) -> 57.53 | E55: =RC[-1]*RC[-2] -> 7709.02 | F55: =RC[-1]-RC[-4] -> -115.1899999999996 | H55: 851 | I55: 4 | J55: AP2PW11000238 | K55: 2011-10-10 00:00:00 | L55: 2012-10-10 00:00:00 | M55: 12 | N55: 20712.330000000002 | O55: 100000 | P55: 1 | Q55: 30 | R55: 1 | S55: 1 | T55: 365 | U55: 21
A56: 70000 | B56: 4792.25 | C56: =IF(DAYS360(RC[8],R1C3)+2>365,365,DAYS360(RC[8],R1C3)+2) -> 117 | D56: =ROUND(RC[-3]*RC[17]/36500,2) -> 40.270000000000003 | E56: =RC[-1]*RC[-2] -> 4711.59 | F56: =RC[-1]-RC[-4] -> -80.659999999999854 | H56: 872 | I56: 4 | J56: AP2PW11000239 | K56: 2011-10-27 00:00:00 | L56: 2012-10-27 00:00:00 | M56: 12 | N56: 14498.63 | O56: 70000 | P56: 1 | Q56: 30 | R56: 1 | S56: 1 | T56: 365 | U56: 21
A57: 13500 | B57: 863.83 | C57: =IF(DAYS360(RC[8],R1C3)+2>365,365,DAYS360(RC[8],R1C3)+2) -> 110 | D57: =ROUND(RC[-3]*RC[17]/36500,2) -> 7.77 | E57: =RC[-1]*RC[-2] -> 854.69999999999993 | F57: =RC[-1]-RC[-4] -> -9.1300000000001091 | H57: 878 | I57: 4 | J57: AP2PW11000240 | K57: 2011-11-04 00:00:00 | L57: 2012-11-04 00:00:00 | M57: 12 | N57: 2796.16 | O57: 13500 | P57: 1 | Q57: 32 | R57: 1 | S57: 1 | T57: 365 | U57: 21
A58: 9000 | B58: 560.79999999999995 | C58: =IF(DAYS360(RC[8],R1C3)+2>365,365,DAYS360(RC[8],R1C3)+2) -> 107 | D58: =ROUND(RC[-3]*RC[17]/36500,2) -> 5.18 | E58: =RC[-1]*RC[-2] -> 554.26 | F58: =RC[-1]-RC[-4] -> -6.5399999999999636 | H58: 879 | I58: 4 | J58: AP2PW11000241 | K58: 2011-11-07 00:00:00 | L58: 2012-11-07 00:00:00 | M58: 12 | N58: 1864.11 | O58: 9000 | P58: 1 | Q58: 48 | R58: 1 | S58: 1 | T58: 365 | U58: 21
A59: 173500 | B59: 8898.2900000000009 | C59: =IF(DAYS360(RC[8],R1C3)+2>365,365,DAYS360(RC[8],R1C3)+2) -> 103 | D59: =ROUND(RC[-3]*RC[17]/36500,2) -> 85.56 | E59: =RC[-1]*RC[-2] -> 8812.68 | F59: =RC[-1]-RC[-4] -> -85.610000000000582 | H59: 891 | I59: 4 | J59: AP2PW11000244 | K59: 2011-11-11 00:00:00 | L59: 2012-11-11 00:00:00 | M59: 12 | N59: 30802.19 | O59: 173500 | P59: 1 | Q59: 30 | R59: 1 | S59: 1 | T59: 365 | U59: 18
A60: 40000 | B60: 2051.8000000000002 | C60: =IF(DAYS360(RC[8],R1C3)+2>365,365,DAYS360(RC[8],R1C3)+2) -> 103 | D60: =ROUND(RC[-3]*RC[17]/36500,2) -> 19.73 | E60: =RC[-1]*RC[-2] -> 2032.19 | F60: =RC[-1]-RC[-4] -> -19.610000000000127 | H60: 892 | I60: 4 | J60: AP2PW11000245 | K60: 2011-11-11 00:00:00 | L60: 2012-11-11 00:00:00 | M60: 12 | N60: 7101.37 | O60: 40000 | P60: 1 | Q60: 30 | R60: 1 | S60: 1 | T60: 365 | U60: 18
A61: 61000 | B61: 3128.39 | C61: =IF(DAYS360(RC[8],R1C3)+2>365,365,DAYS360(RC[8],R1C3)+2) -> 103 | D61: =ROUND(RC[-3]*RC[17]/36500,2) -> 30.08 | E61: =RC[-1]*RC[-2] -> 3098.24 | F61: =RC[-1]-RC[-4] -> -30.150000000000091 | H61: 895 | I61: 4 | J61: AP2PW11000246 | K61: 2011-11-11 00:00:00 | L61: 2012-11-11 00:00:00 | M61: 12 | N61: 10829.59 | O61: 61000 | P61: 1 | Q61: 30 | R61: 1 | S61: 1 | T61: 365 | U61: 18
A62: 78000 | B62: 3885.34 | C62: =IF(DAYS360(RC[8],R1C3)+2>365,365,DAYS360(RC[8],R1C3)+2) -> 100 | D62: =ROUND(RC[-3]*RC[17]/36500,2) -> 38.47 | E62: =RC[-1]*RC[-2] -> 3847 | F62: =RC[-1]-RC[-4] -> -38.340000000000146 | H62: 903 | I62: 4 | J62: AP2PW11000249 | K62: 2011-11-14 00:00:00 | L62: 2012-11-14 00:00:00 | M62: 12 | N62: 13847.67 | O62: 78000 | P62: 1 | Q62: 30 | R62: 1 | S62: 1 | T62: 365 | U62: 18
A63: 20000 | B63: 976.23 | C63: =IF(DAYS360(RC[8],R1C3)+2>365,365,DAYS360(RC[8],R1C3)+2) -> 98 | D63: =ROUND(RC[-3]*RC[17]/36500,2) -> 9.86 | E63: =RC[-1]*RC[-2] -> 966.28 | F63: =RC[-1]-RC[-4] -> -9.9500000000000455 | H63: 913 | I63: 4 | J63: AP2PW11000251 | K63: 2011-11-16 00:00:00 | L63: 2012-11-16 00:00:00 | M63: 12 | N63: 3550.68 | O63: 20000 | P63: 1 | Q63: 30 | R63: 1 | S63: 1 | T63: 365 | U63: 18
A64: 50000 | B64: 2071.37 | C64: =IF(DAYS360(RC[8],R1C3)+2>365,365,DAYS360(RC[8],R1C3)+2) -> 83 | D64: =ROUND(RC[-3]*RC[17]/36500,2) -> 24.66 | E64: =RC[-1]*RC[-2] -> 2046.78 | F64: =RC[-1]-RC[-4] -> -24.589999999999918 | H64: 949 | I64: 4 | J64: AP2PW11000254 | K64: 2011-12-01 00:00:00 | L64: 2012-12-01 00:00:00 | M64: 12 | N64: 8876.7099999999991 | O64: 50000 | P64: 1 | Q64: 30 | R64: 1 | S64: 1 | T64: 365 | U64: 18
A65: 33000 | B65: 1236.6400000000001 | C65: =IF(DAYS360(RC[8],R1C3)+2>365,365,DAYS360(RC[8],R1C3)+2) -> 75 | D65: =ROUND(RC[-3]*RC[17]/36500,2) -> 16.27 | E65: =RC[-1]*RC[-2] -> 1220.25 | F65: =RC[-1]-RC[-4] -> -16.3900000000001 | H65: 970 | I65: 4 | J65: AP2PW11000255 | K65: 2011-12-09 00:00:00 | L65: 2012-12-09 00:00:00 | M65: 12 | N65: 5858.63 | O65: 33000 | P65: 1 | Q65: 30 | R65: 1 | S65: 1 | T65: 365 | U65: 18
A66: 160000 | B66: 5680.92 | C66: =IF(DAYS360(RC[8],R1C3)+2>365,365,DAYS360(RC[8],R1C3)+2) -> 71 | D66: =ROUND(RC[-3]*RC[17]/36500,2) -> 78.900000000000006 | E66: =RC[-1]*RC[-2] -> 5601.9000000000005 | F66: =RC[-1]-RC[-4] -> -79.019999999999527 | H66: 981 | I66: 4 | J66: AP2PW11000257 | K66: 2011-12-13 00:00:00 | L66: 2012-12-13 00:00:00 | M66: 12 | N66: 28405.48 | O66: 160000 | P66: 1 | Q66: 30 | R66: 1 | S66: 1 | T66: 365 | U66: 18
A67: 50000 | B67: 1750.79 | C67: =IF(DAYS360(RC[8],R1C3)+2>365,365,DAYS360(RC[8],R1C3)+2) -> 70 | D67: =ROUND(RC[-3]*RC[17]/36500,2) -> 24.66 | E67: =RC[-1]*RC[-2] -> 1726.2 | F67: =RC[-1]-RC[-4] -> -24.589999999999918 | H67: 982 | I67: 4 | J67: AP2PW11000258 | K67: 2011-12-14 00:00:00 | L67: 2012-12-14 00:00:00 | M67: 12 | N67: 8876.7099999999991 | O67: 50000 | P67: 1 | Q67: 30 | R67: 1 | S67: 1 | T67: 365 | U67: 18
A68: 10000 | B68: 343.67 | C68: =IF(DAYS360(RC[8],R1C3)+2>365,365,DAYS360(RC[8],R1C3)+2) -> 68 | D68: =ROUND(RC[-3]*RC[17]/36500,2) -> 4.93 | E68: =RC[-1]*RC[-2] -> 335.24 | F68: =RC[-1]-RC[-4] -> -8.4300000000000068 | H68: 996 | I68: 4 | J68: AP2PW11000262 | K68: 2011-12-16 00:00:00 | L68: 2012-12-16 00:00:00 | M68: 12 | N68: 1775.34 | O68: 10000 | P68: 1 | Q68: 50 | R68: 1 | S68: 1 | T68: 365 | U68: 18
A69: 5000 | B69: 250 | C69: =IF(DAYS360(RC[8],R1C3)+2>365,365,DAYS360(RC[8],R1C3)+2) -> 61 | D69: =ROUND(RC[-3]*RC[17]/36500,2) -> 2.4700000000000002 | E69: =RC[-1]*RC[-2] -> 150.67000000000002 | F69: =RC[-1]-RC[-4] -> -99.329999999999984 | H69: 1035 | I69: 4 | J69: AP2PW11000269 | K69: 2011-12-23 00:00:00 | L69: 2012-12-23 00:00:00 | M69: 12 | N69: 887.67 | O69: 5000 | P69: 1 | Q69: 101 | R69: 1 | S69: 1 | T69: 365 | U69: 18
A70: 130000 | B70: 3654.26 | C70: =IF(DAYS360(RC[8],R1C3)+2>365,365,DAYS360(RC[8],R1C3)+2) -> 56 | D70: =ROUND(RC[-3]*RC[17]/36500,2) -> 64.11 | E70: =RC[-1]*RC[-2] -> 3590.16 | F70: =RC[-1]-RC[-4] -> -64.100000000000364 | H70: 1049 | I70: 4 | J70: AP2PW11000275 | K70: 2011-12-28 00:00:00 | L70: 2012-12-28 00:00:00 | M70: 12 | N70: 23079.45 | O70: 130000 | P70: 1 | Q70: 30 | R70: 1 | S70: 1 | T70: 365 | U70: 18
A71: 50000 | B71: 1356.23 | C71: =IF(DAYS360(RC[8],R1C3)+2>365,365,DAYS360(RC[8],R1C3)+2) -> 54 | D71: =ROUND(RC[-3]*RC[17]/36500,2) -> 24.66 | E71: =RC[-1]*RC[-2] -> 1331.64 | F71: =RC[-1]-RC[-4] -> -24.589999999999918 | H71: 1059 | I71: 4 | J71: AP2PW11000277 | K71: 2011-12-30 00:00:00 | L71: 2012-12-30 00:00:00 | M71: 12 | N71: 8876.7099999999991 | O71: 50000 | P71: 1 | Q71: 30 | R71: 1 | S71: 1 | T71: 365 | U71: 18
A72: 22000 | B72: 553.33000000000004 | C72: =IF(DAYS360(RC[8],R1C3)+2>365,365,DAYS360(RC[8],R1C3)+2) -> 51 | D72: =ROUND(RC[-3]*RC[17]/36500,2) -> 10.85 | E72: =RC[-1]*RC[-2] -> 553.35 | F72: =RC[-1]-RC[-4] -> 1.999999999998181E-2 | H72: 1068 | I72: 4 | J72: AP2PW12000281 | K72: 2012-01-03 00:00:00 | L72: 2013-01-03 00:00:00 | M72: 12 | N72: 3905.75 | O72: 22000 | P72: 1 | Q72: 30 | R72: 1 | S72: 1 | T72: 365 | U72: 18
A73: 150000 | B73: 3772.55 | C73: =IF(DAYS360(RC[8],R1C3)+2>365,365,DAYS360(RC[8],R1C3)+2) -> 51 | D73: =ROUND(RC[-3]*RC[17]/36500,2) -> 73.97 | E73: =RC[-1]*RC[-2] -> 3772.47 | F73: =RC[-1]-RC[-4] -> -8.0000000000381988E-2 | H73: 1075 | I73: 4 | J73: AP2PW12000283 | K73: 2012-01-03 00:00:00 | L73: 2013-01-03 00:00:00 | M73: 12 | N73: 26630.14 | O73: 150000 | P73: 1 | Q73: 30 | R73: 1 | S73: 1 | T73: 365 | U73: 18
A74: 10000 | B74: 250 | C74: =IF(DAYS360(RC[8],R1C3)+2>365,365,DAYS360(RC[8],R1C3)+2) -> 48 | D74: =ROUND(RC[-3]*RC[17]/36500,2) -> 4.93 | E74: =RC[-1]*RC[-2] -> 236.64 | F74: =RC[-1]-RC[-4] -> -13.360000000000014 | H74: 1092 | I74: 4 | J74: AP2PW12000285 | K74: 2012-01-06 00:00:00 | L74: 2013-01-06 00:00:00 | M74: 12 | N74: 1775.34 | O74: 10000 | P74: 1 | Q74: 50 | R74: 1 | S74: 1 | T74: 365 | U74: 18
A75: 116000 | B75: 2002.21 | C75: =IF(DAYS360(RC[8],R1C3)+2>365,365,DAYS360(RC[8],R1C3)+2) -> 35 | D75: =ROUND(RC[-3]*RC[17]/36500,2) -> 57.21 | E75: =RC[-1]*RC[-2] -> 2002.3500000000001 | F75: =RC[-1]-RC[-4] -> 0.14000000000010004 | H75: 1154 | I75: 4 | J75: AP2PW12000293 | K75: 2012-01-19 00:00:00 | L75: 2013-01-19 00:00:00 | M75: 12 | N75: 20593.97 | O75: 116000 | P75: 1 | Q75: 30 | R75: 1 | S75: 1 | T75: 365 | U75: 18
A76: 10000 | B76: 250 | C76: =IF(DAYS360(RC[8],R1C3)+2>365,365,DAYS360(RC[8],R1C3)+2) -> 30 | D76: =ROUND(RC[-3]*RC[17]/36500,2) -> 4.93 | E76: =RC[-1]*RC[-2] -> 147.89999999999998 | F76: =RC[-1]-RC[-4] -> -102.10000000000002 | H76: 1179 | I76: 4 | J76: AP2PW12000296 | K76: 2012-01-24 00:00:00 | L76: 2013-01-24 00:00:00 | M76: 12 | N76: 1775.34 | O76: 10000 | P76: 1 | Q76: 50 | R76: 1 | S76: 1 | T76: 365 | U76: 18
A77: 100000 | B77: 1479.45 | C77: =IF(DAYS360(RC[8],R1C3)+2>365,365,DAYS360(RC[8],R1C3)+2) -> 29 | D77: =ROUND(RC[-3]*RC[17]/36500,2) -> 49.32 | E77: =RC[-1]*RC[-2] -> 1430.28 | F77: =RC[-1]-RC[-4] -> -49.170000000000073 | H77: 1184 | I77: 4 | J77: AP2PW12000297 | K77: 2012-01-25 00:00:00 | L77: 2013-01-25 00:00:00 | M77: 12 | N77: 17753.419999999998 | O77: 100000 | P77: 1 | Q77: 30 | R77: 1 | S77: 1 | T77: 365 | U77: 18
A78: 20000 | B78: 295.89 | C78: =IF(DAYS360(RC[8],R1C3)+2>365,365,DAYS360(RC[8],R1C3)+2) -> 29 | D78: =ROUND(RC[-3]*RC[17]/36500,2) -> 9.86 | E78: =RC[-1]*RC[-2] -> 285.94 | F78: =RC[-1]-RC[-4] -> -9.9499999999999886 | H78: 1185 | I78: 4 | J78: AP2PW12000298 | K78: 2012-01-25 00:00:00 | L78: 2013-01-25 00:00:00 | M78: 12 | N78: 3550.68 | O78: 20000 | P78: 1 | Q78: 30 | R78: 1 | S78: 1 | T78: 365 | U78: 18
A79: 19000 | B79: 281.10000000000002 | C79: =IF(DAYS360(RC[8],R1C3)+2>365,365,DAYS360(RC[8],R1C3)+2) -> 24 | D79: =ROUND(RC[-3]*RC[17]/36500,2) -> 9.3699999999999992 | E79: =RC[-1]*RC[-2] -> 224.88 | F79: =RC[-1]-RC[-4] -> -56.220000000000027 | H79: 1205 | I79: 4 | J79: AP2PW12000299 | K79: 2012-01-30 00:00:00 | L79: 2013-01-30 00:00:00 | M79: 12 | N79: 3373.15 | O79: 19000 | P79: 1 | Q79: 30 | R79: 1 | S79: 1 | T79: 365 | U79: 18
A80: 5000 | B80: 250 | C80: =IF(DAYS360(RC[8],R1C3)+2>365,365,DAYS360(RC[8],R1C3)+2) -> 2 | D80: =ROUND(RC[-3]*RC[17]/36500,2) -> 2.4700000000000002 | E80: =RC[-1]*RC[-2] -> 4.9400000000000004 | F80: =RC[-1]-RC[-4] -> -245.06 | H80: 1286 | I80: 4 | J80: AP2PW12000312 | K80: 2012-02-22 00:00:00 | L80: 2013-02-22 00:00:00 | M80: 12 | N80: 887.67 | O80: 5000 | P80: 1 | Q80: 101 | R80: 1 | S80: 1 | T80: 365 | U80: 18
A81: 6000 | B81: 872.44 | C81: =IF(DAYS360(RC[8],R1C3)+2>365,365,DAYS360(RC[8],R1C3)+2) -> 347 | D81: =ROUND(RC[-3]*RC[17]/36500,2) -> 2.4700000000000002 | E81: =RC[-1]*RC[-2] -> 857.09 | F81: =RC[-1]-RC[-4] -> -15.350000000000023 | H81: 307 | I81: 5 | J81: AW3PW11000023 | K81: 2011-03-07 12:28:48 | L81: 2012-03-07 12:28:48 | M81: 12 | N81: 887.67 | O81: 6000 | P81: 1 | Q81: 101 | R81: 1 | S81: 1 | T81: 365 | U81: 15
A82: 7000 | B82: 949.84 | C82: =IF(DAYS360(RC[8],R1C3)+2>365,365,DAYS360(RC[8],R1C3)+2) -> 324 | D82: =ROUND(RC[-3]*RC[17]/36500,2) -> 2.88 | E82: =RC[-1]*RC[-2] -> 933.12 | F82: =RC[-1]-RC[-4] -> -16.720000000000027 | H82: 367 | I82: 5 | J82: AW3PW11000033 | K82: 2011-03-30 12:28:48 | L82: 2012-03-30 12:28:48 | M82: 12 | N82: 1035.6199999999999 | O82: 7000 | P82: 1 | Q82: 87 | R82: 1 | S82: 1 | T82: 365 | U82: 15
A83: 25500 | B83: 3447.9 | C83: =IF(DAYS360(RC[8],R1C3)+2>365,365,DAYS360(RC[8],R1C3)+2) -> 324 | D83: =ROUND(RC[-3]*RC[17]/36500,2) -> 10.48 | E83: =RC[-1]*RC[-2] -> 3395.52 | F83: =RC[-1]-RC[-4] -> -52.380000000000109 | H83: 373 | I83: 5 | J83: AW3PW11000035 | K83: 2011-03-31 12:28:48 | L83: 2012-03-31 12:28:48 | M83: 12 | N83: 3772.6 | O83: 25500 | P83: 1 | Q83: 30 | R83: 1 | S83: 1 | T83: 365 | U83: 15
A84: 10000 | B84: 1306.27 | C84: =IF(DAYS360(RC[8],R1C3)+2>365,365,DAYS360(RC[8],R1C3)+2) -> 312 | D84: =ROUND(RC[-3]*RC[17]/36500,2) -> 4.1100000000000003 | E84: =RC[-1]*RC[-2] -> 1282.3200000000002 | F84: =RC[-1]-RC[-4] -> -23.949999999999818 | H84: 406 | I84: 5 | J84: AW3PW11000039 | K84: 2011-04-12 12:28:48 | L84: 2012-04-12 12:28:48 | M84: 12 | N84: 1479.45 | O84: 10000 | P84: 1 | Q84: 60 | R84: 1 | S84: 1 | T84: 365 | U84: 15
A85: 5000 | B85: 602.6 | C85: =IF(DAYS360(RC[8],R1C3)+2>365,365,DAYS360(RC[8],R1C3)+2) -> 288 | D85: =ROUND(RC[-3]*RC[17]/36500,2) -> 2.0499999999999998 | E85: =RC[-1]*RC[-2] -> 590.4 | F85: =RC[-1]-RC[-4] -> -12.200000000000045 | H85: 466 | I85: 5 | J85: AW3PW11000045 | K85: 2011-05-06 12:28:48 | L85: 2012-05-06 12:28:48 | M85: 12 | N85: 739.73 | O85: 5000 | P85: 1 | Q85: 121 | R85: 1 | S85: 1 | T85: 365 | U85: 15
A86: 6000 | B86: 744.32 | C86: =IF(DAYS360(RC[8],R1C3)+2>365,365,DAYS360(RC[8],R1C3)+2) -> 247 | D86: =ROUND(RC[-3]*RC[17]/36500,2) -> 2.96 | E86: =RC[-1]*RC[-2] -> 731.12 | F86: =RC[-1]-RC[-4] -> -13.200000000000045 | H86: 517 | I86: 5 | J86: AW3PW11000052 | K86: 2011-06-17 12:28:48 | L86: 2012-06-17 12:28:48 | M86: 12 | N86: 1065.21 | O86: 6000 | P86: 1 | Q86: 84 | R86: 1 | S86: 1 | T86: 365 | U86: 18
A87: 37000 | B87: 4270.3999999999996 | C87: =IF(DAYS360(RC[8],R1C3)+2>365,365,DAYS360(RC[8],R1C3)+2) -> 230 | D87: =ROUND(RC[-3]*RC[17]/36500,2) -> 18.25 | E87: =RC[-1]*RC[-2] -> 4197.5 | F87: =RC[-1]-RC[-4] -> -72.899999999999636 | H87: 543 | I87: 5 | J87: AW3PW11000059 | K87: 2011-07-04 12:28:48 | L87: 2012-07-04 12:28:48 | M87: 12 | N87: 6568.77 | O87: 37000 | P87: 1 | Q87: 30 | R87: 1 | S87: 1 | T87: 365 | U87: 18
A88: 33000 | B88: 3693.41 | C88: =IF(DAYS360(RC[8],R1C3)+2>365,365,DAYS360(RC[8],R1C3)+2) -> 223 | D88: =ROUND(RC[-3]*RC[17]/36500,2) -> 16.27 | E88: =RC[-1]*RC[-2] -> 3628.21 | F88: =RC[-1]-RC[-4] -> -65.199999999999818 | H88: 551 | I88: 5 | J88: AW3PW11000062 | K88: 2011-07-11 12:28:48 | L88: 2012-07-11 12:28:48 | M88: 12 | N88: 5858.63 | O88: 33000 | P88: 1 | Q88: 30 | R88: 1 | S88: 1 | T88: 365 | U88: 18
A89: 6000 | B89: 667.36 | C89: =IF(DAYS360(RC[8],R1C3)+2>365,365,DAYS360(RC[8],R1C3)+2) -> 222 | D89: =ROUND(RC[-3]*RC[17]/36500,2) -> 2.96 | E89: =RC[-1]*RC[-2] -> 657.12 | F89: =RC[-1]-RC[-4] -> -10.240000000000009 | H89: 553 | I89: 5 | J89: AW3PW11000063 | K89: 2011-07-12 12:28:48 | L89: 2012-07-12 12:28:48 | M89: 12 | N89: 1065.21 | O89: 6000 | P89: 1 | Q89: 84 | R89: 1 | S89: 1 | T89: 365 | U89: 18
A90: 33000 | B90: 3335.47 | C90: =IF(DAYS360(RC[8],R1C3)+2>365,365,DAYS360(RC[8],R1C3)+2) -> 202 | D90: =ROUND(RC[-3]*RC[17]/36500,2) -> 16.27 | E90: =RC[-1]*RC[-2] -> 3286.54 | F90: =RC[-1]-RC[-4] -> -48.929999999999836 | H90: 580 | I90: 5 | J90: AW3PW11000065 | K90: 2011-08-02 12:28:48 | L90: 2012-08-02 12:28:48 | M90: 12 | N90: 5858.63 | O90: 33000 | P90: 1 | Q90: 30 | R90: 1 | S90: 1 | T90: 365 | U90: 18
A91: 130000 | B91: 13014.32 | C91: =IF(DAYS360(RC[8],R1C3)+2>365,365,DAYS360(RC[8],R1C3)+2) -> 200 | D91: =ROUND(RC[-3]*RC[17]/36500,2) -> 64.11 | E91: =RC[-1]*RC[-2] -> 12822 | F91: =RC[-1]-RC[-4] -> -192.31999999999971 | H91: 588 | I91: 5 | J91: AW3PW11000066 | K91: 2011-08-04 12:28:48 | L91: 2012-08-04 12:28:48 | M91: 12 | N91: 23079.45 | O91: 130000 | P91: 1 | Q91: 30 | R91: 1 | S91: 1 | T91: 365 | U91: 18
A92: 34000 | B92: 3135.9 | C92: =IF(DAYS360(RC[8],R1C3)+2>365,365,DAYS360(RC[8],R1C3)+2) -> 185 | D92: =ROUND(RC[-3]*RC[17]/36500,2) -> 16.77 | E92: =RC[-1]*RC[-2] -> 3102.45 | F92: =RC[-1]-RC[-4] -> -33.450000000000273 | H92: 671 | I92: 5 | J92: AW3PW11000079 | K92: 2011-08-19 12:28:48 | L92: 2012-08-19 12:28:48 | M92: 12 | N92: 6036.16 | O92: 34000 | P92: 1 | Q92: 30 | R92: 1 | S92: 1 | T92: 365 | U92: 18
A93: 33000 | B93: 2993.8 | C93: =IF(DAYS360(RC[8],R1C3)+2>365,365,DAYS360(RC[8],R1C3)+2) -> 182 | D93: =ROUND(RC[-3]*RC[17]/36500,2) -> 16.27 | E93: =RC[-1]*RC[-2] -> 2961.14 | F93: =RC[-1]-RC[-4] -> -32.660000000000309 | H93: 688 | I93: 5 | J93: AW3PW11000084 | K93: 2011-08-22 12:28:48 | L93: 2012-08-22 12:28:48 | M93: 12 | N93: 5858.63 | O93: 33000 | P93: 1 | Q93: 30 | R93: 1 | S93: 1 | T93: 365 | U93: 18
A94: 47000 | B94: 4195.5200000000004 | C94: =IF(DAYS360(RC[8],R1C3)+2>365,365,DAYS360(RC[8],R1C3)+2) -> 179 | D94: =ROUND(RC[-3]*RC[17]/36500,2) -> 23.18 | E94: =RC[-1]*RC[-2] -> 4149.22 | F94: =RC[-1]-RC[-4] -> -46.300000000000182 | H94: 713 | I94: 5 | J94: AW3PW11000086 | K94: 2011-08-25 12:28:48 | L94: 2012-08-25 12:28:48 | M94: 12 | N94: 8344.11 | O94: 47000 | P94: 1 | Q94: 30 | R94: 1 | S94: 1 | T94: 365 | U94: 18
A95: 39300 | B95: 3488.42 | C95: =IF(DAYS360(RC[8],R1C3)+2>365,365,DAYS360(RC[8],R1C3)+2) -> 178 | D95: =ROUND(RC[-3]*RC[17]/36500,2) -> 19.38 | E95: =RC[-1]*RC[-2] -> 3449.64 | F95: =RC[-1]-RC[-4] -> -38.7800000000002 | H95: 718 | I95: 5 | J95: AW3PW11000087 | K95: 2011-08-26 12:28:48 | L95: 2012-08-26 12:28:48 | M95: 12 | N95: 6977.1 | O95: 39300 | P95: 1 | Q95: 30 | R95: 1 | S95: 1 | T95: 365 | U95: 18
A96: 93750 | B96: 8044.11 | C96: =IF(DAYS360(RC[8],R1C3)+2>365,365,DAYS360(RC[8],R1C3)+2) -> 173 | D96: =ROUND(RC[-3]*RC[17]/36500,2) -> 46.23 | E96: =RC[-1]*RC[-2] -> 7997.7899999999991 | F96: =RC[-1]-RC[-4] -> -46.320000000000618 | H96: 729 | I96: 5 | J96: AW3PW11000089 | K96: 2011-09-01 12:28:48 | L96: 2012-09-01 12:28:48 | M96: 12 | N96: 16643.84 | O96: 93750 | P96: 1 | Q96: 30 | R96: 1 | S96: 1 | T96: 365 | U96: 18
A97: 36000 | B97: 3088.6 | C97: =IF(DAYS360(RC[8],R1C3)+2>365,365,DAYS360(RC[8],R1C3)+2) -> 173 | D97: =ROUND(RC[-3]*RC[17]/36500,2) -> 17.75 | E97: =RC[-1]*RC[-2] -> 3070.75 | F97: =RC[-1]-RC[-4] -> -17.849999999999909 | H97: 735 | I97: 5 | J97: AW3PW11000090 | K97: 2011-09-01 12:28:48 | L97: 2012-09-01 12:28:48 | M97: 12 | N97: 6391.23 | O97: 36000 | P97: 1 | Q97: 30 | R97: 1 | S97: 1 | T97: 365 | U97: 18
A98: 33000 | B98: 2831.1 | C98: =IF(DAYS360(RC[8],R1C3)+2>365,365,DAYS360(RC[8],R1C3)+2) -> 173 | D98: =ROUND(RC[-3]*RC[17]/36500,2) -> 16.27 | E98: =RC[-1]*RC[-2] -> 2814.71 | F98: =RC[-1]-RC[-4] -> -16.389999999999873 | H98: 736 | I98: 5 | J98: AW3PW11000091 | K98: 2011-09-01 12:28:48 | L98: 2012-09-01 12:28:48 | M98: 12 | N98: 5858.63 | O98: 33000 | P98: 1 | Q98: 30 | R98: 1 | S98: 1 | T98: 365 | U98: 18
A99: 35000 | B99: 2985.99 | C99: =IF(DAYS360(RC[8],R1C3)+2>365,365,DAYS360(RC[8],R1C3)+2) -> 172 | D99: =ROUND(RC[-3]*RC[17]/36500,2) -> 17.260000000000002 | E99: =RC[-1]*RC[-2] -> 2968.7200000000003 | F99: =RC[-1]-RC[-4] -> -17.269999999999527 | H99: 737 | I99: 5 | J99: AW3PW11000092 | K99: 2011-09-02 12:28:48 | L99: 2012-09-02 12:28:48 | M99: 12 | N99: 6213.7 | O99: 35000 | P99: 1 | Q99: 30 | R99: 1 | S99: 1 | T99: 365 | U99: 18
A100: 35000 | B100: 2985.99 | C100: =IF(DAYS360(RC[8],R1C3)+2>365,365,DAYS360(RC[8],R1C3)+2) -> 172 | D100: =ROUND(RC[-3]*RC[17]/36500,2) -> 17.260000000000002 | E100: =RC[-1]*RC[-2] -> 2968.7200000000003 | F100: =RC[-1]-RC[-4] -> -17.269999999999527 | H100: 738 | I100: 5 | J100: AW3PW11000093 | K100: 2011-09-02 12:28:48 | L100: 2012-09-02 12:28:48 | M100: 12 | N100: 6213.7 | O100: 35000 | P100: 1 | Q100: 30 | R100: 1 | S100: 1 | T100: 365 | U100: 18
A101: 76000 | B101: 6334.1 | C101: =IF(DAYS360(RC[8],R1C3)+2>365,365,DAYS360(RC[8],R1C3)+2) -> 168 | D101: =ROUND(RC[-3]*RC[17]/36500,2) -> 37.479999999999997 | E101: =RC[-1]*RC[-2] -> 6296.6399999999994 | F101: =RC[-1]-RC[-4] -> -37.460000000000946 | H101: 746 | I101: 5 | J101: AW3PW11000094 | K101: 2011-09-06 12:28:48 | L101: 2012-09-06 12:28:48 | M101: 12 | N101: 13492.6 | O101: 76000 | P101: 1 | Q101: 30 | R101: 1 | S101: 1 | T101: 365 | U101: 18
A102: 48000 | B102: 4000.27 | C102: =IF(DAYS360(RC[8],R1C3)+2>365,365,DAYS360(RC[8],R1C3)+2) -> 168 | D102: =ROUND(RC[-3]*RC[17]/36500,2) -> 23.67 | E102: =RC[-1]*RC[-2] -> 3976.5600000000004 | F102: =RC[-1]-RC[-4] -> -23.709999999999582 | H102: 747 | I102: 5 | J102: AW3PW11000095 | K102: 2011-09-06 12:28:48 | L102: 2012-09-06 12:28:48 | M102: 12 | N102: 8521.64 | O102: 48000 | P102: 1 | Q102: 30 | R102: 1 | S102: 1 | T102: 365 | U102: 18
A103: 45000 | B103: 3750.16 | C103: =IF(DAYS360(RC[8],R1C3)+2>365,365,DAYS360(RC[8],R1C3)+2) -> 168 | D103: =ROUND(RC[-3]*RC[17]/36500,2) -> 22.19 | E103: =RC[-1]*RC[-2] -> 3727.92 | F103: =RC[-1]-RC[-4] -> -22.239999999999782 | H103: 748 | I103: 5 | J103: AW3PW11000096 | K103: 2011-09-06 12:28:48 | L103: 2012-09-06 12:28:48 | M103: 12 | N103: 7989.04 | O103: 45000 | P103: 1 | Q103: 30 | R103: 1 | S103: 1 | T103: 365 | U103: 18
A104: 37000 | B104: 3065.9 | C104: =IF(DAYS360(RC[8],R1C3)+2>365,365,DAYS360(RC[8],R1C3)+2) -> 167 | D104: =ROUND(RC[-3]*RC[17]/36500,2) -> 18.25 | E104: =RC[-1]*RC[-2] -> 3047.75 | F104: =RC[-1]-RC[-4] -> -18.150000000000091 | H104: 755 | I104: 5 | J104: AW3PW11000097 | K104: 2011-09-07 12:28:48 | L104: 2012-09-07 12:28:48 | M104: 12 | N104: 6568.77 | O104: 37000 | P104: 1 | Q104: 30 | R104: 1 | S104: 1 | T104: 365 | U104: 18
A105: 50000 | B105: 4142.8100000000004 | C105: =IF(DAYS360(RC[8],R1C3)+2>365,365,DAYS360(RC[8],R1C3)+2) -> 167 | D105: =ROUND(RC[-3]*RC[17]/36500,2) -> 24.66 | E105: =RC[-1]*RC[-2] -> 4118.22 | F105: =RC[-1]-RC[-4] -> -24.590000000000146 | H105: 760 | I105: 5 | J105: AW3PW11000098 | K105: 2011-09-07 12:28:48 | L105: 2012-09-07 12:28:48 | M105: 12 | N105: 8876.7099999999991 | O105: 50000 | P105: 1 | Q105: 30 | R105: 1 | S105: 1 | T105: 365 | U105: 18
A106: 18500 | B106: 1486.66 | C106: =IF(DAYS360(RC[8],R1C3)+2>365,365,DAYS360(RC[8],R1C3)+2) -> 162 | D106: =ROUND(RC[-3]*RC[17]/36500,2) -> 9.1199999999999992 | E106: =RC[-1]*RC[-2] -> 1477.4399999999998 | F106: =RC[-1]-RC[-4] -> -9.2200000000002547 | H106: 774 | I106: 5 | J106: AW3PW11000102 | K106: 2011-09-12 12:28:48 | L106: 2012-09-12 12:28:48 | M106: 12 | N106: 3284.38 | O106: 18500 | P106: 1 | Q106: 30 | R106: 1 | S106: 1 | T106: 365 | U106: 18
A107: 35000 | B107: 2813.39 | C107: =IF(DAYS360(RC[8],R1C3)+2>365,365,DAYS360(RC[8],R1C3)+2) -> 162 | D107: =ROUND(RC[-3]*RC[17]/36500,2) -> 17.260000000000002 | E107: =RC[-1]*RC[-2] -> 2796.1200000000003 | F107: =RC[-1]-RC[-4] -> -17.269999999999527 | H107: 775 | I107: 5 | J107: AW3PW11000103 | K107: 2011-09-12 12:28:48 | L107: 2012-09-12 12:28:48 | M107: 12 | N107: 6213.7 | O107: 35000 | P107: 1 | Q107: 30 | R107: 1 | S107: 1 | T107: 365 | U107: 18
A108: 34000 | B108: 2632.8 | C108: =IF(DAYS360(RC[8],R1C3)+2>365,365,DAYS360(RC[8],R1C3)+2) -> 155 | D108: =ROUND(RC[-3]*RC[17]/36500,2) -> 16.77 | E108: =RC[-1]*RC[-2] -> 2599.35 | F108: =RC[-1]-RC[-4] -> -33.450000000000273 | H108: 802 | I108: 5 | J108: AW3PW11000106 | K108: 2011-09-19 00:00:00 | L108: 2012-09-19 00:00:00 | M108: 12 | N108: 6036.16 | O108: 34000 | P108: 1 | Q108: 30 | R108: 1 | S108: 1 | T108: 365 | U108: 18
A109: 110000 | B109: 8607.3700000000008 | C109: =IF(DAYS360(RC[8],R1C3)+2>365,365,DAYS360(RC[8],R1C3)+2) -> 134 | D109: =ROUND(RC[-3]*RC[17]/36500,2) -> 63.29 | E109: =RC[-1]*RC[-2] -> 8480.86 | F109: =RC[-1]-RC[-4] -> -126.51000000000022 | H109: 852 | I109: 5 | J109: AW3PW11000109 | K109: 2011-10-10 00:00:00 | L109: 2012-10-10 00:00:00 | M109: 12 | N109: 22783.56 | O109: 110000 | P109: 1 | Q109: 30 | R109: 1 | S109: 1 | T109: 365 | U109: 21
A110: 13000 | B110: 968.08 | C110: =IF(DAYS360(RC[8],R1C3)+2>365,365,DAYS360(RC[8],R1C3)+2) -> 127 | D110: =ROUND(RC[-3]*RC[17]/36500,2) -> 7.48 | E110: =RC[-1]*RC[-2] -> 949.96 | F110: =RC[-1]-RC[-4] -> -18.120000000000005 | H110: 860 | I110: 5 | J110: AW3PW11000110 | K110: 2011-10-17 00:00:00 | L110: 2012-10-17 00:00:00 | M110: 12 | N110: 2692.6 | O110: 13000 | P110: 1 | Q110: 33 | R110: 1 | S110: 1 | T110: 365 | U110: 21
A111: 27000 | B111: 2003.5 | C111: =IF(DAYS360(RC[8],R1C3)+2>365,365,DAYS360(RC[8],R1C3)+2) -> 127 | D111: =ROUND(RC[-3]*RC[17]/36500,2) -> 15.53 | E111: =RC[-1]*RC[-2] -> 1972.31 | F111: =RC[-1]-RC[-4] -> -31.190000000000055 | H111: 861 | I111: 5 | J111: AW3PW11000111 | K111: 2011-10-17 00:00:00 | L111: 2012-10-17 00:00:00 | M111: 12 | N111: 5592.33 | O111: 27000 | P111: 1 | Q111: 30 | R111: 1 | S111: 1 | T111: 365 | U111: 21
A112: 25000 | B112: 1696.95 | C112: =IF(DAYS360(RC[8],R1C3)+2>365,365,DAYS360(RC[8],R1C3)+2) -> 116 | D112: =ROUND(RC[-3]*RC[17]/36500,2) -> 14.38 | E112: =RC[-1]*RC[-2] -> 1668.0800000000002 | F112: =RC[-1]-RC[-4] -> -28.869999999999891 | H112: 873 | I112: 5 | J112: AW3PW11000114 | K112: 2011-10-28 00:00:00 | L112: 2012-10-28 00:00:00 | M112: 12 | N112: 5178.08 | O112: 25000 | P112: 1 | Q112: 30 | R112: 1 | S112: 1 | T112: 365 | U112: 21
A113: 8500 | B113: 548.29 | C113: =IF(DAYS360(RC[8],R1C3)+2>365,365,DAYS360(RC[8],R1C3)+2) -> 111 | D113: =ROUND(RC[-3]*RC[17]/36500,2) -> 4.8899999999999997 | E113: =RC[-1]*RC[-2] -> 542.79 | F113: =RC[-1]-RC[-4] -> -5.5 | H113: 877 | I113: 5 | J113: AW3PW11000115 | K113: 2011-11-03 00:00:00 | L113: 2012-11-03 00:00:00 | M113: 12 | N113: 1760.55 | O113: 8500 | P113: 1 | Q113: 51 | R113: 1 | S113: 1 | T113: 365 | U113: 21
A114: 45000 | B114: 2085.91 | C114: =IF(DAYS360(RC[8],R1C3)+2>365,365,DAYS360(RC[8],R1C3)+2) -> 93 | D114: =ROUND(RC[-3]*RC[17]/36500,2) -> 22.19 | E114: =RC[-1]*RC[-2] -> 2063.67 | F114: =RC[-1]-RC[-4] -> -22.239999999999782 | H114: 923 | I114: 5 | J114: AW3PW11000117 | K114: 2011-11-21 00:00:00 | L114: 2012-11-21 00:00:00 | M114: 12 | N114: 7989.04 | O114: 45000 | P114: 1 | Q114: 30 | R114: 1 | S114: 1 | T114: 365 | U114: 18
A115: 30000 | B115: 1272.08 | C115: =IF(DAYS360(RC[8],R1C3)+2>365,365,DAYS360(RC[8],R1C3)+2) -> 85 | D115: =ROUND(RC[-3]*RC[17]/36500,2) -> 14.79 | E115: =RC[-1]*RC[-2] -> 1257.1499999999999 | F115: =RC[-1]-RC[-4] -> -14.930000000000064 | H115: 942 | I115: 5 | J115: AW3PW11000118 | K115: 2011-11-29 00:00:00 | L115: 2012-11-29 00:00:00 | M115: 12 | N115: 5326.03 | O115: 30000 | P115: 1 | Q115: 30 | R115: 1 | S115: 1 | T115: 365 | U115: 18
A116: 30000 | B116: 1227.71 | C116: =IF(DAYS360(RC[8],R1C3)+2>365,365,DAYS360(RC[8],R1C3)+2) -> 82 | D116: =ROUND(RC[-3]*RC[17]/36500,2) -> 14.79 | E116: =RC[-1]*RC[-2] -> 1212.78 | F116: =RC[-1]-RC[-4] -> -14.930000000000064 | H116: 951 | I116: 5 | J116: AW3PW11000119 | K116: 2011-12-02 00:00:00 | L116: 2012-12-02 00:00:00 | M116: 12 | N116: 5326.03 | O116: 30000 | P116: 1 | Q116: 30 | R116: 1 | S116: 1 | T116: 365 | U116: 18
A117: 20000 | B117: 769.17 | C117: =IF(DAYS360(RC[8],R1C3)+2>365,365,DAYS360(RC[8],R1C3)+2) -> 77 | D117: =ROUND(RC[-3]*RC[17]/36500,2) -> 9.86 | E117: =RC[-1]*RC[-2] -> 759.21999999999991 | F117: =RC[-1]-RC[-4] -> -9.9500000000000455 | H117: 963 | I117: 5 | J117: AW3PW11000120 | K117: 2011-12-07 00:00:00 | L117: 2012-12-07 00:00:00 | M117: 12 | N117: 3550.68 | O117: 20000 | P117: 1 | Q117: 30 | R117: 1 | S117: 1 | T117: 365 | U117: 18
A118: 103000 | B118: 3707.81 | C118: =IF(DAYS360(RC[8],R1C3)+2>365,365,DAYS360(RC[8],R1C3)+2) -> 72 | D118: =ROUND(RC[-3]*RC[17]/36500,2) -> 50.79 | E118: =RC[-1]*RC[-2] -> 3656.88 | F118: =RC[-1]-RC[-4] -> -50.929999999999836 | H118: 975 | I118: 5 | J118: AW3PW11000121 | K118: 2011-12-12 00:00:00 | L118: 2012-12-12 00:00:00 | M118: 12 | N118: 18286.03 | O118: 103000 | P118: 1 | Q118: 30 | R118: 1 | S118: 1 | T118: 365 | U118: 18
A119: 63000 | B119: 2268.06 | C119: =IF(DAYS360(RC[8],R1C3)+2>365,365,DAYS360(RC[8],R1C3)+2) -> 72 | D119: =ROUND(RC[-3]*RC[17]/36500,2) -> 31.07 | E119: =RC[-1]*RC[-2] -> 2237.04 | F119: =RC[-1]-RC[-4] -> -31.019999999999982 | H119: 976 | I119: 5 | J119: AW3PW11000122 | K119: 2011-12-12 00:00:00 | L119: 2012-12-12 00:00:00 | M119: 12 | N119: 11184.66 | O119: 63000 | P119: 1 | Q119: 30 | R119: 1 | S119: 1 | T119: 365 | U119: 18
A120: 14000 | B120: 498.4 | C120: =IF(DAYS360(RC[8],R1C3)+2>365,365,DAYS360(RC[8],R1C3)+2) -> 71 | D120: =ROUND(RC[-3]*RC[17]/36500,2) -> 6.9 | E120: =RC[-1]*RC[-2] -> 489.90000000000003 | F120: =RC[-1]-RC[-4] -> -8.4999999999999432 | H120: 980 | I120: 5 | J120: AW3PW11000123 | K120: 2011-12-13 00:00:00 | L120: 2012-12-13 00:00:00 | M120: 12 | N120: 2485.48 | O120: 14000 | P120: 1 | Q120: 36 | R120: 1 | S120: 1 | T120: 365 | U120: 18
A121: 6000 | B121: 250 | C121: =IF(DAYS360(RC[8],R1C3)+2>365,365,DAYS360(RC[8],R1C3)+2) -> 49 | D121: =ROUND(RC[-3]*RC[17]/36500,2) -> 2.96 | E121: =RC[-1]*RC[-2] -> 145.04 | F121: =RC[-1]-RC[-4] -> -104.96000000000001 | H121: 1086 | I121: 5 | J121: AW3PW12000132 | K121: 2012-01-05 00:00:00 | L121: 2013-01-05 00:00:00 | M121: 12 | N121: 1065.21 | O121: 6000 | P121: 1 | Q121: 84 | R121: 1 | S121: 1 | T121: 365 | U121: 18
A122: 25000 | B122: 554.80999999999995 | C122: =IF(DAYS360(RC[8],R1C3)+2>365,365,DAYS360(RC[8],R1C3)+2) -> 45 | D122: =ROUND(RC[-3]*RC[17]/36500,2) -> 12.33 | E122: =RC[-1]*RC[-2] -> 554.85 | F122: =RC[-1]-RC[-4] -> 4.0000000000077307E-2 | H122: 1098 | I122: 5 | J122: AW3PW12000133 | K122: 2012-01-09 00:00:00 | L122: 2013-01-09 00:00:00 | M122: 12 | N122: 4438.3599999999997 | O122: 25000 | P122: 1 | Q122: 30 | R122: 1 | S122: 1 | T122: 365 | U122: 18
A123: 39000 | B123: 576.99 | C123: =IF(DAYS360(RC[8],R1C3)+2>365,365,DAYS360(RC[8],R1C3)+2) -> 27 | D123: =ROUND(RC[-3]*RC[17]/36500,2) -> 19.23 | E123: =RC[-1]*RC[-2] -> 519.21 | F123: =RC[-1]-RC[-4] -> -57.779999999999973 | H123: 1194 | I123: 5 | J123: AW3PW12000143 | K123: 2012-01-27 00:00:00 | L123: 2013-01-27 00:00:00 | M123: 12 | N123: 6923.84 | O123: 39000 | P123: 1 | Q123: 30 | R123: 1 | S123: 1 | T123: 365 | U123: 18
A124: 55000 | B124: 813.7 | C124: =IF(DAYS360(RC[8],R1C3)+2>365,365,DAYS360(RC[8],R1C3)+2) -> 21 | D124: =ROUND(RC[-3]*RC[17]/36500,2) -> 27.12 | E124: =RC[-1]*RC[-2] -> 569.52 | F124: =RC[-1]-RC[-4] -> -244.18000000000006 | H124: 1230 | I124: 5 | J124: AW3PW12000147 | K124: 2012-02-03 00:00:00 | L124: 2013-02-03 00:00:00 | M124: 12 | N124: 9764.3799999999992 | O124: 55000 | P124: 1 | Q124: 30 | R124: 1 | S124: 1 | T124: 365 | U124: 18
A125: 15000 | B125: 250 | C125: =IF(DAYS360(RC[8],R1C3)+2>365,365,DAYS360(RC[8],R1C3)+2) -> 10 | D125: =ROUND(RC[-3]*RC[17]/36500,2) -> 7.4 | E125: =RC[-1]*RC[-2] -> 74 | F125: =RC[-1]-RC[-4] -> -176 | H125: 1257 | I125: 5 | J125: AW3PW12000150 | K125: 2012-02-14 00:00:00 | L125: 2013-02-14 00:00:00 | M125: 12 | N125: 2663.01 | O125: 15000 | P125: 1 | Q125: 33 | R125: 1 | S125: 1 | T125: 365 | U125: 18
A126: 50000 | B126: 739.73 | C126: =IF(DAYS360(RC[8],R1C3)+2>365,365,DAYS360(RC[8],R1C3)+2) -> 8 | D126: =ROUND(RC[-3]*RC[17]/36500,2) -> 24.66 | E126: =RC[-1]*RC[-2] -> 197.28 | F126: =RC[-1]-RC[-4] -> -542.45000000000005 | H126: 1264 | I126: 5 | J126: AW3PW12000151 | K126: 2012-02-16 00:00:00 | L126: 2013-02-16 00:00:00 | M126: 12 | N126: 8876.7099999999991 | O126: 50000 | P126: 1 | Q126: 30 | R126: 1 | S126: 1 | T126: 365 | U126: 18
A127: 30000 | B127: 2898.98 | C127: =IF(DAYS360(RC[8],R1C3)+2>365,365,DAYS360(RC[8],R1C3)+2) -> 193 | D127: =ROUND(RC[-3]*RC[17]/36500,2) -> 14.79 | E127: =RC[-1]*RC[-2] -> 2854.47 | F127: =RC[-1]-RC[-4] -> -44.510000000000218 | H127: 627 | I127: 7 | J127: EP5PW11000006 | K127: 2011-08-11 12:28:48 | L127: 2012-08-11 12:28:48 | M127: 12 | N127: 5326.03 | O127: 30000 | P127: 1 | Q127: 30 | R127: 1 | S127: 1 | T127: 365 | U127: 18
A128: 80000 | B128: 7495.56 | C128: =IF(DAYS360(RC[8],R1C3)+2>365,365,DAYS360(RC[8],R1C3)+2) -> 188 | D128: =ROUND(RC[-3]*RC[17]/36500,2) -> 39.450000000000003 | E128: =RC[-1]*RC[-2] -> 7416.6 | F128: =RC[-1]-RC[-4] -> -78.960000000000036 | H128: 649 | I128: 7 | J128: EP5PW11000010 | K128: 2011-08-16 12:28:48 | L128: 2012-08-16 12:28:48 | M128: 12 | N128: 14202.74 | O128: 80000 | P128: 1 | Q128: 30 | R128: 1 | S128: 1 | T128: 365 | U128: 18
A129: 18500 | B129: 1650.82 | C129: =IF(DAYS360(RC[8],R1C3)+2>365,365,DAYS360(RC[8],R1C3)+2) -> 179 | D129: =ROUND(RC[-3]*RC[17]/36500,2) -> 9.1199999999999992 | E129: =RC[-1]*RC[-2] -> 1632.4799999999998 | F129: =RC[-1]-RC[-4] -> -18.340000000000146 | H129: 711 | I129: 7 | J129: EP5PW11000015 | K129: 2011-08-25 12:28:48 | L129: 2012-08-25 12:28:48 | M129: 12 | N129: 3284.38 | O129: 18500 | P129: 1 | Q129: 30 | R129: 1 | S129: 1 | T129: 365 | U129: 18
A130: 120000 | B130: 10060.540000000001 | C130: =IF(DAYS360(RC[8],R1C3)+2>365,365,DAYS360(RC[8],R1C3)+2) -> 169 | D130: =ROUND(RC[-3]*RC[17]/36500,2) -> 59.18 | E130: =RC[-1]*RC[-2] -> 10001.42 | F130: =RC[-1]-RC[-4] -> -59.1200000000008 | H130: 742 | I130: 7 | J130: EP5PW11000018 | K130: 2011-09-05 12:28:48 | L130: 2012-09-05 12:28:48 | M130: 12 | N130: 21304.11 | O130: 120000 | P130: 1 | Q130: 30 | R130: 1 | S130: 1 | T130: 365 | U130: 18
A131: 37000 | B131: 2810.4 | C131: =IF(DAYS360(RC[8],R1C3)+2>365,365,DAYS360(RC[8],R1C3)+2) -> 152 | D131: =ROUND(RC[-3]*RC[17]/36500,2) -> 18.25 | E131: =RC[-1]*RC[-2] -> 2774 | F131: =RC[-1]-RC[-4] -> -36.400000000000091 | H131: 816 | I131: 7 | J131: EP5PW11000020 | K131: 2011-09-22 00:00:00 | L131: 2012-09-22 00:00:00 | M131: 12 | N131: 6568.77 | O131: 37000 | P131: 1 | Q131: 30 | R131: 1 | S131: 1 | T131: 365 | U131: 18
A132: 100000 | B132: 7299.21 | C132: =IF(DAYS360(RC[8],R1C3)+2>365,365,DAYS360(RC[8],R1C3)+2) -> 146 | D132: =ROUND(RC[-3]*RC[17]/36500,2) -> 49.32 | E132: =RC[-1]*RC[-2] -> 7200.72 | F132: =RC[-1]-RC[-4] -> -98.489999999999782 | H132: 829 | I132: 7 | J132: EP5PW11000021 | K132: 2011-09-28 00:00:00 | L132: 2012-09-28 00:00:00 | M132: 12 | N132: 17753.419999999998 | O132: 100000 | P132: 1 | Q132: 30 | R132: 1 | S132: 1 | T132: 365 | U132: 18
A133: 12000 | B133: 877.52 | C133: =IF(DAYS360(RC[8],R1C3)+2>365,365,DAYS360(RC[8],R1C3)+2) -> 146 | D133: =ROUND(RC[-3]*RC[17]/36500,2) -> 5.92 | E133: =RC[-1]*RC[-2] -> 864.31999999999994 | F133: =RC[-1]-RC[-4] -> -13.200000000000045 | H133: 831 | I133: 7 | J133: EP5PW11000022 | K133: 2011-09-28 00:00:00 | L133: 2012-09-28 00:00:00 | M133: 12 | N133: 2130.41 | O133: 12000 | P133: 1 | Q133: 42 | R133: 1 | S133: 1 | T133: 365 | U133: 18
A134: 8000 | B134: 372.45 | C134: =IF(DAYS360(RC[8],R1C3)+2>365,365,DAYS360(RC[8],R1C3)+2) -> 93 | D134: =ROUND(RC[-3]*RC[17]/36500,2) -> 3.95 | E134: =RC[-1]*RC[-2] -> 367.35 | F134: =RC[-1]-RC[-4] -> -5.0999999999999659 | H134: 919 | I134: 7 | J134: EP5PW11000030 | K134: 2011-11-21 00:00:00 | L134: 2012-11-21 00:00:00 | M134: 12 | N134: 1420.27 | O134: 8000 | P134: 1 | Q134: 63 | R134: 1 | S134: 1 | T134: 365 | U134: 18
A135: 66500 | B135: 3049.61 | C135: =IF(DAYS360(RC[8],R1C3)+2>365,365,DAYS360(RC[8],R1C3)+2) -> 92 | D135: =ROUND(RC[-3]*RC[17]/36500,2) -> 32.79 | E135: =RC[-1]*RC[-2] -> 3016.68 | F135: =RC[-1]-RC[-4] -> -32.930000000000291 | H135: 932 | I135: 7 | J135: EP5PW11000032 | K135: 2011-11-22 00:00:00 | L135: 2012-11-22 00:00:00 | M135: 12 | N135: 11806.03 | O135: 66500 | P135: 1 | Q135: 30 | R135: 1 | S135: 1 | T135: 365 | U135: 18
A136: 20000 | B136: 857.91 | C136: =IF(DAYS360(RC[8],R1C3)+2>365,365,DAYS360(RC[8],R1C3)+2) -> 86 | D136: =ROUND(RC[-3]*RC[17]/36500,2) -> 9.86 | E136: =RC[-1]*RC[-2] -> 847.95999999999992 | F136: =RC[-1]-RC[-4] -> -9.9500000000000455 | H136: 939 | I136: 7 | J136: EP5PW11000033 | K136: 2011-11-28 00:00:00 | L136: 2012-11-28 00:00:00 | M136: 12 | N136: 3550.68 | O136: 20000 | P136: 1 | Q136: 30 | R136: 1 | S136: 1 | T136: 365 | U136: 18
A137: 36000 | B137: 1526.6 | C137: =IF(DAYS360(RC[8],R1C3)+2>365,365,DAYS360(RC[8],R1C3)+2) -> 85 | D137: =ROUND(RC[-3]*RC[17]/36500,2) -> 17.75 | E137: =RC[-1]*RC[-2] -> 1508.75 | F137: =RC[-1]-RC[-4] -> -17.849999999999909 | H137: 941 | I137: 7 | J137: EP5PW11000034 | K137: 2011-11-29 00:00:00 | L137: 2012-11-29 00:00:00 | M137: 12 | N137: 6391.23 | O137: 36000 | P137: 1 | Q137: 30 | R137: 1 | S137: 1 | T137: 365 | U137: 18
A138: 90000 | B138: 3506.13 | C138: =IF(DAYS360(RC[8],R1C3)+2>365,365,DAYS360(RC[8],R1C3)+2) -> 78 | D138: =ROUND(RC[-3]*RC[17]/36500,2) -> 44.38 | E138: =RC[-1]*RC[-2] -> 3461.6400000000003 | F138: =RC[-1]-RC[-4] -> -44.489999999999782 | H138: 957 | I138: 7 | J138: EP5PW11000035 | K138: 2011-12-06 00:00:00 | L138: 2012-12-06 00:00:00 | M138: 12 | N138: 15978.08 | O138: 90000 | P138: 1 | Q138: 30 | R138: 1 | S138: 1 | T138: 365 | U138: 18
A139: 30000 | B139: 1168.55 | C139: =IF(DAYS360(RC[8],R1C3)+2>365,365,DAYS360(RC[8],R1C3)+2) -> 78 | D139: =ROUND(RC[-3]*RC[17]/36500,2) -> 14.79 | E139: =RC[-1]*RC[-2] -> 1153.6199999999999 | F139: =RC[-1]-RC[-4] -> -14.930000000000064 | H139: 958 | I139: 7 | J139: EP5PW11000036 | K139: 2011-12-06 00:00:00 | L139: 2012-12-06 00:00:00 | M139: 12 | N139: 5326.03 | O139: 30000 | P139: 1 | Q139: 30 | R139: 1 | S139: 1 | T139: 365 | U139: 18
A140: 50000 | B140: 1800.11 | C140: =IF(DAYS360(RC[8],R1C3)+2>365,365,DAYS360(RC[8],R1C3)+2) -> 72 | D140: =ROUND(RC[-3]*RC[17]/36500,2) -> 24.66 | E140: =RC[-1]*RC[-2] -> 1775.52 | F140: =RC[-1]-RC[-4] -> -24.589999999999918 | H140: 977 | I140: 7 | J140: EP5PW11000037 | K140: 2011-12-12 00:00:00 | L140: 2012-12-12 00:00:00 | M140: 12 | N140: 8876.7099999999991 | O140: 50000 | P140: 1 | Q140: 30 | R140: 1 | S140: 1 | T140: 365 | U140: 18
A141: 40000 | B141: 1400.71 | C141: =IF(DAYS360(RC[8],R1C3)+2>365,365,DAYS360(RC[8],R1C3)+2) -> 70 | D141: =ROUND(RC[-3]*RC[17]/36500,2) -> 19.73 | E141: =RC[-1]*RC[-2] -> 1381.1000000000001 | F141: =RC[-1]-RC[-4] -> -19.6099999999999 | H141: 983 | I141: 7 | J141: EP5PW11000038 | K141: 2011-12-14 00:00:00 | L141: 2012-12-14 00:00:00 | M141: 12 | N141: 7101.37 | O141: 40000 | P141: 1 | Q141: 30 | R141: 1 | S141: 1 | T141: 365 | U141: 18
A142: 30000 | B142: 946.7 | C142: =IF(DAYS360(RC[8],R1C3)+2>365,365,DAYS360(RC[8],R1C3)+2) -> 63 | D142: =ROUND(RC[-3]*RC[17]/36500,2) -> 14.79 | E142: =RC[-1]*RC[-2] -> 931.77 | F142: =RC[-1]-RC[-4] -> -14.930000000000064 | H142: 1020 | I142: 7 | J142: EP5PW11000040 | K142: 2011-12-21 00:00:00 | L142: 2012-12-21 00:00:00 | M142: 12 | N142: 5326.03 | O142: 30000 | P142: 1 | Q142: 30 | R142: 1 | S142: 1 | T142: 365 | U142: 18
A143: 136000 | B143: 3286.38 | C143: =IF(DAYS360(RC[8],R1C3)+2>365,365,DAYS360(RC[8],R1C3)+2) -> 49 | D143: =ROUND(RC[-3]*RC[17]/36500,2) -> 67.069999999999993 | E143: =RC[-1]*RC[-2] -> 3286.43 | F143: =RC[-1]-RC[-4] -> 4.9999999999727152E-2 | H143: 1085 | I143: 7 | J143: EP5PW12000042 | K143: 2012-01-05 00:00:00 | L143: 2013-01-05 00:00:00 | M143: 12 | N143: 24144.66 | O143: 136000 | P143: 1 | Q143: 30 | R143: 1 | S143: 1 | T143: 365 | U143: 18
A144: 30000 | B144: 710.06 | C144: =IF(DAYS360(RC[8],R1C3)+2>365,365,DAYS360(RC[8],R1C3)+2) -> 48 | D144: =ROUND(RC[-3]*RC[17]/36500,2) -> 14.79 | E144: =RC[-1]*RC[-2] -> 709.92 | F144: =RC[-1]-RC[-4] -> -0.13999999999998636 | H144: 1090 | I144: 7 | J144: EP5PW12000043 | K144: 2012-01-06 00:00:00 | L144: 2013-01-06 00:00:00 | M144: 12 | N144: 5326.03 | O144: 30000 | P144: 1 | Q144: 30 | R144: 1 | S144: 1 | T144: 365 | U144: 18
A145: 30000 | B145: 710.06 | C145: =IF(DAYS360(RC[8],R1C3)+2>365,365,DAYS360(RC[8],R1C3)+2) -> 48 | D145: =ROUND(RC[-3]*RC[17]/36500,2) -> 14.79 | E145: =RC[-1]*RC[-2] -> 709.92 | F145: =RC[-1]-RC[-4] -> -0.13999999999998636 | H145: 1095 | I145: 7 | J145: EP5PW12000044 | K145: 2012-01-06 00:00:00 | L145: 2013-01-06 00:00:00 | M145: 12 | N145: 5326.03 | O145: 30000 | P145: 1 | Q145: 30 | R145: 1 | S145: 1 | T145: 365 | U145: 18
A146: 36000 | B146: 727.85 | C146: =IF(DAYS360(RC[8],R1C3)+2>365,365,DAYS360(RC[8],R1C3)+2) -> 41 | D146: =ROUND(RC[-3]*RC[17]/36500,2) -> 17.75 | E146: =RC[-1]*RC[-2] -> 727.75 | F146: =RC[-1]-RC[-4] -> -0.10000000000002274 | H146: 1122 | I146: 7 | J146: EP5PW12000046 | K146: 2012-01-13 00:00:00 | L146: 2013-01-13 00:00:00 | M146: 12 | N146: 6391.23 | O146: 36000 | P146: 1 | Q146: 30 | R146: 1 | S146: 1 | T146: 365 | U146: 18
A147: 24000 | B147: 355.07 | C147: =IF(DAYS360(RC[8],R1C3)+2>365,365,DAYS360(RC[8],R1C3)+2) -> 28 | D147: =ROUND(RC[-3]*RC[17]/36500,2) -> 11.84 | E147: =RC[-1]*RC[-2] -> 331.52 | F147: =RC[-1]-RC[-4] -> -23.550000000000011 | H147: 1190 | I147: 7 | J147: EP5PW12000050 | K147: 2012-01-26 00:00:00 | L147: 2013-01-26 00:00:00 | M147: 12 | N147: 4260.82 | O147: 24000 | P147: 1 | Q147: 30 | R147: 1 | S147: 1 | T147: 365 | U147: 18
A148: 10000 | B148: 250 | C148: =IF(DAYS360(RC[8],R1C3)+2>365,365,DAYS360(RC[8],R1C3)+2) -> 27 | D148: =ROUND(RC[-3]*RC[17]/36500,2) -> 4.93 | E148: =RC[-1]*RC[-2] -> 133.10999999999999 | F148: =RC[-1]-RC[-4] -> -116.89000000000001 | H148: 1195 | I148: 7 | J148: EP5PW12000051 | K148: 2012-01-27 00:00:00 | L148: 2013-01-27 00:00:00 | M148: 12 | N148: 1775.34 | O148: 10000 | P148: 1 | Q148: 50 | R148: 1 | S148: 1 | T148: 365 | U148: 18
A149: 40000 | B149: 591.78 | C149: =IF(DAYS360(RC[8],R1C3)+2>365,365,DAYS360(RC[8],R1C3)+2) -> 27 | D149: =ROUND(RC[-3]*RC[17]/36500,2) -> 19.73 | E149: =RC[-1]*RC[-2] -> 532.71 | F149: =RC[-1]-RC[-4] -> -59.069999999999936 | H149: 1198 | I149: 7 | J149: EP5PW12000052 | K149: 2012-01-27 00:00:00 | L149: 2013-01-27 00:00:00 | M149: 12 | N149: 7101.37 | O149: 40000 | P149: 1 | Q149: 30 | R149: 1 | S149: 1 | T149: 365 | U149: 18
A150: 40000 | B150: 591.78 | C150: =IF(DAYS360(RC[8],R1C3)+2>365,365,DAYS360(RC[8],R1C3)+2) -> 24 | D150: =ROUND(RC[-3]*RC[17]/36500,2) -> 19.73 | E150: =RC[-1]*RC[-2] -> 473.52 | F150: =RC[-1]-RC[-4] -> -118.25999999999999 | H150: 1199 | I150: 7 | J150: EP5PW12000053 | K150: 2012-01-30 00:00:00 | L150: 2013-01-30 00:00:00 | M150: 12 | N150: 7101.37 | O150: 40000 | P150: 1 | Q150: 30 | R150: 1 | S150: 1 | T150: 365 | U150: 18
A151: 53000 | B151: 784.11 | C151: =IF(DAYS360(RC[8],R1C3)+2>365,365,DAYS360(RC[8],R1C3)+2) -> 24 | D151: =ROUND(RC[-3]*RC[17]/36500,2) -> 26.14 | E151: =RC[-1]*RC[-2] -> 627.36 | F151: =RC[-1]-RC[-4] -> -156.75 | H151: 1206 | I151: 7 | J151: EP5PW12000054 | K151: 2012-01-30 00:00:00 | L151: 2013-01-30 00:00:00 | M151: 12 | N151: 9409.32 | O151: 53000 | P151: 1 | Q151: 30 | R151: 1 | S151: 1 | T151: 365 | U151: 18
A152: 79000 | B152: 1168.77 | C152: =IF(DAYS360(RC[8],R1C3)+2>365,365,DAYS360(RC[8],R1C3)+2) -> 11 | D152: =ROUND(RC[-3]*RC[17]/36500,2) -> 38.96 | E152: =RC[-1]*RC[-2] -> 428.56 | F152: =RC[-1]-RC[-4] -> -740.21 | H152: 1253 | I152: 7 | J152: EP5PW12000055 | K152: 2012-02-13 00:00:00 | L152: 2013-02-13 00:00:00 | M152: 12 | N152: 14025.21 | O152: 79000 | P152: 1 | Q152: 30 | R152: 1 | S152: 1 | T152: 365 | U152: 18
A153: 20000 | B153: 295.89 | C153: =IF(DAYS360(RC[8],R1C3)+2>365,365,DAYS360(RC[8],R1C3)+2) -> 3 | D153: =ROUND(RC[-3]*RC[17]/36500,2) -> 9.86 | E153: =RC[-1]*RC[-2] -> 29.58 | F153: =RC[-1]-RC[-4] -> -266.31 | H153: 1279 | I153: 7 | J153: EP5PW12000057 | K153: 2012-02-21 00:00:00 | L153: 2013-02-21 00:00:00 | M153: 12 | N153: 3550.68 | O153: 20000 | P153: 1 | Q153: 30 | R153: 1 | S153: 1 | T153: 365 | U153: 18
A154: 25000 | B154: 1035.68 | C154: =IF(DAYS360(RC[8],R1C3)+2>365,365,DAYS360(RC[8],R1C3)+2) -> 83 | D154: =ROUND(RC[-3]*RC[17]/36500,2) -> 12.33 | E154: =RC[-1]*RC[-2] -> 1023.39 | F154: =RC[-1]-RC[-4] -> -12.290000000000077 | H154: 946 | I154: 1 | J154: HEDPW11000002 | K154: 2011-12-01 00:00:00 | L154: 2012-12-01 00:00:00 | M154: 12 | N154: 4438.3599999999997 | O154: 25000 | P154: 1 | Q154: 30 | R154: 1 | S154: 1 | T154: 365 | U154: 18
A155: 10000 | B155: 417.62 | C155: =IF(DAYS360(RC[8],R1C3)+2>365,365,DAYS360(RC[8],R1C3)+2) -> 83 | D155: =ROUND(RC[-3]*RC[17]/36500,2) -> 4.93 | E155: =RC[-1]*RC[-2] -> 409.19 | F155: =RC[-1]-RC[-4] -> -8.4300000000000068 | H155: 947 | I155: 1 | J155: HEDPW11000003 | K155: 2011-12-01 00:00:00 | L155: 2012-12-01 00:00:00 | M155: 12 | N155: 1775.34 | O155: 10000 | P155: 1 | Q155: 50 | R155: 1 | S155: 1 | T155: 365 | U155: 18
A156: 550000 | B156: 21427.26 | C156: =IF(DAYS360(RC[8],R1C3)+2>365,365,DAYS360(RC[8],R1C3)+2) -> 78 | D156: =ROUND(RC[-3]*RC[17]/36500,2) -> 271.23 | E156: =RC[-1]*RC[-2] -> 21155.940000000002 | F156: =RC[-1]-RC[-4] -> -271.31999999999607 | H156: 956 | I156: 1 | J156: HEDPW11000007 | K156: 2011-12-06 00:00:00 | L156: 2012-12-06 00:00:00 | M156: 12 | N156: 97643.839999999997 | O156: 550000 | P156: 1 | Q156: 30 | R156: 1 | S156: 1 | T156: 365 | U156: 18
A157: 50000 | B157: 1923.41 | C157: =IF(DAYS360(RC[8],R1C3)+2>365,365,DAYS360(RC[8],R1C3)+2) -> 77 | D157: =ROUND(RC[-3]*RC[17]/36500,2) -> 24.66 | E157: =RC[-1]*RC[-2] -> 1898.82 | F157: =RC[-1]-RC[-4] -> -24.590000000000146 | H157: 959 | I157: 1 | J157: HEDPW11000008 | K157: 2011-12-07 00:00:00 | L157: 2012-12-07 00:00:00 | M157: 12 | N157: 8876.7099999999991 | O157: 50000 | P157: 1 | Q157: 30 | R157: 1 | S157: 1 | T157: 365 | U157: 18
A158: 6000 | B158: 250 | C158: =IF(DAYS360(RC[8],R1C3)+2>365,365,DAYS360(RC[8],R1C3)+2) -> 70 | D158: =ROUND(RC[-3]*RC[17]/36500,2) -> 2.96 | E158: =RC[-1]*RC[-2] -> 207.2 | F158: =RC[-1]-RC[-4] -> -42.800000000000011 | H158: 986 | I158: 1 | J158: HEDPW11000009 | K158: 2011-12-14 00:00:00 | L158: 2012-12-14 00:00:00 | M158: 12 | N158: 1065.21 | O158: 6000 | P158: 1 | Q158: 84 | R158: 1 | S158: 1 | T158: 365 | U158: 18
A159: 40000 | B159: 946.92 | C159: =IF(DAYS360(RC[8],R1C3)+2>365,365,DAYS360(RC[8],R1C3)+2) -> 48 | D159: =ROUND(RC[-3]*RC[17]/36500,2) -> 19.73 | E159: =RC[-1]*RC[-2] -> 947.04 | F159: =RC[-1]-RC[-4] -> 0.12000000000000455 | H159: 1091 | I159: 1 | J159: HEDPW12000012 | K159: 2012-01-06 00:00:00 | L159: 2013-01-06 00:00:00 | M159: 12 | N159: 7101.37 | O159: 40000 | P159: 1 | Q159: 30 | R159: 1 | S159: 1 | T159: 365 | U159: 18
A160: 26000 | B160: 474.4 | C160: =IF(DAYS360(RC[8],R1C3)+2>365,365,DAYS360(RC[8],R1C3)+2) -> 37 | D160: =ROUND(RC[-3]*RC[17]/36500,2) -> 12.82 | E160: =RC[-1]*RC[-2] -> 474.34000000000003 | F160: =RC[-1]-RC[-4] -> -5.999999999994543E-2 | H160: 1130 | I160: 1 | J160: HEDPW12000014 | K160: 2012-01-17 00:00:00 | L160: 2013-01-17 00:00:00 | M160: 12 | N160: 4615.8900000000003 | O160: 26000 | P160: 1 | Q160: 30 | R160: 1 | S160: 1 | T160: 365 | U160: 18
A161: 16500 | B161: 282.56 | C161: =IF(DAYS360(RC[8],R1C3)+2>365,365,DAYS360(RC[8],R1C3)+2) -> 34 | D161: =ROUND(RC[-3]*RC[17]/36500,2) -> 8.14 | E161: =RC[-1]*RC[-2] -> 276.76 | F161: =RC[-1]-RC[-4] -> -5.8000000000000114 | H161: 1162 | I161: 1 | J161: HEDPW12000019 | K161: 2012-01-20 00:00:00 | L161: 2013-01-20 00:00:00 | M161: 12 | N161: 2929.32 | O161: 16500 | P161: 1 | Q161: 30 | R161: 1 | S161: 1 | T161: 365 | U161: 18
A162: 15000 | B162: 250 | C162: =IF(DAYS360(RC[8],R1C3)+2>365,365,DAYS360(RC[8],R1C3)+2) -> 31 | D162: =ROUND(RC[-3]*RC[17]/36500,2) -> 7.4 | E162: =RC[-1]*RC[-2] -> 229.4 | F162: =RC[-1]-RC[-4] -> -20.599999999999994 | H162: 1172 | I162: 1 | J162: HEDPW12000023 | K162: 2012-01-23 00:00:00 | L162: 2013-01-23 00:00:00 | M162: 12 | N162: 2663.01 | O162: 15000 | P162: 1 | Q162: 33 | R162: 1 | S162: 1 | T162: 365 | U162: 18
A163: 8000 | B163: 250 | C163: =IF(DAYS360(RC[8],R1C3)+2>365,365,DAYS360(RC[8],R1C3)+2) -> 22 | D163: =ROUND(RC[-3]*RC[17]/36500,2) -> 3.95 | E163: =RC[-1]*RC[-2] -> 86.9 | F163: =RC[-1]-RC[-4] -> -163.1 | H163: 1222 | I163: 1 | J163: HEDPW12000025 | K163: 2012-02-02 00:00:00 | L163: 2013-02-02 00:00:00 | M163: 12 | N163: 1420.27 | O163: 8000 | P163: 1 | Q163: 63 | R163: 1 | S163: 1 | T163: 365 | U163: 18
A164: 57000 | B164: 843.29 | C164: =IF(DAYS360(RC[8],R1C3)+2>365,365,DAYS360(RC[8],R1C3)+2) -> 22 | D164: =ROUND(RC[-3]*RC[17]/36500,2) -> 28.11 | E164: =RC[-1]*RC[-2] -> 618.41999999999996 | F164: =RC[-1]-RC[-4] -> -224.87 | H164: 1223 | I164: 1 | J164: HEDPW12000026 | K164: 2012-02-02 00:00:00 | L164: 2013-02-02 00:00:00 | M164: 12 | N164: 10119.450000000001 | O164: 57000 | P164: 1 | Q164: 30 | R164: 1 | S164: 1 | T164: 365 | U164: 18
A165: 11500 | B165: 1726.14 | C165: =IF(DAYS360(RC[8],R1C3)+2>365,365,DAYS360(RC[8],R1C3)+2) -> 365 | D165: =ROUND(RC[-3]*RC[17]/36500,2) -> 4.7300000000000004 | E165: =RC[-1]*RC[-2] -> 1726.45 | F165: =RC[-1]-RC[-4] -> 0.30999999999994543 | H165: 111 | I165: 6 | J165: KA4PW11000007 | K165: 2011-01-12 12:28:48 | L165: 2012-01-12 12:28:48 | M165: 12 | N165: 1701.37 | O165: 11500 | P165: 4 | Q165: 53 | R165: 1 | S165: 1 | T165: 365 | U165: 15
A166: 78000 | B166: 11698.72 | C166: =IF(DAYS360(RC[8],R1C3)+2>365,365,DAYS360(RC[8],R1C3)+2) -> 365 | D166: =ROUND(RC[-3]*RC[17]/36500,2) -> 32.049999999999997 | E166: =RC[-1]*RC[-2] -> 11698.249999999998 | F166: =RC[-1]-RC[-4] -> -0.47000000000116415 | H166: 112 | I166: 6 | J166: KA4PW11000008 | K166: 2011-01-12 12:28:48 | L166: 2012-01-12 12:28:48 | M166: 12 | N166: 11539.73 | O166: 78000 | P166: 4 | Q166: 30 | R166: 1 | S166: 1 | T166: 365 | U166: 15
A167: 93000 | B167: 13950.22 | C167: =IF(DAYS360(RC[8],R1C3)+2>365,365,DAYS360(RC[8],R1C3)+2) -> 365 | D167: =ROUND(RC[-3]*RC[17]/36500,2) -> 38.22 | E167: =RC[-1]*RC[-2] -> 13950.3 | F167: =RC[-1]-RC[-4] -> 7.999999999992724E-2 | H167: 225 | I167: 6 | J167: KA4PW11000014 | K167: 2011-01-18 12:28:48 | L167: 2012-01-18 12:28:48 | M167: 12 | N167: 13758.9 | O167: 93000 | P167: 4 | Q167: 30 | R167: 1 | S167: 1 | T167: 365 | U167: 15
A168: 41000 | B168: 6150.19 | C168: =IF(DAYS360(RC[8],R1C3)+2>365,365,DAYS360(RC[8],R1C3)+2) -> 365 | D168: =ROUND(RC[-3]*RC[17]/36500,2) -> 16.850000000000001 | E168: =RC[-1]*RC[-2] -> 6150.2500000000009 | F168: =RC[-1]-RC[-4] -> 6.0000000001309672E-2 | H168: 266 | I168: 6 | J168: KA4PW11000017 | K168: 2011-01-20 12:28:48 | L168: 2012-01-20 12:28:48 | M168: 12 | N168: 6065.75 | O168: 41000 | P168: 4 | Q168: 30 | R168: 1 | S168: 1 | T168: 365 | U168: 15
A169: 27500 | B169: 4124.62 | C169: =IF(DAYS360(RC[8],R1C3)+2>365,365,DAYS360(RC[8],R1C3)+2) -> 365 | D169: =ROUND(RC[-3]*RC[17]/36500,2) -> 11.3 | E169: =RC[-1]*RC[-2] -> 4124.5 | F169: =RC[-1]-RC[-4] -> -0.11999999999989086 | H169: 267 | I169: 6 | J169: KA4PW11000018 | K169: 2011-01-20 12:28:48 | L169: 2012-01-20 12:28:48 | M169: 12 | N169: 4068.49 | O169: 27500 | P169: 4 | Q169: 30 | R169: 1 | S169: 1 | T169: 365 | U169: 15
A170: 59000 | B170: 8850.9500000000007 | C170: =IF(DAYS360(RC[8],R1C3)+2>365,365,DAYS360(RC[8],R1C3)+2) -> 365 | D170: =ROUND(RC[-3]*RC[17]/36500,2) -> 24.25 | E170: =RC[-1]*RC[-2] -> 8851.25 | F170: =RC[-1]-RC[-4] -> 0.2999999999992724 | H170: 276 | I170: 6 | J170: KA4PW11000022 | K170: 2011-01-24 12:28:48 | L170: 2012-01-24 12:28:48 | M170: 12 | N170: 8728.77 | O170: 59000 | P170: 4 | Q170: 30 | R170: 1 | S170: 1 | T170: 365 | U170: 15
A171: 51000 | B171: 7650.32 | C171: =IF(DAYS360(RC[8],R1C3)+2>365,365,DAYS360(RC[8],R1C3)+2) -> 365 | D171: =ROUND(RC[-3]*RC[17]/36500,2) -> 20.96 | E171: =RC[-1]*RC[-2] -> 7650.4000000000005 | F171: =RC[-1]-RC[-4] -> 8.0000000000836735E-2 | H171: 282 | I171: 6 | J171: KA4PW11000026 | K171: 2011-02-11 12:28:48 | L171: 2012-02-11 12:28:48 | M171: 12 | N171: 7545.21 | O171: 51000 | P171: 4 | Q171: 30 | R171: 1 | S171: 1 | T171: 365 | U171: 15
A172: 38000 | B172: 5607.4 | C172: =IF(DAYS360(RC[8],R1C3)+2>365,365,DAYS360(RC[8],R1C3)+2) -> 353 | D172: =ROUND(RC[-3]*RC[17]/36500,2) -> 15.62 | E172: =RC[-1]*RC[-2] -> 5513.86 | F172: =RC[-1]-RC[-4] -> -93.539999999999964 | H172: 287 | I172: 6 | J172: KA4PW11000031 | K172: 2011-03-01 12:28:48 | L172: 2012-03-01 12:28:48 | M172: 12 | N172: 5621.92 | O172: 38000 | P172: 1 | Q172: 30 | R172: 1 | S172: 1 | T172: 365 | U172: 15
A173: 40000 | B173: 5869 | C173: =IF(DAYS360(RC[8],R1C3)+2>365,365,DAYS360(RC[8],R1C3)+2) -> 351 | D173: =ROUND(RC[-3]*RC[17]/36500,2) -> 16.440000000000001 | E173: =RC[-1]*RC[-2] -> 5770.4400000000005 | F173: =RC[-1]-RC[-4] -> -98.559999999999491 | H173: 289 | I173: 6 | J173: KA4PW11000033 | K173: 2011-03-03 12:28:48 | L173: 2012-03-03 12:28:48 | M173: 12 | N173: 5917.81 | O173: 40000 | P173: 1 | Q173: 30 | R173: 1 | S173: 1 | T173: 365 | U173: 15
A174: 40000 | B174: 5869 | C174: =IF(DAYS360(RC[8],R1C3)+2>365,365,DAYS360(RC[8],R1C3)+2) -> 351 | D174: =ROUND(RC[-3]*RC[17]/36500,2) -> 16.440000000000001 | E174: =RC[-1]*RC[-2] -> 5770.4400000000005 | F174: =RC[-1]-RC[-4] -> -98.559999999999491 | H174: 290 | I174: 6 | J174: KA4PW11000034 | K174: 2011-03-03 12:28:48 | L174: 2012-03-03 12:28:48 | M174: 12 | N174: 5917.81 | O174: 40000 | P174: 1 | Q174: 30 | R174: 1 | S174: 1 | T174: 365 | U174: 15
A175: 55000 | B175: 7910.12 | C175: =IF(DAYS360(RC[8],R1C3)+2>365,365,DAYS360(RC[8],R1C3)+2) -> 344 | D175: =ROUND(RC[-3]*RC[17]/36500,2) -> 22.6 | E175: =RC[-1]*RC[-2] -> 7774.4000000000005 | F175: =RC[-1]-RC[-4] -> -135.71999999999935 | H175: 315 | I175: 6 | J175: KA4PW11000038 | K175: 2011-03-10 12:28:48 | L175: 2012-03-10 12:28:48 | M175: 12 | N175: 8136.99 | O175: 55000 | P175: 1 | Q175: 30 | R175: 1 | S175: 1 | T175: 365 | U175: 15
A176: 7500 | B176: 1066.2 | C176: =IF(DAYS360(RC[8],R1C3)+2>365,365,DAYS360(RC[8],R1C3)+2) -> 340 | D176: =ROUND(RC[-3]*RC[17]/36500,2) -> 3.08 | E176: =RC[-1]*RC[-2] -> 1047.2 | F176: =RC[-1]-RC[-4] -> -19 | H176: 320 | I176: 6 | J176: KA4PW11000040 | K176: 2011-03-14 12:28:48 | L176: 2012-03-14 12:28:48 | M176: 12 | N176: 1109.5899999999999 | O176: 7500 | P176: 1 | Q176: 81 | R176: 1 | S176: 1 | T176: 365 | U176: 15
A177: 7800 | B177: 1039.6600000000001 | C177: =IF(DAYS360(RC[8],R1C3)+2>365,365,DAYS360(RC[8],R1C3)+2) -> 318 | D177: =ROUND(RC[-3]*RC[17]/36500,2) -> 3.21 | E177: =RC[-1]*RC[-2] -> 1020.78 | F177: =RC[-1]-RC[-4] -> -18.880000000000109 | H177: 397 | I177: 6 | J177: KA4PW11000056 | K177: 2011-04-06 12:28:48 | L177: 2012-04-06 12:28:48 | M177: 12 | N177: 1153.97 | O177: 7800 | P177: 1 | Q177: 77 | R177: 1 | S177: 1 | T177: 365 | U177: 15
A178: 39000 | B178: 5177.6099999999997 | C178: =IF(DAYS360(RC[8],R1C3)+2>365,365,DAYS360(RC[8],R1C3)+2) -> 318 | D178: =ROUND(RC[-3]*RC[17]/36500,2) -> 16.03 | E178: =RC[-1]*RC[-2] -> 5097.54 | F178: =RC[-1]-RC[-4] -> -80.069999999999709 | H178: 398 | I178: 6 | J178: KA4PW11000057 | K178: 2011-04-06 12:28:48 | L178: 2012-04-06 12:28:48 | M178: 12 | N178: 5769.86 | O178: 39000 | P178: 1 | Q178: 30 | R178: 1 | S178: 1 | T178: 365 | U178: 15
A179: 13000 | B179: 1718.5 | C179: =IF(DAYS360(RC[8],R1C3)+2>365,365,DAYS360(RC[8],R1C3)+2) -> 316 | D179: =ROUND(RC[-3]*RC[17]/36500,2) -> 5.34 | E179: =RC[-1]*RC[-2] -> 1687.44 | F179: =RC[-1]-RC[-4] -> -31.059999999999945 | H179: 400 | I179: 6 | J179: KA4PW11000058 | K179: 2011-04-08 12:28:48 | L179: 2012-04-08 12:28:48 | M179: 12 | N179: 1923.29 | O179: 13000 | P179: 1 | Q179: 46 | R179: 1 | S179: 1 | T179: 365 | U179: 15
A180: 47000 | B180: 6124.29 | C180: =IF(DAYS360(RC[8],R1C3)+2>365,365,DAYS360(RC[8],R1C3)+2) -> 312 | D180: =ROUND(RC[-3]*RC[17]/36500,2) -> 19.32 | E180: =RC[-1]*RC[-2] -> 6027.84 | F180: =RC[-1]-RC[-4] -> -96.449999999999818 | H180: 408 | I180: 6 | J180: KA4PW11000060 | K180: 2011-04-12 12:28:48 | L180: 2012-04-12 12:28:48 | M180: 12 | N180: 6953.42 | O180: 47000 | P180: 1 | Q180: 30 | R180: 1 | S180: 1 | T180: 365 | U180: 15
A181: 15750 | B181: 1971.02 | C181: =IF(DAYS360(RC[8],R1C3)+2>365,365,DAYS360(RC[8],R1C3)+2) -> 299 | D181: =ROUND(RC[-3]*RC[17]/36500,2) -> 6.47 | E181: =RC[-1]*RC[-2] -> 1934.53 | F181: =RC[-1]-RC[-4] -> -36.490000000000009 | H181: 426 | I181: 6 | J181: KA4PW11000064 | K181: 2011-04-25 12:28:48 | L181: 2012-04-25 12:28:48 | M181: 12 | N181: 2330.14 | O181: 15750 | P181: 1 | Q181: 38 | R181: 1 | S181: 1 | T181: 365 | U181: 15
A182: 45000 | B182: 5417.66 | C182: =IF(DAYS360(RC[8],R1C3)+2>365,365,DAYS360(RC[8],R1C3)+2) -> 288 | D182: =ROUND(RC[-3]*RC[17]/36500,2) -> 18.489999999999998 | E182: =RC[-1]*RC[-2] -> 5325.12 | F182: =RC[-1]-RC[-4] -> -92.539999999999964 | H182: 465 | I182: 6 | J182: KA4PW11000072 | K182: 2011-05-06 12:28:48 | L182: 2012-05-06 12:28:48 | M182: 12 | N182: 6657.53 | O182: 45000 | P182: 1 | Q182: 30 | R182: 1 | S182: 1 | T182: 365 | U182: 15
A183: 53000 | B183: 6272.66 | C183: =IF(DAYS360(RC[8],R1C3)+2>365,365,DAYS360(RC[8],R1C3)+2) -> 283 | D183: =ROUND(RC[-3]*RC[17]/36500,2) -> 21.78 | E183: =RC[-1]*RC[-2] -> 6163.7400000000007 | F183: =RC[-1]-RC[-4] -> -108.91999999999916 | H183: 472 | I183: 6 | J183: KA4PW11000073 | K183: 2011-05-11 12:28:48 | L183: 2012-05-11 12:28:48 | M183: 12 | N183: 7841.1 | O183: 53000 | P183: 1 | Q183: 30 | R183: 1 | S183: 1 | T183: 365 | U183: 15
A184: 16000 | B184: 1962.13 | C184: =IF(DAYS360(RC[8],R1C3)+2>365,365,DAYS360(RC[8],R1C3)+2) -> 244 | D184: =ROUND(RC[-3]*RC[17]/36500,2) -> 7.89 | E184: =RC[-1]*RC[-2] -> 1925.1599999999999 | F184: =RC[-1]-RC[-4] -> -36.970000000000255 | H184: 522 | I184: 6 | J184: KA4PW11000077 | K184: 2011-06-20 12:28:48 | L184: 2012-06-20 12:28:48 | M184: 12 | N184: 2840.55 | O184: 16000 | P184: 1 | Q184: 31 | R184: 1 | S184: 1 | T184: 365 | U184: 18
A185: 8750 | B185: 1070.8 | C185: =IF(DAYS360(RC[8],R1C3)+2>365,365,DAYS360(RC[8],R1C3)+2) -> 243 | D185: =ROUND(RC[-3]*RC[17]/36500,2) -> 4.32 | E185: =RC[-1]*RC[-2] -> 1049.76 | F185: =RC[-1]-RC[-4] -> -21.039999999999964 | H185: 525 | I185: 6 | J185: KA4PW11000079 | K185: 2011-06-21 12:28:48 | L185: 2012-06-21 12:28:48 | M185: 12 | N185: 1553.42 | O185: 8750 | P185: 1 | Q185: 57 | R185: 1 | S185: 1 | T185: 365 | U185: 18
A186: 27000 | B186: 3263.25 | C186: =IF(DAYS360(RC[8],R1C3)+2>365,365,DAYS360(RC[8],R1C3)+2) -> 241 | D186: =ROUND(RC[-3]*RC[17]/36500,2) -> 13.32 | E186: =RC[-1]*RC[-2] -> 3210.12 | F186: =RC[-1]-RC[-4] -> -53.130000000000109 | H186: 531 | I186: 6 | J186: KA4PW11000081 | K186: 2011-06-23 12:28:48 | L186: 2012-06-23 12:28:48 | M186: 12 | N186: 4793.42 | O186: 27000 | P186: 1 | Q186: 30 | R186: 1 | S186: 1 | T186: 365 | U186: 18
A187: 48000 | B187: 4947.07 | C187: =IF(DAYS360(RC[8],R1C3)+2>365,365,DAYS360(RC[8],R1C3)+2) -> 205 | D187: =ROUND(RC[-3]*RC[17]/36500,2) -> 23.67 | E187: =RC[-1]*RC[-2] -> 4852.3500000000004 | F187: =RC[-1]-RC[-4] -> -94.719999999999345 | H187: 578 | I187: 6 | J187: KA4PW11000085 | K187: 2011-07-29 12:28:48 | L187: 2012-07-29 12:28:48 | M187: 12 | N187: 8521.64 | O187: 48000 | P187: 1 | Q187: 30 | R187: 1 | S187: 1 | T187: 365 | U187: 18
A188: 30000 | B188: 2943.35 | C188: =IF(DAYS360(RC[8],R1C3)+2>365,365,DAYS360(RC[8],R1C3)+2) -> 196 | D188: =ROUND(RC[-3]*RC[17]/36500,2) -> 14.79 | E188: =RC[-1]*RC[-2] -> 2898.8399999999997 | F188: =RC[-1]-RC[-4] -> -44.510000000000218 | H188: 602 | I188: 6 | J188: KA4PW11000087 | K188: 2011-08-08 12:28:48 | L188: 2012-08-08 12:28:48 | M188: 12 | N188: 5326.03 | O188: 30000 | P188: 1 | Q188: 30 | R188: 1 | S188: 1 | T188: 365 | U188: 18
A189: 180000 | B189: 17665.14 | C189: =IF(DAYS360(RC[8],R1C3)+2>365,365,DAYS360(RC[8],R1C3)+2) -> 196 | D189: =ROUND(RC[-3]*RC[17]/36500,2) -> 88.77 | E189: =RC[-1]*RC[-2] -> 17398.919999999998 | F189: =RC[-1]-RC[-4] -> -266.22000000000116 | H189: 607 | I189: 6 | J189: KA4PW11000089 | K189: 2011-08-08 12:28:48 | L189: 2012-08-08 12:28:48 | M189: 12 | N189: 31956.16 | O189: 180000 | P189: 1 | Q189: 30 | R189: 1 | S189: 1 | T189: 365 | U189: 18
A190: 36000 | B190: 3514.6 | C190: =IF(DAYS360(RC[8],R1C3)+2>365,365,DAYS360(RC[8],R1C3)+2) -> 195 | D190: =ROUND(RC[-3]*RC[17]/36500,2) -> 17.75 | E190: =RC[-1]*RC[-2] -> 3461.25 | F190: =RC[-1]-RC[-4] -> -53.349999999999909 | H190: 612 | I190: 6 | J190: KA4PW11000090 | K190: 2011-08-09 12:28:48 | L190: 2012-08-09 12:28:48 | M190: 12 | N190: 6391.23 | O190: 36000 | P190: 1 | Q190: 30 | R190: 1 | S190: 1 | T190: 365 | U190: 18
A191: 8500 | B191: 798.89 | C191: =IF(DAYS360(RC[8],R1C3)+2>365,365,DAYS360(RC[8],R1C3)+2) -> 188 | D191: =ROUND(RC[-3]*RC[17]/36500,2) -> 4.1900000000000004 | E191: =RC[-1]*RC[-2] -> 787.72 | F191: =RC[-1]-RC[-4] -> -11.169999999999959 | H191: 652 | I191: 6 | J191: KA4PW11000096 | K191: 2011-08-16 12:28:48 | L191: 2012-08-16 12:28:48 | M191: 12 | N191: 1509.04 | O191: 8500 | P191: 1 | Q191: 59 | R191: 1 | S191: 1 | T191: 365 | U191: 18
A192: 17000 | B192: 1525.27 | C192: =IF(DAYS360(RC[8],R1C3)+2>365,365,DAYS360(RC[8],R1C3)+2) -> 180 | D192: =ROUND(RC[-3]*RC[17]/36500,2) -> 8.3800000000000008 | E192: =RC[-1]*RC[-2] -> 1508.4 | F192: =RC[-1]-RC[-4] -> -16.869999999999891 | H192: 699 | I192: 6 | J192: KA4PW11000108 | K192: 2011-08-24 12:28:48 | L192: 2012-08-24 12:28:48 | M192: 12 | N192: 3018.08 | O192: 17000 | P192: 1 | Q192: 30 | R192: 1 | S192: 1 | T192: 365 | U192: 18
A193: 77700 | B193: 6897.53 | C193: =IF(DAYS360(RC[8],R1C3)+2>365,365,DAYS360(RC[8],R1C3)+2) -> 178 | D193: =ROUND(RC[-3]*RC[17]/36500,2) -> 38.32 | E193: =RC[-1]*RC[-2] -> 6820.96 | F193: =RC[-1]-RC[-4] -> -76.569999999999709 | H193: 716 | I193: 6 | J193: KA4PW11000113 | K193: 2011-08-26 12:28:48 | L193: 2012-08-26 12:28:48 | M193: 12 | N193: 13794.41 | O193: 77700 | P193: 1 | Q193: 30 | R193: 1 | S193: 1 | T193: 365 | U193: 18
A194: 36500 | B194: 3132 | C194: =IF(DAYS360(RC[8],R1C3)+2>365,365,DAYS360(RC[8],R1C3)+2) -> 173 | D194: =ROUND(RC[-3]*RC[17]/36500,2) -> 18 | E194: =RC[-1]*RC[-2] -> 3114 | F194: =RC[-1]-RC[-4] -> -18 | H194: 732 | I194: 6 | J194: KA4PW11000117 | K194: 2011-09-01 12:28:48 | L194: 2012-09-01 12:28:48 | M194: 12 | N194: 6480 | O194: 36500 | P194: 1 | Q194: 30 | R194: 1 | S194: 1 | T194: 365 | U194: 18
A195: 135000 | B195: 11185.3 | C195: =IF(DAYS360(RC[8],R1C3)+2>365,365,DAYS360(RC[8],R1C3)+2) -> 167 | D195: =ROUND(RC[-3]*RC[17]/36500,2) -> 66.58 | E195: =RC[-1]*RC[-2] -> 11118.86 | F195: =RC[-1]-RC[-4] -> -66.43999999999869 | H195: 754 | I195: 6 | J195: KA4PW11000121 | K195: 2011-09-07 12:28:48 | L195: 2012-09-07 12:28:48 | M195: 12 | N195: 23967.119999999999 | O195: 135000 | P195: 1 | Q195: 30 | R195: 1 | S195: 1 | T195: 365 | U195: 18
A196: 39000 | B196: 3230.73 | C196: =IF(DAYS360(RC[8],R1C3)+2>365,365,DAYS360(RC[8],R1C3)+2) -> 167 | D196: =ROUND(RC[-3]*RC[17]/36500,2) -> 19.23 | E196: =RC[-1]*RC[-2] -> 3211.41 | F196: =RC[-1]-RC[-4] -> -19.320000000000164 | H196: 761 | I196: 6 | J196: KA4PW11000124 | K196: 2011-09-07 12:28:48 | L196: 2012-09-07 12:28:48 | M196: 12 | N196: 6923.84 | O196: 39000 | P196: 1 | Q196: 30 | R196: 1 | S196: 1 | T196: 365 | U196: 18
A197: 90000 | B197: 7411.57 | C197: =IF(DAYS360(RC[8],R1C3)+2>365,365,DAYS360(RC[8],R1C3)+2) -> 166 | D197: =ROUND(RC[-3]*RC[17]/36500,2) -> 44.38 | E197: =RC[-1]*RC[-2] -> 7367.0800000000008 | F197: =RC[-1]-RC[-4] -> -44.489999999998872 | H197: 764 | I197: 6 | J197: KA4PW11000126 | K197: 2011-09-08 12:28:48 | L197: 2012-09-08 12:28:48 | M197: 12 | N197: 15978.08 | O197: 90000 | P197: 1 | Q197: 30 | R197: 1 | S197: 1 | T197: 365 | U197: 18
A198: 9250 | B198: 747.04 | C198: =IF(DAYS360(RC[8],R1C3)+2>365,365,DAYS360(RC[8],R1C3)+2) -> 162 | D198: =ROUND(RC[-3]*RC[17]/36500,2) -> 4.5599999999999996 | E198: =RC[-1]*RC[-2] -> 738.71999999999991 | F198: =RC[-1]-RC[-4] -> -8.32000000000005 | H198: 776 | I198: 6 | J198: KA4PW11000130 | K198: 2011-09-12 12:28:48 | L198: 2012-09-12 12:28:48 | M198: 12 | N198: 1642.19 | O198: 9250 | P198: 1 | Q198: 54 | R198: 1 | S198: 1 | T198: 365 | U198: 18
A199: 36500 | B199: 2898 | C199: =IF(DAYS360(RC[8],R1C3)+2>365,365,DAYS360(RC[8],R1C3)+2) -> 160 | D199: =ROUND(RC[-3]*RC[17]/36500,2) -> 18 | E199: =RC[-1]*RC[-2] -> 2880 | F199: =RC[-1]-RC[-4] -> -18 | H199: 787 | I199: 6 | J199: KA4PW11000134 | K199: 2011-09-14 12:28:48 | L199: 2012-09-14 12:28:48 | M199: 12 | N199: 6480 | O199: 36500 | P199: 1 | Q199: 30 | R199: 1 | S199: 1 | T199: 365 | U199: 18
A200: 17500 | B200: 1389.43 | C200: =IF(DAYS360(RC[8],R1C3)+2>365,365,DAYS360(RC[8],R1C3)+2) -> 159 | D200: =ROUND(RC[-3]*RC[17]/36500,2) -> 8.6300000000000008 | E200: =RC[-1]*RC[-2] -> 1372.17 | F200: =RC[-1]-RC[-4] -> -17.259999999999991 | H200: 796 | I200: 6 | J200: KA4PW11000136 | K200: 2011-09-15 00:00:00 | L200: 2012-09-15 00:00:00 | M200: 12 | N200: 3106.85 | O200: 17500 | P200: 1 | Q200: 30 | R200: 1 | S200: 1 | T200: 365 | U200: 18
A201: 20000 | B201: 1548.11 | C201: =IF(DAYS360(RC[8],R1C3)+2>365,365,DAYS360(RC[8],R1C3)+2) -> 155 | D201: =ROUND(RC[-3]*RC[17]/36500,2) -> 9.86 | E201: =RC[-1]*RC[-2] -> 1528.3 | F201: =RC[-1]-RC[-4] -> -19.809999999999945 | H201: 804 | I201: 6 | J201: KA4PW11000138 | K201: 2011-09-19 00:00:00 | L201: 2012-09-19 00:00:00 | M201: 12 | N201: 3550.68 | O201: 20000 | P201: 1 | Q201: 30 | R201: 1 | S201: 1 | T201: 365 | U201: 18
A202: 30000 | B202: 2322.17 | C202: =IF(DAYS360(RC[8],R1C3)+2>365,365,DAYS360(RC[8],R1C3)+2) -> 155 | D202: =ROUND(RC[-3]*RC[17]/36500,2) -> 14.79 | E202: =RC[-1]*RC[-2] -> 2292.4499999999998 | F202: =RC[-1]-RC[-4] -> -29.720000000000255 | H202: 806 | I202: 6 | J202: KA4PW11000140 | K202: 2011-09-19 00:00:00 | L202: 2012-09-19 00:00:00 | M202: 12 | N202: 5326.03 | O202: 30000 | P202: 1 | Q202: 30 | R202: 1 | S202: 1 | T202: 365 | U202: 18
A203: 36500 | B203: 2808 | C203: =IF(DAYS360(RC[8],R1C3)+2>365,365,DAYS360(RC[8],R1C3)+2) -> 154 | D203: =ROUND(RC[-3]*RC[17]/36500,2) -> 18 | E203: =RC[-1]*RC[-2] -> 2772 | F203: =RC[-1]-RC[-4] -> -36 | H203: 807 | I203: 6 | J203: KA4PW11000141 | K203: 2011-09-20 00:00:00 | L203: 2012-09-20 00:00:00 | M203: 12 | N203: 6480 | O203: 36500 | P203: 1 | Q203: 30 | R203: 1 | S203: 1 | T203: 365 | U203: 18
A204: 11000 | B204: 770.32 | C204: =IF(DAYS360(RC[8],R1C3)+2>365,365,DAYS360(RC[8],R1C3)+2) -> 140 | D204: =ROUND(RC[-3]*RC[17]/36500,2) -> 5.42 | E204: =RC[-1]*RC[-2] -> 758.8 | F204: =RC[-1]-RC[-4] -> -11.520000000000095 | H204: 841 | I204: 6 | J204: KA4PW11000144 | K204: 2011-10-04 00:00:00 | L204: 2012-10-04 00:00:00 | M204: 12 | N204: 1952.88 | O204: 11000 | P204: 1 | Q204: 46 | R204: 1 | S204: 1 | T204: 365 | U204: 18
A205: 13000 | B205: 915.72 | C205: =IF(DAYS360(RC[8],R1C3)+2>365,365,DAYS360(RC[8],R1C3)+2) -> 120 | D205: =ROUND(RC[-3]*RC[17]/36500,2) -> 7.48 | E205: =RC[-1]*RC[-2] -> 897.6 | F205: =RC[-1]-RC[-4] -> -18.120000000000005 | H205: 869 | I205: 6 | J205: KA4PW11000146 | K205: 2011-10-24 00:00:00 | L205: 2012-10-24 00:00:00 | M205: 12 | N205: 2692.6 | O205: 13000 | P205: 1 | Q205: 33 | R205: 1 | S205: 1 | T205: 365 | U205: 21
A206: 57000 | B206: 3967.73 | C206: =IF(DAYS360(RC[8],R1C3)+2>365,365,DAYS360(RC[8],R1C3)+2) -> 119 | D206: =ROUND(RC[-3]*RC[17]/36500,2) -> 32.79 | E206: =RC[-1]*RC[-2] -> 3902.0099999999998 | F206: =RC[-1]-RC[-4] -> -65.720000000000255 | H206: 871 | I206: 6 | J206: KA4PW11000148 | K206: 2011-10-25 00:00:00 | L206: 2012-10-25 00:00:00 | M206: 12 | N206: 11806.03 | O206: 57000 | P206: 1 | Q206: 30 | R206: 1 | S206: 1 | T206: 365 | U206: 21
A207: 59500 | B207: 2963.41 | C207: =IF(DAYS360(RC[8],R1C3)+2>365,365,DAYS360(RC[8],R1C3)+2) -> 100 | D207: =ROUND(RC[-3]*RC[17]/36500,2) -> 29.34 | E207: =RC[-1]*RC[-2] -> 2934 | F207: =RC[-1]-RC[-4] -> -29.409999999999854 | H207: 904 | I207: 6 | J207: KA4PW11000152 | K207: 2011-11-14 00:00:00 | L207: 2012-11-14 00:00:00 | M207: 12 | N207: 10563.29 | O207: 59500 | P207: 1 | Q207: 30 | R207: 1 | S207: 1 | T207: 365 | U207: 18
A208: 6900 | B208: 338.4 | C208: =IF(DAYS360(RC[8],R1C3)+2>365,365,DAYS360(RC[8],R1C3)+2) -> 98 | D208: =ROUND(RC[-3]*RC[17]/36500,2) -> 3.4 | E208: =RC[-1]*RC[-2] -> 333.2 | F208: =RC[-1]-RC[-4] -> -5.1999999999999886 | H208: 914 | I208: 6 | J208: KA4PW11000153 | K208: 2011-11-16 00:00:00 | L208: 2012-11-16 00:00:00 | M208: 12 | N208: 1224.99 | O208: 6900 | P208: 1 | Q208: 73 | R208: 1 | S208: 1 | T208: 365 | U208: 18
A209: 10000 | B209: 481.71 | C209: =IF(DAYS360(RC[8],R1C3)+2>365,365,DAYS360(RC[8],R1C3)+2) -> 96 | D209: =ROUND(RC[-3]*RC[17]/36500,2) -> 4.93 | E209: =RC[-1]*RC[-2] -> 473.28 | F209: =RC[-1]-RC[-4] -> -8.4300000000000068 | H209: 917 | I209: 6 | J209: KA4PW11000154 | K209: 2011-11-18 00:00:00 | L209: 2012-11-18 00:00:00 | M209: 12 | N209: 1775.34 | O209: 10000 | P209: 1 | Q209: 50 | R209: 1 | S209: 1 | T209: 365 | U209: 18
A210: 12500 | B210: 582.64 | C210: =IF(DAYS360(RC[8],R1C3)+2>365,365,DAYS360(RC[8],R1C3)+2) -> 93 | D210: =ROUND(RC[-3]*RC[17]/36500,2) -> 6.16 | E210: =RC[-1]*RC[-2] -> 572.88 | F210: =RC[-1]-RC[-4] -> -9.7599999999999909 | H210: 920 | I210: 6 | J210: KA4PW11000155 | K210: 2011-11-21 00:00:00 | L210: 2012-11-21 00:00:00 | M210: 12 | N210: 2219.1799999999998 | O210: 12500 | P210: 1 | Q210: 40 | R210: 1 | S210: 1 | T210: 365 | U210: 18
A211: 74109.16 | B211: 3435.61 | C211: =IF(DAYS360(RC[8],R1C3)+2>365,365,DAYS360(RC[8],R1C3)+2) -> 93 | D211: =ROUND(RC[-3]*RC[17]/36500,2) -> 36.549999999999997 | E211: =RC[-1]*RC[-2] -> 3399.1499999999996 | F211: =RC[-1]-RC[-4] -> -36.460000000000491 | H211: 922 | I211: 6 | J211: KA4PW11000157 | K211: 2011-11-21 00:00:00 | L211: 2012-11-21 00:00:00 | M211: 12 | N211: 13156.91 | O211: 74109.16 | P211: 1 | Q211: 30 | R211: 1 | S211: 1 | T211: 365 | U211: 18
A212: 8000 | B212: 368.5 | C212: =IF(DAYS360(RC[8],R1C3)+2>365,365,DAYS360(RC[8],R1C3)+2) -> 92 | D212: =ROUND(RC[-3]*RC[17]/36500,2) -> 3.95 | E212: =RC[-1]*RC[-2] -> 363.40000000000003 | F212: =RC[-1]-RC[-4] -> -5.0999999999999659 | H212: 928 | I212: 6 | J212: KA4PW11000158 | K212: 2011-11-22 00:00:00 | L212: 2012-11-22 00:00:00 | M212: 12 | N212: 1420.27 | O212: 8000 | P212: 1 | Q212: 63 | R212: 1 | S212: 1 | T212: 365 | U212: 18
A213: 64000 | B213: 2872.01 | C213: =IF(DAYS360(RC[8],R1C3)+2>365,365,DAYS360(RC[8],R1C3)+2) -> 90 | D213: =ROUND(RC[-3]*RC[17]/36500,2) -> 31.56 | E213: =RC[-1]*RC[-2] -> 2840.4 | F213: =RC[-1]-RC[-4] -> -31.610000000000127 | H213: 936 | I213: 6 | J213: KA4PW11000163 | K213: 2011-11-24 00:00:00 | L213: 2012-11-24 00:00:00 | M213: 12 | N213: 11362.19 | O213: 64000 | P213: 1 | Q213: 30 | R213: 1 | S213: 1 | T213: 365 | U213: 18
A214: 41000 | B214: 1759.12 | C214: =IF(DAYS360(RC[8],R1C3)+2>365,365,DAYS360(RC[8],R1C3)+2) -> 86 | D214: =ROUND(RC[-3]*RC[17]/36500,2) -> 20.22 | E214: =RC[-1]*RC[-2] -> 1738.9199999999998 | F214: =RC[-1]-RC[-4] -> -20.200000000000045 | H214: 940 | I214: 6 | J214: KA4PW11000164 | K214: 2011-11-28 00:00:00 | L214: 2012-11-28 00:00:00 | M214: 12 | N214: 7278.9 | O214: 41000 | P214: 1 | Q214: 30 | R214: 1 | S214: 1 | T214: 365 | U214: 18
A215: 40000 | B215: 1578.28 | C215: =IF(DAYS360(RC[8],R1C3)+2>365,365,DAYS360(RC[8],R1C3)+2) -> 79 | D215: =ROUND(RC[-3]*RC[17]/36500,2) -> 19.73 | E215: =RC[-1]*RC[-2] -> 1558.67 | F215: =RC[-1]-RC[-4] -> -19.6099999999999 | H215: 954 | I215: 6 | J215: KA4PW11000166 | K215: 2011-12-05 00:00:00 | L215: 2012-12-05 00:00:00 | M215: 12 | N215: 7101.37 | O215: 40000 | P215: 1 | Q215: 30 | R215: 1 | S215: 1 | T215: 365 | U215: 18
A216: 139000 | B216: 5209.74 | C216: =IF(DAYS360(RC[8],R1C3)+2>365,365,DAYS360(RC[8],R1C3)+2) -> 75 | D216: =ROUND(RC[-3]*RC[17]/36500,2) -> 68.55 | E216: =RC[-1]*RC[-2] -> 5141.25 | F216: =RC[-1]-RC[-4] -> -68.489999999999782 | H216: 972 | I216: 6 | J216: KA4PW11000170 | K216: 2011-12-09 00:00:00 | L216: 2012-12-09 00:00:00 | M216: 12 | N216: 24677.26 | O216: 139000 | P216: 1 | Q216: 30 | R216: 1 | S216: 1 | T216: 365 | U216: 18
A217: 210000 | B217: 7870.61 | C217: =IF(DAYS360(RC[8],R1C3)+2>365,365,DAYS360(RC[8],R1C3)+2) -> 75 | D217: =ROUND(RC[-3]*RC[17]/36500,2) -> 103.56 | E217: =RC[-1]*RC[-2] -> 7767 | F217: =RC[-1]-RC[-4] -> -103.60999999999967 | H217: 973 | I217: 6 | J217: KA4PW11000171 | K217: 2011-12-09 00:00:00 | L217: 2012-12-09 00:00:00 | M217: 12 | N217: 37282.19 | O217: 210000 | P217: 1 | Q217: 30 | R217: 1 | S217: 1 | T217: 365 | U217: 18
A218: 12000 | B218: 451.28 | C218: =IF(DAYS360(RC[8],R1C3)+2>365,365,DAYS360(RC[8],R1C3)+2) -> 75 | D218: =ROUND(RC[-3]*RC[17]/36500,2) -> 5.92 | E218: =RC[-1]*RC[-2] -> 444 | F218: =RC[-1]-RC[-4] -> -7.2799999999999727 | H218: 974 | I218: 6 | J218: KA4PW11000172 | K218: 2011-12-09 00:00:00 | L218: 2012-12-09 00:00:00 | M218: 12 | N218: 2130.41 | O218: 12000 | P218: 1 | Q218: 42 | R218: 1 | S218: 1 | T218: 365 | U218: 18
A219: 25000 | B219: 875.39 | C219: =IF(DAYS360(RC[8],R1C3)+2>365,365,DAYS360(RC[8],R1C3)+2) -> 70 | D219: =ROUND(RC[-3]*RC[17]/36500,2) -> 12.33 | E219: =RC[-1]*RC[-2] -> 863.1 | F219: =RC[-1]-RC[-4] -> -12.289999999999964 | H219: 984 | I219: 6 | J219: KA4PW11000174 | K219: 2011-12-14 00:00:00 | L219: 2012-12-14 00:00:00 | M219: 12 | N219: 4438.3599999999997 | O219: 25000 | P219: 1 | Q219: 30 | R219: 1 | S219: 1 | T219: 365 | U219: 18
A220: 7000 | B220: 250 | C220: =IF(DAYS360(RC[8],R1C3)+2>365,365,DAYS360(RC[8],R1C3)+2) -> 70 | D220: =ROUND(RC[-3]*RC[17]/36500,2) -> 3.45 | E220: =RC[-1]*RC[-2] -> 241.5 | F220: =RC[-1]-RC[-4] -> -8.5 | H220: 987 | I220: 6 | J220: KA4PW11000175 | K220: 2011-12-14 00:00:00 | L220: 2012-12-14 00:00:00 | M220: 12 | N220: 1242.74 | O220: 7000 | P220: 1 | Q220: 72 | R220: 1 | S220: 1 | T220: 365 | U220: 18
A221: 44000 | B221: 1518.96 | C221: =IF(DAYS360(RC[8],R1C3)+2>365,365,DAYS360(RC[8],R1C3)+2) -> 69 | D221: =ROUND(RC[-3]*RC[17]/36500,2) -> 21.7 | E221: =RC[-1]*RC[-2] -> 1497.3 | F221: =RC[-1]-RC[-4] -> -21.660000000000082 | H221: 989 | I221: 6 | J221: KA4PW11000177 | K221: 2011-12-15 00:00:00 | L221: 2012-12-15 00:00:00 | M221: 12 | N221: 7811.51 | O221: 44000 | P221: 1 | Q221: 30 | R221: 1 | S221: 1 | T221: 365 | U221: 18
A222: 62000 | B222: 2018.14 | C222: =IF(DAYS360(RC[8],R1C3)+2>365,365,DAYS360(RC[8],R1C3)+2) -> 65 | D222: =ROUND(RC[-3]*RC[17]/36500,2) -> 30.58 | E222: =RC[-1]*RC[-2] -> 1987.6999999999998 | F222: =RC[-1]-RC[-4] -> -30.440000000000282 | H222: 1004 | I222: 6 | J222: KA4PW11000178 | K222: 2011-12-19 00:00:00 | L222: 2012-12-19 00:00:00 | M222: 12 | N222: 11007.12 | O222: 62000 | P222: 1 | Q222: 30 | R222: 1 | S222: 1 | T222: 365 | U222: 18
A223: 48000 | B223: 1349.23 | C223: =IF(DAYS360(RC[8],R1C3)+2>365,365,DAYS360(RC[8],R1C3)+2) -> 56 | D223: =ROUND(RC[-3]*RC[17]/36500,2) -> 23.67 | E223: =RC[-1]*RC[-2] -> 1325.52 | F223: =RC[-1]-RC[-4] -> -23.710000000000036 | H223: 1047 | I223: 6 | J223: KA4PW11000188 | K223: 2011-12-28 00:00:00 | L223: 2012-12-28 00:00:00 | M223: 12 | N223: 8521.64 | O223: 48000 | P223: 1 | Q223: 30 | R223: 1 | S223: 1 | T223: 365 | U223: 18
A224: 39500 | B224: 1090.8599999999999 | C224: =IF(DAYS360(RC[8],R1C3)+2>365,365,DAYS360(RC[8],R1C3)+2) -> 55 | D224: =ROUND(RC[-3]*RC[17]/36500,2) -> 19.48 | E224: =RC[-1]*RC[-2] -> 1071.4000000000001 | F224: =RC[-1]-RC[-4] -> -19.459999999999809 | H224: 1055 | I224: 6 | J224: KA4PW11000192 | K224: 2011-12-29 00:00:00 | L224: 2012-12-29 00:00:00 | M224: 12 | N224: 7012.6 | O224: 39500 | P224: 1 | Q224: 30 | R224: 1 | S224: 1 | T224: 365 | U224: 18
A225: 295000 | B225: 8001.38 | C225: =IF(DAYS360(RC[8],R1C3)+2>365,365,DAYS360(RC[8],R1C3)+2) -> 54 | D225: =ROUND(RC[-3]*RC[17]/36500,2) -> 145.47999999999999 | E225: =RC[-1]*RC[-2] -> 7855.9199999999992 | F225: =RC[-1]-RC[-4] -> -145.46000000000095 | H225: 1058 | I225: 6 | J225: KA4PW11000194 | K225: 2011-12-30 00:00:00 | L225: 2012-12-30 00:00:00 | M225: 12 | N225: 52372.6 | O225: 295000 | P225: 1 | Q225: 30 | R225: 1 | S225: 1 | T225: 365 | U225: 18
A226: 25000 | B226: 641.12 | C226: =IF(DAYS360(RC[8],R1C3)+2>365,365,DAYS360(RC[8],R1C3)+2) -> 52 | D226: =ROUND(RC[-3]*RC[17]/36500,2) -> 12.33 | E226: =RC[-1]*RC[-2] -> 641.16 | F226: =RC[-1]-RC[-4] -> 3.999999999996362E-2 | H226: 1064 | I226: 6 | J226: KA4PW12000196 | K226: 2012-01-02 00:00:00 | L226: 2013-01-02 00:00:00 | M226: 12 | N226: 4438.3599999999997 | O226: 25000 | P226: 1 | Q226: 30 | R226: 1 | S226: 1 | T226: 365 | U226: 18
A227: 18000 | B227: 435.02 | C227: =IF(DAYS360(RC[8],R1C3)+2>365,365,DAYS360(RC[8],R1C3)+2) -> 49 | D227: =ROUND(RC[-3]*RC[17]/36500,2) -> 8.8800000000000008 | E227: =RC[-1]*RC[-2] -> 435.12000000000006 | F227: =RC[-1]-RC[-4] -> 0.10000000000007958 | H227: 1080 | I227: 6 | J227: KA4PW12000199 | K227: 2012-01-05 00:00:00 | L227: 2013-01-05 00:00:00 | M227: 12 | N227: 3195.62 | O227: 18000 | P227: 1 | Q227: 30 | R227: 1 | S227: 1 | T227: 365 | U227: 18
A228: 100000 | B228: 2367.21 | C228: =IF(DAYS360(RC[8],R1C3)+2>365,365,DAYS360(RC[8],R1C3)+2) -> 48 | D228: =ROUND(RC[-3]*RC[17]/36500,2) -> 49.32 | E228: =RC[-1]*RC[-2] -> 2367.36 | F228: =RC[-1]-RC[-4] -> 0.15000000000009095 | H228: 1094 | I228: 6 | J228: KA4PW12000202 | K228: 2012-01-06 00:00:00 | L228: 2013-01-06 00:00:00 | M228: 12 | N228: 17753.419999999998 | O228: 100000 | P228: 1 | Q228: 30 | R228: 1 | S228: 1 | T228: 365 | U228: 18
A229: 100000 | B229: 2169.9299999999998 | C229: =IF(DAYS360(RC[8],R1C3)+2>365,365,DAYS360(RC[8],R1C3)+2) -> 44 | D229: =ROUND(RC[-3]*RC[17]/36500,2) -> 49.32 | E229: =RC[-1]*RC[-2] -> 2170.08 | F229: =RC[-1]-RC[-4] -> 0.15000000000009095 | H229: 1107 | I229: 6 | J229: KA4PW12000206 | K229: 2012-01-10 00:00:00 | L229: 2013-01-10 00:00:00 | M229: 12 | N229: 17753.419999999998 | O229: 100000 | P229: 1 | Q229: 30 | R229: 1 | S229: 1 | T229: 365 | U229: 18
A230: 30000 | B230: 636.11 | C230: =IF(DAYS360(RC[8],R1C3)+2>365,365,DAYS360(RC[8],R1C3)+2) -> 43 | D230: =ROUND(RC[-3]*RC[17]/36500,2) -> 14.79 | E230: =RC[-1]*RC[-2] -> 635.96999999999991 | F230: =RC[-1]-RC[-4] -> -0.14000000000010004 | H230: 1110 | I230: 6 | J230: KA4PW12000207 | K230: 2012-01-11 00:00:00 | L230: 2013-01-11 00:00:00 | M230: 12 | N230: 5326.03 | O230: 30000 | P230: 1 | Q230: 30 | R230: 1 | S230: 1 | T230: 365 | U230: 18
A231: 128000 | B231: 2714.26 | C231: =IF(DAYS360(RC[8],R1C3)+2>365,365,DAYS360(RC[8],R1C3)+2) -> 43 | D231: =ROUND(RC[-3]*RC[17]/36500,2) -> 63.12 | E231: =RC[-1]*RC[-2] -> 2714.16 | F231: =RC[-1]-RC[-4] -> -0.1000000000003638 | H231: 1115 | I231: 6 | J231: KA4PW12000210 | K231: 2012-01-11 00:00:00 | L231: 2013-01-11 00:00:00 | M231: 12 | N231: 22724.38 | O231: 128000 | P231: 1 | Q231: 30 | R231: 1 | S231: 1 | T231: 365 | U231: 18
A232: 50869.54 | B232: 903.13 | C232: =IF(DAYS360(RC[8],R1C3)+2>365,365,DAYS360(RC[8],R1C3)+2) -> 36 | D232: =ROUND(RC[-3]*RC[17]/36500,2) -> 25.09 | E232: =RC[-1]*RC[-2] -> 903.24 | F232: =RC[-1]-RC[-4] -> 0.11000000000001364 | H232: 1146 | I232: 6 | J232: KA4PW12000212 | K232: 2012-01-18 00:00:00 | L232: 2013-01-18 00:00:00 | M232: 12 | N232: 9031.09 | O232: 50869.54 | P232: 1 | Q232: 30 | R232: 1 | S232: 1 | T232: 365 | U232: 18
A233: 6000 | B233: 250 | C233: =IF(DAYS360(RC[8],R1C3)+2>365,365,DAYS360(RC[8],R1C3)+2) -> 36 | D233: =ROUND(RC[-3]*RC[17]/36500,2) -> 2.96 | E233: =RC[-1]*RC[-2] -> 106.56 | F233: =RC[-1]-RC[-4] -> -143.44 | H233: 1147 | I233: 6 | J233: KA4PW12000213 | K233: 2012-01-18 00:00:00 | L233: 2013-01-18 00:00:00 | M233: 12 | N233: 1065.21 | O233: 6000 | P233: 1 | Q233: 84 | R233: 1 | S233: 1 | T233: 365 | U233: 18
A234: 55000 | B234: 922.18 | C234: =IF(DAYS360(RC[8],R1C3)+2>365,365,DAYS360(RC[8],R1C3)+2) -> 34 | D234: =ROUND(RC[-3]*RC[17]/36500,2) -> 27.12 | E234: =RC[-1]*RC[-2] -> 922.08 | F234: =RC[-1]-RC[-4] -> -9.9999999999909051E-2 | H234: 1158 | I234: 6 | J234: KA4PW12000216 | K234: 2012-01-20 00:00:00 | L234: 2013-01-20 00:00:00 | M234: 12 | N234: 9764.3799999999992 | O234: 55000 | P234: 1 | Q234: 30 | R234: 1 | S234: 1 | T234: 365 | U234: 18
A235: 20000 | B235: 295.89 | C235: =IF(DAYS360(RC[8],R1C3)+2>365,365,DAYS360(RC[8],R1C3)+2) -> 27 | D235: =ROUND(RC[-3]*RC[17]/36500,2) -> 9.86 | E235: =RC[-1]*RC[-2] -> 266.21999999999997 | F235: =RC[-1]-RC[-4] -> -29.670000000000016 | H235: 1193 | I235: 6 | J235: KA4PW12000224 | K235: 2012-01-27 00:00:00 | L235: 2013-01-27 00:00:00 | M235: 12 | N235: 3550.68 | O235: 20000 | P235: 1 | Q235: 30 | R235: 1 | S235: 1 | T235: 365 | U235: 18
A236: 11000 | B236: 250 | C236: =IF(DAYS360(RC[8],R1C3)+2>365,365,DAYS360(RC[8],R1C3)+2) -> 27 | D236: =ROUND(RC[-3]*RC[17]/36500,2) -> 5.42 | E236: =RC[-1]*RC[-2] -> 146.34 | F236: =RC[-1]-RC[-4] -> -103.66 | H236: 1197 | I236: 6 | J236: KA4PW12000225 | K236: 2012-01-27 00:00:00 | L236: 2013-01-27 00:00:00 | M236: 12 | N236: 1952.88 | O236: 11000 | P236: 1 | Q236: 46 | R236: 1 | S236: 1 | T236: 365 | U236: 18
A237: 16000 | B237: 250 | C237: =IF(DAYS360(RC[8],R1C3)+2>365,365,DAYS360(RC[8],R1C3)+2) -> 24 | D237: =ROUND(RC[-3]*RC[17]/36500,2) -> 7.89 | E237: =RC[-1]*RC[-2] -> 189.35999999999999 | F237: =RC[-1]-RC[-4] -> -60.640000000000015 | H237: 1204 | I237: 6 | J237: KA4PW12000226 | K237: 2012-01-30 00:00:00 | L237: 2013-01-30 00:00:00 | M237: 12 | N237: 2840.55 | O237: 16000 | P237: 1 | Q237: 31 | R237: 1 | S237: 1 | T237: 365 | U237: 18
A238: 40000 | B238: 591.78 | C238: =IF(DAYS360(RC[8],R1C3)+2>365,365,DAYS360(RC[8],R1C3)+2) -> 24 | D238: =ROUND(RC[-3]*RC[17]/36500,2) -> 19.73 | E238: =RC[-1]*RC[-2] -> 473.52 | F238: =RC[-1]-RC[-4] -> -118.25999999999999 | H238: 1207 | I238: 6 | J238: KA4PW12000227 | K238: 2012-01-30 00:00:00 | L238: 2013-01-30 00:00:00 | M238: 12 | N238: 7101.37 | O238: 40000 | P238: 1 | Q238: 30 | R238: 1 | S238: 1 | T238: 365 | U238: 18
A239: 95000 | B239: 1405.48 | C239: =IF(DAYS360(RC[8],R1C3)+2>365,365,DAYS360(RC[8],R1C3)+2) -> 24 | D239: =ROUND(RC[-3]*RC[17]/36500,2) -> 46.85 | E239: =RC[-1]*RC[-2] -> 1124.4000000000001 | F239: =RC[-1]-RC[-4] -> -281.07999999999993 | H239: 1212 | I239: 6 | J239: KA4PW12000228 | K239: 2012-01-31 00:00:00 | L239: 2013-01-31 00:00:00 | M239: 12 | N239: 16865.75 | O239: 95000 | P239: 1 | Q239: 30 | R239: 1 | S239: 1 | T239: 365 | U239: 18
A240: 15000 | B240: 250 | C240: =IF(DAYS360(RC[8],R1C3)+2>365,365,DAYS360(RC[8],R1C3)+2) -> 16 | D240: =ROUND(RC[-3]*RC[17]/36500,2) -> 7.4 | E240: =RC[-1]*RC[-2] -> 118.4 | F240: =RC[-1]-RC[-4] -> -131.6 | H240: 1236 | I240: 6 | J240: KA4PW12000230 | K240: 2012-02-08 00:00:00 | L240: 2013-02-08 00:00:00 | M240: 12 | N240: 2663.01 | O240: 15000 | P240: 1 | Q240: 33 | R240: 1 | S240: 1 | T240: 365 | U240: 18
A241: 40000 | B241: 591.78 | C241: =IF(DAYS360(RC[8],R1C3)+2>365,365,DAYS360(RC[8],R1C3)+2) -> 16 | D241: =ROUND(RC[-3]*RC[17]/36500,2) -> 19.73 | E241: =RC[-1]*RC[-2] -> 315.68 | F241: =RC[-1]-RC[-4] -> -276.09999999999997 | H241: 1237 | I241: 6 | J241: KA4PW12000231 | K241: 2012-02-08 00:00:00 | L241: 2013-02-08 00:00:00 | M241: 12 | N241: 7101.37 | O241: 40000 | P241: 1 | Q241: 30 | R241: 1 | S241: 1 | T241: 365 | U241: 18
A242: 7500 | B242: 250 | C242: =IF(DAYS360(RC[8],R1C3)+2>365,365,DAYS360(RC[8],R1C3)+2) -> 14 | D242: =ROUND(RC[-3]*RC[17]/36500,2) -> 3.7 | E242: =RC[-1]*RC[-2] -> 51.800000000000004 | F242: =RC[-1]-RC[-4] -> -198.2 | H242: 1248 | I242: 6 | J242: KA4PW12000232 | K242: 2012-02-10 00:00:00 | L242: 2013-02-10 00:00:00 | M242: 12 | N242: 1331.51 | O242: 7500 | P242: 1 | Q242: 67 | R242: 1 | S242: 1 | T242: 365 | U242: 18
A243: 15000 | B243: 250 | C243: =IF(DAYS360(RC[8],R1C3)+2>365,365,DAYS360(RC[8],R1C3)+2) -> 11 | D243: =ROUND(RC[-3]*RC[17]/36500,2) -> 7.4 | E243: =RC[-1]*RC[-2] -> 81.400000000000006 | F243: =RC[-1]-RC[-4] -> -168.6 | H243: 1252 | I243: 6 | J243: KA4PW12000235 | K243: 2012-02-13 00:00:00 | L243: 2013-02-13 00:00:00 | M243: 12 | N243: 2663.01 | O243: 15000 | P243: 1 | Q243: 33 | R243: 1 | S243: 1 | T243: 365 | U243: 18
A244: 5000 | B244: 250 | C244: =IF(DAYS360(RC[8],R1C3)+2>365,365,DAYS360(RC[8],R1C3)+2) -> 9 | D244: =ROUND(RC[-3]*RC[17]/36500,2) -> 2.4700000000000002 | E244: =RC[-1]*RC[-2] -> 22.23 | F244: =RC[-1]-RC[-4] -> -227.77 | H244: 1260 | I244: 6 | J244: KA4PW12000236 | K244: 2012-02-15 00:00:00 | L244: 2013-02-15 00:00:00 | M244: 12 | N244: 887.67 | O244: 5000 | P244: 1 | Q244: 101 | R244: 1 | S244: 1 | T244: 365 | U244: 18
A245: 10000 | B245: 250 | C245: =IF(DAYS360(RC[8],R1C3)+2>365,365,DAYS360(RC[8],R1C3)+2) -> 3 | D245: =ROUND(RC[-3]*RC[17]/36500,2) -> 4.93 | E245: =RC[-1]*RC[-2] -> 14.79 | F245: =RC[-1]-RC[-4] -> -235.21 | H245: 1280 | I245: 6 | J245: KA4PW12000242 | K245: 2012-02-21 00:00:00 | L245: 2013-02-21 00:00:00 | M245: 12 | N245: 1775.34 | O245: 10000 | P245: 1 | Q245: 50 | R245: 1 | S245: 1 | T245: 365 | U245: 18
A246: 115000 | B246: 1701.37 | C246: =IF(DAYS360(RC[8],R1C3)+2>365,365,DAYS360(RC[8],R1C3)+2) -> 2 | D246: =ROUND(RC[-3]*RC[17]/36500,2) -> 56.71 | E246: =RC[-1]*RC[-2] -> 113.42 | F246: =RC[-1]-RC[-4] -> -1587.9499999999998 | H246: 1284 | I246: 6 | J246: KA4PW12000243 | K246: 2012-02-22 00:00:00 | L246: 2013-02-22 00:00:00 | M246: 12 | N246: 20416.439999999999 | O246: 115000 | P246: 1 | Q246: 30 | R246: 1 | S246: 1 | T246: 365 | U246: 18
A247: 10000 | B247: 999.36 | C247: =IF(DAYS360(RC[8],R1C3)+2>365,365,DAYS360(RC[8],R1C3)+2) -> 200 | D247: =ROUND(RC[-3]*RC[17]/36500,2) -> 4.93 | E247: =RC[-1]*RC[-2] -> 986 | F247: =RC[-1]-RC[-4] -> -13.360000000000014 | H247: 595 | I247: 9 | J247: MB7PW11000006 | K247: 2011-08-04 12:28:48 | L247: 2012-08-04 12:28:48 | M247: 12 | N247: 1775.34 | O247: 10000 | P247: 1 | Q247: 50 | R247: 1 | S247: 1 | T247: 365 | U247: 18
A248: 32000 | B248: 3203.36 | C248: =IF(DAYS360(RC[8],R1C3)+2>365,365,DAYS360(RC[8],R1C3)+2) -> 200 | D248: =ROUND(RC[-3]*RC[17]/36500,2) -> 15.78 | E248: =RC[-1]*RC[-2] -> 3156 | F248: =RC[-1]-RC[-4] -> -47.360000000000127 | H248: 596 | I248: 9 | J248: MB7PW11000007 | K248: 2011-08-04 12:28:48 | L248: 2012-08-04 12:28:48 | M248: 12 | N248: 5681.1 | O248: 32000 | P248: 1 | Q248: 30 | R248: 1 | S248: 1 | T248: 365 | U248: 18
A249: 20000 | B249: 2001.67 | C249: =IF(DAYS360(RC[8],R1C3)+2>365,365,DAYS360(RC[8],R1C3)+2) -> 200 | D249: =ROUND(RC[-3]*RC[17]/36500,2) -> 9.86 | E249: =RC[-1]*RC[-2] -> 1972 | F249: =RC[-1]-RC[-4] -> -29.670000000000073 | H249: 597 | I249: 9 | J249: MB7PW11000008 | K249: 2011-08-04 12:28:48 | L249: 2012-08-04 12:28:48 | M249: 12 | N249: 3550.68 | O249: 20000 | P249: 1 | Q249: 30 | R249: 1 | S249: 1 | T249: 365 | U249: 18
A250: 40000 | B250: 3590.74 | C250: =IF(DAYS360(RC[8],R1C3)+2>365,365,DAYS360(RC[8],R1C3)+2) -> 180 | D250: =ROUND(RC[-3]*RC[17]/36500,2) -> 19.73 | E250: =RC[-1]*RC[-2] -> 3551.4 | F250: =RC[-1]-RC[-4] -> -39.339999999999691 | H250: 694 | I250: 9 | J250: MB7PW11000015 | K250: 2011-08-24 12:28:48 | L250: 2012-08-24 12:28:48 | M250: 12 | N250: 7101.37 | O250: 40000 | P250: 1 | Q250: 30 | R250: 1 | S250: 1 | T250: 365 | U250: 18
A251: 25000 | B251: 2244.02 | C251: =IF(DAYS360(RC[8],R1C3)+2>365,365,DAYS360(RC[8],R1C3)+2) -> 180 | D251: =ROUND(RC[-3]*RC[17]/36500,2) -> 12.33 | E251: =RC[-1]*RC[-2] -> 2219.4 | F251: =RC[-1]-RC[-4] -> -24.619999999999891 | H251: 695 | I251: 9 | J251: MB7PW11000016 | K251: 2011-08-24 12:28:48 | L251: 2012-08-24 12:28:48 | M251: 12 | N251: 4438.3599999999997 | O251: 25000 | P251: 1 | Q251: 30 | R251: 1 | S251: 1 | T251: 365 | U251: 18
A252: 175000 | B252: 13376.54 | C252: =IF(DAYS360(RC[8],R1C3)+2>365,365,DAYS360(RC[8],R1C3)+2) -> 153 | D252: =ROUND(RC[-3]*RC[17]/36500,2) -> 86.3 | E252: =RC[-1]*RC[-2] -> 13203.9 | F252: =RC[-1]-RC[-4] -> -172.64000000000124 | H252: 812 | I252: 9 | J252: MB7PW11000022 | K252: 2011-09-21 00:00:00 | L252: 2012-09-21 00:00:00 | M252: 12 | N252: 31068.49 | O252: 175000 | P252: 1 | Q252: 30 | R252: 1 | S252: 1 | T252: 365 | U252: 18
A253: 100000 | B253: 7644.45 | C253: =IF(DAYS360(RC[8],R1C3)+2>365,365,DAYS360(RC[8],R1C3)+2) -> 153 | D253: =ROUND(RC[-3]*RC[17]/36500,2) -> 49.32 | E253: =RC[-1]*RC[-2] -> 7545.96 | F253: =RC[-1]-RC[-4] -> -98.489999999999782 | H253: 813 | I253: 9 | J253: MB7PW11000023 | K253: 2011-09-21 00:00:00 | L253: 2012-09-21 00:00:00 | M253: 12 | N253: 17753.419999999998 | O253: 100000 | P253: 1 | Q253: 30 | R253: 1 | S253: 1 | T253: 365 | U253: 18
A254: 100000 | B254: 7644.45 | C254: =IF(DAYS360(RC[8],R1C3)+2>365,365,DAYS360(RC[8],R1C3)+2) -> 153 | D254: =ROUND(RC[-3]*RC[17]/36500,2) -> 49.32 | E254: =RC[-1]*RC[-2] -> 7545.96 | F254: =RC[-1]-RC[-4] -> -98.489999999999782 | H254: 814 | I254: 9 | J254: MB7PW11000024 | K254: 2011-09-21 00:00:00 | L254: 2012-09-21 00:00:00 | M254: 12 | N254: 17753.419999999998 | O254: 100000 | P254: 1 | Q254: 30 | R254: 1 | S254: 1 | T254: 365 | U254: 18
A255: 75000 | B255: 5733.34 | C255: =IF(DAYS360(RC[8],R1C3)+2>365,365,DAYS360(RC[8],R1C3)+2) -> 153 | D255: =ROUND(RC[-3]*RC[17]/36500,2) -> 36.99 | E255: =RC[-1]*RC[-2] -> 5659.47 | F255: =RC[-1]-RC[-4] -> -73.869999999999891 | H255: 815 | I255: 9 | J255: MB7PW11000025 | K255: 2011-09-21 00:00:00 | L255: 2012-09-21 00:00:00 | M255: 12 | N255: 13315.07 | O255: 75000 | P255: 1 | Q255: 30 | R255: 1 | S255: 1 | T255: 365 | U255: 18
A256: 10000 | B256: 323.95 | C256: =IF(DAYS360(RC[8],R1C3)+2>365,365,DAYS360(RC[8],R1C3)+2) -> 64 | D256: =ROUND(RC[-3]*RC[17]/36500,2) -> 4.93 | E256: =RC[-1]*RC[-2] -> 315.52 | F256: =RC[-1]-RC[-4] -> -8.4300000000000068 | H256: 1017 | I256: 9 | J256: MB7PW11000052 | K256: 2011-12-20 00:00:00 | L256: 2012-12-20 00:00:00 | M256: 12 | N256: 1775.34 | O256: 10000 | P256: 1 | Q256: 50 | R256: 1 | S256: 1 | T256: 365 | U256: 18
A257: 10000 | B257: 250 | C257: =IF(DAYS360(RC[8],R1C3)+2>365,365,DAYS360(RC[8],R1C3)+2) -> 49 | D257: =ROUND(RC[-3]*RC[17]/36500,2) -> 4.93 | E257: =RC[-1]*RC[-2] -> 241.57 | F257: =RC[-1]-RC[-4] -> -8.4300000000000068 | H257: 1079 | I257: 9 | J257: MB7PW12000055 | K257: 2012-01-05 00:00:00 | L257: 2013-01-05 00:00:00 | M257: 12 | N257: 1775.34 | O257: 10000 | P257: 1 | Q257: 50 | R257: 1 | S257: 1 | T257: 365 | U257: 18
A258: 10000 | B258: 250 | C258: =IF(DAYS360(RC[8],R1C3)+2>365,365,DAYS360(RC[8],R1C3)+2) -> 44 | D258: =ROUND(RC[-3]*RC[17]/36500,2) -> 4.93 | E258: =RC[-1]*RC[-2] -> 216.92 | F258: =RC[-1]-RC[-4] -> -33.080000000000013 | H258: 1108 | I258: 9 | J258: MB7PW12000056 | K258: 2012-01-10 00:00:00 | L258: 2013-01-10 00:00:00 | M258: 12 | N258: 1775.34 | O258: 10000 | P258: 1 | Q258: 50 | R258: 1 | S258: 1 | T258: 365 | U258: 18
A259: 110000 | B259: 9819.15 | C259: =IF(DAYS360(RC[8],R1C3)+2>365,365,DAYS360(RC[8],R1C3)+2) -> 179 | D259: =ROUND(RC[-3]*RC[17]/36500,2) -> 54.25 | E259: =RC[-1]*RC[-2] -> 9710.75 | F259: =RC[-1]-RC[-4] -> -108.39999999999964 | H259: 705 | I259: 8 | J259: MG6PW11000006 | K259: 2011-08-25 12:28:48 | L259: 2012-08-25 12:28:48 | M259: 12 | N259: 19528.77 | O259: 110000 | P259: 1 | Q259: 30 | R259: 1 | S259: 1 | T259: 365 | U259: 18
A260: 230000 | B260: 20529.16 | C260: =IF(DAYS360(RC[8],R1C3)+2>365,365,DAYS360(RC[8],R1C3)+2) -> 179 | D260: =ROUND(RC[-3]*RC[17]/36500,2) -> 113.42 | E260: =RC[-1]*RC[-2] -> 20302.18 | F260: =RC[-1]-RC[-4] -> -226.97999999999956 | H260: 708 | I260: 8 | J260: MG6PW11000007 | K260: 2011-08-25 12:28:48 | L260: 2012-08-25 12:28:48 | M260: 12 | N260: 40832.879999999997 | O260: 230000 | P260: 1 | Q260: 30 | R260: 1 | S260: 1 | T260: 365 | U260: 18
A261: 92000 | B261: 8211.9699999999993 | C261: =IF(DAYS360(RC[8],R1C3)+2>365,365,DAYS360(RC[8],R1C3)+2) -> 179 | D261: =ROUND(RC[-3]*RC[17]/36500,2) -> 45.37 | E261: =RC[-1]*RC[-2] -> 8121.23 | F261: =RC[-1]-RC[-4] -> -90.739999999999782 | H261: 709 | I261: 8 | J261: MG6PW11000008 | K261: 2011-08-25 12:28:48 | L261: 2012-08-25 12:28:48 | M261: 12 | N261: 16333.15 | O261: 92000 | P261: 1 | Q261: 30 | R261: 1 | S261: 1 | T261: 365 | U261: 18
A262: 419000 | B262: 34300.58 | C262: =IF(DAYS360(RC[8],R1C3)+2>365,365,DAYS360(RC[8],R1C3)+2) -> 165 | D262: =ROUND(RC[-3]*RC[17]/36500,2) -> 206.63 | E262: =RC[-1]*RC[-2] -> 34093.949999999997 | F262: =RC[-1]-RC[-4] -> -206.63000000000466 | H262: 773 | I262: 8 | J262: MG6PW11000011 | K262: 2011-09-09 12:28:48 | L262: 2012-09-09 12:28:48 | M262: 12 | N262: 74386.850000000006 | O262: 419000 | P262: 1 | Q262: 30 | R262: 1 | S262: 1 | T262: 365 | U262: 18
A263: 33000 | B263: 2619.59 | C263: =IF(DAYS360(RC[8],R1C3)+2>365,365,DAYS360(RC[8],R1C3)+2) -> 160 | D263: =ROUND(RC[-3]*RC[17]/36500,2) -> 16.27 | E263: =RC[-1]*RC[-2] -> 2603.1999999999998 | F263: =RC[-1]-RC[-4] -> -16.390000000000327 | H263: 785 | I263: 8 | J263: MG6PW11000012 | K263: 2011-09-14 12:28:48 | L263: 2012-09-14 12:28:48 | M263: 12 | N263: 5858.63 | O263: 33000 | P263: 1 | Q263: 30 | R263: 1 | S263: 1 | T263: 365 | U263: 18
A264: 48000 | B264: 3787.24 | C264: =IF(DAYS360(RC[8],R1C3)+2>365,365,DAYS360(RC[8],R1C3)+2) -> 158 | D264: =ROUND(RC[-3]*RC[17]/36500,2) -> 23.67 | E264: =RC[-1]*RC[-2] -> 3739.86 | F264: =RC[-1]-RC[-4] -> -47.379999999999654 | H264: 801 | I264: 8 | J264: MG6PW11000013 | K264: 2011-09-16 00:00:00 | L264: 2012-09-16 00:00:00 | M264: 12 | N264: 8521.64 | O264: 48000 | P264: 1 | Q264: 30 | R264: 1 | S264: 1 | T264: 365 | U264: 18
A265: 20000 | B265: 1519.23 | C265: =IF(DAYS360(RC[8],R1C3)+2>365,365,DAYS360(RC[8],R1C3)+2) -> 130 | D265: =ROUND(RC[-3]*RC[17]/36500,2) -> 11.51 | E265: =RC[-1]*RC[-2] -> 1496.3 | F265: =RC[-1]-RC[-4] -> -22.930000000000064 | H265: 857 | I265: 8 | J265: MG6PW11000017 | K265: 2011-10-14 00:00:00 | L265: 2012-10-14 00:00:00 | M265: 12 | N265: 4142.47 | O265: 20000 | P265: 1 | Q265: 30 | R265: 1 | S265: 1 | T265: 365 | U265: 21
A266: 20000 | B266: 1025.53 | C266: =IF(DAYS360(RC[8],R1C3)+2>365,365,DAYS360(RC[8],R1C3)+2) -> 103 | D266: =ROUND(RC[-3]*RC[17]/36500,2) -> 9.86 | E266: =RC[-1]*RC[-2] -> 1015.5799999999999 | F266: =RC[-1]-RC[-4] -> -9.9500000000000455 | H266: 890 | I266: 8 | J266: MG6PW11000020 | K266: 2011-11-11 00:00:00 | L266: 2012-11-11 00:00:00 | M266: 12 | N266: 3550.68 | O266: 20000 | P266: 1 | Q266: 30 | R266: 1 | S266: 1 | T266: 365 | U266: 18
A267: 148000 | B267: 7371.88 | C267: =IF(DAYS360(RC[8],R1C3)+2>365,365,DAYS360(RC[8],R1C3)+2) -> 100 | D267: =ROUND(RC[-3]*RC[17]/36500,2) -> 72.989999999999995 | E267: =RC[-1]*RC[-2] -> 7298.9999999999991 | F267: =RC[-1]-RC[-4] -> -72.880000000001019 | H267: 905 | I267: 8 | J267: MG6PW11000021 | K267: 2011-11-14 00:00:00 | L267: 2012-11-14 00:00:00 | M267: 12 | N267: 26275.07 | O267: 148000 | P267: 1 | Q267: 30 | R267: 1 | S267: 1 | T267: 365 | U267: 18
A268: 530000 | B268: 26398.37 | C268: =IF(DAYS360(RC[8],R1C3)+2>365,365,DAYS360(RC[8],R1C3)+2) -> 100 | D268: =ROUND(RC[-3]*RC[17]/36500,2) -> 261.37 | E268: =RC[-1]*RC[-2] -> 26137 | F268: =RC[-1]-RC[-4] -> -261.36999999999898 | H268: 906 | I268: 8 | J268: MG6PW11000022 | K268: 2011-11-14 00:00:00 | L268: 2012-11-14 00:00:00 | M268: 12 | N268: 94093.15 | O268: 530000 | P268: 1 | Q268: 30 | R268: 1 | S268: 1 | T268: 365 | U268: 18
A269: 60000 | B269: 2781.43 | C269: =IF(DAYS360(RC[8],R1C3)+2>365,365,DAYS360(RC[8],R1C3)+2) -> 93 | D269: =ROUND(RC[-3]*RC[17]/36500,2) -> 29.59 | E269: =RC[-1]*RC[-2] -> 2751.87 | F269: =RC[-1]-RC[-4] -> -29.559999999999945 | H269: 924 | I269: 8 | J269: MG6PW11000023 | K269: 2011-11-21 00:00:00 | L269: 2012-11-21 00:00:00 | M269: 12 | N269: 10652.05 | O269: 60000 | P269: 1 | Q269: 30 | R269: 1 | S269: 1 | T269: 365 | U269: 18
A270: 10000 | B270: 388.04 | C270: =IF(DAYS360(RC[8],R1C3)+2>365,365,DAYS360(RC[8],R1C3)+2) -> 77 | D270: =ROUND(RC[-3]*RC[17]/36500,2) -> 4.93 | E270: =RC[-1]*RC[-2] -> 379.60999999999996 | F270: =RC[-1]-RC[-4] -> -8.4300000000000637 | H270: 962 | I270: 8 | J270: MG6PW11000026 | K270: 2011-12-07 00:00:00 | L270: 2012-12-07 00:00:00 | M270: 12 | N270: 1775.34 | O270: 10000 | P270: 1 | Q270: 50 | R270: 1 | S270: 1 | T270: 365 | U270: 18
A271: 312500 | B271: 9554.81 | C271: =IF(DAYS360(RC[8],R1C3)+2>365,365,DAYS360(RC[8],R1C3)+2) -> 61 | D271: =ROUND(RC[-3]*RC[17]/36500,2) -> 154.11000000000001 | E271: =RC[-1]*RC[-2] -> 9400.7100000000009 | F271: =RC[-1]-RC[-4] -> -154.09999999999854 | H271: 1036 | I271: 8 | J271: MG6PW11000027 | K271: 2011-12-23 00:00:00 | L271: 2012-12-23 00:00:00 | M271: 12 | N271: 55479.45 | O271: 312500 | P271: 1 | Q271: 30 | R271: 1 | S271: 1 | T271: 365 | U271: 18
A272: 41000 | B272: 1253.6199999999999 | C272: =IF(DAYS360(RC[8],R1C3)+2>365,365,DAYS360(RC[8],R1C3)+2) -> 61 | D272: =ROUND(RC[-3]*RC[17]/36500,2) -> 20.22 | E272: =RC[-1]*RC[-2] -> 1233.4199999999998 | F272: =RC[-1]-RC[-4] -> -20.200000000000045 | H272: 1037 | I272: 8 | J272: MG6PW11000028 | K272: 2011-12-23 00:00:00 | L272: 2012-12-23 00:00:00 | M272: 12 | N272: 7278.9 | O272: 41000 | P272: 1 | Q272: 30 | R272: 1 | S272: 1 | T272: 365 | U272: 18
A273: 39500 | B273: 1207.74 | C273: =IF(DAYS360(RC[8],R1C3)+2>365,365,DAYS360(RC[8],R1C3)+2) -> 61 | D273: =ROUND(RC[-3]*RC[17]/36500,2) -> 19.48 | E273: =RC[-1]*RC[-2] -> 1188.28 | F273: =RC[-1]-RC[-4] -> -19.460000000000036 | H273: 1038 | I273: 8 | J273: MG6PW11000029 | K273: 2011-12-23 00:00:00 | L273: 2012-12-23 00:00:00 | M273: 12 | N273: 7012.6 | O273: 39500 | P273: 1 | Q273: 30 | R273: 1 | S273: 1 | T273: 365 | U273: 18
A274: 150000 | B274: 3032.85 | C274: =IF(DAYS360(RC[8],R1C3)+2>365,365,DAYS360(RC[8],R1C3)+2) -> 41 | D274: =ROUND(RC[-3]*RC[17]/36500,2) -> 73.97 | E274: =RC[-1]*RC[-2] -> 3032.77 | F274: =RC[-1]-RC[-4] -> -7.999999999992724E-2 | H274: 1126 | I274: 8 | J274: MG6PW12000032 | K274: 2012-01-13 00:00:00 | L274: 2013-01-13 00:00:00 | M274: 12 | N274: 26630.14 | O274: 150000 | P274: 1 | Q274: 30 | R274: 1 | S274: 1 | T274: 365 | U274: 18
A275: 135000 | B275: 2729.64 | C275: =IF(DAYS360(RC[8],R1C3)+2>365,365,DAYS360(RC[8],R1C3)+2) -> 41 | D275: =ROUND(RC[-3]*RC[17]/36500,2) -> 66.58 | E275: =RC[-1]*RC[-2] -> 2729.7799999999997 | F275: =RC[-1]-RC[-4] -> 0.13999999999987267 | H275: 1127 | I275: 8 | J275: MG6PW12000033 | K275: 2012-01-13 00:00:00 | L275: 2013-01-13 00:00:00 | M275: 12 | N275: 23967.119999999999 | O275: 135000 | P275: 1 | Q275: 30 | R275: 1 | S275: 1 | T275: 365 | U275: 18
A276: 325000 | B276: 6571.19 | C276: =IF(DAYS360(RC[8],R1C3)+2>365,365,DAYS360(RC[8],R1C3)+2) -> 41 | D276: =ROUND(RC[-3]*RC[17]/36500,2) -> 160.27000000000001 | E276: =RC[-1]*RC[-2] -> 6571.0700000000006 | F276: =RC[-1]-RC[-4] -> -0.11999999999898137 | H276: 1128 | I276: 8 | J276: MG6PW12000034 | K276: 2012-01-13 00:00:00 | L276: 2013-01-13 00:00:00 | M276: 12 | N276: 57698.63 | O276: 325000 | P276: 1 | Q276: 30 | R276: 1 | S276: 1 | T276: 365 | U276: 18
A277: 17000 | B277: 301.79000000000002 | C277: =IF(DAYS360(RC[8],R1C3)+2>365,365,DAYS360(RC[8],R1C3)+2) -> 36 | D277: =ROUND(RC[-3]*RC[17]/36500,2) -> 8.3800000000000008 | E277: =RC[-1]*RC[-2] -> 301.68 | F277: =RC[-1]-RC[-4] -> -0.11000000000001364 | H277: 1143 | I277: 8 | J277: MG6PW12000035 | K277: 2012-01-18 00:00:00 | L277: 2013-01-18 00:00:00 | M277: 12 | N277: 3018.08 | O277: 17000 | P277: 1 | Q277: 30 | R277: 1 | S277: 1 | T277: 365 | U277: 18
A278: 32000 | B278: 568.1 | C278: =IF(DAYS360(RC[8],R1C3)+2>365,365,DAYS360(RC[8],R1C3)+2) -> 36 | D278: =ROUND(RC[-3]*RC[17]/36500,2) -> 15.78 | E278: =RC[-1]*RC[-2] -> 568.07999999999993 | F278: =RC[-1]-RC[-4] -> -2.0000000000095497E-2 | H278: 1144 | I278: 8 | J278: MG6PW12000036 | K278: 2012-01-18 00:00:00 | L278: 2013-01-18 00:00:00 | M278: 12 | N278: 5681.1 | O278: 32000 | P278: 1 | Q278: 30 | R278: 1 | S278: 1 | T278: 365 | U278: 18
A279: 9800 | B279: 1470.73 | C279: =IF(DAYS360(RC[8],R1C3)+2>365,365,DAYS360(RC[8],R1C3)+2) -> 365 | D279: =ROUND(RC[-3]*RC[17]/36500,2) -> 4.03 | E279: =RC[-1]*RC[-2] -> 1470.95 | F279: =RC[-1]-RC[-4] -> 0.22000000000002728 | H279: 137 | I279: 3 | J279: TR1PW11000048 | K279: 2011-01-07 12:28:48 | L279: 2012-01-07 12:28:48 | M279: 12 | N279: 1449.86 | O279: 9800 | P279: 4 | Q279: 64 | R279: 1 | S279: 1 | T279: 365 | U279: 15
A280: 12000 | B280: 1799.56 | C280: =IF(DAYS360(RC[8],R1C3)+2>365,365,DAYS360(RC[8],R1C3)+2) -> 365 | D280: =ROUND(RC[-3]*RC[17]/36500,2) -> 4.93 | E280: =RC[-1]*RC[-2] -> 1799.4499999999998 | F280: =RC[-1]-RC[-4] -> -0.11000000000012733 | H280: 197 | I280: 3 | J280: TR1PW11000067 | K280: 2011-01-17 12:28:48 | L280: 2012-01-17 12:28:48 | M280: 12 | N280: 1775.34 | O280: 12000 | P280: 4 | Q280: 52 | R280: 1 | S280: 1 | T280: 365 | U280: 15
A281: 39000 | B281: 5722.58 | C281: =IF(DAYS360(RC[8],R1C3)+2>365,365,DAYS360(RC[8],R1C3)+2) -> 351 | D281: =ROUND(RC[-3]*RC[17]/36500,2) -> 16.03 | E281: =RC[-1]*RC[-2] -> 5626.5300000000007 | F281: =RC[-1]-RC[-4] -> -96.049999999999272 | H281: 297 | I281: 3 | J281: TR1PW11000112 | K281: 2011-03-03 12:28:48 | L281: 2012-03-03 12:28:48 | M281: 12 | N281: 5769.86 | O281: 39000 | P281: 1 | Q281: 30 | R281: 1 | S281: 1 | T281: 365 | U281: 15
A282: 23000 | B282: 3373.75 | C282: =IF(DAYS360(RC[8],R1C3)+2>365,365,DAYS360(RC[8],R1C3)+2) -> 351 | D282: =ROUND(RC[-3]*RC[17]/36500,2) -> 9.4499999999999993 | E282: =RC[-1]*RC[-2] -> 3316.95 | F282: =RC[-1]-RC[-4] -> -56.800000000000182 | H282: 298 | I282: 3 | J282: TR1PW11000113 | K282: 2011-03-03 12:28:48 | L282: 2012-03-03 12:28:48 | M282: 12 | N282: 3402.74 | O282: 23000 | P282: 1 | Q282: 30 | R282: 1 | S282: 1 | T282: 365 | U282: 15
A283: 75000 | B283: 10447.56 | C283: =IF(DAYS360(RC[8],R1C3)+2>365,365,DAYS360(RC[8],R1C3)+2) -> 333 | D283: =ROUND(RC[-3]*RC[17]/36500,2) -> 30.82 | E283: =RC[-1]*RC[-2] -> 10263.06 | F283: =RC[-1]-RC[-4] -> -184.5 | H283: 333 | I283: 3 | J283: TR1PW11000123 | K283: 2011-03-21 12:28:48 | L283: 2012-03-21 12:28:48 | M283: 12 | N283: 11095.89 | O283: 75000 | P283: 1 | Q283: 30 | R283: 1 | S283: 1 | T283: 365 | U283: 15
A284: 31500 | B284: 4299.22 | C284: =IF(DAYS360(RC[8],R1C3)+2>365,365,DAYS360(RC[8],R1C3)+2) -> 326 | D284: =ROUND(RC[-3]*RC[17]/36500,2) -> 12.95 | E284: =RC[-1]*RC[-2] -> 4221.7 | F284: =RC[-1]-RC[-4] -> -77.520000000000437 | H284: 349 | I284: 3 | J284: TR1PW11000132 | K284: 2011-03-28 12:28:48 | L284: 2012-03-28 12:28:48 | M284: 12 | N284: 4660.2700000000004 | O284: 31500 | P284: 1 | Q284: 30 | R284: 1 | S284: 1 | T284: 365 | U284: 15
A285: 230000 | B285: 31097.1 | C285: =IF(DAYS360(RC[8],R1C3)+2>365,365,DAYS360(RC[8],R1C3)+2) -> 324 | D285: =ROUND(RC[-3]*RC[17]/36500,2) -> 94.52 | E285: =RC[-1]*RC[-2] -> 30624.48 | F285: =RC[-1]-RC[-4] -> -472.61999999999898 | H285: 364 | I285: 3 | J285: TR1PW11000136 | K285: 2011-03-30 12:28:48 | L285: 2012-03-30 12:28:48 | M285: 12 | N285: 34027.4 | O285: 230000 | P285: 1 | Q285: 30 | R285: 1 | S285: 1 | T285: 365 | U285: 15
A286: 5000 | B286: 668.2 | C286: =IF(DAYS360(RC[8],R1C3)+2>365,365,DAYS360(RC[8],R1C3)+2) -> 320 | D286: =ROUND(RC[-3]*RC[17]/36500,2) -> 2.0499999999999998 | E286: =RC[-1]*RC[-2] -> 656 | F286: =RC[-1]-RC[-4] -> -12.200000000000045 | H286: 387 | I286: 3 | J286: TR1PW11000138 | K286: 2011-04-04 00:00:00 | L286: 2012-04-04 00:00:00 | M286: 12 | N286: 739.73 | O286: 5000 | P286: 1 | Q286: 121 | R286: 1 | S286: 1 | T286: 365 | U286: 15
A287: 5000 | B287: 635.4 | C287: =IF(DAYS360(RC[8],R1C3)+2>365,365,DAYS360(RC[8],R1C3)+2) -> 304 | D287: =ROUND(RC[-3]*RC[17]/36500,2) -> 2.0499999999999998 | E287: =RC[-1]*RC[-2] -> 623.19999999999993 | F287: =RC[-1]-RC[-4] -> -12.200000000000045 | H287: 417 | I287: 3 | J287: TR1PW11000147 | K287: 2011-04-20 00:00:00 | L287: 2012-04-20 00:00:00 | M287: 12 | N287: 739.73 | O287: 5000 | P287: 1 | Q287: 121 | R287: 1 | S287: 1 | T287: 365 | U287: 15
A288: 15000 | B288: 1876.24 | C288: =IF(DAYS360(RC[8],R1C3)+2>365,365,DAYS360(RC[8],R1C3)+2) -> 299 | D288: =ROUND(RC[-3]*RC[17]/36500,2) -> 6.16 | E288: =RC[-1]*RC[-2] -> 1841.8400000000001 | F288: =RC[-1]-RC[-4] -> -34.399999999999864 | H288: 425 | I288: 3 | J288: TR1PW11000150 | K288: 2011-04-25 00:00:00 | L288: 2012-04-25 00:00:00 | M288: 12 | N288: 2219.1799999999998 | O288: 15000 | P288: 1 | Q288: 40 | R288: 1 | S288: 1 | T288: 365 | U288: 15
A289: 10000 | B289: 1219.96 | C289: =IF(DAYS360(RC[8],R1C3)+2>365,365,DAYS360(RC[8],R1C3)+2) -> 291 | D289: =ROUND(RC[-3]*RC[17]/36500,2) -> 4.1100000000000003 | E289: =RC[-1]*RC[-2] -> 1196.01 | F289: =RC[-1]-RC[-4] -> -23.950000000000045 | H289: 452 | I289: 3 | J289: TR1PW11000160 | K289: 2011-05-03 00:00:00 | L289: 2012-05-03 00:00:00 | M289: 12 | N289: 1479.45 | O289: 10000 | P289: 1 | Q289: 60 | R289: 1 | S289: 1 | T289: 365 | U289: 15
A290: 50000 | B290: 6062.19 | C290: =IF(DAYS360(RC[8],R1C3)+2>365,365,DAYS360(RC[8],R1C3)+2) -> 290 | D290: =ROUND(RC[-3]*RC[17]/36500,2) -> 20.55 | E290: =RC[-1]*RC[-2] -> 5959.5 | F290: =RC[-1]-RC[-4] -> -102.6899999999996 | H290: 460 | I290: 3 | J290: TR1PW11000161 | K290: 2011-05-04 00:00:00 | L290: 2012-05-04 00:00:00 | M290: 12 | N290: 7397.26 | O290: 50000 | P290: 1 | Q290: 30 | R290: 1 | S290: 1 | T290: 365 | U290: 15
A291: 27500 | B291: 3310.94 | C291: =IF(DAYS360(RC[8],R1C3)+2>365,365,DAYS360(RC[8],R1C3)+2) -> 288 | D291: =ROUND(RC[-3]*RC[17]/36500,2) -> 11.3 | E291: =RC[-1]*RC[-2] -> 3254.4 | F291: =RC[-1]-RC[-4] -> -56.539999999999964 | H291: 469 | I291: 3 | J291: TR1PW11000164 | K291: 2011-05-06 00:00:00 | L291: 2012-05-06 00:00:00 | M291: 12 | N291: 4068.49 | O291: 27500 | P291: 1 | Q291: 30 | R291: 1 | S291: 1 | T291: 365 | U291: 15
A292: 9000 | B292: 1075.0999999999999 | C292: =IF(DAYS360(RC[8],R1C3)+2>365,365,DAYS360(RC[8],R1C3)+2) -> 285 | D292: =ROUND(RC[-3]*RC[17]/36500,2) -> 3.7 | E292: =RC[-1]*RC[-2] -> 1054.5 | F292: =RC[-1]-RC[-4] -> -20.599999999999909 | H292: 470 | I292: 3 | J292: TR1PW11000165 | K292: 2011-05-09 00:00:00 | L292: 2012-05-09 00:00:00 | M292: 12 | N292: 1331.51 | O292: 9000 | P292: 1 | Q292: 67 | R292: 1 | S292: 1 | T292: 365 | U292: 15
A293: 14000 | B293: 1819.84 | C293: =IF(DAYS360(RC[8],R1C3)+2>365,365,DAYS360(RC[8],R1C3)+2) -> 282 | D293: =ROUND(RC[-3]*RC[17]/36500,2) -> 6.33 | E293: =RC[-1]*RC[-2] -> 1785.06 | F293: =RC[-1]-RC[-4] -> -34.779999999999973 | H293: 475 | I293: 3 | J293: TR1PW11000166 | K293: 2011-05-12 00:00:00 | L293: 2012-05-12 00:00:00 | M293: 12 | N293: 2278.36 | O293: 14000 | P293: 1 | Q293: 39 | R293: 1 | S293: 1 | T293: 365 | U293: 16.5
A294: 9000 | B294: 1165.75 | C294: =IF(DAYS360(RC[8],R1C3)+2>365,365,DAYS360(RC[8],R1C3)+2) -> 281 | D294: =ROUND(RC[-3]*RC[17]/36500,2) -> 4.07 | E294: =RC[-1]*RC[-2] -> 1143.67 | F294: =RC[-1]-RC[-4] -> -22.079999999999927 | H294: 477 | I294: 3 | J294: TR1PW11000168 | K294: 2011-05-13 00:00:00 | L294: 2012-05-13 00:00:00 | M294: 12 | N294: 1464.66 | O294: 9000 | P294: 1 | Q294: 61 | R294: 1 | S294: 1 | T294: 365 | U294: 16.5
A295: 5000 | B295: 647.76 | C295: =IF(DAYS360(RC[8],R1C3)+2>365,365,DAYS360(RC[8],R1C3)+2) -> 281 | D295: =ROUND(RC[-3]*RC[17]/36500,2) -> 2.2599999999999998 | E295: =RC[-1]*RC[-2] -> 635.05999999999995 | F295: =RC[-1]-RC[-4] -> -12.700000000000045 | H295: 478 | I295: 3 | J295: TR1PW11000169 | K295: 2011-05-13 00:00:00 | L295: 2012-05-13 00:00:00 | M295: 12 | N295: 813.7 | O295: 5000 | P295: 1 | Q295: 110 | R295: 1 | S295: 1 | T295: 365 | U295: 16.5
A296: 19500 | B296: 2495.91 | C296: =IF(DAYS360(RC[8],R1C3)+2>365,365,DAYS360(RC[8],R1C3)+2) -> 278 | D296: =ROUND(RC[-3]*RC[17]/36500,2) -> 8.82 | E296: =RC[-1]*RC[-2] -> 2451.96 | F296: =RC[-1]-RC[-4] -> -43.949999999999818 | H296: 481 | I296: 3 | J296: TR1PW11000170 | K296: 2011-05-16 00:00:00 | L296: 2012-05-16 00:00:00 | M296: 12 | N296: 3173.42 | O296: 19500 | P296: 1 | Q296: 30 | R296: 1 | S296: 1 | T296: 365 | U296: 16.5
A297: 15500 | B297: 1988.48 | C297: =IF(DAYS360(RC[8],R1C3)+2>365,365,DAYS360(RC[8],R1C3)+2) -> 278 | D297: =ROUND(RC[-3]*RC[17]/36500,2) -> 7.01 | E297: =RC[-1]*RC[-2] -> 1948.78 | F297: =RC[-1]-RC[-4] -> -39.700000000000045 | H297: 484 | I297: 3 | J297: TR1PW11000172 | K297: 2011-05-16 00:00:00 | L297: 2012-05-16 00:00:00 | M297: 12 | N297: 2522.4699999999998 | O297: 15500 | P297: 1 | Q297: 35 | R297: 1 | S297: 1 | T297: 365 | U297: 16.5
A298: 10000 | B298: 1212.76 | C298: =IF(DAYS360(RC[8],R1C3)+2>365,365,DAYS360(RC[8],R1C3)+2) -> 264 | D298: =ROUND(RC[-3]*RC[17]/36500,2) -> 4.5199999999999996 | E298: =RC[-1]*RC[-2] -> 1193.28 | F298: =RC[-1]-RC[-4] -> -19.480000000000018 | H298: 493 | I298: 3 | J298: TR1PW11000175 | K298: 2011-05-31 00:00:00 | L298: 2012-05-31 00:00:00 | M298: 12 | N298: 1627.4 | O298: 10000 | P298: 1 | Q298: 55 | R298: 1 | S298: 1 | T298: 365 | U298: 16.5
A299: 60000 | B299: 7268.26 | C299: =IF(DAYS360(RC[8],R1C3)+2>365,365,DAYS360(RC[8],R1C3)+2) -> 264 | D299: =ROUND(RC[-3]*RC[17]/36500,2) -> 27.12 | E299: =RC[-1]*RC[-2] -> 7159.68 | F299: =RC[-1]-RC[-4] -> -108.57999999999993 | H299: 494 | I299: 3 | J299: TR1PW11000176 | K299: 2011-05-31 00:00:00 | L299: 2012-05-31 00:00:00 | M299: 12 | N299: 9764.3799999999992 | O299: 60000 | P299: 1 | Q299: 30 | R299: 1 | S299: 1 | T299: 365 | U299: 16.5
A300: 9000 | B300: 1059.93 | C300: =IF(DAYS360(RC[8],R1C3)+2>365,365,DAYS360(RC[8],R1C3)+2) -> 256 | D300: =ROUND(RC[-3]*RC[17]/36500,2) -> 4.07 | E300: =RC[-1]*RC[-2] -> 1041.92 | F300: =RC[-1]-RC[-4] -> -18.009999999999991 | H300: 500 | I300: 3 | J300: TR1PW11000180 | K300: 2011-06-08 00:00:00 | L300: 2012-06-08 00:00:00 | M300: 12 | N300: 1464.66 | O300: 9000 | P300: 1 | Q300: 61 | R300: 1 | S300: 1 | T300: 365 | U300: 16.5
A301: 121000 | B301: 13843.48 | C301: =IF(DAYS360(RC[8],R1C3)+2>365,365,DAYS360(RC[8],R1C3)+2) -> 228 | D301: =ROUND(RC[-3]*RC[17]/36500,2) -> 59.67 | E301: =RC[-1]*RC[-2] -> 13604.76 | F301: =RC[-1]-RC[-4] -> -238.71999999999935 | H301: 548 | I301: 3 | J301: TR1PW11000193 | K301: 2011-07-06 00:00:00 | L301: 2012-07-06 00:00:00 | M301: 12 | N301: 21481.64 | O301: 121000 | P301: 1 | Q301: 30 | R301: 1 | S301: 1 | T301: 365 | U301: 18
A302: 150000 | B302: 15681.72 | C302: =IF(DAYS360(RC[8],R1C3)+2>365,365,DAYS360(RC[8],R1C3)+2) -> 208 | D302: =ROUND(RC[-3]*RC[17]/36500,2) -> 73.97 | E302: =RC[-1]*RC[-2] -> 15385.76 | F302: =RC[-1]-RC[-4] -> -295.95999999999913 | H302: 569 | I302: 3 | J302: TR1PW11000196 | K302: 2011-07-26 00:00:00 | L302: 2012-07-26 00:00:00 | M302: 12 | N302: 26630.14 | O302: 150000 | P302: 1 | Q302: 30 | R302: 1 | S302: 1 | T302: 365 | U302: 18
A303: 52000 | B303: 5205.04 | C303: =IF(DAYS360(RC[8],R1C3)+2>365,365,DAYS360(RC[8],R1C3)+2) -> 200 | D303: =ROUND(RC[-3]*RC[17]/36500,2) -> 25.64 | E303: =RC[-1]*RC[-2] -> 5128 | F303: =RC[-1]-RC[-4] -> -77.039999999999964 | H303: 587 | I303: 3 | J303: TR1PW11000204 | K303: 2011-08-04 00:00:00 | L303: 2012-08-04 00:00:00 | M303: 12 | N303: 9231.7800000000007 | O303: 52000 | P303: 1 | Q303: 30 | R303: 1 | S303: 1 | T303: 365 | U303: 18
A304: 15000 | B304: 1456.2 | C304: =IF(DAYS360(RC[8],R1C3)+2>365,365,DAYS360(RC[8],R1C3)+2) -> 193 | D304: =ROUND(RC[-3]*RC[17]/36500,2) -> 7.4 | E304: =RC[-1]*RC[-2] -> 1428.2 | F304: =RC[-1]-RC[-4] -> -28 | H304: 617 | I304: 3 | J304: TR1PW11000206 | K304: 2011-08-11 00:00:00 | L304: 2012-08-11 00:00:00 | M304: 12 | N304: 2663.01 | O304: 15000 | P304: 1 | Q304: 33 | R304: 1 | S304: 1 | T304: 365 | U304: 18
A305: 105000 | B305: 9786.44 | C305: =IF(DAYS360(RC[8],R1C3)+2>365,365,DAYS360(RC[8],R1C3)+2) -> 186 | D305: =ROUND(RC[-3]*RC[17]/36500,2) -> 51.78 | E305: =RC[-1]*RC[-2] -> 9631.08 | F305: =RC[-1]-RC[-4] -> -155.36000000000058 | H305: 667 | I305: 3 | J305: TR1PW11000212 | K305: 2011-08-18 00:00:00 | L305: 2012-08-18 00:00:00 | M305: 12 | N305: 18641.099999999999 | O305: 105000 | P305: 1 | Q305: 30 | R305: 1 | S305: 1 | T305: 365 | U305: 18
A306: 100000 | B306: 9124.0499999999993 | C306: =IF(DAYS360(RC[8],R1C3)+2>365,365,DAYS360(RC[8],R1C3)+2) -> 182 | D306: =ROUND(RC[-3]*RC[17]/36500,2) -> 49.32 | E306: =RC[-1]*RC[-2] -> 8976.24 | F306: =RC[-1]-RC[-4] -> -147.80999999999949 | H306: 683 | I306: 3 | J306: TR1PW11000213 | K306: 2011-08-22 00:00:00 | L306: 2012-08-22 00:00:00 | M306: 12 | N306: 17753.419999999998 | O306: 100000 | P306: 1 | Q306: 30 | R306: 1 | S306: 1 | T306: 365 | U306: 18
A307: 125000 | B307: 11403.52 | C307: =IF(DAYS360(RC[8],R1C3)+2>365,365,DAYS360(RC[8],R1C3)+2) -> 182 | D307: =ROUND(RC[-3]*RC[17]/36500,2) -> 61.64 | E307: =RC[-1]*RC[-2] -> 11218.48 | F307: =RC[-1]-RC[-4] -> -185.04000000000087 | H307: 684 | I307: 3 | J307: TR1PW11000214 | K307: 2011-08-22 00:00:00 | L307: 2012-08-22 00:00:00 | M307: 12 | N307: 22191.78 | O307: 125000 | P307: 1 | Q307: 30 | R307: 1 | S307: 1 | T307: 365 | U307: 18
A308: 19500 | B308: 1779.59 | C308: =IF(DAYS360(RC[8],R1C3)+2>365,365,DAYS360(RC[8],R1C3)+2) -> 182 | D308: =ROUND(RC[-3]*RC[17]/36500,2) -> 9.6199999999999992 | E308: =RC[-1]*RC[-2] -> 1750.84 | F308: =RC[-1]-RC[-4] -> -28.75 | H308: 685 | I308: 3 | J308: TR1PW11000215 | K308: 2011-08-22 00:00:00 | L308: 2012-08-22 00:00:00 | M308: 12 | N308: 3461.92 | O308: 19500 | P308: 1 | Q308: 30 | R308: 1 | S308: 1 | T308: 365 | U308: 18
A309: 106000 | B309: 9304.18 | C309: =IF(DAYS360(RC[8],R1C3)+2>365,365,DAYS360(RC[8],R1C3)+2) -> 175 | D309: =ROUND(RC[-3]*RC[17]/36500,2) -> 52.27 | E309: =RC[-1]*RC[-2] -> 9147.25 | F309: =RC[-1]-RC[-4] -> -156.93000000000029 | H309: 722 | I309: 3 | J309: TR1PW11000220 | K309: 2011-08-29 00:00:00 | L309: 2012-08-29 00:00:00 | M309: 12 | N309: 18818.63 | O309: 106000 | P309: 1 | Q309: 30 | R309: 1 | S309: 1 | T309: 365 | U309: 18
A310: 36500 | B310: 3060 | C310: =IF(DAYS360(RC[8],R1C3)+2>365,365,DAYS360(RC[8],R1C3)+2) -> 168 | D310: =ROUND(RC[-3]*RC[17]/36500,2) -> 18 | E310: =RC[-1]*RC[-2] -> 3024 | F310: =RC[-1]-RC[-4] -> -36 | H310: 749 | I310: 3 | J310: TR1PW11000221 | K310: 2011-09-06 00:00:00 | L310: 2012-09-06 00:00:00 | M310: 12 | N310: 6480 | O310: 36500 | P310: 1 | Q310: 30 | R310: 1 | S310: 1 | T310: 365 | U310: 18
A311: 29000 | B311: 2216.54 | C311: =IF(DAYS360(RC[8],R1C3)+2>365,365,DAYS360(RC[8],R1C3)+2) -> 153 | D311: =ROUND(RC[-3]*RC[17]/36500,2) -> 14.3 | E311: =RC[-1]*RC[-2] -> 2187.9 | F311: =RC[-1]-RC[-4] -> -28.639999999999873 | H311: 808 | I311: 3 | J311: TR1PW11000230 | K311: 2011-09-21 00:00:00 | L311: 2012-09-21 00:00:00 | M311: 12 | N311: 5148.49 | O311: 29000 | P311: 1 | Q311: 30 | R311: 1 | S311: 1 | T311: 365 | U311: 18
A312: 19200 | B312: 1335.22 | C312: =IF(DAYS360(RC[8],R1C3)+2>365,365,DAYS360(RC[8],R1C3)+2) -> 139 | D312: =ROUND(RC[-3]*RC[17]/36500,2) -> 9.4700000000000006 | E312: =RC[-1]*RC[-2] -> 1316.3300000000002 | F312: =RC[-1]-RC[-4] -> -18.889999999999873 | H312: 845 | I312: 3 | J312: TR1PW11000238 | K312: 2011-10-05 00:00:00 | L312: 2012-10-05 00:00:00 | M312: 12 | N312: 3408.66 | O312: 19200 | P312: 1 | Q312: 30 | R312: 1 | S312: 1 | T312: 365 | U312: 18
A313: 28000 | B313: 2190.9499999999998 | C313: =IF(DAYS360(RC[8],R1C3)+2>365,365,DAYS360(RC[8],R1C3)+2) -> 134 | D313: =ROUND(RC[-3]*RC[17]/36500,2) -> 16.11 | E313: =RC[-1]*RC[-2] -> 2158.7399999999998 | F313: =RC[-1]-RC[-4] -> -32.210000000000036 | H313: 853 | I313: 3 | J313: TR1PW11000243 | K313: 2011-10-10 00:00:00 | L313: 2012-10-10 00:00:00 | M313: 12 | N313: 5799.45 | O313: 28000 | P313: 1 | Q313: 30 | R313: 1 | S313: 1 | T313: 365 | U313: 21
A314: 37000 | B314: 2810.21 | C314: =IF(DAYS360(RC[8],R1C3)+2>365,365,DAYS360(RC[8],R1C3)+2) -> 130 | D314: =ROUND(RC[-3]*RC[17]/36500,2) -> 21.29 | E314: =RC[-1]*RC[-2] -> 2767.7 | F314: =RC[-1]-RC[-4] -> -42.510000000000218 | H314: 859 | I314: 3 | J314: TR1PW11000248 | K314: 2011-10-14 00:00:00 | L314: 2012-10-14 00:00:00 | M314: 12 | N314: 7663.56 | O314: 37000 | P314: 1 | Q314: 30 | R314: 1 | S314: 1 | T314: 365 | U314: 21
A315: 17000 | B315: 1222.52 | C315: =IF(DAYS360(RC[8],R1C3)+2>365,365,DAYS360(RC[8],R1C3)+2) -> 123 | D315: =ROUND(RC[-3]*RC[17]/36500,2) -> 9.7799999999999994 | E315: =RC[-1]*RC[-2] -> 1202.9399999999998 | F315: =RC[-1]-RC[-4] -> -19.580000000000155 | H315: 865 | I315: 3 | J315: TR1PW11000250 | K315: 2011-10-21 00:00:00 | L315: 2012-10-21 00:00:00 | M315: 12 | N315: 3521.1 | O315: 17000 | P315: 1 | Q315: 30 | R315: 1 | S315: 1 | T315: 365 | U315: 21
A316: 10000 | B316: 623.75 | C316: =IF(DAYS360(RC[8],R1C3)+2>365,365,DAYS360(RC[8],R1C3)+2) -> 107 | D316: =ROUND(RC[-3]*RC[17]/36500,2) -> 5.75 | E316: =RC[-1]*RC[-2] -> 615.25 | F316: =RC[-1]-RC[-4] -> -8.5 | H316: 882 | I316: 3 | J316: TR1PW11000253 | K316: 2011-11-07 00:00:00 | L316: 2012-11-07 00:00:00 | M316: 12 | N316: 2071.23 | O316: 10000 | P316: 1 | Q316: 43 | R316: 1 | S316: 1 | T316: 365 | U316: 21
A317: 320000 | B317: 16885.62 | C317: =IF(DAYS360(RC[8],R1C3)+2>365,365,DAYS360(RC[8],R1C3)+2) -> 106 | D317: =ROUND(RC[-3]*RC[17]/36500,2) -> 157.81 | E317: =RC[-1]*RC[-2] -> 16727.86 | F317: =RC[-1]-RC[-4] -> -157.7599999999984 | H317: 883 | I317: 3 | J317: TR1PW11000254 | K317: 2011-11-08 00:00:00 | L317: 2012-11-08 00:00:00 | M317: 12 | N317: 56810.96 | O317: 320000 | P317: 1 | Q317: 30 | R317: 1 | S317: 1 | T317: 365 | U317: 18
A318: 410000 | B318: 21634.38 | C318: =IF(DAYS360(RC[8],R1C3)+2>365,365,DAYS360(RC[8],R1C3)+2) -> 106 | D318: =ROUND(RC[-3]*RC[17]/36500,2) -> 202.19 | E318: =RC[-1]*RC[-2] -> 21432.14 | F318: =RC[-1]-RC[-4] -> -202.2400000000016 | H318: 884 | I318: 3 | J318: TR1PW11000255 | K318: 2011-11-08 00:00:00 | L318: 2012-11-08 00:00:00 | M318: 12 | N318: 72789.039999999994 | O318: 410000 | P318: 1 | Q318: 30 | R318: 1 | S318: 1 | T318: 365 | U318: 18
A319: 40000 | B319: 2091.2600000000002 | C319: =IF(DAYS360(RC[8],R1C3)+2>365,365,DAYS360(RC[8],R1C3)+2) -> 105 | D319: =ROUND(RC[-3]*RC[17]/36500,2) -> 19.73 | E319: =RC[-1]*RC[-2] -> 2071.65 | F319: =RC[-1]-RC[-4] -> -19.610000000000127 | H319: 887 | I319: 3 | J319: TR1PW11000256 | K319: 2011-11-09 00:00:00 | L319: 2012-11-09 00:00:00 | M319: 12 | N319: 7101.37 | O319: 40000 | P319: 1 | Q319: 30 | R319: 1 | S319: 1 | T319: 365 | U319: 18
A320: 28000 | B320: 1463.81 | C320: =IF(DAYS360(RC[8],R1C3)+2>365,365,DAYS360(RC[8],R1C3)+2) -> 105 | D320: =ROUND(RC[-3]*RC[17]/36500,2) -> 13.81 | E320: =RC[-1]*RC[-2] -> 1450.05 | F320: =RC[-1]-RC[-4] -> -13.759999999999991 | H320: 888 | I320: 3 | J320: TR1PW11000257 | K320: 2011-11-09 00:00:00 | L320: 2012-11-09 00:00:00 | M320: 12 | N320: 4970.96 | O320: 28000 | P320: 1 | Q320: 30 | R320: 1 | S320: 1 | T320: 365 | U320: 18
A321: 14000 | B321: 698.5 | C321: =IF(DAYS360(RC[8],R1C3)+2>365,365,DAYS360(RC[8],R1C3)+2) -> 100 | D321: =ROUND(RC[-3]*RC[17]/36500,2) -> 6.9 | E321: =RC[-1]*RC[-2] -> 690 | F321: =RC[-1]-RC[-4] -> -8.5 | H321: 901 | I321: 3 | J321: TR1PW11000260 | K321: 2011-11-14 00:00:00 | L321: 2012-11-14 00:00:00 | M321: 12 | N321: 2485.48 | O321: 14000 | P321: 1 | Q321: 36 | R321: 1 | S321: 1 | T321: 365 | U321: 18
A322: 6000 | B322: 297.36 | C322: =IF(DAYS360(RC[8],R1C3)+2>365,365,DAYS360(RC[8],R1C3)+2) -> 99 | D322: =ROUND(RC[-3]*RC[17]/36500,2) -> 2.96 | E322: =RC[-1]*RC[-2] -> 293.04000000000002 | F322: =RC[-1]-RC[-4] -> -4.3199999999999932 | H322: 907 | I322: 3 | J322: TR1PW11000261 | K322: 2011-11-15 00:00:00 | L322: 2012-11-15 00:00:00 | M322: 12 | N322: 1065.21 | O322: 6000 | P322: 1 | Q322: 84 | R322: 1 | S322: 1 | T322: 365 | U322: 18
A323: 17000 | B323: 838.11 | C323: =IF(DAYS360(RC[8],R1C3)+2>365,365,DAYS360(RC[8],R1C3)+2) -> 99 | D323: =ROUND(RC[-3]*RC[17]/36500,2) -> 8.3800000000000008 | E323: =RC[-1]*RC[-2] -> 829.62000000000012 | F323: =RC[-1]-RC[-4] -> -8.4899999999998954 | H323: 911 | I323: 3 | J323: TR1PW11000262 | K323: 2011-11-15 00:00:00 | L323: 2012-11-15 00:00:00 | M323: 12 | N323: 3018.08 | O323: 17000 | P323: 1 | Q323: 30 | R323: 1 | S323: 1 | T323: 365 | U323: 18
A324: 5000 | B324: 250 | C324: =IF(DAYS360(RC[8],R1C3)+2>365,365,DAYS360(RC[8],R1C3)+2) -> 93 | D324: =ROUND(RC[-3]*RC[17]/36500,2) -> 2.4700000000000002 | E324: =RC[-1]*RC[-2] -> 229.71 | F324: =RC[-1]-RC[-4] -> -20.289999999999992 | H324: 927 | I324: 3 | J324: TR1PW11000265 | K324: 2011-11-21 00:00:00 | L324: 2012-11-21 00:00:00 | M324: 12 | N324: 887.67 | O324: 5000 | P324: 1 | Q324: 101 | R324: 1 | S324: 1 | T324: 365 | U324: 18
A325: 6500 | B325: 298.14999999999998 | C325: =IF(DAYS360(RC[8],R1C3)+2>365,365,DAYS360(RC[8],R1C3)+2) -> 91 | D325: =ROUND(RC[-3]*RC[17]/36500,2) -> 3.21 | E325: =RC[-1]*RC[-2] -> 292.11 | F325: =RC[-1]-RC[-4] -> -6.0399999999999636 | H325: 933 | I325: 3 | J325: TR1PW11000266 | K325: 2011-11-23 00:00:00 | L325: 2012-11-23 00:00:00 | M325: 12 | N325: 1153.97 | O325: 6500 | P325: 1 | Q325: 77 | R325: 1 | S325: 1 | T325: 365 | U325: 18
A326: 41000 | B326: 1718.68 | C326: =IF(DAYS360(RC[8],R1C3)+2>365,365,DAYS360(RC[8],R1C3)+2) -> 84 | D326: =ROUND(RC[-3]*RC[17]/36500,2) -> 20.22 | E326: =RC[-1]*RC[-2] -> 1698.48 | F326: =RC[-1]-RC[-4] -> -20.200000000000045 | H326: 943 | I326: 3 | J326: TR1PW11000269 | K326: 2011-11-30 00:00:00 | L326: 2012-11-30 00:00:00 | M326: 12 | N326: 7278.9 | O326: 41000 | P326: 1 | Q326: 30 | R326: 1 | S326: 1 | T326: 365 | U326: 18
A327: 5000 | B327: 250 | C327: =IF(DAYS360(RC[8],R1C3)+2>365,365,DAYS360(RC[8],R1C3)+2) -> 77 | D327: =ROUND(RC[-3]*RC[17]/36500,2) -> 2.4700000000000002 | E327: =RC[-1]*RC[-2] -> 190.19000000000003 | F327: =RC[-1]-RC[-4] -> -59.809999999999974 | H327: 961 | I327: 3 | J327: TR1PW11000270 | K327: 2011-12-07 00:00:00 | L327: 2012-12-07 00:00:00 | M327: 12 | N327: 887.67 | O327: 5000 | P327: 1 | Q327: 101 | R327: 1 | S327: 1 | T327: 365 | U327: 18
A328: 7000 | B328: 250 | C328: =IF(DAYS360(RC[8],R1C3)+2>365,365,DAYS360(RC[8],R1C3)+2) -> 63 | D328: =ROUND(RC[-3]*RC[17]/36500,2) -> 3.45 | E328: =RC[-1]*RC[-2] -> 217.35000000000002 | F328: =RC[-1]-RC[-4] -> -32.649999999999977 | H328: 1024 | I328: 3 | J328: TR1PW11000274 | K328: 2011-12-21 00:00:00 | L328: 2012-12-21 00:00:00 | M328: 12 | N328: 1242.74 | O328: 7000 | P328: 1 | Q328: 72 | R328: 1 | S328: 1 | T328: 365 | U328: 18
A329: 70000 | B329: 1726.02 | C329: =IF(DAYS360(RC[8],R1C3)+2>365,365,DAYS360(RC[8],R1C3)+2) -> 50 | D329: =ROUND(RC[-3]*RC[17]/36500,2) -> 34.520000000000003 | E329: =RC[-1]*RC[-2] -> 1726.0000000000002 | F329: =RC[-1]-RC[-4] -> -1.9999999999754436E-2 | H329: 1078 | I329: 3 | J329: TR1PW12000280 | K329: 2012-01-04 00:00:00 | L329: 2013-01-04 00:00:00 | M329: 12 | N329: 12427.4 | O329: 70000 | P329: 1 | Q329: 30 | R329: 1 | S329: 1 | T329: 365 | U329: 18
A330: 27500 | B330: 664.49 | C330: =IF(DAYS360(RC[8],R1C3)+2>365,365,DAYS360(RC[8],R1C3)+2) -> 49 | D330: =ROUND(RC[-3]*RC[17]/36500,2) -> 13.56 | E330: =RC[-1]*RC[-2] -> 664.44 | F330: =RC[-1]-RC[-4] -> -4.9999999999954525E-2 | H330: 1084 | I330: 3 | J330: TR1PW12000283 | K330: 2012-01-05 00:00:00 | L330: 2013-01-05 00:00:00 | M330: 12 | N330: 4882.1899999999996 | O330: 27500 | P330: 1 | Q330: 30 | R330: 1 | S330: 1 | T330: 365 | U330: 18
A331: 79000 | B331: 1636.29 | C331: =IF(DAYS360(RC[8],R1C3)+2>365,365,DAYS360(RC[8],R1C3)+2) -> 42 | D331: =ROUND(RC[-3]*RC[17]/36500,2) -> 38.96 | E331: =RC[-1]*RC[-2] -> 1636.32 | F331: =RC[-1]-RC[-4] -> 2.9999999999972715E-2 | H331: 1118 | I331: 3 | J331: TR1PW12000287 | K331: 2012-01-12 00:00:00 | L331: 2013-01-12 00:00:00 | M331: 12 | N331: 14025.21 | O331: 79000 | P331: 1 | Q331: 30 | R331: 1 | S331: 1 | T331: 365 | U331: 18
A332: 53000 | B332: 1097.79 | C332: =IF(DAYS360(RC[8],R1C3)+2>365,365,DAYS360(RC[8],R1C3)+2) -> 42 | D332: =ROUND(RC[-3]*RC[17]/36500,2) -> 26.14 | E332: =RC[-1]*RC[-2] -> 1097.8800000000001 | F332: =RC[-1]-RC[-4] -> 9.0000000000145519E-2 | H332: 1119 | I332: 3 | J332: TR1PW12000288 | K332: 2012-01-12 00:00:00 | L332: 2013-01-12 00:00:00 | M332: 12 | N332: 9409.32 | O332: 53000 | P332: 1 | Q332: 30 | R332: 1 | S332: 1 | T332: 365 | U332: 18
A333: 15000 | B333: 316.60000000000002 | C333: =IF(DAYS360(RC[8],R1C3)+2>365,365,DAYS360(RC[8],R1C3)+2) -> 42 | D333: =ROUND(RC[-3]*RC[17]/36500,2) -> 7.4 | E333: =RC[-1]*RC[-2] -> 310.8 | F333: =RC[-1]-RC[-4] -> -5.8000000000000114 | H333: 1121 | I333: 3 | J333: TR1PW12000289 | K333: 2012-01-12 00:00:00 | L333: 2013-01-12 00:00:00 | M333: 12 | N333: 2663.01 | O333: 15000 | P333: 1 | Q333: 33 | R333: 1 | S333: 1 | T333: 365 | U333: 18
A334: 54000 | B334: 1091.83 | C334: =IF(DAYS360(RC[8],R1C3)+2>365,365,DAYS360(RC[8],R1C3)+2) -> 41 | D334: =ROUND(RC[-3]*RC[17]/36500,2) -> 26.63 | E334: =RC[-1]*RC[-2] -> 1091.83 | F334: =RC[-1]-RC[-4] -> 0 | H334: 1129 | I334: 3 | J334: TR1PW12000291 | K334: 2012-01-13 00:00:00 | L334: 2013-01-13 00:00:00 | M334: 12 | N334: 9586.85 | O334: 54000 | P334: 1 | Q334: 30 | R334: 1 | S334: 1 | T334: 365 | U334: 18
A335: 107000 | B335: 1952.4 | C335: =IF(DAYS360(RC[8],R1C3)+2>365,365,DAYS360(RC[8],R1C3)+2) -> 37 | D335: =ROUND(RC[-3]*RC[17]/36500,2) -> 52.77 | E335: =RC[-1]*RC[-2] -> 1952.49 | F335: =RC[-1]-RC[-4] -> 8.9999999999918145E-2 | H335: 1131 | I335: 3 | J335: TR1PW12000292 | K335: 2012-01-17 00:00:00 | L335: 2013-01-17 00:00:00 | M335: 12 | N335: 18996.16 | O335: 107000 | P335: 1 | Q335: 30 | R335: 1 | S335: 1 | T335: 365 | U335: 18
A336: 12000 | B336: 250 | C336: =IF(DAYS360(RC[8],R1C3)+2>365,365,DAYS360(RC[8],R1C3)+2) -> 37 | D336: =ROUND(RC[-3]*RC[17]/36500,2) -> 5.92 | E336: =RC[-1]*RC[-2] -> 219.04 | F336: =RC[-1]-RC[-4] -> -30.960000000000008 | H336: 1135 | I336: 3 | J336: TR1PW12000294 | K336: 2012-01-17 00:00:00 | L336: 2013-01-17 00:00:00 | M336: 12 | N336: 2130.41 | O336: 12000 | P336: 1 | Q336: 42 | R336: 1 | S336: 1 | T336: 365 | U336: 18
A337: 5000 | B337: 250 | C337: =IF(DAYS360(RC[8],R1C3)+2>365,365,DAYS360(RC[8],R1C3)+2) -> 36 | D337: =ROUND(RC[-3]*RC[17]/36500,2) -> 2.4700000000000002 | E337: =RC[-1]*RC[-2] -> 88.92 | F337: =RC[-1]-RC[-4] -> -161.07999999999998 | H337: 1145 | I337: 3 | J337: TR1PW12000297 | K337: 2012-01-18 00:00:00 | L337: 2013-01-18 00:00:00 | M337: 12 | N337: 887.67 | O337: 5000 | P337: 1 | Q337: 101 | R337: 1 | S337: 1 | T337: 365 | U337: 18
A338: 8000 | B338: 250 | C338: =IF(DAYS360(RC[8],R1C3)+2>365,365,DAYS360(RC[8],R1C3)+2) -> 34 | D338: =ROUND(RC[-3]*RC[17]/36500,2) -> 3.95 | E338: =RC[-1]*RC[-2] -> 134.30000000000001 | F338: =RC[-1]-RC[-4] -> -115.69999999999999 | H338: 1161 | I338: 3 | J338: TR1PW12000301 | K338: 2012-01-20 00:00:00 | L338: 2013-01-20 00:00:00 | M338: 12 | N338: 1420.27 | O338: 8000 | P338: 1 | Q338: 63 | R338: 1 | S338: 1 | T338: 365 | U338: 18
A339: 98000 | B339: 1498.19 | C339: =IF(DAYS360(RC[8],R1C3)+2>365,365,DAYS360(RC[8],R1C3)+2) -> 31 | D339: =ROUND(RC[-3]*RC[17]/36500,2) -> 48.33 | E339: =RC[-1]*RC[-2] -> 1498.23 | F339: =RC[-1]-RC[-4] -> 3.999999999996362E-2 | H339: 1168 | I339: 3 | J339: TR1PW12000302 | K339: 2012-01-23 00:00:00 | L339: 2013-01-23 00:00:00 | M339: 12 | N339: 17398.36 | O339: 98000 | P339: 1 | Q339: 30 | R339: 1 | S339: 1 | T339: 365 | U339: 18
A340: 51000 | B340: 754.52 | C340: =IF(DAYS360(RC[8],R1C3)+2>365,365,DAYS360(RC[8],R1C3)+2) -> 29 | D340: =ROUND(RC[-3]*RC[17]/36500,2) -> 25.15 | E340: =RC[-1]*RC[-2] -> 729.34999999999991 | F340: =RC[-1]-RC[-4] -> -25.170000000000073 | H340: 1183 | I340: 3 | J340: TR1PW12000305 | K340: 2012-01-25 00:00:00 | L340: 2013-01-25 00:00:00 | M340: 12 | N340: 9054.25 | O340: 51000 | P340: 1 | Q340: 30 | R340: 1 | S340: 1 | T340: 365 | U340: 18
A341: 22000 | B341: 325.48 | C341: =IF(DAYS360(RC[8],R1C3)+2>365,365,DAYS360(RC[8],R1C3)+2) -> 28 | D341: =ROUND(RC[-3]*RC[17]/36500,2) -> 10.85 | E341: =RC[-1]*RC[-2] -> 303.8 | F341: =RC[-1]-RC[-4] -> -21.680000000000007 | H341: 1186 | I341: 3 | J341: TR1PW12000306 | K341: 2012-01-26 00:00:00 | L341: 2013-01-26 00:00:00 | M341: 12 | N341: 3905.75 | O341: 22000 | P341: 1 | Q341: 30 | R341: 1 | S341: 1 | T341: 365 | U341: 18
A342: 17000 | B342: 251.51 | C342: =IF(DAYS360(RC[8],R1C3)+2>365,365,DAYS360(RC[8],R1C3)+2) -> 28 | D342: =ROUND(RC[-3]*RC[17]/36500,2) -> 8.3800000000000008 | E342: =RC[-1]*RC[-2] -> 234.64000000000001 | F342: =RC[-1]-RC[-4] -> -16.869999999999976 | H342: 1187 | I342: 3 | J342: TR1PW12000307 | K342: 2012-01-26 00:00:00 | L342: 2013-01-26 00:00:00 | M342: 12 | N342: 3018.08 | O342: 17000 | P342: 1 | Q342: 30 | R342: 1 | S342: 1 | T342: 365 | U342: 18
A343: 13000 | B343: 250 | C343: =IF(DAYS360(RC[8],R1C3)+2>365,365,DAYS360(RC[8],R1C3)+2) -> 28 | D343: =ROUND(RC[-3]*RC[17]/36500,2) -> 6.41 | E343: =RC[-1]*RC[-2] -> 179.48000000000002 | F343: =RC[-1]-RC[-4] -> -70.519999999999982 | H343: 1188 | I343: 3 | J343: TR1PW12000308 | K343: 2012-01-26 00:00:00 | L343: 2013-01-26 00:00:00 | M343: 12 | N343: 2307.9499999999998 | O343: 13000 | P343: 1 | Q343: 38 | R343: 1 | S343: 1 | T343: 365 | U343: 18
A344: 16500 | B344: 250 | C344: =IF(DAYS360(RC[8],R1C3)+2>365,365,DAYS360(RC[8],R1C3)+2) -> 28 | D344: =ROUND(RC[-3]*RC[17]/36500,2) -> 8.14 | E344: =RC[-1]*RC[-2] -> 227.92000000000002 | F344: =RC[-1]-RC[-4] -> -22.079999999999984 | H344: 1189 | I344: 3 | J344: TR1PW12000309 | K344: 2012-01-26 00:00:00 | L344: 2013-01-26 00:00:00 | M344: 12 | N344: 2929.32 | O344: 16500 | P344: 1 | Q344: 30 | R344: 1 | S344: 1 | T344: 365 | U344: 18
A345: 13000 | B345: 250 | C345: =IF(DAYS360(RC[8],R1C3)+2>365,365,DAYS360(RC[8],R1C3)+2) -> 27 | D345: =ROUND(RC[-3]*RC[17]/36500,2) -> 6.41 | E345: =RC[-1]*RC[-2] -> 173.07 | F345: =RC[-1]-RC[-4] -> -76.930000000000007 | H345: 1196 | I345: 3 | J345: TR1PW12000310 | K345: 2012-01-27 00:00:00 | L345: 2013-01-27 00:00:00 | M345: 12 | N345: 2307.9499999999998 | O345: 13000 | P345: 1 | Q345: 38 | R345: 1 | S345: 1 | T345: 365 | U345: 18
A346: 5000 | B346: 250 | C346: =IF(DAYS360(RC[8],R1C3)+2>365,365,DAYS360(RC[8],R1C3)+2) -> 24 | D346: =ROUND(RC[-3]*RC[17]/36500,2) -> 2.4700000000000002 | E346: =RC[-1]*RC[-2] -> 59.28 | F346: =RC[-1]-RC[-4] -> -190.72 | H346: 1202 | I346: 3 | J346: TR1PW12000312 | K346: 2012-01-30 00:00:00 | L346: 2013-01-30 00:00:00 | M346: 12 | N346: 887.67 | O346: 5000 | P346: 1 | Q346: 101 | R346: 1 | S346: 1 | T346: 365 | U346: 18
A347: 10000 | B347: 250 | C347: =IF(DAYS360(RC[8],R1C3)+2>365,365,DAYS360(RC[8],R1C3)+2) -> 24 | D347: =ROUND(RC[-3]*RC[17]/36500,2) -> 4.93 | E347: =RC[-1]*RC[-2] -> 118.32 | F347: =RC[-1]-RC[-4] -> -131.68 | H347: 1209 | I347: 3 | J347: TR1PW12000314 | K347: 2012-01-31 00:00:00 | L347: 2013-01-31 00:00:00 | M347: 12 | N347: 1775.34 | O347: 10000 | P347: 1 | Q347: 50 | R347: 1 | S347: 1 | T347: 365 | U347: 18
A348: 19000 | B348: 281.10000000000002 | C348: =IF(DAYS360(RC[8],R1C3)+2>365,365,DAYS360(RC[8],R1C3)+2) -> 23 | D348: =ROUND(RC[-3]*RC[17]/36500,2) -> 9.3699999999999992 | E348: =RC[-1]*RC[-2] -> 215.51 | F348: =RC[-1]-RC[-4] -> -65.590000000000032 | H348: 1214 | I348: 3 | J348: TR1PW12000315 | K348: 2012-02-01 00:00:00 | L348: 2013-02-01 00:00:00 | M348: 12 | N348: 3373.15 | O348: 19000 | P348: 1 | Q348: 30 | R348: 1 | S348: 1 | T348: 365 | U348: 18
A349: 7000 | B349: 250 | C349: =IF(DAYS360(RC[8],R1C3)+2>365,365,DAYS360(RC[8],R1C3)+2) -> 23 | D349: =ROUND(RC[-3]*RC[17]/36500,2) -> 3.45 | E349: =RC[-1]*RC[-2] -> 79.350000000000009 | F349: =RC[-1]-RC[-4] -> -170.64999999999998 | H349: 1215 | I349: 3 | J349: TR1PW12000316 | K349: 2012-02-01 00:00:00 | L349: 2013-02-01 00:00:00 | M349: 12 | N349: 1242.74 | O349: 7000 | P349: 1 | Q349: 72 | R349: 1 | S349: 1 | T349: 365 | U349: 18
A350: 17000 | B350: 251.51 | C350: =IF(DAYS360(RC[8],R1C3)+2>365,365,DAYS360(RC[8],R1C3)+2) -> 23 | D350: =ROUND(RC[-3]*RC[17]/36500,2) -> 8.3800000000000008 | E350: =RC[-1]*RC[-2] -> 192.74 | F350: =RC[-1]-RC[-4] -> -58.769999999999982 | H350: 1216 | I350: 3 | J350: TR1PW12000317 | K350: 2012-02-01 00:00:00 | L350: 2013-02-01 00:00:00 | M350: 12 | N350: 3018.08 | O350: 17000 | P350: 1 | Q350: 30 | R350: 1 | S350: 1 | T350: 365 | U350: 18
A351: 60000 | B351: 887.67 | C351: =IF(DAYS360(RC[8],R1C3)+2>365,365,DAYS360(RC[8],R1C3)+2) -> 23 | D351: =ROUND(RC[-3]*RC[17]/36500,2) -> 29.59 | E351: =RC[-1]*RC[-2] -> 680.57 | F351: =RC[-1]-RC[-4] -> -207.09999999999991 | H351: 1218 | I351: 3 | J351: TR1PW12000318 | K351: 2012-02-01 00:00:00 | L351: 2013-02-01 00:00:00 | M351: 12 | N351: 10652.05 | O351: 60000 | P351: 1 | Q351: 30 | R351: 1 | S351: 1 | T351: 365 | U351: 18
A352: 11000 | B352: 250 | C352: =IF(DAYS360(RC[8],R1C3)+2>365,365,DAYS360(RC[8],R1C3)+2) -> 22 | D352: =ROUND(RC[-3]*RC[17]/36500,2) -> 5.42 | E352: =RC[-1]*RC[-2] -> 119.24 | F352: =RC[-1]-RC[-4] -> -130.76 | H352: 1219 | I352: 3 | J352: TR1PW12000319 | K352: 2012-02-02 00:00:00 | L352: 2013-02-02 00:00:00 | M352: 12 | N352: 1952.88 | O352: 11000 | P352: 1 | Q352: 46 | R352: 1 | S352: 1 | T352: 365 | U352: 18
A353: 5000 | B353: 250 | C353: =IF(DAYS360(RC[8],R1C3)+2>365,365,DAYS360(RC[8],R1C3)+2) -> 21 | D353: =ROUND(RC[-3]*RC[17]/36500,2) -> 2.4700000000000002 | E353: =RC[-1]*RC[-2] -> 51.870000000000005 | F353: =RC[-1]-RC[-4] -> -198.13 | H353: 1224 | I353: 3 | J353: TR1PW12000320 | K353: 2012-02-03 00:00:00 | L353: 2013-02-03 00:00:00 | M353: 12 | N353: 887.67 | O353: 5000 | P353: 1 | Q353: 101 | R353: 1 | S353: 1 | T353: 365 | U353: 18
A354: 81000 | B354: 1198.3599999999999 | C354: =IF(DAYS360(RC[8],R1C3)+2>365,365,DAYS360(RC[8],R1C3)+2) -> 11 | D354: =ROUND(RC[-3]*RC[17]/36500,2) -> 39.950000000000003 | E354: =RC[-1]*RC[-2] -> 439.45000000000005 | F354: =RC[-1]-RC[-4] -> -758.90999999999985 | H354: 1254 | I354: 3 | J354: TR1PW12000325 | K354: 2012-02-13 00:00:00 | L354: 2013-02-13 00:00:00 | M354: 12 | N354: 14380.27 | O354: 81000 | P354: 1 | Q354: 30 | R354: 1 | S354: 1 | T354: 365 | U354: 18
A355: 5000 | B355: 250 | C355: =IF(DAYS360(RC[8],R1C3)+2>365,365,DAYS360(RC[8],R1C3)+2) -> 9 | D355: =ROUND(RC[-3]*RC[17]/36500,2) -> 2.4700000000000002 | E355: =RC[-1]*RC[-2] -> 22.23 | F355: =RC[-1]-RC[-4] -> -227.77 | H355: 1263 | I355: 3 | J355: TR1PW12000329 | K355: 2012-02-15 00:00:00 | L355: 2013-02-15 00:00:00 | M355: 12 | N355: 887.67 | O355: 5000 | P355: 1 | Q355: 101 | R355: 1 | S355: 1 | T355: 365 | U355: 18
A356: 10000 | B356: 250 | C356: =IF(DAYS360(RC[8],R1C3)+2>365,365,DAYS360(RC[8],R1C3)+2) -> 7 | D356: =ROUND(RC[-3]*RC[17]/36500,2) -> 4.93 | E356: =RC[-1]*RC[-2] -> 34.51 | F356: =RC[-1]-RC[-4] -> -215.49 | H356: 1266 | I356: 3 | J356: TR1PW12000331 | K356: 2012-02-17 00:00:00 | L356: 2013-02-17 00:00:00 | M356: 12 | N356: 1775.34 | O356: 10000 | P356: 1 | Q356: 50 | R356: 1 | S356: 1 | T356: 365 | U356: 18
A357: 20000 | B357: 295.89 | C357: =IF(DAYS360(RC[8],R1C3)+2>365,365,DAYS360(RC[8],R1C3)+2) -> 3 | D357: =ROUND(RC[-3]*RC[17]/36500,2) -> 9.86 | E357: =RC[-1]*RC[-2] -> 29.58 | F357: =RC[-1]-RC[-4] -> -266.31 | H357: 1276 | I357: 3 | J357: TR1PW12000336 | K357: 2012-02-21 00:00:00 | L357: 2013-02-21 00:00:00 | M357: 12 | N357: 3550.68 | O357: 20000 | P357: 1 | Q357: 30 | R357: 1 | S357: 1 | T357: 365 | U357: 18